,name,date,text,stars,answer
99,Михаил Чугунов,2021-09-21 14:54:00,"Сбербанк теряет свои позиции. Теперь не банк для людей, а люди для банка. В последнее посещение пришлось ждать более двенадцати минут, хотя посетителей практически не было.",3,
100,Татьяна О.,2021-08-31 08:57:13,"Хорошее отделение очереди совсем не большие, можно смело посоветовать жителям района!",4,
101,Андромеда Звёздная,2022-12-15 17:48:22,Персонал и обслуживание На высоте.,5,
102,Елена Г.,2022-09-12 11:05:45,"Персонал отзывчивый, если что то не понятно, всë объясняют",5,
103,NY,2020-08-13 05:04:17,"Обслуживались на прошлой неделе с мамой в юр.отделе данного отделения) Сотрудник Ольга Л.-сразу видно-профессионал своего дела! Доброжелательность,доступность к пониманию клиентом и восприятию информации,оперативность действий! Сотрудник-лицо и визитная карточка банка по моему мнению!Поэтому ставлю 5 баллов всему отделению. Есть к сжл,с чем сравнить..сотрудникам ВТБ в г.Энгельс далеко до Ольги,100 процентов) да и в др отделениях Сбера обслуживание не было ‘на высоте’.. хамство,безучастие и некомпетентность зачастую.",5,
104,Ирина И,2021-02-28 05:40:13,"Удобное расположение,хорошая парковка.Центральный офис для всех банковских операций.",5,
105,Ревизор 0164,2023-06-05 15:48:13,Шикарный персонал,5,
106,юлия,2020-05-26 18:23:17,"Центр по работе с ипотечным заёмщика отличается грамотным и профессиональным коллективом, удобной парковкой и месторасположением",5,
107,Марат Ниталиев,2023-10-12 14:47:33,Сбер как сбер,4,
108,Tanchik,2021-03-26 08:49:26,"К консультанту особых нареканий нет. А вот к юристам, одобрявшим заочно договор продажи дома- множество. После их проверки пришлось нам( клиентам) корректировать договор продажи сразу по нескольким пунктам. Очень непрофессионально.",3,
109,Светлана А.,2020-12-15 10:51:56,"Просто верх непрофессионализма. Менеджер центра ипотечного кредитования Сеченова Ольга неграмотный специалист. После сделки не можем уже 2 недели получить наши деньги. Каждый раз ничего внятного сказать не может, просит перезвонить и сама трубку не берет и не перезвонит. Вообщем про банк ничего хорошего сказать не могу.",1,
110,Светлана Стрельцова,2023-06-14 18:28:28,Хорошее обслуживание,5,
111,Марина Куличкова,2023-05-12 17:01:37,Хорошее обслуживание.,5,
112,Игорь Колчин,2023-04-30 16:54:49,Сбер везде хорошие,5,
113,Анна Шагалова,2023-03-18 19:40:29,Отличное обслуживание.,5,
114,Светлана Апаева,2019-09-18 11:38:00,"Центральное положение дает отделению хорошую проходимость. Внимательный персонал всегда поможет советом. Чисто, светло, уютно.",5,
115,Наталья Б.,2022-01-16 22:47:46,Да! Специалисты молодцы. Всё чётко и во время.,5,
116,Яков Дерр,2023-05-15 14:03:35,Оценка хорошо.,4,
117,олька,2021-05-07 10:29:19,"Удобная парковка, много операциониста, много банкоматов круглосуточных.",5,
118,татьяна исайчинкова,2023-04-29 04:03:45,Все понравилось.,5,
119,irinadavydova317,2021-09-09 08:17:29,"Круглосуточно работпют банкоматы, обслуживание хорошее",5,
120,Наталия Торжинская,2023-01-04 16:59:05,Всегда много народа,4,
121,660008 Ирина Павловна,2020-01-31 07:31:12,"Просто нет слов нас встретила как своих знакомых Хатинова Гульнара все объяснила рассказала и отвела в зал, когда объявили окно со мной работала Журавлева Ирина прям до слез благодарна ей прошу руководство объявить им благодарность это очень перспективные сотрудницы.",5,
122,Ольга Полякова,2022-06-23 07:38:41,"Вечно море народу, ждёшь очереди по 3 часа, особенно в кассу",3,
123,Дмитрий Дружинин,2019-10-16 13:34:17,"Удобно по дороге на работу совершить работу с картой, но грязно. Можно и почаще убирать зал с банкоматами. Несколько раз видел там бомжей.
PS: Был приятно удивлён изменениям, рано утром в зале с банкоматами идеальная чистота. Спасибо за наведенный порядок. Надеюсь это не разовая акция со стороны персонала.",3,
124,Алексей Алексеев,2023-05-18 02:54:10,Долго ждать.,3,
125,Сергей Владимирович,2023-04-30 15:57:23,Грязь и воняет,1,
126,Юлия М.,2021-04-04 10:52:35,"Оформляли в этом банке ипотеку, очень хорошие сотрудники, отвечают на все интересующие вопросы! Рекомендую!",5,
127,Андрей Муравлев,2020-02-02 19:33:08,"грамотно, по быстроте обслуживания 4,чистенько,терминалов хватает. подсказывающий персонал с работой справляется, ттлончики выдаются моментально....",5,
128,Александр Хорошунов,2020-10-20 07:59:09,"Выдали депозит без процентов,вроде нет данных,когда и под каким,в смысле запрос был через нотариуса,что есть вклад,остался после смерти мамы,соответственно мне было не до выяснения в то время",1,
129,Анна Чернышова,2019-09-26 06:49:25,"Много автоматов. Нам сотрудники помогли подобрать максимально удобные условия, поясняя все тонкости, остались довольны.",5,
130,Тоня Кекелидзе,2023-01-13 13:16:43,Отличный Сбербанк,5,
131,Андрей Наумчик,2022-08-27 12:06:07,"Ужас, порковки нет а че есть все в дырах",1,
132,ЖЕНЯ ДАВЫДОВ,2019-10-20 15:04:28,"У меня когда возникли проблемы,приехал в банк,мне все обьяснили, все проблемы решили,все качественно ,быстро,душевно,просто красавцы.",5,
133,Олечка,2019-09-28 16:47:14,"Всегда очень много людей. По сути обманывают, когда предлагают активировать новую карту. Всего-то подключают мобильный банк. В последний раз оформляла пенсионные отчисления. Так подключили автоплатеж на телеф. Типа без него никак. Чушь. Бесит еще, что часто направляют не в то окно. И ходишь туда-сюда по 20раз объясняешь, что нужно. Ну и как в сказках заканчивают.....а так нормальное отделение. Чисто и красиво.",4,
134,SV,2021-08-28 17:22:38,"Ипотечный отдел ,,отличный стециалисты грамотные",5,
135,Ловец ОС,2021-10-17 15:34:54,Быстрое обслуживание плюс ипотечный цент огромный.,5,
136,Мария,2022-02-03 11:15:49,Оформляли сделку. Всё за один раз. В электронном виде,5,
137,Андрейка активист,2021-12-01 21:23:27,"Позорище Сбербанка! Надуривают стариков своим пенсионным счётом! При инфляции в 8%, открывают пенсионный счёт под 3.5% просто позорище!!! Греф не стыдно?",1,
138,Ирина К.,2020-10-22 13:09:33,"протянули с ответом неделю, всегда пользуюсь картами сбербанка, запросила не большую сумму , пришел отказ, теперь хочу поменять банк",1,
139,Ольга Ан,2022-12-05 17:27:01,Вежливый персонал,5,
140,ирина косенко,2021-03-03 08:17:08,"Вежливые операторы в зале чистенько 
Советую обращаться",5,
141,Юлия М.,2021-05-12 08:48:19,"Очень маленький, все вечно заняты, консультанта не дождёшься, терминалы часто не работают.",3,
142,волков николай,2022-02-16 12:34:11,Прекрасные служащие все обьеснят.,5,
143,Иван Астафуров,2022-07-28 02:09:09,Кому нужен кредит заходидите,5,
144,ИРИНА К.,2021-10-22 13:38:16,Дорога ужас не подъехать к сбербанку. Обслуживание хорошее,3,
145,Барся,2021-09-18 09:00:28,Хороший банк хорошее отношение к людям в общем жороший банк,5,
146,Елена Вихорева,2022-01-26 15:40:25,Все на отличном уровне!!!,5,
147,Оксана Б.,2021-03-29 19:05:11,"Грамотные специалисты, внутри помещения современное",5,
148,Ольга М,2021-04-18 08:33:57,"Всегда под рукой ))) Быстро, удобно)))",5,
149,Мария Кацебо,2022-10-24 17:18:42,Все нравится,5,
150,Нет,2022-11-15 16:23:16,Рекомендую!!!,5,
151,Владислав Маличенко,2022-06-25 15:28:48,Много банкоматов,5,
152,Владимир Козин,2021-08-13 13:01:04,"Хороший банк, персонал приветливый.",5,
153,Наталия Михайловна ОПГ 🤣,2019-12-02 11:27:30,"Готова карта, приходите... А их график работы до 17.30, в выходные выходной....Я работаю так же.. плюс время на дорогу из Саратова... Вопрос - как мне попасть в банк ?? Неужели нельзя сделать хотя бы через субботу рабочие часы с 9 до 12 ??",2,
154,Валерия Мартынова,2020-03-31 13:38:29,"31.03.2020 года офис не работал, хотя должен был работать с 8:30 до 14:30, посещение было в 10:00, но двери сбербанка были закрыты",1,
155,Оксана Власова,2021-05-13 10:42:53,Хорошее отделение возьмёшь талончик и ждёшь когда очередь подойдёт.,5,
156,Анонимный отзыв,2022-04-19 05:30:08,Хорошие специалисты,5,
157,Инесса Штода,2021-07-28 08:35:53,Хорошее обслуживание.За ипотекой сюда!,4,
158,ктото,2021-07-31 06:19:27,Как и всё в этом банке ленивый персонал корявые услуги,3,
159,Мария К.,2021-12-23 09:43:39,Хорошее отделение банка!!!,5,
160,41304 Кузеева,2021-10-03 17:53:50,Нормальный банк как и везде в сбере,5,
161,ОВО по г. Новоузенску,2022-12-05 18:38:27,Хорошо,5,
162,Роман Л.,2019-04-07 17:18:01,"Надменные девушки кассиры, относятся так будто мы клиенты должны знать перечень документов, а они королевы и мы холопы к ним пришли на поклон. Ужас какой то не могу им замечание на сделать😅 не в одном отделении больше такого нет, я точно не замечала.",1,
163,Светлана Ушакова,2020-12-12 17:39:25,Клиентоориентированные специалисты 👍 беда с парковкой,5,
164,Ольга Запасчикова,2020-08-23 09:53:14,"Быстрое обслуживание, вежливый персонал.",5,
165,yelena yelena,2020-12-22 02:31:07,"Все как обычно в Сбере.. уставшие, замученные менеджеры...",3,
166,natalia lifar,2019-12-20 11:32:04,"Нет очередей, персональные консультанты очень вежливы. 
Вот только проценты по вкладам маленькие.",5,
167,Михалыч,2020-07-29 13:26:34,"Быстрое обслуживание,вежливый персонал",5,
168,удалился,2020-05-29 17:00:33,"все хорошо , но не ужели сбербанк не может отремонтировать дорогу к самому себе пыль грязь",5,
169,Юлия Е,2021-09-13 11:54:37,К персоналу претензий нет.,5,
170,А Т,2022-04-21 15:56:18,"Банк как банк,как многие банки в России!",5,
171,VaiZa,2019-12-20 07:56:20,"Оперативности не хватает, чтобы получить заказанные денежные средства заранее, нужно потратить час времени.",4,
172,Сергей М.,2022-08-18 17:41:34,Хорошо,5,
173,VLOZ,2021-09-02 21:44:46,"сбер как сбер, все норм",5,
174,Юрий Х,2021-05-17 08:19:15,очень очень плохо с парковкой,2,
175,Империал,2020-11-20 13:45:08,По вечерам собираются любители моргенштерна человек 30....греются.....удивлен почему еще не унесли банкомат...,1,
176,Александр П.,2020-03-30 05:18:29,"Хороший банк, много консультантов, много банкоматов.",5,
177,Наталия Ланина,2021-11-29 16:14:03,Быстрые сделки,5,
178,Галина Аубекирова,2019-12-27 14:13:03,очень отзывчивые девчата мне понравилось очень,5,
179,Александр Штобич,2021-09-09 08:30:15,"Долго все, на троечку",3,
180,Александр Заикин,2020-08-03 18:57:57,"Хорошее, быстрое обслуживание клиентов",5,
181,Ольга Чапурина,2021-05-30 14:41:11,Очень добрый персонал,5,
182,Александра Т.,2020-01-20 11:00:10,"Приятный персонал, вежливость, внимательность.",5,
183,Михаил Белоусов,2020-03-07 16:05:55,Стандартный сбербанк с электронными очередями и всем остальным,4,
184,Всем добра,2020-02-01 11:49:10,Быстрое обслуживание. Приветлевые консультанты,5,
185,Денис С,2020-07-09 11:59:31,"Обслуживают тут давно, мне удобно",5,
186,Инна Демидова,2021-01-14 10:15:43,Не компетентные работники,3,
187,glowwormstar81 Старцева,2020-03-19 18:07:56,"Вежливые сотрудники, приятно общаться",4,
188,Светлана Лана,2021-08-04 04:39:49,Хороший сервис,4,
189,Светлана Викторовна,2020-04-10 17:20:39,"Отличное обслуживание, ничего не навязывают лишнего",5,
190,Андрей А,2020-02-12 06:09:50,"Много банкоматов, это удобно, парковка маленькая",5,
191,Анонимный отзыв,2016-03-01 10:17:41,"Когда активировал карту (а эту функцию чуть ли не в обязательном порядке выполняют ""помощники"") - попросил местного ""сбербанковца"" не подключать мне мобильный банк, за который нещадно дерут деньги. Я собирался подключить себе бесплатную версию мобильного банка за который не нужно платить вообще, но которая отлично работала на телефоне. В итоге этот человек натыкал и всё равно её включил (аргументировал мол эта бесплатная версия, правда первые три месяца и всё это с невинным выражением глаз - за это хотелось громко выругаться, устроили на работу неуча, который не в курсе об услугах компании) - пришлось самому тратить время и переподключать услугу.",1,
192,Анатолий НТ,2020-04-12 16:59:29,Тут можно провести не один час своей жизни.,3,
193,Владимир В.,2018-04-10 13:08:28,"Пока всё в порядке, всё понятно всё доступно я очень доволен спасибо.",5,
194,Иван Матренин,2021-05-14 07:08:38,Все что нужно,5,
195,людмила к.,2020-02-17 15:07:45,"Хорошее отношение к людям, внимательны.",5,
196,Алексей Берсенев,2019-10-19 14:26:19,Приятный персонал. Есть парковка.,5,
197,Иван,2021-08-06 17:00:17,Отлично,5,
198,Сергей Александрович,2021-06-05 17:04:15,Нет ресепшена,4,
199,Элла Гершенович,2020-10-17 11:04:56,Вежливое обслуживание,5,
200,Александр Протасов,2020-07-18 12:16:15,Нормально. Профессионалы,5,
201,Дарья Р.,2019-09-08 13:20:09,Работают компетентные люди ни когда не уйдешь без ответа,5,
202,Дарья Рутковская,2021-08-27 06:00:42,Все Отл.,5,
203,Павел С.,2020-11-15 15:10:51,Удобный банк,5,
204,Марина Щ.,2020-09-23 20:28:08,Работают профи,5,
205,Лариса Новетова,2020-07-20 14:15:37,Самый крупный офис,5,
206,Екатерина Шатровая,2019-08-29 05:44:47,Сбербанк банк надёжный первый банк России,5,
207,Сергей Султанов,2020-02-07 15:38:34,Меня все в этом банке устраевает,5,
208,Brian Lustmord,2021-05-12 11:08:24,Так себе,3,
209,Тутси,2020-02-12 11:54:39,Быстрое обслуживание,5,
210,Игорь Пастухов,2021-06-20 10:34:51,Все отлично),5,
211,М. Н,2020-01-27 14:48:46,Быстрое обслуживание,5,
212,Наталья Скибина,2019-11-27 09:31:24,Наша палочка выручалочка,5,
213,Наталья Кузьмина,2020-03-27 12:30:51,Все как и везде,5,
214,marina-kornienkovа,2019-08-29 09:18:01,Большой банк все быстро,5,
215,Андрей Р.,2019-09-02 05:11:43,Высокие ставки по кредитам,3,
216,Валерий Анатольевич,2019-09-06 12:42:48,Классный персонал,5,
217,Diman Miller,2019-11-01 16:26:47,Огромные очереди,1,
218,Светлана Х.,2019-12-27 03:44:23,Отличный банк,5,
219,Юлия Бондарь,2018-08-12 13:43:45,Хорошее отделение,5,
