,name,date,text,stars,answer
75,Володя,2023-04-18 17:08:50,"Удобное расположение, хорошее отношение к клиентам",5,
76,Ян Чередников,2022-04-08 04:14:42,Ставлю 3 потому что отделение для бездельников работает до 17:30 рабочему человеку после работы попасть туда не реально! 1 отделение на огромный район города!,3,
77,Наталья Цымбарь,2021-08-16 08:44:28,"Довольна обслуживанием! Специалисты принимают быстро, консультируют по всем вопросам. В помещении чисто и прохладно",5,
78,Алексей,2023-07-01 17:30:41,"Обслуживают быстро, спасибо руководителю",5,
79,Ксюша,2021-08-05 19:12:38,"Это отделение банка хорошее, и расположение удобное,
Но столкнулась с ужасным отношением персонала, мне нужна была консультация для получения кредита, мне всё объяснили, говорят приходите, через пару дней пришла к этому же специалисту уже оформить кредит, но тут наткнулась на некомпетентность сотрудницы в 10 окне, она пригласила а потом говорит что кредит этот оформить ни как нельзя
Что за хамское отношение, я же не лично к ней пришла, она можно сказать принебрегает людьми и портит рипутацию многолетнего труда этого отделения, первый раз вообще вижу что бы оказывали в такой услуге, при чём уже перечень документов весь придоставили
Мне не хотелось бы попасть ещё раз к такому недоброжелательному оператору сбербанка",1,
80,Любовь Жукова,2023-04-14 11:55:57,"Меняла там карту. Странный администратор. Талоны выбивает так как им выгодно. Сидела в очереди минут сорок, что бы выдали мне карту. То одного пропустите, то другого. То в другое окно идите. Навязывают свои услуги.",4,
81,803701 молдованенко,2022-07-07 06:14:06,"Хорошо обслуживают,только очень далеко от дома,откройте еще одну точку на Усть-Курдюмской 29",5,
82,Елена Чайковская,2023-06-01 11:46:10,Обслуживание персонал отношение клиента Время ожидания,5,
83,Ксения,2021-08-25 18:15:06,"Если проезжаешь мимо, можно без очереди заехать и решить свой вопрос. Удобная парковка, режим работы и грамотные сотрудники. Банкоматы всегда направлены купюрами.",5,
84,Роман,2022-06-06 12:09:37,"Три с большой натяжкой персанал работает медленно так ещё и хамит 
. А когда образуется очереди на обслуживания стопорятся все",3,
85,Елена Б.,2022-08-24 17:02:10,"В последнее время стали медленно работать, приходится долго ждать очередь, иногда уходишь не дождавшись.",4,
86,Алексей,2022-06-08 12:26:17,"Старикам впаривают страховки, полиса типа телемедецина и тд которыми они явно никогда пользоватся не будут, будьте внимательние",1,
87,Людмила матвеева,2023-02-01 05:38:34,"Всегда помогут и подскажут, оперативны",5,
88,Дмитрий Данилов,2021-09-21 07:15:44,"хорошее отделение сбербанка
много сотрудников
достаточное кол-во банкоматов 
нет больших очередей
Рекомендую",5,
89,Инга Гладкова,2023-05-18 14:25:52,"Быстро получила дебетовую кврту, спасибо..",5,
90,ArTi,2021-11-18 17:29:35,"Мне нравится это отделение Сбербанка. Персонал умный, вежливый, в отличии от Альфа-Банка. Всем рекомендую.",5,
91,Андрей Моисеев,2022-07-15 17:39:32,"Новый стандарт обслуживания: минимум живого общения с человеком, максимум терминала и личного кабинета.",4,
92,Николай Северин,2021-11-17 15:34:34,"Хороший и грамотный персонал, стараются все успеть, но толпы посетителей, не успевают, из-за чего страдает качество. Нужен ещё один офис в Юбилейном!",3,
93,АХ!,2021-10-03 09:55:15,"Что за отстой в п. ЮБИЛЕЙНЫЙ, нормально не снять не положить средства, один банкомат из пяти работают, на Усть-Курдюмская 3, а доме 11 вообще все разломали, очередь как за бананами в 80е, куда смотрит рукводство сбербанка?",1,
94,Саша Савенков,2023-02-02 16:48:36,Нормальный стандартный сбербанковский сбер. Заезд плохой.,5,
95,Антон Московский,2023-10-27 15:41:41,Некомпетентные сотрудники,3,
96,Амина С,2023-10-01 18:18:03,Банкомат. Обслуживание,5,
97,А. Т.,2023-01-02 17:42:43,"Обслуживание не понятное. Оформляли карту ребёнку, персанал не мог объяснить что и как по карте, говорили только, так положено. Ожидание долгое",4,
98,Mikhail Medvedev,2023-06-27 13:41:44,Очень внимательные служащие банка,5,
99,Vagaferon064 A,2022-05-10 15:38:37,"Обслуживание очень хорошее, отношение к клиентам отличное",5,
100,Евгений Морозов,2023-04-25 13:40:26,Они есть быстро обслужить,5,
101,Мария И.,2022-02-16 13:31:15,Один банк на крупный посёлок. Бешенные очереди к банкоматам и к операторам. Раньше было хорошо.,2,
102,Эдуард Эдуард,2021-09-09 06:29:55,"Давно уже не пользуюсь услугами данной организации. Постоянно с ними какие то проблемы. А чтобы получить вклады, это вообще надо пройти 7 кругов ада.",1,
103,Oleg Gorelov,2023-01-19 12:05:27,Сбером я пользуюсь все норм .,5,
104,Андрей,2020-01-15 11:40:18,"Единственный филиал в Юбилейном, где есть кредитный специалист. Как всегда очередь. Вежливый персонал. Но кредитный специалист уж какая то недовольная, я ещё не зашёл к ней, а создаётся впечатление что уже что то ей должен. Но могу сказать в её же защиту, что народу к ней много, я бы сам наверное людей кусал, будь так перегружен работой. Несмотря на строгость, вежливая.",3,
105,Александр Кор,2022-12-25 16:06:48,"Захожу только к банкоматам, офис как офис",4,
106,александр райков,2023-04-01 02:59:54,Большой удобный филиал.,5,
107,Олег .,2022-11-15 17:23:40,Зимой можно улететь с крутизны подъема),4,
108,irina scheremet,2022-02-17 19:24:00,"Старательный персонал,всегда помогают клиентам,не навязчивы",5,
109,Doctor Zlo,2022-12-08 12:43:45,Всегда имеется очередь посетителей,4,
110,Roman Ushakov,2021-07-03 13:51:18,"Так себе банк!Не нравится постоянное навязывание своих продуктов и услуг.Когда деньги кладёшь на счёт никому не интересно где ты их заработал,когда хочешь снять свои собственные деньги,то нужно предоставить документы о происхождении денежных средств!Потратил кучу времени на то чтобы забрать свои кровные.Понравилась поддержка на горячей линии Сбера!",3,
111,Виктория Багдасарова,2022-02-04 06:41:01,Единственное отделение банка на весь юбилейный поселок! Постоянно большая очередь.,5,
112,Олег Гамада,2021-11-02 05:50:49,"Взяли талон в пятое окошко первые, в итоге пропустили двух человек, так как консултант вызывала в разноброс",1,
113,Виталий Сергунин,2023-02-14 21:02:49,"Очереди бывают, но редко.",4,
114,Valentin L.,2023-04-19 15:17:08,Неудобный режим работы,3,
115,Виталий Соколов,2023-04-04 17:22:48,Отличный Сбербанк,5,
116,Светлана Динеева,2022-02-25 09:51:29,"Ужасное отделение. Полный беспорядок. Сижу в очереди уже час, пропускают без талонов.",1,
117,Алекс,2022-12-09 04:30:34,Как и везде постоянные очереди,3,
118,ersoy bilge,2022-09-11 15:20:48,Персонал супер работает но сам Сбербанк ужасно,5,
119,Елизавета Колчина,2023-02-21 16:36:46,"Быстро обслужили, чисто, комфортно",5,
120,СБН СБН,2023-02-27 16:41:26,Удобная парковка,5,
121,Ирина а.,2021-11-11 14:26:51,"Осталось одно отделение сбербанка п пос. Юбилейный, для такого кол ва населения это очень мало",1,
122,Людмила Вьюркова,2023-03-19 17:39:41,Отличный персонал,5,
123,Оля,2023-08-12 05:08:53,Все хорошо,5,
124,Рачи П.,2021-07-24 18:40:27,"Иногда захожу. Ещё не разу грубо не обращались, наоборот, всегда вежливо и корректно работают...",5,
125,Елена-Михаил Преображенские,2021-08-27 20:38:37,"Удобно, вежливо и быстро по обслуживанию.",5,
126,Марина Ларина,2023-02-10 19:25:58,Все стандартно,4,
127,кристина исмоилова,2023-09-12 17:38:53,Вежливые,5,
128,Хрипунова Татьяна,2021-09-11 11:18:55,"Очень светлое место, отзывчивые специалисты",5,
129,belonov.anatoliy@mail.ru,2022-07-02 05:07:12,"Нужный,полезный офис в Юбилейном",5,
130,АНЮТА ))))),2022-01-16 15:36:36,"Кошмар, создают искусственные очереди, не разрешают брать талоны.",2,
131,Лусине Арушанян,2021-06-08 04:14:16,"Очень вежливые сотрудники, всегда помогут и и объяснят если, что то не понятно.",5,
132,Татьяна Б.,2019-12-05 17:28:31,"Хороший персонал и при любой просьбе всегда помогает.Более грамотные и знающие,чем в другом отделение поселка Юбилейный.",5,
133,Владислав Сабельников,2023-06-07 17:18:01,Все ок,5,
134,Сергей,2019-09-12 18:56:40,Удобное расположение для жителей района. Быстрое и эффективное обслуживание. Вежливый персонал.,5,
135,anatoly.velichcko,2021-11-20 11:14:45,"Нормально. Банкоматов хватает, а вот консультантов никого не видел.",4,
136,Светлана В.,2021-09-21 16:17:51,"Чисто, удобно 24/7,быстро, спокойно",5,
137,Александр Кубашев,2022-08-05 20:10:37,Персонал доброжелателен,5,
138,Вадим Рыбков,2021-05-19 12:18:21,"Отличное отделение сбера, вежливые сотрудники",5,
139,Денис Антонов,2021-12-21 05:37:31,"Обычное отделение сбера, есть банкоматы",4,
140,Сергей Саратов,2021-07-20 08:45:05,Работать стали быстрее и грамотные специалисты.,5,
141,Юрий К.,2019-07-25 11:07:35,"Удобно расположен, есть много банкоматов. Из минусов, как и у других банков - рабочие часы. Банки рассчитаны на тунеядцев и пенсионеров? Открывается поздно, зато закрывается рано, в будни не попасть.",4,
142,Артём И.,2022-11-21 21:49:17,Хороший магазин,5,
143,Александр Виноградов,2022-01-11 18:20:58,За крылся стало не удобно ходить в другой,1,
144,off.lelkis💋,2021-12-12 11:49:03,Хороший банк великолепно!,5,
145,Лариса М.,2021-12-25 18:18:54,"Банк как банк, а чего может быть особенным.",4,
146,Дарья,2019-10-05 04:33:17,"Сбербанк - филиал ада на Земле. Стоит подойти к банкомату - налетают консультанты и навязывают услуги и подключают не нужные автоплатежи. Радует, что после ремонты шанс придти и снять деньги выше. раньше банкоматы часто не работали",1,
147,наталья д.,2020-01-16 09:11:17,"Все доступно объясняют,вежливые доброжелательный коллектив сотрудников банка.",5,
148,Инкогнито Саратов,2022-09-15 14:42:01,Хороший банк,5,
149,Татьяна,2022-03-01 08:24:11,Постоянно огромные очереди.,2,
150,Рустем Шайхуллин,2020-01-20 10:26:25,"Достойное отделение Сбербанка. Чисто, опрятно, хорошее обслуживание.",3,
151,Вадим Партыко,2019-11-11 07:05:03,"Образец расторопности, вежливости и внимательного отношения к посетителям!!!! Да! Очень выдержаны и толерантны!! Браво девочки!+++++",5,
152,Ирина Гостева,2021-08-09 13:22:05,"Пользовалась только банкоматами, проблем не было",5,
153,Александр,2022-01-04 18:38:05,Банкоматов достаточно .,5,
154,Ольга Сошникова,2022-01-11 11:45:38,Терминалы часто не принимают наличку,5,
155,Ник Емельянов,2019-10-12 08:36:25,"Бедный работники старательно ""втюхивают"" страховку карт NFC и навязывают автоплатежи. Два балла ставлю банкоматам - один за прём, другой за выдачу наличных!",2,
156,Анонимный отзыв,2018-08-04 08:36:43,"04.08.2018 пришла в офис банка забрать перевыпущенную карту . После небольшого ожидания пригласили в 1 окно. Специалист банка принесла мою карту и сказала , что ее надо активировать. Для этого нужно подключить автоплатеж оплаты телефона. И даже когда я сказала, что мне эта услуга не нужна, специалист продолжала настаивать, якобы иначе карта не активируется. Я согласилась. После множества манипуляций моя новая карта осталась заблокированной. Мне предложили приехать в понедельник 06.08.2018 и снова заняться активацией карты. Тут же пригласили другого клиента, а меня выпихнули , так и не выполнив свою работу! Я стала звонить на горячую линию , где выяснила , что для активации карты достаточно вставить ее в банкомат, ввести пин-код и проверить баланс - ВСЁ, карта разблокирована и готова к работе! Больше часа я просидела у сотрудника и вышла от с заблокированной картой!!! Я просто в шоке от квалификации сотрудников в такой организации! Как такое можно допускать в работе - сотрудник банка не знает элементарных вещей!!!!",0,
157,Наталия М,2020-07-31 11:30:25,"Старательно навязывают дополнительные услуги, но это сейчас во всех отделениях Сбербанка",4,
158,Дикий жук.,2021-08-07 11:41:43,"Тог Банк. Сам не очень, а так очень удобно.",4,
159,Vol,2020-01-12 02:06:25,"Очень удобно находится рядом с домами 😁
Консультанты вежливые и помогут в любую минуту.",5,
160,Александр,2021-06-07 12:54:51,Хорошее обслуживание + чистота!,5,
161,Андрей Денисов,2021-09-29 16:27:58,Попал без очередей. Остался доволен.,5,
162,Елизавета С.,2019-11-07 13:35:40,"Очень много рекламы от оператора, столько что выходишь с больной головой. Меняли карту, а предложили кучу всего, отняли тем самым много личного времени.",4,
163,Аристарх,2021-05-31 15:03:03,Удобно пользоваться картой.,5,
164,Хайс Имару,2020-01-04 22:06:00,Хороший персонал. Если что непонятно разжуют и объяснят (по крайней мере по дисконт карте мне объяснили).,5,
165,РМ,2022-09-07 12:50:34,"Работают, будто за «Спасибо»",4,
166,Павел Н.,2019-11-17 19:55:10,Хороший сбербанк и персонал доброжелательный и отзывчивый!,5,
167,Артём Смирнов,2021-02-22 22:08:04,"Сбер он везде такой. Лучше не ходить, когда дни выдачи пенсий.",4,
168,Светлана Хачатурова,2023-01-15 15:34:28,Обслуживание хорошее,5,
169,iam for,2022-12-04 06:03:19,Начали навязывать услуги.,4,
170,Olga Gor,2020-02-04 18:19:50,"Вежливые сотрудницы. Некоторые работают в этом отделении несколько лет, здороваемся как с подругами.",4,
171,drabatulin.an,2018-03-20 11:13:44,Очень интересное отделение. Пришёл попросил неизменную карт. Однозначный ответ нет. Нет так нет. Пришёл спустя 3 месяца без проблем дали. Что сказать банк делают сотрудники и все разные. Руководитель все время разный. Побольше бы им постоянства...,4,
172,Tema Brain,2021-07-18 10:34:57,"Хороший банкомат, нет очередей",5,
173,Надежда Григорчук,2019-10-16 14:28:39,"Рядом с домом, грамотные и доброжелательные специалисты!",5,
174,Юрий Чиров,2020-09-19 17:13:04,У них всегда все хорошо. Но проценты&&&&&&?!,4,
175,Ольга Веденеева,2020-03-02 04:38:32,"Просторный хороший филиал,персонал вежливый",5,
176,maximo4kanikulin,2019-08-27 18:15:36,Персонал всегда отзывчивый и готов помочь с любым вопросам.,4,
177,Лариса Кузнецова,2021-08-12 09:22:00,Отзывчивые сотрудники.,5,
178,roman parfen,2020-11-19 10:35:57,"Неплохое расположение
Хотя их как и аптек полно",2,
179,Александр К.,2019-12-03 14:55:17,"приличный банк, но есть проблемы которые не решаются часто положить деньги через банкомат невозможно",3,
180,Леонтий С.,2020-02-13 08:29:55,Стало совсем неплохо с банкоматами! Ранее были большие очереди...,4,
181,Айгюн Махмудова,2022-06-20 16:51:31,Хорошо,5,
182,Кирилл К,2021-07-28 04:26:16,"Сбер же,что сказать...",3,
183,forpost.17,2020-08-05 16:56:21,"Хорошие специалисты, пять банкоматов на ввод/выдачу",5,
184,Андрей Селиванов,2019-12-17 05:20:23,"Как банк - нормально.
Территория вокруг чистится от снега плохо, лестница, ведущая к банку не восстанавливается уже много лет. Зимой становится совсем плохо.",3,
185,Вячеслав Г.,2021-07-02 16:07:20,Почти нет очереди.,5,
186,Дмитрий В.,2019-12-24 03:14:10,"Банкоматы 
 работают не все. Приходиться ждать в очереди по 10-15 минут",3,
187,Федор левин,2019-09-18 09:17:08,Все всегда ок а если не ок то есть вежливые консультанты,5,
188,марина суравцева,2020-02-07 18:34:32,Рядом с домом. Удобно расположен.,5,
189,Александр Костин,2019-09-22 10:51:31,"Отвратительно работает отделение банка, постоянно проблемы с банкоматоми, персонал невежливый",1,
190,DAPotekhin,2021-08-10 06:12:25,Хороший офис,5,
191,Ignat Kvik,2019-12-28 11:56:59,Ну за Сбербанк говорит само за себя его название - банк которому доверяю!!!))),5,
192,Олег,2020-02-18 10:29:38,"Всегда все хорошо было, когда обращался",5,
193,Марина Марина,2021-03-12 09:22:39,Как и все сбербанки,4,
194,Екатерина Савостикова,2019-12-17 17:34:44,Грамотный персонал отличный сервис,5,
195,Анна Юдочкина,2019-09-25 00:09:48,Невменяемая управляющая при клиентах кричит на весь зал на консультантов,3,
196,Павел Пучков,2019-10-14 11:32:16,"Нормальный офис,компетентные сотрудники,хорошо обращаются с посетителями!",4,
197,Андрей С,2020-07-09 11:49:11,Единственный банк на весь район,4,
198,Ринат Бектагиров,2019-08-17 06:56:18,Всегда без очереди и приветливый персонал,5,
199,Алекс,2022-09-20 12:17:03,Все норм,4,
200,Наталья,2020-04-03 05:14:16,Удобно. Мне нравится,5,
201,Светлана Екимова,2020-10-21 12:15:42,Много банкоматов,5,
202,Елена В.,2019-09-09 05:58:45,"отличное обслуживание, спасибо",5,
203,Михаил Толок,2020-03-17 06:56:44,Моодцы.все быстро.понятно.доступно.,5,
204,Сергей Деревягин,2021-07-28 17:13:41,Пойдет,5,
205,Молоток,2019-11-03 16:55:47,Много банкоматов стало это радует,5,
