,name,date,text,stars,answer
0,Юлия К,2024-03-13 22:36:48,"Выражаю свою благодарность специалисту,которая работает в справочном отделе)Всегда готова помочь и очень доброжелательна)Благодаря таким сотрудникам приятно посещать банк).Хотя и другой персонал вызывает те же чувства)А также нравится приятная цветовая гамма в зале ожидания и то,что есть уголок для детей,чтоб порисовали пока заняты родители)",5,
1,Луконина Ирина,2023-07-27 05:17:12,"Руководитель Татьяна Николаевна со своим дружным коллективом всегда поможет и проконсультирует клиента. Весь персонал-высококвалифицированные и отзывчивые люди. Всем советую обращаться только в этот офис- останетесь довольны! Очень Рекомендую этот офис!!! Обслуживаюсь здесь с 2003 года, спасибо большое ещё Ольге Смыковой, Ярославе Беловой Оксане Викторовне, да и всем девушкам консультантам, обслуживание всегда на высоте",5,
2,Татьяна А.,2023-11-28 06:33:14,"Отличное и комфортное расположение офиса!Все сотрудники внимательные ,доброжелательные,всегда помогут решить любой вопрос!",5,
3,Татьяна Сафарова,2023-10-23 17:41:50,"Консультанты очень подробно и грамотно разьяснили все интересующие моменты, вежливые, без навязывания продуктов кампании, рекомендую 💯, окно √3, отдельное спасибо, приятно было пообщаться",5,
4,Галина,2024-04-01 10:01:32,"Рядом, удобный график. Но обслуживание зачастую зависит от настроения персонала. Нового. Старые сотрудники всегда терпеливы и доброжелательны.",4,
5,Заира К.,2024-02-24 11:59:51,"Обслуживают достаточно быстро, на все возникающие вопросы дают чёткие ответы. Каждый раз хожу в этот филиал и всегда получала качественные консультации и обслуживание.",5,
6,Алёна Симонова,2024-01-13 12:01:36,"Обслуживание на высоте, но после того, как закрыли второе отделение Сбербанка в Юбилейном, всегда очень много народа((( А так как в основном, это люди пожилые, очередь, бывает, движется, очень медленно (",3,
7,Софья Владимирова,2023-03-28 14:54:38,"Очень нравится этот сбербанк. Удобное местоположение, приятные консультанты. Часто попадаю в окно 1, Держицкая Юлия, консультант от бога!!! Приятной внешности, граммотный специалист, всегда в хорошем настроении, общительна, любезна. Я всегда довольна результом своего вопроса и ухожу в позитивном настроении!!! Побольше бы таких специалистов)",5,
8,владимир мазаев,2023-08-30 17:48:59,"Персонал вежливый, предупредительный, всегда могут подсказать и помочь. Организована электронная очередь. Для детей организован детский уголок. В Сбербанке установлены банкоматы, которые работают круглосуточно.",5,
9,Даниил Биткер,2023-06-08 11:13:49,Самый лучший филиал в Саратове. Руководитель Татьяна Николаевна со своим дружным коллективом всегда поможет и проконсультирует клиента. Весь персонал-высококвалифицированные и отзывчивые люди. Все советую обращаться только в этот офис- останетесь довольны! Рекомендую!!!,5,
10,182960 Даниличева,2023-10-12 02:38:13,"Сбербанк единственный в этом районе, поэтому все хорошо, обслуживание,внимательные сотрудники,расположение удачное, без очередей огромных,все быстро и качественно",5,
11,Станислав Жижин,2024-02-02 14:24:46,"Спасибо большое консультанту! Пришел, спросил, подсказали, решили проблему. А она была в отсутствии смс от нового приложения. Причина - когда-то ставил блок на номер 900, так как звонили мошендосы с него. Снял блок - смс пришло. Спасибо большое за подсказку консультанту!",5,
12,Мария Лихоман,2023-12-09 17:13:53,"Хорошее отделение. И на весь Юбилейный, мне кажется, - единственное)
Есть не только банкоматы, через операционистов можно хоть за услуги оплатить, хоть деньги перевести или обменять.
Очередь двигается довольно быстро, почти все окна всегда работают, в отделении чисто, тепло",5,
13,Давыдова Виолетта,2023-04-10 09:38:13,"Я очень довольна обслуживанием Виктории Пересыпкиной ....
Она меня обслужила очень профессионально, быстро без лишних вопросов и расспросов.
Всё сделано чётко и очень вежливо.
Выражаю свою благодарность этому замечательному менеджеру!
Побольше бы таких умных и современных работников!!!
Так держать Сбербанк!!!",5,
14,Елена Штэнь,2024-03-24 19:16:06,"Единственный на весь пос Юбилейный и близлежащие посёлки, офис сбербанка. Работает как и все остальные, не лучше и не хуже. Переодически пользуюсь его услугами и пользсь банкоматами.",5,
15,Star Kate,2024-04-19 09:45:09,"Работа отделения вызывает вопросы, закрывается по разному в выходные, в будние дни работает до 18.00, как и большинство людей которые идут в него после работы. Также непонятно почему сервис по доставке товаров нельзя организовать отдельно от режима работы офис-менеджеров…",2,
16,Татьяна Гуменюк,2023-06-23 18:34:24,"Чисто в помещении, сотрудники соблюдают дресс-код, вежливые, доброжелательные. Очередь движется быстро, при входе надо взять талон, тут помогает сотрудница. Окон обслуживания много. Также много банкоматов, если возникают трудности, то они легко разрешаются специалистом Сбербанка.",5,
17,ДОМНА С.,2023-09-19 10:45:44,"Отделение как отделение, чисто, сотрудники стараются, банкоматов много.
Единственное, в последние два посещения, сотрудники очень навящево предлагали оформить сбер прайм. Понимаю, kpi, все такое, но прям перебор)",4,
18,Люба Репях,2023-11-30 13:13:46,"Грамотный персонал, деловая обстановка и просто чудесная Татьяна Николаевна - заведующая филиалом.",5,
19,Wulf,2023-11-26 17:07:39,Сбербанк как сбербанк. Персонал приветлив и профессионален. Ответит на любой вопрос в их компетенции. Если затрудняются с ответом найдут того кто ответит.,5,
20,Инесса,2023-06-02 07:44:06,"Отличное отделение,работают настоящие профессионалы.
Оператору Ольге (окно 1)отдельное спасибо за сохранность забытых вещей. К сажелению благодарность в финансовом плане не взяла. Но оставила очень приятные впечатления.
Надеюсь на премию со стороны руководства.",5,
21,Альберт Рысаев,2023-12-14 10:31:50,"Супер отделение, отзывчивый персонал,заказываю получение товаров с мега маркета сюда, все без очередей, помогут, крутой подъем, место под машины нет",5,
22,Ксюша,2023-08-19 08:29:20,"Не правильный подход к постоянным клиентам, был открытый вклад под 5,85%, ЦБ РФ поднял ключевую ставку, поднялись проценты по вкладам, решили закрыть текущий вклад и открыть новый под более высокий процент, но оказалось что это сделать нельзя тем у кого имелся вклад в Сбербанке в течение последних 3 месяцев!!! Сбербанк, хочется спросить, вы нормальные??? Адекватно мыслите??? Т.е. по вашей логике те, кто вновь к вам пришли им хорошие условия, а кто у вас десятки лет обслуживается, до них вам все равно???Если уйдут, не страшно??? Ну хорошо, нам все понятно, сняли все свои накопления тут же, незамедлительно и отнесли в соседний банк конкурент - Россельхозбанк, открыли вклад под 11%, следующие накопления отнесем также в Россельхозбанк, а вы с таким подходом продолжайте терять своих клиентов…Удачи и процветания!!!",2,
23,Ольга Саратов,2023-06-04 23:24:49,"Хорошее большое отделение, много банкоматов где можно и снять и положить деньги. Много диванчиков где можно посидеть пока ждешь очередь . Очередь электронная. На взоде всегда стоит консультант которая подсказывает какой талон взять и куда пройти. Персонал весь очень вежливый. Так же тут можно сделать возврат товаров купленных в СберМегаМаркете",5,
24,Максим Брехов,2023-10-03 16:29:42,"Поставить машину рядом - большая удача. Улицы узкие и всегда забитые. Персонал банка вежлив по уставу, но политика - сделать деньги на людях из воздуха. Пришёл поменять железные деньги на бумажные - во первых лимит 3000р, во вторых - комиссия! Вопрос: за что?",1,
25,Лаура Мукашева,2023-09-28 17:02:30,"Открыла для
Себя,что в этом Сбербанке постамат от мегамаркета,а некоторые товары даже у сотрудников можно забрать,когда мест не хватает в ящике ,банкоматов хватает ,очередей практически нет,персонал приветливый и вежливый",5,
26,Надежда Ж.,2023-06-14 16:09:00,"Быстрое обслуживание, небольшие очереди, всегда помогут и подскажут. Хорошее место , рядом остановка магазин Берилл.",5,
27,Инкогнито 6111,2023-12-19 06:38:07,"Девушки очень классные. Быстро, вежливо. Все толково объясняют.",5,
28,Константин,2023-06-30 12:54:48,"Очень рад что есть банк в юбилейном и не приходится ехать в центр и потом искать где оставить машину, тут есть место и для парковки и зона 24, в целом, рады что он есть",5,
29,Анна К,2023-07-15 15:39:36,"Очередь фантастическая! Я такое столпотворение не видела очень давно. Прождала более 30минут, пришла к сотруднику, сделать перевод и ответ был ""не умею"", побегали, перевели к другому специалисту. Итог - час в банке в жарком, душном и не постесняюсь сказать ""вонючем"" помещении. Я понимаю что там 133 пенсионера одновременно, но они потели бы меньше, эсли бы работали кондиционеры. Ужасно...",2,
30,Инкогнито 8678,2024-02-14 15:52:02,"Очереди, очень долгое ожидание. Просидела 40 минут из за пустякового вопроса, который мог решить любой работник банка.",3,
31,тина маркова,2023-09-07 15:37:23,"Могу отозваться только положительно. По любому вопросу и возникшей проблеме , всегда помогут. Мне помогали всегда, когда бы я не обращалась .А я обращалась неоднократно!",5,
32,Людмила Зейналова,2023-09-24 16:42:25,"Посещала несколько раз. Работают квалифицированные сотрудники. Ворос решила бысто и без проблем, за что девочкам отдельное спасибо.",5,
33,Юрий Након,2023-12-09 09:27:16,Чтобы получить готовую карту уходит 1 час нас позвали но нешевелется вообще и это зам руководителя Ольга,1,
34,VoV ОКСАНА VoV,2023-09-01 17:41:51,"Бутьте осторожны консультируют не правильно,обманули со вкладом,по факту пролетела с процентами не выплатили так как говорили, одно,а оказалось через месяц другое,всё время навязывают настойчиво платные услуги,собирают биометрию не спросив даже разрешение устно,хотя по закону это должно быть письменное согласие клиента",1,
35,Alexander,2023-06-29 13:26:33,"Удобное расположение, близость к остановкам. Обслуживание отлмчеое, так же персонал всегда дружелюблив",5,
36,Сергей Ф.,2023-04-10 07:17:47,Очень доволен обслуживанием. Специалист Смыкова Ольга квалифицированных и очень доходчиво помогла в решении вопроса,5,
37,Ник Вольский,2023-10-30 03:18:18,"Отличный банк, персонал вежливый, пошли на уступки выдали крупную сумму без заявки",5,
38,Руслан Т.,2023-03-28 12:25:54,"Отличный коллектив, сотрудники доброжелательны, всегда помогут в любой операции. Рекомендую отправку посылок!!!",5,
39,Вадим Неугодов,2023-07-11 00:50:09,"Старший менеджер, все очень доходчиво и понятно объяснил. Без суеты и криков. Хотя на входе, после объяснения цели нашего визита сказали, лучше посмотрите в интернете......",5,
40,Лариса Лягина,2024-01-07 16:19:11,"Хорошее отделение, но как и почти везде в Саратове, нет парковки",4,
41,Ян Чередников,2023-03-10 12:51:16,Вообще мрак на такой огромный район Юбилейный оставили одно отделение! Самое главное что часы работы до 18.00. У меня рабочий день в 18.00 заканчивается. Как люди должны успевать после работы непонятно. Такое ощущение что только для бабок или безработных открыты.,1,
42,Инкогнито 6301,2024-01-24 17:01:05,"Плохо, то, что один Сбербанк на такой большой микрорайон. Всегда очередь.",3,
43,Геннадий Афанасьев,2023-10-06 16:32:34,"Персонал тактичный, компетентный. Минус только за то, что совсем не ловит связь на телефоне, как только переступаешь порог",4,
44,Валя Ефремова,2023-11-21 12:42:34,Девочки просто чудо!!! Грамотные и вежливые.,5,
45,956082 Станчина,2023-06-05 12:12:10,Всегда хорошее и быстрое обслуживание . Вежливый персонал рекомендую,5,
46,Александр Хвостиков,2023-03-22 06:43:58,"много банкоматов, большое отделение, даже есть парковка хоть и не очень удобная, но зимой никогда не чистят ступеньки",5,
47,Анна Русакова,2023-03-29 15:08:10,"Очереди конечно большие, сидела наблюдала за работой сотрудников, сотрудники делают все возможное. Проблема только в том, что на такой большой район одно отделение банка.",5,
48,Алёна Комарова,2024-03-05 16:41:19,Вежливый и грамотный персонал,5,
49,Наталья Акулова,2023-02-16 14:46:33,"Ужасное обслуживание, по 40минут на одного человека. Самый гадкий Сбер, администратор как змея на всех шипит. Сатаева Ольга отчитывает сотрудников при посетителях.",1,
50,Ирина Барышева,2024-01-20 11:40:19,"Близко к дому, удачное расположение",5,
51,светлана новаковская,2023-09-29 17:34:09,"Обслуживание клиентов замечательное, отношение очень хорошее.",5,
52,Вадим Раев,2024-03-13 14:26:56,Хороший филиал персонал знает свою работу,5,
53,Сергей,2023-04-15 05:48:52,"Всегда очередь, с парковкой беда, персонал всё время торопится пытаясь устранить очередь получается суета.",3,
54,Наталья Баранник,2023-05-03 16:52:06,"Не компетентный персонал, каждый раз испытываешь шок от персонала, такое ощущение, что приходишь оплачивать, а к тебе относятся, что будто милостыню просишь!!!",1,
55,Татьяна Турбина,2024-01-17 05:03:18,Относительно быстро обслуживают,5,
56,Пётр Суханов,2023-01-30 16:45:43,"Постоянно навязывают какие-то подписки и услуги, во главе с руководителем отделения, она больше всех там бегает и навязывает прям пресует не по-детски, отваливаются если только начинаешь разговаривать в грубой форме",3,
57,Меженкова Татьяна Николаевна,2024-02-18 15:45:28,Парковаться на горке не удобно.,5,
58,Александра Панферова,2024-02-20 09:51:36,Почти час пожилой человек ждала свою очередьЯ,1,
59,веденеева елена,2023-02-22 15:14:49,"Единственное на весь посёлок отделение Сбербанка, часто очереди от этого!!! Очень скользкие полы на входе в банк там в зимнее время можно просто убиться!",4,
60,Лидия,2022-04-30 06:48:47,"Приветливый персонал, всегда проконсультируют по нужному вопросу, быстрое обслуживание. Очередей нету, а если есть, то не большие. Много банкоматов к которым доступ 24/7.",5,
61,Мисс КОШЕЧКА,2023-09-17 09:24:16,Быстро обслужили и очень приятный персонал,5,
62,Татьяна Ш.,2022-07-12 11:03:03,"Постоянная очередь в кассы к операционисиам. Да и понятно , закрыли рядом филиал сбербанка и остался всего один на большой посёлок. Надо запастись терпением , чтобы решить вопрос",5,
63,Наталья Игнатенко,2022-10-18 17:41:01,"Приятное обслуживание, вежливый персонал. Очень грамотные консультанты.",5,
64,Нина Яковлева,2023-07-11 16:22:57,"Быстрое обслуживание, вежливый персонал,.",5,
65,Юлия Вербицкая,2023-04-07 14:02:35,"Отзывчивый персонал,очереди мало,удобно и рядом!",5,
66,Анастасия Абузярова,2023-03-31 12:46:35,"Хороший, Добрый персонал, сейчас и очередей почти нет, но один сбер на юбилейный мало..",5,
67,Kirito _,2023-03-28 18:31:23,"Хорошее отделение, жаль только что очереди больше стали после закрытия другого отделения.",5,
68,Гуля Нургалиевна,2024-04-19 07:49:58,Благодарю за помощь!,5,
69,Елена Скрипка,2022-08-16 11:51:53,"Спасибо всему персоналу банка,всегда компетентны,приветливы,терпеливы и вежливы",5,
70,Наталия,2023-10-22 06:16:38,"Большие очереди, часто не работают банкоматы.",3,
71,Валерий Елохин,2023-02-17 17:19:18,Быстрое и качественное обслуживание. Нет навязчивых предложений.,5,
72,Мария Х,2023-04-14 11:36:51,"Навязывают настойчиво услуги своего банка, что аж хочется бежать сверкая тапками. Если любите, чтоб вас ""принуждали"", то вам сюда.",2,
73,Андрей Мараев,2023-09-04 15:12:50,Быстро и качественно оказали услуги,5,
74,Володина Елена,2023-01-08 16:53:54,Хорошее отношение. Быстрое решение аопромов. Удобный график работы.,5,
