,name,date,text,stars,answer
0,Юлия К.,2023-11-01 05:20:07,"Одно из крупных отделений Сбербанка в регионе.
Отзывчивые сотрудники, всегда решают оперативно мои вопросы. 
Работают профессионально. 
Не создают в отделении очередь. 
Всегда есть место для парковки.",5,
1,Евгения Панюшкина,2024-03-14 12:22:54,"Очень крутой ипотечный центр!
Менеджеры все на позитиве и всегда грамотно и компетентно относятся к своим клиентам!
Отдельное спасибо ,менеджеру по ипотечному кредитованию Островской Ирине!",5,
2,Алексей Ильин,2024-01-25 12:05:17,"Приветствую. Хочу поделиться приятным опытом в банке. Обслуживание было быстрым и эффективным, сотрудники проявили профессионализм. Получил всю необходимую информацию и помощь по моим вопросам. Доволен качеством обслуживания и вниманием к клиентам. Рекомендую!",5,
3,Татьяна Новожилова,2024-01-06 18:17:51,"Профессионалы ! С учетом того , что большой штат специалистов и всегда есть народ. Но совсем с этим ,сотрудники всегда любезны и отзывчивы, готовы помочь. Это отделение люблю больше остальных.",5,
4,Наталья Петровна,2023-11-09 11:37:10,"С большим удовольствием захожу в ипотечный отдел, проконсультироваться для себя, для бизнеса. Очень внимательные и вежливые сотрудники. Спасибо большое.",5,
5,Екатерина Хорошун,2023-11-03 10:23:10,"Притензия не к самому данному банку. А вообще к банку как к юр лицу: сберспасибо перестали начисляться,а новые условия их начисления -ужас, низкий процент по вкладу, и вечно задерживают зачёт денежных средств,обычно на 2 часа ,а в этом месяце соцзащита отправила детские пособия утром ,почти 15 часов дня - банк деньги не перевёл. Жду переоформления пособий - буду закрывать карту и ухожу в другой банк",1,
6,Надежда С.,2023-11-08 13:21:55,"Удобное местоположение,всегда помогут с проблемой и найдут выход.Пользуюсь банком очень давно.✌️👍🤗💯💯💯",5,
7,Юлиана,2023-11-28 15:31:28,"Хороший банк. Грамотные, вежливые специалисты. Оперативно можно решить свои вопросы. Рекомендую.",5,
8,Мария Андрианова,2024-02-18 18:38:56,"Дорогу к Сбербанку никогда не чистили!!! Лишний раз не хочется обращаться в это отделение! С парковкой засада! Сейчас февраль -глыбы льда! На машине не рекомендую-можно без бампера остаться! А в самом отделении, где банкоматы вечно грязь и неприятный запах!",1,
9,Саратовчанин 1986,2023-11-01 13:43:48,"Стандартный банк. Неплохой персонал. Сделку оформил быстро. Ловит интернет в отличие от филиалов , где приходится бегать на улицу постоянно.",5,
10,Наталия Галкина,2023-12-24 17:25:43,"В данный момент,терминалы надо проверять, работают через один, зимой или летом всегда ночуют собаки ,никто не гоняет, тусуется молодежь внутри,никакой охраны,желательно бы....",4,
11,L Sh,2023-01-11 15:51:07,"Тепло, чисто, удобно снять, внести, оплатить. Если, что непонятно добрые и отзывчивые сотрудники всё подскажут. Удобное расположение здания. Удобно оформить киберкарту для школьника.",5,
12,Вадим Рыбков,2023-10-21 11:41:30,"Хорошее отделение, приветливые сотрудники, недавно оформлял сделку купли продажи так. Особая благодарность Наталье Юнусовой!",5,
13,наталья это я,2023-06-09 15:56:02,"Всегда пользуюсь только этим отделением банка,просторно ,обслуживают быстро,ещё заказываю через этот банк товар из Мегамаркета.неудобство только одно,что банк работает до 18.00,частенько не успеваю с него,после работы.",5,
14,Elena Golubeva,2023-08-02 17:49:18,"Большое отделение банка. Много сотрудников, готовых помочь, в решении Вашего вопроса. 
Не смотря на большое количество посетителей, обслуживание проходит достаточно быстро.",5,
15,Ольга Макарова,2023-04-29 12:52:44,"Удобное расположение, рядом с работой. Персонал внимательный, компетентный. Обслуживание быстрое, или так попадаю с утра..",5,
16,Валерий Молчанов,2023-11-20 16:51:51,"Отвратительно, что сделали общую очередь для физических и юридических лиц, очень много времени тратиться впустую",2,
17,Мониторинг 64 ГЛОНАСС,2024-02-12 07:12:09,"Банк хороший, приветливые сотрудники, оформление сделки быстрое.",5,
18,Оксана У.,2023-11-13 08:25:12,"Всегда грамотно помогают с документами, спасибо",5,
19,Ольга Крылова,2023-02-02 10:50:04,"Приехала в офис из другого города, нужно получить токен, на ресепшен встретили две девушки, выдали талон к специалисту, ОК. Обратилась с просьбой посетить туалетную комнату_ на что девушки ответили, у нас нет для клиентов! ПЛОХО!!! ОЧЕНЬ ПЛОХО!!!",1,
20,Валентина Шестакова,2024-01-03 07:23:22,Приветливые сотрудники. Все понятно обьясняют.,5,
21,Дамир Алимбеков,2023-11-10 09:50:51,Кассира ждем уже 45 минут. В других отделениях намного быстрее.,2,
22,Алексей Костин,2023-02-22 06:17:36,"Заказал справвку о передвижений всех денежных средств. Два дня за ней ходил Первый день потратил 1,5 часа так и не дождался банк закрылся . Второй два часа. Если у вас не простой вопрос в этот банк лучше не обращатся",1,
23,Aleksandr Kha.,2022-07-14 04:02:53,"Это не народный банк. Ранее, т.е до санкций Запада его процентная ставка за рубежом составляла от 0,8% до 2.0% годовых , например, для граждан стран ЕС, в то время как для россиян эта ставка была в десятки раз больше. Для пенсионеров, с их жалкими пенсиями кредитные, ипотечные операции конкретно в этом отделении Сбера совсем недоступны. 1 млн. Рублей для улучшения жилусловий пенсионеру получить по ставке 7-10 % невозможно: сами же банковские служащие говорят что пенсия даже в размере 18-18 тыс. руб недостаточно, чтобы получить кредит или оформить ипотеку в Сбере. Срок на момент закрытия кредита или ипотеки не может превышать возраст пенсионера -75 лет. ( в Почтабанке - 65 лет). Знают, что государственные пенсии в РФ - нищенские. Суды в РФ тоже это знают. Что толку от того, что в зале банка стерильно как морге? Кому это пошло на пользу? Жалкое зрелище предстает перед глазами, когда понимаешь, что скрывается за внешним благопристойным фасадом Сбербанка. Когда человек тонет, то спасатели грубо тащат его из воды за волосы. Замечательный банк для тех кто получает от него (>70%) дивиденды - иностранных ""инвесторов"".",4,
24,Сергей Ломовцев,2023-11-15 16:20:10,Хорошее обслуживание и компетпенция операторов.,5,
25,Екатерина Конченко,2023-02-28 14:27:33,"Не совсем понятно куда идти человеку который зашёл впервые, что то узнать. Все занимаются своими делами,такое ощущение что попала в офис, и клиентов там быть не должно)",3,
26,Ирина Сложеникина,2024-01-03 20:17:41,"Ужасный подъезд к офису, можно оторвать бампер или защиту картера.",1,
27,Спартак Шаров,2023-04-06 10:13:49,"Все отлично, расположение, есть парковка. Персонал вежливый.",5,
28,Наталия Риэлтор,2023-08-18 16:16:16,"Сотрудники ипотечного отделения классные профессионалы, всегда идут на встречу",5,
29,андрей мартыненко,2024-01-05 16:48:59,Вежливый приятный персонал.,5,
30,Инкогнито 9061,2024-03-11 04:59:10,Сбербанк супер. Всегда работаю с ними,5,
31,Антон игоревич Фалалеев,2024-01-10 12:15:37,Очень отзывчивый персонал !,5,
32,Татьяна Черябрикова,2023-11-21 16:12:46,Отличное место Хоть я там ни разу не была,5,
33,Мирослава Кошелева,2024-01-28 18:33:31,"Сбербанк хороший! Ооочень большой,",5,
34,София Мавлютова,2023-09-30 15:36:05,"Все хорошо , и очень быстро прошла сделка .",5,
35,Руслан Al,2022-06-05 10:07:45,"Оформлял ипотеку 2021г. Приятные сотрудники.
1-й сотрудники быстро оформил документы, все объяснил. Через год необходимо было взять документы по ипотеке, помогли за 3 мин.
👍👍👍",5,
36,Константин Платонов (Артлюкс),2022-05-16 16:14:07,"Сбер, он и в Африке Сбер. Умеренные очереди, в меру навязчивое впаривание продуктов, но по факту самый крупный банк страны со всеми плюсами и минусами.",5,
37,Татьяна Омельченко,2023-02-26 17:49:54,"Очень внимательные сотрудники.всегда помогут, 🌻. По всем вопросам обращаюсь только в этот офис 🏢",5,
38,Ирина Алексеевна Мандрыкина,2023-08-23 18:10:29,"Помещение очень маленькое, душно особенно в дни выдачи пенсий, лето жара, людей много...",4,
39,Кристина Белоногова,2023-07-09 07:07:45,"Быстро, четко и по делу)
С хамством не сталкивалась
Сотрудники доброжелательные",5,
40,Евгений Геннадьевич,2023-12-14 15:15:45,есть не одыкватные сотрудники,3,
41,Вера Г.,2023-10-12 15:25:17,"Хороший банк, чисто уютно приветливо",5,
42,Valeri Martynov,2022-11-21 19:35:42,"Удобное расположение,имеется стоянка для авто, банкоматы работают круглосуточно",5,
43,sehchin.vadim,2023-05-17 17:13:21,"Квалифицированный персонал, доходчивое объяснение возникших вопросов.",5,
44,Виктория Филичи,2023-03-26 06:30:10,"Удобно. НО, если вы решили что-то оплатить на кассе, а карты сбербанка у вас нет, снимайте деньги заранее, принимают ТОЛЬКО КАРТЫ СБ🤯",4,
45,Ира,2022-12-02 04:35:49,"Удобное время обслуживания, грамотный персонал, удобное расположение",5,
46,Марина Еремина,2022-06-09 17:34:59,"Очень современный банк. Недавно была, ответили на все интересующие вопросы, вежливо. Очень понравилось. Буду ходить только туда",5,
47,сергей рубанов,2022-08-13 14:10:21,"Спасибо сотруднице банка! Жаль, не запомнил ее фамилию. Восхищен компетентентностью, внимательностью, ясностью разъяснением, не оставившем необходимости. в дополнительных вопросах",5,
48,Ансар Сариев,2024-01-30 08:17:46,Удобное расположение!,5,
49,Бигалиев А.Г.,2023-02-22 07:31:58,"Хороший филиал банка! Хорошая парковка, дорога только в критическом состоянии и такое ощущение, что ее не когда не ремонтировали.",5,
50,Виктор,2023-10-26 17:11:45,"Одни вруны и обманщики, обводят пенсионеров вокруг пальца. СберПримьер.",1,
51,Вячеслав К.,2023-07-31 09:43:06,"Вежливый персонал, иногда бывают очереди в банкомат",4,
52,Посетитель,2023-04-06 16:06:49,"Очень оперативное обслуживание
Компетентные сотрудники.",5,
53,Александр,2023-03-19 17:55:42,"Очень удобный офис в центре города, много банкоматов",5,
54,Инкогнито 1466,2023-10-07 13:23:58,"Быстрое обслуживание,
Уютно",4,
55,Tomara80,2024-03-27 10:59:23,Ужасная разбитая парковка у главного Сбербанка в Энгельсе. В зоне 24 постоянно тусят дети!,1,
56,сергей ч,2024-01-25 12:32:51,Хорошее обслуживание.,5,
57,Марина Харькова,2021-06-27 06:42:01,"Специалисты вежливые. Обслуживания когда как попадёшь бывает что быстро очередь двигается а бывает и нет. 
Те специалисты которые сидят работают с карточками с кредитами очень американский грамотно обьесняют нет так чтобы что-то навязывали. Да они предлогают услуги свои но без фонатизма",5,
58,Наталия С,2023-08-13 15:28:36,"Персонал отличный, всё для клиентов",5,
59,Галина Кашкина,2022-10-31 21:17:55,"Снял сам, положил сам, отправил, заплатил, а с чем не справился сам, поможет персонал с 8 до 18 строго по часам.",5,
60,Мария Чугунова,2022-05-18 11:21:23,Обслуживание на высоте. Грамотный персонал. Лояльно относятся к клиентам с маленькими детьми,5,
61,Александр,2021-12-27 16:21:45,"Пользовались услугой данного офиса, все понравилось, быстро сделали свою работу, сотрудник попался мне приветливый и обхадительный",5,
62,471000 Моисеева,2022-07-21 11:29:29,"Перестала пользоваться услугами этого банка по многим причинам : от взимания комиссии за коммуналку до безразличного, не профессионального отношения к клиентам",2,
63,МАРИНА Заплатина,2023-07-03 07:28:33,отличное отделение банка! обслуживание отличное!,5,
64,Ирина Будюкова,2022-11-14 01:46:46,Очень хороший персонал. Всё быстро сделали молодцы.,5,
65,сергей д.,2023-09-26 11:24:16,Отвратительный банк. Очередь не дождешься,1,
66,Дмитрий Юрьевич Иванов,2023-03-18 07:50:39,Центр ипотеки сбербанка. Места много и свободно.,5,
67,Энрике,2022-08-15 18:55:00,"Днем чисто, быстро помогут и подскажут девушки-специалисты. Вечером помещение с банкоматами становится местом обитания бомжей, собак, подростков.",3,
68,Лина Бурдашкина,2023-02-08 16:42:49,"Сбербанк в нашем районе, поэтому если есть необходимость, приходим сюда🫰",5,
69,LoraEng Рыбалкина,2022-08-20 11:09:03,Очень удобно расположен. Банкоматы работают круглосуточно.,5,
70,Антон Антонов,2022-10-14 12:15:14,Очень приветливые сотрудники и всегда готовые помочь !,5,
71,Алексей Тараканов,2021-12-20 18:32:17,"Бываю здесь каждый рабочий день, потому что работаю по этому адресу. А корпоративную этику никто не отменял, поэтому всем советую пользоваться этим банком, и все будет в порядке у вас в финансовом плане. 😀",5,
72,Виктория Махрова,2023-12-04 11:08:15,Все нравится!,5,
73,Константин Осипов,2023-05-02 16:23:00,Все хорошо работают люди на своих местах,5,
74,Александр С.,2022-06-29 07:25:48,"большой филиал Сбербанка, поэтому очень долго приходиться ждать очереди, но зато консультируют по любым вопросам",4,
75,Наталия Мельникова,2022-02-09 16:17:39,Единственный ипотечный центр в городе Энгельсе. Сотрудники девчонки большие умницы.,5,
76,Иванов,2022-07-24 02:35:44,"Ну тоже, сбер как сбер, вообще для всех сберов есть жирный минус! Сокращают сотрудников, консультировать наших пенсионеров некому. Они кучкуются возле банкоматов, в надежде что может кто нибудь всё таки поможет. И слава Богу, помогают, мир не без добрых людей!",5,
77,Анастасия,2021-06-22 11:55:14,"Быстрое обслуживание, ожидание в очереди не более 10 минут обычно.
Но один раз взяла талон, пришла моя очередь и мне женщина из персонала говорит что ее рабочий день окончен и идите ещё за талоном👍🏻 В общем проторчала там пол часа.",4,
78,Игорь Пахомов,2022-06-26 13:36:35,Вечерами в отделе банкоматов - молодёжный клуб с напитками и чипсами. Так же ночлежка для бродячих собак.,4,
79,Эдуард,2023-06-07 10:37:19,"Обслуживание 5, условия -0, полная замануха",1,
80,Сергей П.,2023-01-12 13:10:28,Очень вежливый и внимательный персонал,5,
81,Denis Fedin,2023-09-02 17:15:19,"Как обычно, большие очереди",4,
82,Одуванчик,2022-09-08 11:31:44,"Оформляла кредитку у сбербанка, много молодёжи, но совсем не знают как пользоваться, главное втюхать страховку, на которую я, не была согласна, без моего ведома паренек её мне оформил, обман кругом",3,
83,Сергей юдин,2022-08-06 13:29:46,Хоршый отзывчивый и очень грамотный коллектив,5,
84,Ильмира Исмаилова,2021-08-06 10:08:54,"Лучший Сбербанк на районе. Всегда помогут, подскажут. Единственное очередь всегда космос тут
Всегда сижу по 20-30 минут",5,
85,Юлия Мусаева,2023-11-18 16:20:43,Всё хорошо,5,
86,Нк Нк,2023-11-03 13:08:37,Всё хорошо,5,
87,Оксана Ефимова,2022-07-30 17:07:43,"Ипотечный центр, приветливые работники, Профессионалы своего дела.",5,
88,Алексей 64,2022-10-31 15:55:44,"Обычное отделение банка, удобное расположение и подьезд",5,
89,678043 Хромов Андрей,2023-07-26 06:34:40,Хороший банк. Всё норм,5,
90,Игнатьева Наталья,2022-01-18 18:46:48,"Очень вежливо,спокойная обстановка .Оформляла ипотеку осталась довольна.",1,
91,Елена Кулабухова,2022-11-25 12:53:43,Хороший ипотечный отдел! Ирина Островская в топе!👍,5,
92,Игорь Шуляк,2022-02-19 15:09:39,"В основном бываю на снятии денег или лужу на карту,телефон.Доводилось обращаться в сам банк изредка.Нареканий не имею.",5,
93,юлия Д.,2021-08-16 21:37:10,"Одобрили сельскую ипотеку. Когда осталось только оформить сделку, менеджер начала говорить, что финансирование закончилось. Начали впаривать кредиты по высоким ставкам. С ними что то выяснить вообще не реально. Конченые",1,
94,Артем Б.,2022-09-17 16:09:53,"Ужасный подъезд к Офису Сбербанка . 
По состоянию на 17.09.2022 года.",2,
95,Виктор Шерстнев,2022-11-27 12:20:46,Центральный офис банка удобен всё быстро,5,
96,Павел Артёменко,2023-01-10 16:09:47,"Очень удобно, рекомендую 👍",5,
97,Виталий Смирнов,2023-01-06 12:35:02,"Мне понравилось то, как налажена работа в этом офисе",5,
98,Китана,2023-01-15 18:07:39,"Обслуживание ужасное, законов незнают и помощи ноль",1,
