,name,date,text,stars,answer
0,Инкогнито 3335,2024-01-07 17:27:19,"Отличный Сбербанк, мало народу чем меня привлекло , вежливый персонал мне понравился хотя живу в Ленинском районе, но когда бываю в той районе удобно лучше чем на Чемодурова 8а",5,
1,Валера,2024-03-30 15:47:04,"Нормальное отделение, народа не очень много, доброжелательный персонал. Конечно когда не день получки и пенсии. Многие платят коммуналку.Удобно расположено.",5,
2,Александр Ефремов,2023-12-17 11:47:01,"Обошёл несколько отделений, но только здесь смогли сделать биометрию для гос ключа. Доброе приветливое внимательное отношение сотрудников. Большое спасибо.",5,
3,Инкогнито 6111,2023-12-09 05:34:19,"Хороший банк. Девочки славные,но...В день получения пенсии очень много народа, приходиться ждать 30-40 минут и пенсия почемуто всегда приходит после обеда(14:00 - 15:00). Почему??? Кто виноват???",4,
4,Оксана Токарева,2023-12-16 15:55:15,"Хорошее отделение,и сотрудники более менее квалифицированные. К стати очень внимательные и клиентоориентированность.",5,
5,Людмила Кондрахина,2023-11-15 04:53:57,"Хорошие, отзывчивые, грамотные специалисты. Быстрое и грамотное обслуживание.",5,
6,Denis Vlasov,2023-12-12 16:42:47,Один из лучших офисов Сбера по скорости обслуживания. Ну и качеству тоже. Удобная парковка,5,
7,Олеся Никитина,2023-07-05 16:44:42,"Рядом с домом. Вежливые сотрудники,всегда помогут,уделят время, всё объяснят. Чисто,спокойно. Очереди очень редко.",5,
8,Алексей Сергеевич,2023-06-03 18:19:47,"Чистый, есть много банкоматов, на удивление мало очередей, или мне так везет)), с парковкой есть проблемы но можно чуть дальше в доль Навашино припарковаться. Обслуживают нормально. Отношение к клиентам вежливое.",5,
9,Клара Нуралиева,2023-07-19 16:50:23,"Офис отличный. Сотрудники все вежливые, грамотные, компитентные. Обслуживание на высшем уровне. Спасибо за работу.",5,
10,Елена,2024-03-16 17:07:51,Отделение хорошее. Банкоматов достаточно. Персонал приветливый.,5,
11,Восканян Давид,2024-03-27 15:21:36,Пытались навязать мне карту чтобы я купил за 2000р так и не понял за что надо было платить туже карту в другом Сбербанке сделали абсолютно бесплатно,1,
12,Елена Толмачева,2023-05-16 17:40:28,"Пользуюсь услугами банкомат .также иногда получаю квалифицированную информацию на интересующие меня вопросы.хочу выделить сотрудника Валентину ,доступно доводит информацию простым человеческим языком а не техническими терминами",5,
13,Светлана Барулина,2024-03-28 05:13:14,"Отличный сбербанк, обслуживание быстрое и вежливое.",5,
14,Роман Г.,2024-01-12 09:52:46,Мне кажется что меня обманули когда отказывали перевыпускать обычную карту без оформления кредитной,2,
15,INFDEF,2023-10-17 17:09:04,"Все очень медленно, царит атмосфера уныния, часто не работают терминалы.
Если вы хотите получить заказанную карту, то оставите там часа 2 минимум",2,
16,Константин М.,2024-02-18 04:28:26,"Попадаются не совсем компетентные специалисты. Или делают вид , что тебя не понимают",4,
17,Людмила шурыгина,2023-04-07 19:45:29,"Персонал доброжелательный, всё очень доступно объясняют. Мне нравится это отделение банка с удовольствием туда захожу.",5,
18,Ольга К,2023-04-24 05:28:21,"Очень вежливый и компетентный персонал. Помогли разобраться с приложением сбербизнес, хоть это и не их профиль. Спасибо большое 🌼 Рекомендую.",5,
19,Сергей Терехин,2022-04-20 18:26:30,"Устроен как и все типовые отделения Сбера, персонал несколько нервный, но старательный. Людей много, место бойкое, парковки нет, движение плотное. Рядом ряд магазинчиков-ларьков продуктовых в основном, станция скорой помощи.",4,
20,Серёжка Танков,2024-01-29 15:42:44,"Заменят банкоматы на новые которые нормально считывают кюар коды, будет 5 🌟",4,
21,Знаток,2023-02-14 10:37:10,Обслуживание на высоте. Очереди небольшие. Можно припарковаться. Персонал всегда помогает.,5,
22,Маргарита Россова,2022-08-04 19:39:21,"Сам офис, конечно, не плохой. Отзывчивые сотрудники, чисто и т.д., но в дни получения пенсии- можно простоять в очереди и 2 и 3 часа! Раньше работал офис на Высокой и там не было ТАК людно... Офис закрыли и теперь приходится ходить сюда. И да, кто живёт на Магнитном- идти очень далеко, особенно бабушкам, а этот офис стал самым ближним....",3,
23,Svetlana,2023-07-21 05:09:27,"Всегда огромное количество людей и нет нормальной парковки. Повезет,если место где -то рядом будет.",4,
24,Маргарита М,2022-08-06 18:36:42,"Вежливые компетентные сотрудники готовые ответить на вопросы, помочь с выбором продуктов без навязывания доп.услуг. Как таковой парковки нет. Пандус имеется. Банкоматы работают круглосуточно",5,
25,Елена Иванова,2023-06-27 16:40:02,"Обслуживание сойдёт, смотря на кого попадешь. Но вот внешний вид банка, а именно где входная зона, это Трэш. Постоянная грязь, переполненные мусорки, выглядит ужасно.",4,
26,Евгений,2022-06-20 11:01:26,"Обслуживание начиная от входа заканчивая сотрудниками в кассах выше всяких похвал,кол- во банкоматов достаточное, персонал на высоте ,расположение удобное но трудности с парковкой.",5,
27,Марина Александровна,2022-05-10 09:43:37,"Вежливый и отзывчивый персонал,всегда помогут,подскажут.. Даже если Вы очень далеки от знаний и пониманий в банковской сфере и услугу кредитования и страхования,то буквально на пальцах объяснят и на бумаге нарисуют,разжуют и в рот положат,и,даже,помогут проглотить!",4,
28,Алексей Парфёнов,2023-02-14 20:48:26,"Мне понравилось. Быстро, без волокиты, всё по регламенту. Специалист Седова поддержала добрым словом. Спасибо вам за выдержку и терпение к нам.",5,
29,Михаил Митрофанов,2023-05-05 12:55:47,"Сбер на районе, один раз переезжал, некоторые сотрудники все те же)) всегда приятное обслуживание",5,
30,Ольга Вехова,2023-05-30 03:06:15,"Внимательный и обходительный персонал.
Быстрое обслуживание клиентов.",5,
31,Дмитрий Ш.,2023-06-22 18:13:55,"Обслуживание на 4,людей в час пик огромное количество.Банкоматы не справляются с наплывом людей,и не всегда в рабочем состоянии.",4,
32,Евгения Щербакова,2022-04-15 17:01:04,"Хороший офис, достойный. Персонал старается не копить людей в очереди, работают быстро и слаженно. Всегда хорошее настроение после посещения. Спасибо!",5,
33,Evgenich ObyxOff,2023-10-20 16:58:46,"Хорошее отделение, всегда проконсультирует и помогут",5,
34,Fred Klinton,2023-09-24 12:56:10,"Рядом с моим домом. Офис чистенький, сотрудники не оставят без внимания.",5,
35,Ольга Л,2023-10-28 21:17:36,Очень удобное расположение,5,
36,Валя Ефремова,2023-03-02 16:28:33,"Отличные сотрудники: вежливые, грамотные и могут найти подход к каждому клиенту.",5,
37,Анастасия,2022-12-23 22:12:28,"Очень хорошее отделение, приветливые консультанты, чисто, быстро!!!!",5,
38,Алексей Антипов,2023-08-18 19:01:59,Хороший филиал. Приветливый персонал. Без суеты.,5,
39,Александр Тимофеев,2023-12-20 16:05:36,Функционально. Удобно.,5,
40,Любляна -,2023-10-17 01:48:31,"Неудобный коридор. А сотрудники внимательные, компетентные и человечные.",5,
41,Алла Томилина,2022-12-20 17:16:51,Обслуживание на высоте. Сотрудники вежливо общаются с клиентами. Ожидание было не долгим. Работают профессионалы.,5,
42,Aleksandr S.,2024-04-02 13:58:45,Хорошее Банковское отделение!,5,
43,Di Babaeva,2023-04-14 00:30:55,Все отлично. Сотрудники всегда помогут расскажут.,5,
44,Алексей Кириллов,2022-07-25 05:30:19,"Постоянно полно народа, вроде как весь спектр услуг банка в этом отделении можно получить, проблемы с парковкой, персонал по большей части адекватный",5,
45,Maksim Shihkerimov,2023-05-21 15:19:08,"4 только из-за того что автоматы старые и могут зависнуть с вашей картой , а так не плохое отделение",4,
46,Хижняк Наталья Валериевна,2024-03-03 18:35:18,"Хорошо, удобно",5,
47,Дмитрий,2021-09-30 15:51:55,"Очень удобно, круглосуточно, чисто, всегда можно обратиться к персоналу, помогут, подскажут, все профессионально объясняют, удобно производить оплату жкх, кредит и много других услуг",5,
48,Vj,2021-07-15 07:03:03,"Удачно территориально расположенное и очень востребованное заведение, всегда много посетителей и как мне кажется все довольны. Круглосуточные-банкоматв.",5,
49,Александр Иванов,2023-10-06 11:28:54,"Зашёл в отделение просто открыть счёт, и прождал около часа. Направляли от одного к другому сотруднику!!! Как мне пояснили сотрудники отделения сегодня много посетителей.",3,
50,Ольга Айбулатова,2024-01-16 17:07:05,Всё отлично!!!,5,
51,Иван Щучкин,2022-06-28 17:07:58,"Всегда много народа , расположение удобное. 5 ночных 
Банкоматов . Удобно",5,
52,Дмитрий Храмов,2024-01-12 13:36:23,"Удобно.
Рядом",4,
53,Татьяна Денисова,2023-12-11 18:31:53,Хорошее обслуживание),5,
54,Оксана К.,2021-12-04 08:55:19,"Всегда открыты, бывает небольшая очередь. Удобное месторасположение. Рядом отделение почты и продовольственный рынок.",4,
55,Мария Горбачева,2021-09-29 11:21:06,"Все разы, что была там - работали 1,5 человека, а остальные сидели, кто-то болтал по телефону и судя по диалогам не на рабочие темы, другие просто между собой, и пока не начнёшь ругаться или возмущаться - ноль реакции
Если приходишь получать посылку, то можно простоять полчаса и на тебя даже не обратят внимание, пока сама не скажешь - хотя взяла талон и им должно высветиться",2,
56,Пашка О,2021-09-21 02:51:17,"У самой организации есть проблемы...Но филиал, вполне достоин 5-ки..Чисто, аккуратно, современно! Персонал соответствует!",5,
57,Валерия Лапкина,2023-12-01 16:19:56,большие очереди,4,
58,Инна Сырова,2022-08-12 18:58:13,Обслуживание быстрое. Персонал компетентный и вежливый. Время ожидание от 1 до 25 минут.,5,
59,Ирина,2023-06-10 12:30:19,"Удобное расположение, рядом с домом",5,
60,Вячеслав С.,2021-09-01 12:45:41,"Небольшое помещение, всё удобно, наглядно, персонал приветлив. Обслуживают быстро. Есть кондиционер.",4,
61,alexej ageev,2023-11-11 17:20:28,Дружебный персонал,5,
62,Просто Наталья,2023-04-28 16:14:11,Хороший филиал Сбера. Грамотные специалисты!,5,
63,Юлия,2021-09-05 16:18:54,"Хорошее обслуживание. Народу обычно не много, специалисты довольно грамотные, приветливые, вежливые.",5,
64,Владимир Табаков,2022-05-19 16:34:07,"Удобно, и добрый там коллектив, объяснят подскажут помогут, твёрдая 5",5,
65,Nikita Avdonin,2022-06-24 16:38:58,"Хорошее отделение, банкоматы. Поручни пандуса можно применить как велопарковку, единственную на районе",5,
66,Екатерина Кекова,2021-10-21 18:36:33,"Сотрудники не умеют выявлять потребность клиента,слышат только себя,пользуются незнанием клиента о картах,о вкладах ,навязывают невыгодные условия для клиента.Приходится много тратить личного времени на оформление вкладов,карт.Я очень расстроена!Будьте внимательны!",2,
67,Ольга Козловская,2022-08-03 11:06:17,"Вежливый персонал, правда очереди долгие , банкомат круглосуточно",5,
68,Александр,2022-01-12 12:42:16,"Банкоматов хватает на всех.на машине удобно.всегда открыто и работают всегда всё терминалы.за сам офис не чего не могу сказать,с менеджером не общался в сам филиал не обращался.",5,
69,Сергеева Виктория,2021-11-22 06:20:29,"Расположение банка,компетентные сотрудники,чистота! Пожалуй,лучший сбербанк из тех где я была,так ещё и рядом с домой",5,
70,Андрей Жандаров,2023-08-07 12:49:33,"Нормальный сбер, как и почти все",5,
71,Тома Александрова,2022-05-20 13:18:13,"Есть парковка , сотрудники вежливые и быстрый . Рекомендую",5,
72,Инкогнито 9876,2023-02-21 18:17:43,Быстрое и хорошее обслуживание очередей мало,5,
73,Натали,2022-09-06 17:25:06,"Три звезды за помещение с банкоматами. Всегда сидит молодёжь на подоконника, частенько курят прямо в помещении. Очень неприятно снимать деньги, когда кто то внимательно смотрит за твоими действиями.

Что касается самого банка, вежливые операторы, всегда чисто, очередей нет.",3,
74,Дмитрий Укропов,2022-12-17 16:16:49,"Удивился,персонал отзывчивый и заинтересован помочь)да и очередей нет.",4,
75,Светлана Кабанович,2022-09-08 11:33:36,"Нормальное отделение, персонал дружелюбный! Бывает долго сидишь в очереди.",5,
76,Антонина,2021-02-09 09:09:36,"Прихожу за пенсией в это отделение регулярно- считай, постоянный клиент😄. Четыре звезды только потому, что иногда бывают очереди. А в целом ,персонал обслуживает качественно, к посетителям относится по-доброму, как и написано в Библии: ""К посторонним не забывайте проявлять радушие...""",4,
77,Новый-год,2022-02-26 10:27:51,Добрый день сбербанк работает очень плохо. Из 6 банкоматов работает только 1. Люди стоят в очереди. И банкомат выдаёт только крупные купюры..,3,
78,Владимир,2022-08-16 19:44:02,"Сбер не может быть разным-он стабильно консервативен, хотя достоинством это я бы не назвал☝️",3,
79,надежда казакова,2023-01-13 15:59:34,Девочки молодцы! С любым вопросом помогут!,5,
80,Светлана Слепова,2021-08-07 09:34:42,"Уютно, чистенько и очень тихо. Хороший коллектив, грамотное обслуживание.",5,
81,Рамина Х.,2023-07-03 17:35:41,Быстро и списались своими работам,5,
82,мария)),2021-10-27 10:40:25,"Особо не стараются работать.очереди большие,отпускают крайне медленно.свою очередь так и не дождалась,ушла.много функций отключить самостоятельно не могут.",3,
83,Александр Книга,2022-01-12 17:34:26,"Нет парковки, персонал не самый квалифицированый, но ребята стараются, с помощью горячей линии, но все же ответили на мой вопрос",4,
84,РАШЕНГЕРЛС RussianGirls,2021-09-13 14:51:47,На 4 рочку. Иногда большьшая очередь и не все окна работают. Был период просто собирали очередь людей на улице. Люди мерзли а в сдание не пускали- пандемия,4,
85,Александр Горюнов,2021-08-14 05:48:57,Персонал не особо торопится. Не заинтересован в быстром обслуживании клиентов. Тянет время и делает вид что есть более важные дела чем клиенты.,3,
86,Александр,2021-11-14 08:05:47,"Больше трёх звёзд поставить не могу! Так как когда заказывал себе карту,пришёл получать отстоял огромную очередь! Прям хаос. Далее сотрудница начала навязывать кредитную карту. На что раз 10 ей было сказано что кредитная карта не нужна! Но сотрудница этого видимо не слышит или не хочет слышать! Продолжала зачитывать свою мантру, про то что кредитная карта это то о чём можно только мечтать.В общем чувство что сходил на базар или рынок.",3,
87,Andrey,2022-12-23 22:14:47,Место мало. Очередь. Но обслуживание нормальное.,3,
88,Валентин Никуленко,2021-10-02 16:39:41,"Хороший филиал, достаточное количество банкоматов, отзывчивый персонал.",5,
89,Екатерина Северионова,2023-04-12 17:11:27,Обслуживание на высшем уровне,5,
90,Александр Лобецкий,2022-06-24 12:48:52,"Компетентный персонал. Иногда много народа, приходится ждать.",5,
91,Елена Чигаркова,2022-02-11 15:18:20,"Всё хорошо в самом отделении , но вот с парковкой очень тяжело ( лучше пешком )",4,
92,наталья н,2020-02-07 14:16:38,"Удобное расположение,вежливые сотрудники. Удобно,что есть возсожность воспользоваться банкоматоми 24/7. Но в вечернее время собираются подростки в холе где находятся банкоматы,слушаю громко музыку и видут себя вызывающе. Продолжвется это безобразие очень давно,но ни кто ни каких мер не предпринимает.",3,
93,Любимая вредина,2023-03-23 19:25:35,"Хорошие сотрудники, нет очередей",5,
94,Оля,2019-12-18 10:40:21,"Отделение небольшое, но комфортное. Есть диван, чтобы ждать очереди своей. Работает электронная очередь, в принципе очень долго не сидишь. В холле 6 банкоматов, которые работают круглосуточно, это удобно. Для микрорайона схи это одно из двух отделений, хотя второе после 6 вообще закрывается и доступа к банкоматам нет.
Консультанты вежливые и всем помогают оплатить.",5,
95,Дмитрий Трусов,2022-07-03 10:49:47,"Норм, очень норм, отличный сервис, 4 за очереди",4,
96,Вячеслав Галкин,2023-10-18 11:59:12,Хороший банк,5,
