,name,icon_href,date,text,stars,answer
55,Александр Бородинов,https://avatars.mds.yandex.net/get-yapic/15298/enc-ee735c3608f5631b041f10da69a7a3bd98eee9008467e0d4eb455d6405be2647/islands-68,2024-03-08 18:40:27,"лучший БАНК, пользуюсь его услугами много лет!",5,"Спасибо за положительный отзыв, нам очень приятно 👍"
56,Igor,,2022-10-01 09:28:11,"Хорошее в целом отделение, но оч мало сотрудников в зоне обслуживания клиентов привелегия. Работают 1-2 окна, очень медленно, зачастую быстрее вопрос решить в обычном окне.",3,"Благодарим за отзыв. Выясним причины такого построения графика работы сотрудников и проведем работу для ускорения обслуживания, а также для повышения комфортности."
57,Ксения Цыркунова,https://avatars.mds.yandex.net/get-yapic/30955/cf4UY1f8fbQbApzIuPHCEQ3b4-1/islands-68,2022-09-16 11:55:30,"Прекрасное отделение
 Заводили сложный аккредитив по сделке с недвижимостью, сотрудники сделали все возможное, чтобы отпустить нас как можно быстрее. Спасибо!",5,Ваш положительный отзыв для нас – лучшая награда 😊
58,Alexey Shmelev,,2022-08-24 11:17:58,"Просторное помещение, работает в субботу, вежливые сотрудники - это основные плюсы. Дополнительно есть вода и автоматы со снеками. Остальное всё по стандартам ВТБ.",5,"Алексей, благодарим за положительный отзыв, нам очень приятно 👍"
59,Михаил Ф,,2023-12-01 13:41:37,"Какое-то соранное отношение.
Базовая операция по счету ~ 1 час",1,"Спасибо, что поделились с нами. Мы обязательно учтем ваше замечание и примем меры. Приносим извинения за неудобства."
60,Алексей Корнев,https://avatars.mds.yandex.net/get-yapic/64336/mDQJYQEnzi5dqXn2PxKCRXwmE-1/islands-68,2022-09-20 15:28:12,"Претензии не конкретно к этому офису а к банковским служащим в целом. Компетенция нулевая. Приипоследнем посещении даже счет не смог паренек открыть. На один и тот же вопрос в разных офисах говорят разное. Я сделал вывод, что ниже чем с управляющим отделения смысла разговаривать не имеет смысла, либо дезинформируют, либо не смогут сделать и пойдут спрашивать у старшего. Тупеем одним словом",4,"Алексей, поверьте, мы стремимся быть лучше. Обратная связь нам помогает понять наши проблемы и принять меры для улучшения сервиса и обслуживания. Благодарим вас за отзыв."
61,Федор Розовский,,2022-07-25 17:50:29,"Одно из лучших отделений ВТБ в Москве. Сотрудники банка профессионалы своего дела, даже самые сложные и нестандартные задачи всегда решаются в срок. Особых очередей не наблюдал, много банкоматов и все рабочие.",5,
62,Светлана,https://avatars.mds.yandex.net/get-yapic/29310/rCidZQt3WZxfgMR5RD8m5Uq77E-1/islands-68,2022-10-25 12:57:50,"Очень была удалена внимательностью работником банка.Мне все рассказали,объяснили и даже помогли подключить мобильный банк.Я пока довольна,а там дальше посмотрим.",5,Спасибо за положительный отзыв. Всегда вам рады помочь 💪
63,Николай Байковский,,2023-03-27 06:08:22,"Отличное большое отделение
Отзывчивый персонал
Все быстро и четко 👌🏼",5,Довольные клиенты - наша лучшая награда. Благодарим за высокую оценку нашей работы.
64,Дарья Фомина,,2022-01-16 17:40:53,"Обращалась 3 раза, два раза по своим вопросам и один раз по доверенности от мамы (наследственный вопрос), все разы осталась очень недовольна, хотелось встать и уйти. Время ожидания очень большое, отговорки, что надо приходить в утреннее время, когда мало людей, а если человек в это время работает!? Может стоит пересмотреть график работы сотрудников? По наследственному делу вообще беда, в другом банке все сделали в моменте, здесь же одни сложности, забрали документы обещали перезвонить через 2 недели, все звонят...",3,
65,Людмила Видягина,,2024-02-13 22:08:53,"НЕ РЕКОМЕНДУЮ !!!! 
Самое ужасное отделение , сто раз уже пожалела что открыла там счёт(((( 
Персонал некомпетентный в своей работе !!! 
Читайте отзывы перед тем как ехать в банк!!!",1,"Будем благодарны, если расскажете подробнее, с какой ситуацией пришлось столкнуться. Не оставим без внимания и во всем разберёмся 👌"
66,Сергей Успешный,https://avatars.mds.yandex.net/get-yapic/15298/enc-aaf7e5a2addae2695e66ccb205eb3df898eee9008467e0d4eb455d6405be2647/islands-68,2022-04-01 05:36:44,"Дважды потерял время и нервы в этом отделении банка.
В первый раз сотрудница требовала подписывать договор не читая, т.к. процитирую ""в интернете надо было читать, а не тратить её время"" и выгнала меня из отделения отказавшись обслуживать и это при том, что я пришёл открыть вклад.
Во второй визит выяснилось, что вышеупомянутая сотрудница умудрилась занести меня в какой то ""чёрный список"" и в итоге мне отказали в обслуживании и даже руководительница отделения не смогла помочь.
Конфликт руководитель отделения тоже разрешить не смогла, да и не хотела.

В другом отделении банка мне смогли помочь быстро и без проблем.
В это ходить не рекомендую, пока там столь не приветливые и откровенно некомпетентные сотрудники. 
Берегите свои нервы.",1,
67,Екатерина М.,https://avatars.mds.yandex.net/get-yapic/28053/enc-b5980f0eb7ac94d1a10ea65268024f443df550dd8e965277bf0aa5d22e952133/islands-68,2022-04-20 11:25:02,"Обслуживаемся в данном отделении как юридическое лицо, отношение как к клиенту банка мягко сказать ни какое, возникли проблемы с обслуживанием, пробовали дозвониться в отделение что оказалось напрасно, не по одному из добавочных что у нас есть трубку не берут, пришлось отвлекать генерального от работы и отправлять непосредственно в офис, проблему не ришили, менеджер Евгения нехотя разговаривала и дала понять что и не хочет вовлекаться в проблему и что-то решать. В итоге отфутболили да еще и с недовольством! Ужасное отделение планируем менять и уж точно не посоветуем нашим партнерам данный банк, а именно данное отделение как обслуживающее отделение для юридических лиц!",1,
68,Найля Л.,https://avatars.mds.yandex.net/get-yapic/35885/QtG0XMxrkc1MNYxbNqHry8Sm3U-1/islands-68,2022-03-24 09:20:34,"Хочу выразить благодарность и поставить высокую оценку при обслуживании в офисе на Москва, Марксистская 5. Специалист Юсупова Д. Ш. Специалист высокого уровня, внимательная и профессионал клиентоориентированности. 
С уважением, Липатова Н. Г.",5,
69,Роман П.,,2024-03-29 14:52:58,Самое худшее отделение. Ожидание на выписку со счета - час,1,"Приносим вам извинения за неудобства. Поверьте, мы стремимся к быстрому обслуживанию. К сожалению, периодически клиенты сталкиваются с длительным временем ожидания. Мы, со своей стороны, проводим постоянную работу для ускорения обслуживания. Надеемся, что при следующем визите вы заметите положительные изменения."
70,Юлия Аксарина,https://avatars.mds.yandex.net/get-yapic/38135/QjXp7NkJo8XjS2gZTmkSqeAcc-1/islands-68,2023-06-17 17:28:40,Вежливые квалифицированные сотрудники. Помогли разобраться со всеми вопросами.,5,"Юлия, спасибо вам большое за доверие 🤗 Всегда рады вам помочь!"
71,а а,,2021-12-29 13:52:20,"Если хотите просиживать время в очередях и работать с сотрудниками, чью компетенцию можно поставить под вопрос, Вам в это отделение. 
Потрясающий сотрудник Татьяна и юр.отдела. Приняла ключи для онлайн-банк. На следующий день пришёл отказ, оказывается должен был быть ещё один документ. На горячей линии любезно сообщили что без данного документа, ключи вообще не должны были принять. 
На следующий день пришли в банк, сразу обратились к Татьяне, которая принимала ключи, на что та ответила что сейчас нас вызовет. «Сейчас» растянулось в благополучные 20 минут. Из 7 окон работает одно, стоим в очереди первыми, никаких движений. В итоге вызвала другая девушка и оказалось что документ нужно было просто отдать и все. Так вместо того чтобы потратить на посещение банка 3 минуты, потратили 20 мин и нервы.",1,"Сожалеем, что вынуждены были потратить ваше личное время на ожидание в очереди. Проведем необходимые мероприятия, которые позволят сократить очередь и решать оперативнее вопросы клиентов. Примите наши извинения, мы исправимся."
72,Cubitalis,https://avatars.mds.yandex.net/get-yapic/15298/enc-c1a5c1cdd2abcd620e4c160aba7268cc98eee9008467e0d4eb455d6405be2647/islands-68,2023-05-02 14:28:03,"ВТБ, кто у вас рекрутер? Приехал в это отделение, начал общаться с сотрудником по имени Дмитрий, в итоге он после консультаций с начальницей отправил меня в другое отделение на край Москвы. Я написал в чат банка об этом, там мне сказали, что так быть не должно. Продержали меня час, с моим паспортом сотрудник уходил в какую-то комнату 6 раз...!!! Что он там с ним делал...??? Вывод - в втб берут тех, кто работать не умеет и не хочет. Люди, делайте выводы из моей истории.",2,"Благодарим вас за отзыв. Нам очень важно знать ваше мнение. Мы стремимся к тому, чтобы быть лучше. Проведем работу в целях улучшения качества обслуживания."
73,Евгений Х.,https://avatars.mds.yandex.net/get-yapic/63256/N20K7XuS8EiR56mbvvIBWTzxq4-1574719567/islands-68,2022-08-03 15:33:25,"Вежливые и профессиональные сотрудники, спасибо! Провели сделку с недвижимостью, быстро и качественно.",5,"Рады видеть, что вы оценили нас на 5 ⭐"
74,€.&amp;K.,https://avatars.mds.yandex.net/get-yapic/27232/FZAxaHzOMspfhJ9ezqu23GV4-1/islands-68,2023-08-30 07:47:38,"Отличный офис, большой и чистый, медленно однако обслуживание..",5,"Спасибо, что отметили наши плюсы!
Организуем проверку и выявим причины длительного обслуживания. Надеемся, что в дальнейшем мы не заставим вас ждать."
75,Анна Скворцова,,2023-07-18 17:08:24,Неприветливый менеджер в зале для клиентов Привилегия. Посещение данного зала было в конце рабочего дня 18 июля.,2,"Спасибо, что поделились с нами. Обязательно проработаем с сотрудниками вопрос соблюдения стандартов клиентского обслуживания. Примите извинения за неудобства."
76,Елена Радуга,https://avatars.mds.yandex.net/get-yapic/21377/enc-f0276e1e9b42e6dae609b1837f3e80f8f56ba639544e07a320a6913d09c3d3d4/islands-68,2023-02-02 17:37:47,"Плохой банк, заказала сумму для снятия, а крутик пришёл, зашёл к начальнице и моей суммы не оказалось... Хотя заказывала ща три дня. Такое только на марксисткой 5 бывает! Другие ВТБ хорошие",5,"Елена, благодарим, что поделились с нами вашим отзывом. Поверьте, мы стремимся быть лучше. Обратная связь нам помогает понять наши проблемы и принять меры для улучшения сервиса и обслуживания. Примите наши извинения."
77,Александр Акимов,https://avatars.mds.yandex.net/get-yapic/65952/JSBPHawpdxvy2P5UsBRiXICF2AI-1/islands-68,2022-03-01 21:27:04,"Сегодня утром, снимал деньги в кассе, деньги выдать не смогли, по причине ошибки компьютера. Через 5 минут списали деньги, но на руки мне их так ни кто и не выдал. Как итог, провел 2 часа в банке, денег нет ни на карте, ни наличных у меня в руках (110т.р.). Составили обращение, ждать 7 дней. Общение с клиентом по форме: вас много, а вы одни, ждите и решайте свои проблемы сами. Помощник руководителя, сказала: что для банка это копейки и им вообще не нужны мои деньги. В поддержке по телефону пренебрижительное общение. Словами сложно описать, как общаются в втб с клиентами, поймёт наверное только тот, кто сталкивался с подобным. К сожалению с данным банком пришлось связаться, потому что там зарплатный проект. Как только верну деньги, с банком разойдусь. А пока напишу заявление в полицию, вполне вероятно, что так они делают регулярно и возможно успевают провернуть деньги, ну или какие у них там схемы?!",1,
78,Евгения Филиппова,,2023-07-06 10:52:09,"Большая площадь и ""куча"" бездельников!!!!! Очереди нет, но все ""ооочень заняты"" отвратительное отделение",1,"Сожалеем, что обслуживание в нашем офисе доставило вам неудобства. Обязательно проведем проверку на основании ваших замечаний вместе с руководителем офиса и примем необходимые меры.
Надеемся, что в дальнейшем мы не заставим вас ждать."
79,Левина Анастасия,https://avatars.mds.yandex.net/get-yapic/50595/enc-4b5322698d62409b74e07c56fb4ca9e1e10904ca0dea0a605caafa2ac17a68d7/islands-68,2023-10-29 15:37:02,Пожалуй одно из лучших отделений ВТБ.,5,"Рады стараться! Спасибо, что вы это оценили 😊"
80,Александр Матузов,,2023-04-26 03:00:21,Хорошее место расположения. Главное - есть где поставить машину!,5,"Рады, что вам понравилось. Ждем вас снова 😃"
81,Влад Владимиров,,2023-02-14 12:43:24,"Обслуживание - жуть какое медленное!!!
15 минут я сидел в очереди и не мог просто получить карту! В других банках это занимает МАКСИМУМ 5 минут.",2,"Поверьте, мы принимаем меры для того, чтобы время ожидания было минимальным. Проведем проверку в отделении и обсудим с руководителем данную проблему. Надеемся, что в дальнейшем мы не заставим вас ждать."
82,Венера К.,,2022-03-11 15:08:55,"Может пришла не в тот день или не в то время, но зал был просто набит клиентами, давно такого не видела. На талончике было указано, что передо мной в очереди 62 человека!!! Удивительно, как нужно ""организовать"" работу и быть ""клиентоориентированными"", чтобы собрать в зале столько народу. Обслуживание ооооооччччччеееееннннннььььььь медленное, сужу по скорости обновления вызываемых номеров. Например : за 25 минут обслужили целых 2-х клиентов! Вот это скорость!",1,"Поверьте, мы стремимся к быстрому обслуживанию. К сожалению, периодически клиенты сталкиваются с очередью и длительным временем ожидания. Мы со своей стороны проводим постоянную работу для ускорения обслуживания. Продолжим работу в данном направлении. Надеемся, что при следующем визите вы заметите наши изменения."
83,Афанасий Хузин,,2023-12-21 11:11:23,Все время приходится ждать если физлицо,3,"Простите, если заставили вас ждать. Поверьте, мы регулярно проводим необходимые мероприятия, которые позволяют сокращать очередь и более оперативно решать вопросы клиентов!"
84,Ирина Кузнецова,https://avatars.mds.yandex.net/get-yapic/25817/HvJHpRIcdnX2iGdIuKnfoa300-1/islands-68,2023-05-04 13:40:42,"Не очень компетентные в некоторых вопросах сотрудники. Друг на друга перекидывают работу, а решить не могут ни чего",3,"Благодарим вас за отзыв. Нам очень важно знать ваше мнение. Мы стремимся к тому, чтобы быть лучше. Проведем работу в целях улучшения качества обслуживания."
85,Александр Чижов,https://avatars.mds.yandex.net/get-yapic/23186/y8XEQANgBzsyHjgcejNkkv2N84-1/islands-68,2021-08-15 12:33:02,"Качественное обслуживание, но в последнее время бывают очереди. Клерки решают все проблемы, а короткие вопросы можно решить при входе у дежурного консультанта без очереди, много банкоматов, достойные проценты по вкладам, пенсионеры, перечисляющие сюда пенсию, обслуживаются круглый год бесплатно, мультикарта ВТБ принимается в любой части света (в Африке, Европе, Америке и Азии не имел никаких проблем никогда)",5,
86,Татьяна СОЛНЦЕ,,2022-11-24 12:03:55,"Персонал отвратительный, сам ни чего не знает, так ещё и потом подстебывает что мол это вы не туда пошли не то сказали. Да и сам банк такой же карту получила а смс всё присылают. Вот вам и здрасьте отношение к клиентам.",1,"Поверьте, мы стремимся быть лучше. Обратная связь нам помогает понять наши проблемы и принять меры для улучшения сервиса и обслуживания. Благодарим вас за отзыв."
87,Наталия Забродская,,2022-08-16 07:18:38,"Не в каждый банк идёшь спокойно, уверенно и надеждой в том, что здесь вас приветливо встретят , ответят на все вопросы, дадут дельный совет. Время ожидания - минимальное!",4,"Наталия, спасибо вам большое за доверие 🤗 Приходите к нам почаще!"
88,Артём Крупский,,2022-08-11 16:51:59,"Хорошее отделение втб, почти всегда свободно отделение для привилегии, парковка своя бесплатная, но часто занята под завязку",4,"Спасибо вам, очень приятно получать обратную связь 🙏👌"
