,name,icon_href,date,text,stars,answer
271,Шавкат Гадоев,https://avatars.mds.yandex.net/get-yapic/27274/B77kAo3VjfJBkBmgkEmLxdBE0ME-1/islands-68,2022-03-15 07:54:59,Если хотите 2 часа посидеть в очереди вам прямо сюда из 20 окон работает,1,Приносим извинения за длительное ожидание. Мы проведем проверку и выясним причины длительного обслуживания. Примем меры для увеличения скорости обслуживания.
272,Anton Zhukov,,2022-10-05 14:00:07,Очередь на час.. По элементарному вопросу.,1,"Антон, хотим извиниться перед вами за долгое ожидание. Это действительно недопустимо. Мы передадим ваш отзыв руководителю отделения, и вместе разработаем комплекс мер, которые не позволят ситуации повториться."
273,Евгения Филичева,https://avatars.mds.yandex.net/get-yapic/63032/UfByD57PbcS3R8rSCJl2SsU84-1/islands-68,2020-10-09 12:02:50,"3 раза пытаемся сдать документы , постоянно огромная очередь. Октройте дополнительный офис, этот не справляется с потоком. В частности, цель - сдать документы для использования мат.капитала",1,
274,Сергей Несобянинов,https://avatars.mds.yandex.net/get-yapic/45131/LivAlxhhmsZHp8LHDeNaXwHenek-1/islands-68,2021-09-07 09:15:55,"Долго обслуживают, непрофессионально( один на всех соображает) из-за обслуживания не стал клиентом",2,
275,никита,,2021-12-07 09:32:08,Консультанты знаю свое дело. Помогли быстро с решением вопроса,5,
276,Солехчон,https://avatars.mds.yandex.net/get-yapic/25358/HSsiQkgZ6up4YKEhiDj0Y0vlSg-1/islands-68,2022-11-29 18:17:22,Очень хорошо спасибо,5,Довольные клиенты - наша лучшая награда. Благодарим за высокую оценку нашей работы.
277,Виктор,https://avatars.mds.yandex.net/get-yapic/39727/6L8PDAmgTD7w0sRzXbQHb8vyx8-1/islands-68,2020-09-08 18:27:54,"Последние визиты оставили очень отрицательные эмоции: обслуживание юр. лиц ужасное, операционисты (7 человек) занимаются чем угодно, но не клиентами (2 клиента за 40 минут); в пандемию у входа собиралась толпа людей, но пускали по одному с большими перерывами...",1,
278,Андрей Жариков,,2022-05-03 04:47:53,"Банк и система хорошие, но юнные особы за стойкой слишком амбициозны и борзы",5,"Спасибо, что поделились с нами вашим опытом обслуживания. Мы обязательно учтем ваши замечания и проработаем их с сотрудниками офиса, чтобы в дальнейшем у вас не возникало сомнений в правильности выбора нашего Банка."
279,Евгения Черноиванова,https://avatars.mds.yandex.net/get-yapic/61207/fcRo6QfJRH2SSRMampNAMmU1gQ-1/islands-68,2022-06-18 17:57:39,Ужас! Зал привелегия- тут ещё на эконом надо учиться.,3,
280,Лилия,,2020-06-23 11:10:21,"Ужасно долго обслуживают!!! Все понимают что в связи с эпидемиологическими условиями и требованиями роспотребнадзора необходимо соблюдать дистанцию, но при этом в вестибюле банка толпится до 15 человек, которых запускают по одному. А какие то блатные клиенты нагло проходят без очереди!!!",3,
281,Olga Anokhina,https://avatars.mds.yandex.net/get-yapic/43473/enc-4631f79d8e574163fd83ffcf324b6872ec92d579cdf06885b43e93971df12c06/islands-68,2022-01-21 11:50:24,Безобразное отделение. 25 окон - принимают шесть. В очереди провели более 40 минут.,1,
282,елена,,2020-10-22 14:41:27,"Сижу 45 минут просто чтобы положить деньги на счет. В кассу напрямую нельзя. Нужно выписать приходник. На талончике было написано 10 человек, прошло уже передо мной 15. Вызова нет. Это ужас, а не отделение!",1,
283,Георгий А.,,2020-07-24 18:40:12,"Время ожидания в любом отделении, в том числе в этом, всегда около часа. Бываю периодически в других банках, там либо не прихолится ждать, либо ждать не более 10 минут. 1 - это оценка всего уровня сервиса ВТБ, не только за время ожидания в очереди.",1,
284,Lullia L.,,2020-06-26 12:07:39,"Ожидание в очереди на вход в здание банка - 40 минут. Ещё столько же в самом банке по талонам. Как так можно организовать работу?? Часы работы сокращённые. Работают посменно, сотрудников не хватает. Если бы не зарплатный проект, в жизни бы не пошла в этот банк",1,
285,Владимир,https://avatars.mds.yandex.net/get-yapic/26311/BVzfzfHS1NdKt4wIwY4AHIBggc4-1/islands-68,2020-08-19 15:59:01,"Очень испортился. Время ожидания- просто треш! Сижу с талончиком уже 30 минут , и это не в пиковое время, после 18- ти. Любая операция у сотрудников занимает пол часа, даже банальная выдача/замена карты,,,",2,
286,Потапов И.,https://avatars.mds.yandex.net/get-yapic/15298/enc-71f66592aee4b2f8be4247d8d3e7d910c0e49ac532fc17e8bae636bfb6a6cc12/islands-68,2020-02-13 11:34:25,"40 минут общей очереди в конце, которой сообщают, что это не та очередь(электронная), хотя в меню электронной очереди четко указанн нужный отдел. Потом, стоя ждал пока освободится менеджер отдела ""привелегия"", ради одного заявления. На рецепшен в прайм, привелегии никого нет, в общем одно название. Никому не советую, выберайте другие отделения, а может и вообще банк.",1,
287,PGRAPH,https://avatars.mds.yandex.net/get-yapic/59871/XIAd4V1SGIxVtP4g42kp0uiL4-1/islands-68,2022-01-28 10:19:03,"Работает 1 сотрудник из 9 возможных, остальные наверное типа работу работают...",1,"Проведем проверку в отделении и выясним причины отсутствия сотрудников на рабочих местах. Согласимся, что такого быть не должно. Спасибо, что поделились с нами. Нам очень помогает обратная связь в решении наших проблем."
288,SvetikM,,2021-11-06 08:21:12,"Хорошо, что всегда открыт и доступен банкомат",5,
289,MMM c.,,2021-09-16 11:50:11,"Самый тормозной отдел втб. 
Работают вялые сотрудники 
Оформляем сделку с 11-00 до 17-00",1,
290,Максим Григорьев,,2023-03-25 05:38:30,Прекрасное отделение с отзывчими работниками.,5,"Максим, благодарим за положительный отзыв работы. Рады, что вы остались довольны 🙂"
291,С.Я.,,2021-06-15 16:08:44,"Из 23 окон работает только 3, ооочень долгое ожидание в очередях. И это в 19.00 когда люди идут с работы",1,"Сожалеем, что вынуждены были потратить Ваше личное время из-за длительного времени ожидания. Примем к сведению данную информацию и проведем необходимые мероприятия, которые позволят сократить очередь и повысить доступность."
292,СС,,2022-01-17 17:04:18,"Всегда очень долго, за секундным вопросом, можно пропасть там на часы. Все из-за больших очередей, хотя окон много, но они не все всегда работают.",2,
293,Наталья Наталья,,2020-12-01 06:42:05,"Отвратительное обслуживание. Ждешь своей очереди по три часа при работе всех операторов, которые сидят и никого не вызывают. Ищите другой банк на обслуживание.",1,
294,Иван Б.,https://avatars.mds.yandex.net/get-yapic/50595/QKsniASVyGAShNMq0TY0i6VE-1/islands-68,2020-09-14 07:57:48,"Худшее отделение банка, которое только может быть. 500 сотрудников, а очередь вообще не движется. Чтобы получить услугу приходится ждать по полтора часа. И это уже 3 раз одно и тоже. Стыдно быть клиентом такого банка",1,
295,Анастасия,https://avatars.mds.yandex.net/get-yapic/25358/tG9UeCWKChYfdZrej1s7YwM-1/islands-68,2020-01-30 09:50:59,"Грамотные консультанты, быстрое обслуживание. Правда, была в этом отделении всего 2 раза, когда брала кредит и, через 3 года, когда закрыла и получала справку 😊 но, тем не менее, всё понравилось",5,
296,Анонимный отзыв,,2022-10-05 11:01:58,Очень медленно движется очередь,3,"Максим, сожалеем, что вынуждены были потратить ваше личное время на ожидание в очереди. Примем меры и исправимся 💪"
297,Мария Абаева,https://avatars.mds.yandex.net/get-yapic/30061/eMDzYQ2KNhRuCT9H18XeKDoUDZ4-1/islands-68,2020-09-05 16:14:08,"Очень мало сотрудников по работе с физ лицами. Просидела в очереди 1ч20 мин. Зато в отделе по работе с юр.лицами - специалистов много, а посетителей ни кого! Безобразие!",3,
298,Олег З.,,2020-09-16 19:18:23,"Пришел чуть позже открытия, взял талон. В банке человек 6, не более. Ну, думаю, очередь быстро подойдет. Но жестоко ошибся. Ждал своего номера минут 40... Работники банка неторопливо беседуют с клиентами, ходят туда-сюда, чем- то важным занимаются, а очередь не идет. Вызов нового клиента примерно раз в 5-7 минут... Хорошо, что никуда не торопился, а то бы ушел сразу. Общение с работником банка было коротким - типа если не нравятся условия банка, то закрывай счет и иди где лучше. Скорее всего так и сделаю.",2,
299,Евгений Митрошенко,https://avatars.mds.yandex.net/get-yapic/30955/tK8Qz7QUAXJqNIPwM2jvCDqsYg-1/islands-68,2022-11-06 13:37:02,Быстро решили мой вопрос,5,"Спасибо вам, очень приятно получать обратную связь 🙏👌 Приезжайте ещё 💛"
300,НБ,,2022-04-16 15:52:54,Огромные очереди. Невозможно дождаться приема специалиста,1,
301,Ирина Анатольевна,https://avatars.mds.yandex.net/get-yapic/56823/FKtVgfFuACSBWiVkdvMmU1VM-1/islands-68,2023-02-09 17:54:25,Вечная очередь злит!,3,"Поверьте, мы всегда стремимся быть лучше. Действительно, вопрос очереди требует незамедлительного решения. Нам важно, чтобы каждый клиент мог решать вопросы без длительного ожидания. Продолжим работу в данном направлении. Надеемся, что в дальнейшем мы не заставим вас ждать."
302,Василий Мельников,https://avatars.mds.yandex.net/get-yapic/36689/a0Qm0zmRxRATMq09N8lVWLnalJI-1/islands-68,2023-01-10 18:43:53,Отличное отделение,5,"Спасибо, рады стараться 😃"
303,Григорий Б.,,2019-10-27 20:22:23,Большое отделение. Грамотный персонал. Умеренные очереди. Всегда работающие банкоматы. Только с парковкой не очень...,4,
304,МариАнна Крюкова,https://avatars.mds.yandex.net/get-yapic/68143/EUH1iGeDvVoU7e5iPQNM3GrGAKM-1/islands-68,2021-07-16 11:04:52,Ни о чем. Информация в буклете не соответствовала информации от специалиста банка. Зря приезжали!!!,5,
305,Михаил Наконечный,,2022-02-21 13:44:34,"При обмене валют есть комиссия 200р, будьте аккуратны",2,
306,Евгений Вольнов,https://avatars.mds.yandex.net/get-yapic/32838/pnBe6Onwe6bLRQieJYHSN5VMDY-1/islands-68,2023-01-06 12:08:06,"Современный банк, обслуживание внимательное.",5,Ваш положительный отзыв для нас – лучшая награда 😊
307,Элина Сапсанская,https://avatars.mds.yandex.net/get-yapic/27232/pPWUjBRII1nAaFt6juae4tYTlbc-1/islands-68,2022-09-29 18:43:58,Крайне быстро решают вопросы!,5,Довольные клиенты - наша лучшая награда. Благодарим за высокую оценку нашей работы.
308,Elena Antipova,,2021-11-26 10:55:59,"Очередь долгая, если не вип обслуживание. Вип все здорово.",4,
309,Бизнес Системы,https://avatars.mds.yandex.net/get-yapic/41409/dshXHsVqV3t7VOxaAcZZoRY97o-1/islands-68,2021-09-25 15:03:52,"Втб на высоте, очень качественное обслуживание",5,
310,Елена,,2020-11-21 17:55:29,"Огромные очереди! По привилегии - 5 человек в очереди, к одному менеджеру. Простейшая операция снятия наличных через кассу парализовала работу отделения и заняла час!!!!",1,
311,Наталья Волкова,https://avatars.mds.yandex.net/get-yapic/21493/enc-383f31da17222a338797431bd55ec4c6b63ccc489e8a6ba55257f36f231a37b5/islands-68,2020-10-12 09:53:16,Пришла в отделение. Сидит очень много народу и ооооочень медленно движется очередь. Очередной талон высвечивается раз в 30 минут. Своего талона так и не дождалась и ушла.,1,
312,Андрей Гришкин,,2022-08-26 18:28:11,ВТБ это всегда долго противно и муторно,3,"Спасибо за отзыв. Нам очень важно знать ваше мнение. Мы стремимся к тому, чтобы быть лучше. Проведем работу в целях улучшения качества и скорости обслуживания."
313,Алексей Алексеевич Артемьев,https://avatars.mds.yandex.net/get-yapic/49368/enc-e9d9f67292d4abb7dfec5012c28b6c16ab0efb114d01455b16146e2de4bc86f6/islands-68,2020-02-15 05:59:52,"У мальчика из отдела ипотеки отсутствует желание работать. Лаптев Сергей Николаевич. Некомпетентность и безразличие, недостоверная информация, волокита. Гнать. 
Компетентный сотрудник Максимова Ксения. Полная противоположность. Вежливость, профессионализм.",3,
314,Таша Кимова,https://avatars.mds.yandex.net/get-yapic/61207/DHo3NAANkNuAR67VQZLxyIHuTgs-1/islands-68,2020-11-18 10:44:50,"Отделение для физических лиц закрылось. Открыто только на марксистской 5,в очереди для разблокировки карты просидела 55 минут. Очень неудобно.",1,
315,Наталья Щербакова,https://avatars.mds.yandex.net/get-yapic/60687/3VV6vN5tjDoPR5x5Wn3tuelkk-1/islands-68,2020-02-23 19:51:21,Хорошее отделение банка. Есть Привилегия офис. Мне нужно было распечатать страховку. Сделали все быстро. Обслуживание вежливое.,5,
316,Светлана,https://avatars.mds.yandex.net/get-yapic/48449/kEMkE9FQjXmhYbrTMBOXUkERdZY-1/islands-68,2020-10-04 08:18:42,"Много терминалов. Если по вопросу какому-то, то очень долгое обслуживание, персонал много отвлекается, разговаривают между собой не по делу.",3,
317,Максим Федюнин,https://avatars.mds.yandex.net/get-yapic/28053/N9IcEGCno9O5FadgdwAMMASTk-1/islands-68,2022-12-11 16:24:49,Прекрасный банк,5,"Максим, спасибо, мы рады стараться 😃"
318,Пётр Александрович метмаш,https://avatars.mds.yandex.net/get-yapic/37154/5IETxnykFelKOGTUeCxCbYgxQM-1/islands-68,2021-03-15 11:06:40,"Очень долго, ждал своей очереди больше часа, почему это происходит ни кто мене ответить не смог, людей в банке на тот момент было мало.",1,
319,Денис Фокин,https://avatars.mds.yandex.net/get-yapic/38135/enc-ce3fc27e18f95cf3e139b3b4df5ed0e101a2ec99d909418c1a6372432126425a/islands-68,2022-02-01 17:20:05,Отличное отделение по ипотечным сделкам.,5,"Благодарим. Нам очень важно, чтобы каждый клиент оставался доволен 😃"
320,сабир Алимамедов,,2022-08-27 17:23:44,Как банк он мне нравиться!,5,"Сабир, очень приятно получить такую высокую оценку, спасибо 😊"
321,Е Ч,,2022-12-26 09:48:32,Вы не офигели?На вацап начинают названивать и впаривать всякую ерунду!,1,"Мы не звоним в мессенджерах, это мошенники. Будьте, пожалуйста, бдительны."
322,🌲Архангельский ЛЕС🌲,https://avatars.mds.yandex.net/get-yapic/68143/txyoNFs3ydXvYjn0oYv8JlNUzOw-1/islands-68,2021-12-20 12:10:14,Хороший просторный зал банкоматов,4,Благодарим за хорошую оценку. Нам приятно)
323,sereginsky,https://avatars.mds.yandex.net/get-yapic/28053/enc-dfd32a7ae7adec656a76b00349aa8b1e27863052bfd3dcac21d757d39908e176/islands-68,2020-09-07 16:36:20,"Жду больше чем 1,5 часа из-за проблемы, легко решающейся через мобильный банк у других банков. Люди вокруг также ждут по долго, во вложении пруф. Фу такими быть, ВТБ!",1,
324,johnobrain,https://avatars.mds.yandex.net/get-yapic/45566/0pbiQ0Qi4n5bNXddTS5XgFhhyB0-1/islands-68,2021-04-30 19:15:46,"Большой, просторный офис. Приветливый персонал.",5,
325,Дмитрий Е,https://avatars.mds.yandex.net/get-yapic/26057/xTGZ3GvplqLYt39qAp9bgQp9E-1/islands-68,2021-10-11 08:41:24,Банкоматы работают безперебойно и круглосуточно,4,
326,Анна М.,https://avatars.mds.yandex.net/get-yapic/48449/BimBAyxgYNt4PUXZS5iJgA5IY7s-1/islands-68,2020-10-23 14:15:16,"При двух пустых кассах, очередь ожидания в кассу больше часа!!! Не тратьте время, на посещение этого отделения, если оно Вам дорого!",1,
327,Jon S.,,2019-05-17 05:14:57,"отвратительнейший банк! заходишь просто забрать карту, операция на одну минуту, а тебе с порога говорят: ""ожидание час!"" час!!! про распределение очереди можно даже не говорить, просто ужас - вызывают людей, которые пришли после тебя. какого фига вообще? вы про логику слышали? сотрудники еле ползают, вообще не торопятся обслужить клиентов побыстрее. конечно, это ведь не им час в очереди сидеть, чо уж. в общем, я думала, что хуже Сбера быть не может, а вот и нет, ВТБ переплюнул все говнобанки.",1,
328,екатерина г.,,2021-07-26 11:36:29,отвратительное обслуживание. Дозвониться невозможно. Сотрудники демонстративно не берут телефон,1,
329,Евгений Я.,,2022-04-07 18:00:49,"1,5 месяца не могут продлить полномочия у юрлица",1,
330,ирина ф.,,2020-10-12 14:40:58,"Ужасное отделение обходите его стороной ожидание в очереди от 2 часов ,2х часов!!!!!смените руководителей и стстему работы 
Звезд таких нет минус 1",1,
331,Денис Комков,https://avatars.mds.yandex.net/get-yapic/30061/IjPSfg6nk2Zn4kkomiZqaOPxC4-1/islands-68,2022-04-26 18:06:53,Одно из самых комфортных отделений.,5,"Рады видеть, что Вы оценили нас на 5 ⭐"
332,Александр Лазуко,https://avatars.mds.yandex.net/get-yapic/49368/enc-fbbfed924c0c87cf3dd4974d72638b9fecf7ad62ca47f5ca8d54c29a7eec3d3f/islands-68,2018-06-23 15:43:43,"До ремонта отделение банка работало очень оперативно. Приходил туда с удовольствием. После ремонта и расширения площади помещения очень медлительное обслуживание клиентов. Много времени проводишь в очереди к менеджеру (оператору), а если от него нужно в кассу внести деньги, то ещё столько же времени потратишь. Даже при отсутствии очереди, долго не вызывают в кассу, потому как подходящих людей с талончиков ""v"" приглашают сразу же.",2,
333,О.,https://avatars.mds.yandex.net/get-yapic/65952/AXrsuZwYBrhpqGYWFP0bxCBSPRM-1/islands-68,2020-09-10 09:31:04,"Сижу в оперзале. Внести деньги на рсч - передо мной 20 человек, открыть дебетовую карту 27. Молодой человек взял талон с интервалом 30 мин- очередь только увеличилась.",1,
334,Нина Ц.,,2018-09-03 13:17:20,"Просьба отметить работу Окованцева Дмитрия, главного финансового консультанта ДО КЦ ""Марксистский"". Компетентный сотрудник, вежливый и внимательный. Квалифицированно помог решить проблему с переводом средств.",5,
