,name,icon_href,date,text,stars,answer
67,шахматист,,2021-08-18 18:49:39,"Являюсь клиентом и довольно давно контактирую с менеджером Владимиром Гусевым( ещё со времен его работы в филиале на Покрышкина) . Спокойный, корректный, очень грамотный и внимательный. Всегда на связи и готов помочь.",5,
68,Людмила П.,https://avatars.mds.yandex.net/get-yapic/65952/p68TcAVgrDAeHokpqGM5JHRKbQ-1/islands-68,2022-08-22 11:34:11,"Была один раз, нужно было задать несколько вопросов. Услугами не воспользовалась, но впечатления приятные. Очень любезные и корректные сотрудники.",5,"Спасибо вам, очень приятно получать обратную связь 🙏👌 Приезжайте ещё 💛"
69,Алексей К,https://avatars.mds.yandex.net/get-yapic/25817/mYoUvtrYwuuhINQiXd8HtmuPBg0-1/islands-68,2022-04-23 09:16:24,"Очень удобное отделение с грамотным персоналом. Банкоматов в достаточном количестве, что бы не образовывалась очередь.",5,
70,Костик салют,https://avatars.mds.yandex.net/get-yapic/30955/tDdrc6o5KGTgHxczek3q2lClj4-1/islands-68,2024-01-27 16:11:25,Да в целом не плохо отделение банка.,5,"Рады видеть, что вы оценили нас на 5 ⭐"
71,Марина Токлуева(Грачёва),https://avatars.mds.yandex.net/get-yapic/21377/enc-bced23bcbf3e62a2e897a00ddcc82370/islands-68,2021-10-19 08:54:03,"Скорее всего вас здесь не примут! Нет никакой пометки, что здесь принимают только избранных. Обратилась с картой втб ( которую выдали в школе ребёнку), внести денежные средства на карту нельзя, соответственно ребёнок не может пользоваться транспортом. Ребёнку сказали, что нужно идти родителю в банк, активировать карту ( замечу: это нельзя сделать через пин в банкомате, как во всех банках!) обратилась в данное отделение, чтобы активировать карту. Сказали, что это не к ним, даже в офис не пустили, хотя никого не было из клиентов. Если ты не Клиент Привилегии, то идите вон.",1,
72,Голубовский Алексей,https://avatars.mds.yandex.net/get-yapic/38663/oDpYmvfiVenLz9ZcJxAoCu5nxI-1/islands-68,2023-12-21 17:03:06,Все классно !!!,5,"Очень приятно получить такую высокую оценку, спасибо 😊"
73,Алексей Рябов,,2023-01-01 21:47:28,"Очень грамотный персонал, помог решить проблему очень быстро",5,"Огромное спасибо за приятный отклик 💛 Рады, что смогли помочь в решение вопроса 😉"
74,Виктор Ульянов,https://avatars.mds.yandex.net/get-yapic/68143/IvWdXo7ZZ81olIerdMWbn4GOU-1/islands-68,2021-09-30 16:50:32,"БЦ "" Чемпион Парк "" на первом этаже уютно, есть удобные кожаные диваны, чисто, есть ресепшн, помогут с любыми трудностями, охрана, ресторан Руки Вверх, ВТБ банк, кофейня, бесплатная парковка под видеонаблюдением.",5,
75,Иван И.,,2024-01-17 17:38:13,Качество обслуживания,5,"Рады видеть, что вы оценили нас на 5 ⭐"
76,Незнакомка,,2022-05-30 07:19:08,"Это филиал только для тех, кто подключил статус ""Привелегия"" (была в мае 2022). Остальных тут не обслуживают, отправляют на Мичуринский, д. 7. Народу, естественно, никого. Банкоматы доступны всем, но иногда некоторые подвисают.",1,
77,Анонимный отзыв,,2022-10-22 16:53:43,"Это отделение можно охарактеризовать как - быстро, качественно, вежливо",5,"Благодарим. Нам очень важно, чтобы каждый клиент оставался доволен 😃"
78,Gayana,https://avatars.mds.yandex.net/get-yapic/47747/rEIzqq9VtbNelNUGE3U6lx92ifE-1/islands-68,2021-09-07 15:57:49,"Банк нормально, да бывают очереди, но зато работают с клиентами, не решенным никогда не оставляют проблему, очень довольна и благодарна сотрудникам данного отделения, в консультации и помощи в моей проблеме , которую создали мне в другом отделении ВТБ, а решать пришлось этим ребятам",5,
79,Виталий Элерс,,2024-02-10 09:13:56,Хорошее обслуживание!,5,Спасибо большое за доверие 🤗 Приходите к нам почаще!
80,Людмила Полевая,,2023-01-13 12:39:42,"Обслуживание на высшем уровне! Грамотные сотрудники, нет людской толчии.",5,"Благодарим. Нам очень важно, чтобы каждый клиент оставался доволен 😃"
81,Михаил Кудряшов,https://avatars.mds.yandex.net/get-yapic/40841/UofJUiSfzq6ODuE7vD0wgEAiU-1/islands-68,2022-12-19 14:32:46,"Хороший персонал, понятное обслуживание, банкоматы у добные для меня.",5,"Рады, что Вам понравилось. Ждем Вас снова 😃"
82,Лилия,https://avatars.mds.yandex.net/get-yapic/58107/uVF3bbwoB4QVlMOAbkJbrVXvEc-1/islands-68,2024-02-08 18:09:04,Замечательно,5,"Спасибо, нам очень приятно получать обратную связь 💙"
83,Кирилл Седых,,2023-11-15 16:20:05,Лучшее отделение,5,Спасибо за высокую оценку 👍
84,Владимир Чебанов,,2022-07-28 17:12:57,Отстойный банк именно в этом офисе меня не обслужили и мне пришлось ехать в другой офис ВТБ в другой день. Одним словом потерял только время обратившись в этот офис ВТБ,1,
85,Инкогнито 5109,,2024-01-13 12:34:03,Все отлично,5,"Спасибо, рады стараться 😊"
86,Саша Мищенко,https://avatars.mds.yandex.net/get-yapic/25358/aRgbKegAZdN7cUoD8UukdRl2fI-1/islands-68,2024-03-15 18:03:29,Нормальное место,5,Благодарим за высокую оценку нашей работы!
87,Георгий Иванов,,2024-04-06 12:39:47,"Очень хороший офис, вежливые сотрудники.",5,"Благодарим за положительный отзыв! Поверьте, мы это очень ценим 💙"
88,Максим Б.,https://avatars.mds.yandex.net/get-yapic/36689/RPEYv1EEbplD3uXeDrWuDCVsTs-1/islands-68,2023-06-03 13:16:06,"Нужно сразу указывать, что обслуживание только премиум клиентов.",1,"Здравствуйте, Максим.
Информация о том, что данный офис работает только с привилегированным клиентами указана в разделе Особенности → Вид отделения. К сожалению, данный геосервис не позволяет указать такие сведения в более заметном месте."
89,Лена Пешкова,https://avatars.mds.yandex.net/get-yapic/28053/zOKW8lrDdzlOQrt8rHUtPDTduM-1/islands-68,2021-07-27 16:39:22,"Добрый день!Первый раз столкнулась с таким банком,где не могу добиться об оплате кредита,звонят просят оплатить кредит по карте,а деньги в кассе не проходят и нет никакого решения.Не один оператор не может решить мою проблему.Я очень удивлена такой тупости.Я желаю платить кредит а операторы банка ВТБ не принимают.Буду писать в Партал,быстро решится вопрос мой.",1,
90,Андрей П.,https://avatars.mds.yandex.net/get-yapic/26311/jzMtNxrHcFkYGQBxVBUoWXzfTc-1/islands-68,2024-02-06 14:33:14,"информации не актуальна, так как не обслуживает без пакета привилегия",1,"Нам очень жаль, что у вас сложилось негативное впечатление о Банке. ДО «Олимпийский» - отделение премиального обслуживания, здесь осуществляется обслуживание клиентов с пакетом «Привилегия».

Данная информация размещена в открытом доступе на нашем сайте online.vtb.ru/map/offices/."
91,Павел Ларин,https://avatars.mds.yandex.net/get-yapic/31078/AKPydJOoGWafG6Uwt2lDLlMezA-1/islands-68,2023-08-21 17:02:41,Очень хороший офис и сотрудники,5,"Рады, что вам понравилось. Ждем вас снова 😃"
92,дмитрий блюхер,,2023-10-13 16:14:15,"Это не офис, какой-то обман сплошной.",1,"Сожалеем, что у вас сложилось такое мнение. Поверьте, мы стремимся к тому, чтобы быть лучше. Надеемся, в дальнейшем ваше мнение о сотрудничестве с нами изменится в положительную сторону"
93,Роман Черемухин,https://avatars.mds.yandex.net/get-yapic/41409/tFR9x2DVCSyudiFQggNAGxak2Mk-1/islands-68,2021-12-18 12:02:30,"Какой-то ужас! Являюсь клиентом банка, приехал в банк оформить договор, чтобы привязать карту к приложению, мне отказали, так как работают в этом банке только с привилегированными клиентами, хотя пустяковый вопрос. Ужас!",1,
94,Светлана Бочкарёва,https://avatars.mds.yandex.net/get-yapic/49368/tspAdQW9caLc7v3J7EOjBA421nc-1/islands-68,2021-07-04 06:20:35,"Доброго времени суток! Обращалась в этот банк 2019г. как физическое лицо! Обслужили отлично, кредит оформили в этот же день, не смотря на то что я не клиент привелегии! Все разъяснили, правильно оформили документы! Большое спасибо !",5,
95,Олег Валентинович Вехов,https://avatars.mds.yandex.net/get-yapic/45566/fynpqLJTwJaaWzdhgbmCgU5CzT4-1/islands-68,2022-03-14 20:13:51,"Год назад поставил одну звезду. Ничего не изменилось. Отношение к клиенту банка механическое и бездумное. Руководитель офиса - очередной клерк способный говорить только заученными фразами. Жаль, ВТБ остаётся на дне.",1,
96,Владимир Самарин,,2022-11-16 11:52:19,"Отделение не для всех. 
Ни где не указано. 
Потратил время, а меня отфутболили и не дали выписку.",1,Спасибо за отзыв! Добавим информацию в описание.
97,Наталия Круглова,https://avatars.mds.yandex.net/get-yapic/32838/n6bSWSbwwX7Ouh7wTbhj2HBd4dE-1/islands-68,2022-06-22 16:46:45,Спасибо менеджеру Ольге Андриановой за помощь- профи!! Банкоматы выдают до 400 тыс ежедневно,5,
98,Дмитрий Преображенский,,2023-01-31 16:18:47,"Только привилегия клиенты. Народу мало это понятно, но с парковкой беда, вдоль дороги постоянно занято если только найти место в соседнем ТЦ",4,Спасибо за отзыв! Приняли во внимание.
99,марина,,2022-11-26 04:53:18,"Мало людей, обслуживание быстрое и вежливое",5,"Рады, что вам понравилось. Ждем вас снова 😃"
100,Владислав,https://avatars.mds.yandex.net/get-yapic/45566/cnl4hQza8cBuTkpS0xrcbOrqWA-1/islands-68,2022-11-25 10:38:13,"Обратился с самым обычным вопросом ""Реквизиты зарплатной карты"" и был послан так как я не Член клуба ""ВТБ Привелегии"" 
Полностью пустое отделение с 4 сотрудниками неможет напечатать листик с циферками
ВТБ прощай я ушёл в СовКом",1,"Сожалеем, но в данном отделении обслуживаются только клиенты пакета ""Привилегия"". Рекомендуем обратиться в ближайшее от него отделение."
101,GGZ,https://avatars.mds.yandex.net/get-yapic/31804/SZ4C3ekSNpWv6rtZLvqMvZDqRQ-1/islands-68,2022-07-08 08:47:16,мне нравится сюда приходить когда возникает необходимость. Приветливый и грамотный персонал,5,"Рады, что Вам понравилось. Ждем Вас снова 😃"
102,Виктор,,2023-08-10 18:06:11,Обычное отделение банка.,3,"Будем благодарны, если расскажете подробнее, что стало причиной такой низкой оценки. Ваше мнение очень важно для нас."
103,Юрий Донченко,https://avatars.mds.yandex.net/get-yapic/20706/enc-91033f83acf2bb46771a69dd2b3ab58a98eee9008467e0d4eb455d6405be2647/islands-68,2022-11-25 17:54:30,Только для привилегированных клиентов. В фойе 6 банкоматов,4,Спасибо за отзыв!
104,Владимир Шадский,https://avatars.mds.yandex.net/get-yapic/27503/cvjqUu8TwmAhpI2OfhUg9msSoE-1/islands-68,2021-04-17 07:06:44,"Худший банк, худшие работники, никакой информативности! Офис для vip-клиентов, вы откуда такое взяли вообще? Где пометка в интернете об этом? Нет доступа к счетам обычных людей, хорошо хоть холопом не назвали. Самый худший банк в России! Вообще никому не советую",1,
105,Александр,https://avatars.mds.yandex.net/get-yapic/59871/LU7x0IFUcnJrNstkF8GH3zNEnLk-1/islands-68,2020-04-08 16:48:20,"Втб - очень надёжный и современный 

банк, всегда будет поддерживать население России,,,, всем советую,, грамотные, консультанты, быстрое обслуживание.",5,
106,Vladimir S.,https://avatars.mds.yandex.net/get-yapic/42215/VovSNvCU4pYdSgUKW6y9qJPX8x8-1/islands-68,2021-12-01 09:51:24,"Послали сюда из другого офиса ВТБ. А оказалось тут обслуживают вип клиентов. Поехал дальше, в Раменки. Просто задолбали в тот день.",1,
107,Вика Бл,,2023-09-15 06:31:01,"Лучшее отделение , особенно девушка за первым столом",5,Спасибо вам большое за доверие 🤗 Приходите к нам почаще!
108,Наталья,,2022-12-16 19:37:19,Хороший офис и грамотные сотрудники.,5,"Очень приятно получить такую высокую оценку, спасибо 😊"
109,Виталий,https://avatars.mds.yandex.net/get-yapic/44850/mDZAbZyTyBymm3dvVuvgnpE-1/islands-68,2022-06-11 07:57:35,"Внимательный персонал, приятная обстановка",5,
110,Maksym Asaturov,https://avatars.mds.yandex.net/get-yapic/53031/ZF1dJlRMUDkwn3uKCh69w1bJFH8-1/islands-68,2021-10-14 14:30:04,"Как оказалось это отделение для ВИП клиентов о чем на сайте ВТБ ни слова, отказались меня обслужить-я не вип клиент.осажочек остался...",2,
111,Макс А,,2024-02-23 03:35:52,Почему-то тут не смог открыть счет..,3,"Будем благодарны, если расскажете подробнее, с какой ситуацией пришлось столкнуться. Не оставим без внимания и во всем разберёмся 👌"
112,А.Г.,https://avatars.mds.yandex.net/get-yapic/45131/7V1g6BBIhmhrbGeHvRegle4-1/islands-68,2020-05-12 13:28:47,"Посещал один раз, когда многие отделения не работали из-за пандемии. Все очень понравилось, чисто, аккуратно, хорошие работники.",5,
113,Irina I.,,2021-07-22 14:04:42,"Нужна была заверенная банком платёжка. Специально уточняла на сайте возможно ли получить её в любом отделении. Заверили, что в любом. Но при обращении в это отделение, сотрудники сказали, что ничего сделать не могут, так как у них не домтупа к обычным счетам, а только к счетам клиентов Привилегии. Предложили обратиться в ближайшее отделение. Жаль потерянного времени. Обслуживание в банке в целом - отвратное!",2,
114,"Алексей Никулкин ""ДровНик58""",https://avatars.mds.yandex.net/get-yapic/30061/enyN05rLg2EjnJEigoAbRxrsfQI-1/islands-68,2021-09-02 18:18:03,Всё хорошо! Сотрудники с удовольствием помогают разобраться во всём,5,
115,Ksenia Z.,,2024-04-02 02:28:11,Удобное отделение,5,Спасибо за отзыв. Ваш комфорт - наша основная задача 👌
116,Иван Сусанин,,2022-11-21 16:01:11,На карте никакой информации о «привелегии»,2,Спасибо за отзыв! Добавим информацию.
117,Netspirit,https://avatars.mds.yandex.net/get-yapic/26057/5n5QvctPswGGoBKhAC2SnuMo7M-1/islands-68,2021-09-12 06:45:54,"Хороший офис. Для привилегированных клиентов. Не очень уютно, но спокойно, без очередей и толп.",5,
118,Владимир Голубев,https://avatars.mds.yandex.net/get-yapic/38135/HIgHK0X4jTIwcrQPP153NTqrGU-1/islands-68,2022-07-12 06:03:23,"Отличный, приятный персонал.",5,"Спасибо, рады стараться 😃"
119,Денис,https://avatars.mds.yandex.net/get-yapic/15298/enc-ad91b1b17ebb47ce4214667ca831198a/islands-68,2021-09-15 13:35:29,"ТОЛЬКО ДЛЯ СТАТУСА ПРИВЕЛЕГИЯ!!! нужно прям как-то выделять этот момент, когда торопишься можно потерять время…",4,
120,Иван Кожан,https://avatars.mds.yandex.net/get-yapic/39803/enc-246455640d9037ed0f3701b186f3cf6abe347143b0d56f46e9f13c74fcc8803d/islands-68,2021-10-27 14:30:54,"Приехал а ВТБ, а тут привелегия отделения, но на карте инфы нигде не было, только время потратил",1,
121,Руслан А.,,2019-08-21 08:57:53,"Для «привилегии» недостаточный уровень обслуживания. Работают очень долго, реагируют на твое появление оперативно, но вопросы решают очень медленно, консультации могут длиться по 2 часа. В банке несколько вкладов, обслуживаюсь третий год, ничего не меняется. И в целом, сотрудники хоть и стараются но выглядят некомпетентными, по каждому вопросу они советуются с коллегами и по два раза. Элементарную задачу «снять деньги в кассе», растянут на пол часа, в отсутствии очереди.",2,
122,Дима *,https://avatars.mds.yandex.net/get-yapic/49368/enc-0d727c3314dc72b2e82b810af329b236d4244a9ff2dd625fc99e2cbf3aa36589/islands-68,2022-07-11 21:48:27,"Людей не много, персонал приветлив",5,"Спасибо вам, очень приятно получать обратную связь 🙏👌 Приезжайте ещё 💛"
123,anna@Voorhees77,https://avatars.mds.yandex.net/get-yapic/39460/enc-7f896bae377cf948c68e64eff1d23815f6d1c9fe6a96fbf22ba70f679cb3bc04/islands-68,2021-07-30 09:23:37,"Доброе время суток .даёт кредит банк и предлагают в довесок ещё сумму и карточку ,создаёт лишние хлопоты.",3,
124,Александр Старовойтов,,2021-09-01 13:15:54,Ужасное отношение к клиенту начальника офиса Сергея Александровича. Самодовольный чванливый чиновник,1,
125,Владимир,https://avatars.mds.yandex.net/get-yapic/61207/NE0J2HdJNGP8jMmG28V2RxPFg-1/islands-68,2019-10-06 09:45:01,"Часто здесь бываю, и мне все здесь нравится. Коллектив приветливый, всегда уделят время и дадут профессиональные разъяснения.",5,
126,Оксана,,2022-03-21 15:51:35,"Всегда очереди.
Уже почти два года мне меняют номер телефона👍",1,
127,Владимир Гев,https://avatars.mds.yandex.net/get-yapic/50595/bgdAQ3MDsVboXKVHTCZVcnlo4N0-1/islands-68,2022-08-03 13:41:15,"Все хорошие менеджеры ушли, банк ни о чем",5,"Благодарим Вас за отзыв. Нам очень важно знать Ваше мнение. Мы стремимся к тому, чтобы быть лучше. Проведем работу в целях улучшения качества обслуживания."
128,꧁༺ Тима𝓥𝓮𝓻𝓽𝓾 ༻꧂,https://avatars.mds.yandex.net/get-yapic/51169/TSc4oQtUIeDJss9iH7heNSM03I-1/islands-68,2022-05-21 11:24:26,"Для вип персон. Не для простых людей, в натуре...",1,"Нам очень жаль, что это стало причиной низкой оценки :("
129,Катерина Иванова,,2022-08-29 16:40:02,Только для ключевых клиентов,3,"Данный офис действительно только длчя обслуживания клиентов - держателей пакета ""Привилегия""."
130,Ольга Королева,,2022-07-01 16:23:47,Отзывчивые добрые работники,5,"Благодарим. Нам очень важно, чтобы каждый клиент оставался доволен 😃"
131,Анна Есенина,https://avatars.mds.yandex.net/get-yapic/27232/VkTZbDOkHIUCQuYYKKT53qUx6Q-1/islands-68,2021-10-09 13:21:51,"Сделайте пометку, что это не обычное отделение, а только для отдельных клиентов",1,
132,Владимир,https://avatars.mds.yandex.net/get-yapic/20706/enc-b9035675aa1e03fdbe1d854a3cf8749e/islands-68,2021-12-13 16:58:08,"Напишите сразу, что только для VIP персон. И в Яндекс-картах также отметьте, а то хотел счет открыть, а пришлось ехать в другое отделение",2,
