,name,icon_href,date,text,stars,answer
0,николай иванов,,2024-04-07 18:05:22,"Приятное, чистое, современное отделение…так же и как работники, очень приятные и вежливые.
Особенно хочу подчеркнуть работу менеджера Чернавцевой Анастасии, уровень обслуживания пять звезд.
А так же благодарю менеджера Андриянову Ольгу за помощь в решении моих вопросов!!!",5,"Для нас очень важно, чтобы наша работа приносила вам только приятные впечатления. Постараемся и дальше вас радовать! Отдельное спасибо, что отметили работу конкретных сотрудников 👍"
1,Тихон Кудлай,https://avatars.mds.yandex.net/get-yapic/63032/t5UeAq7VL9zDs7aehPsqfPcgl4E-1/islands-68,2023-11-04 14:43:41,"Замечательное просторное и коиентоориентированное отделение, очаровательные специалисты помогут в решении любого вашего вопроса.
Очень рекомендую, в пику отделению у метро Раменки, где диаметрально противоположная ситуация, и местные барышни найдут к чему прикопаться и какой пункт инструкций использовать в ущерб клиенту.",5,"Очень приятно получить такую высокую оценку, спасибо 😊"
2,Aygiz,,2023-11-23 11:44:55,"Отличное отделение банка, отзывчивый персонал, всегда быстро и качественно выполняют свою работу, доволен обслуживанием.",5,"Приятно знать, что посещение нашего офиса вызвало у вас исключительно положительные эмоции 😉"
3,Маркет Плейс,https://avatars.mds.yandex.net/get-yapic/20749/DsylVbIxAokCvMjwcmcVlVl1l1Q-1/islands-68,2023-10-24 16:39:15,"В этом отделении имеется Касса, что для сделок очень удобно! Большой зал и удобное место ожидания! Рядом тц Фестиваль, где можно пообедать.",5,"Спасибо, нам очень приятно получать обратную связь 👍"
4,Лисафьев Владимир,https://avatars.mds.yandex.net/get-yapic/45566/CBaNfImsa7Em5XgiaBJZzWEtVOs-1/islands-68,2024-01-10 13:48:05,"Благодарю вашего консультанта по имени Яна, вежливая и отзывчивая, быстро помогла решить проблему, возникшую у клиента ВТБ ""Привилегия"".Спасибо.Лисафьев Владимир.",5,"Спасибо, что нашли время оставить отзыв. Приятно видеть, что помощь нашего сотрудника вызвала у вас исключительно положительные эмоции!"
5,Анна Мацюк,https://avatars.mds.yandex.net/get-yapic/21377/enc-1f4a047222a384122447fe6efc2314c6e78d40fd37be81f6ca2113571bb9b0cd/islands-68,2023-10-19 19:39:04,"Странная концепция банка - отделение есть, но только для випов. То есть ты обычный клиент - тебе обслуживание не светит. Сделайте отдел по работе с клиентами - даже небольшой. Это очень неудобно, когда у тебя как у клиента проблема, а тебя разворачивают, потому что в этом банке у тебя нет миллионов на счету! Дискриминация в чистом виде!",1,"Данное отделение банка обслуживает только клиентов пакета ""Привилегия"". Рекомендуем обратиться в соседние отделения."
6,NikTaraskin,https://avatars.mds.yandex.net/get-yapic/39803/enc-c22e6561ded22cb61ccdd7e580cdbe9bf24874f4dc922b4eb50b455107676f1a/islands-68,2023-11-02 10:43:32,"Оказывается данное отделение только для ""ПРИВИЛЕГИРОВАННЫХ"" клиентов, остальные проходите мимо...
Нужно было лишь актуализировать паспортные данные, но нет - вам здесь не рады, езжайте в другие отделения.
Самое противное в том, что в отделении на тот момент не было ни одного посетителя, от слова совсем! 
Ваша заслуженная ЕДИНИЦА, так держать!",1,"Сожалеем, что возникла такая ситуация. Офис действительно обслуживает только держателей пакета «Привилегия». Информация об этом на данном сервисе указана.

Формат работы отделения можно также уточнить перед посещением на нашем сайте: vtb.ru/about/offices или по звонку в контактный центр по номеру телефона 8 800 100-24-24 или 1000 с мобильного.

Приносим извинения за возможные неудобства."
7,Victoria Zorina,https://avatars.mds.yandex.net/get-yapic/40841/fZwo7t8e3huGpjhiZLuTEJKwk8-1/islands-68,2023-12-02 16:49:57,"Обслуживание нормальное, отделение хорошее. Проблема в том, что зимой крыльцо очень скользкое, коврики далеко, и упасть на пороге ничего не стоит (со мной так и произошло сегодня). Пожалуйста, подвиньте их поближе или постелите что-то, можно и ногу сломать.",3,Спасибо за сигнал. Обратим внимание руководителя офиса на ваши замечания. Приносим извинения за возможные неудобства.
8,Екатерина Д.,,2024-02-17 12:20:00,"Не обслуживают обычных клиентов банка, только ""привилегию"". Об этом нигде не написано, просто вы приедете и потратите своё время. Я лично мама в декрете, шла в ближайшее отделение по пустяковому вопросу, который не могут решить на горячей линии. Отправили в другие отделения, а у меня на это нет времени. Вопрос так и не решила, хотя отделение пустое и народу никого",2,"Нам очень жаль, что у вас сложилось негативное впечатление о Банке. ДО «Олимпийский» - отделение премиального обслуживания, здесь осуществляется обслуживание клиентов с пакетом «Привилегия».

Данная информация размещена в открытом доступе на нашем сайте online.vtb.ru/map/offices/, а также на данном сервисе в разделе «Особенности».

Приносим извинения за возможные неудобства!"
9,Руслан М.,https://avatars.mds.yandex.net/get-yapic/63032/ccyeIabiRWgvuZ8SiwdEGnxplDw-1/islands-68,2023-08-06 13:14:31,"Вежливые и знающие свое дело сотрудники, всегда в хорошем настроении, с большим позитивом и приятным общением. Желаю всем сотрудникам этого отделения успехов и отличного настроения!",5,"Здравствуйте!
Спасибо, что уделили время и оставили отзыв! Приятно видеть, что помощь наших специалистов вызвала у вас положительные эмоции 😊"
10,Nankka,https://avatars.mds.yandex.net/get-yapic/36689/enc-669ea48badff5f2bdadb83f844ca3ba8906b34197d53518395b22861079b9f40/islands-68,2024-02-03 07:22:40,Досадно. Шла по морозу и меня развернули. 10:19 в отделении 3 сотрудника общаются между собой. И ни души! Ни одного клиента. Что ж прощание с ВТБ быстрым не получилось. Но теперь точно прощаемся!!! И верните деньги моего мужа! Было распоряжение Путина заблокировать счета частных иностранных инвесторов и эти деньги вернуть инвесторам резидентам РФ. Другой банк распоряжение исполнил.,1,
11,Serega M.,https://avatars.mds.yandex.net/get-yapic/47747/iI5dSOsfe7UmkuG1nkjS6dWUKU-1/islands-68,2022-12-11 09:49:41,"Банк норм. Персонал вежливый. Внутри чисто , аккуратно, народу мало бывает. Стараются всем помочь. В доль дороги парковка , рядом тц есть , если что там можно припарковаться, поесть , закупиться....рекомендую.",5,"Рады, что вам понравилось. Ждем вас снова 😃"
12,Анастасия Т.,https://avatars.mds.yandex.net/get-yapic/58107/dfhfJ7cYiw8SMbwq5a6udzVBSc-1569471230/islands-68,2024-02-14 22:54:56,"Хорошее отделение, вежливые сотрудники, помогли быстро и оперативно решить мою проблему.",5,"Благодарим за отзыв! Рады, что вы остались довольны. Приходите ещё 💙"
13,Даниил Б.,https://avatars.mds.yandex.net/get-yapic/30061/enc-17f3af7663cf9f827405810d119b487f806798b8d6bd0e173a813d8949cf813c/islands-68,2024-02-13 13:40:36,"Спасибо, обслуживание на вашем уровне, приятный и улыбчивый коллектив, готовые помочь)",5,Ваш положительный отзыв – наша лучшая награда 👍
14,Михаил,,2023-12-09 11:55:58,"Ходили пожилые родственники, в отделении сказали, что вклад в этом отделении можно открыть только от определенной суммы в размере несколько млн. рублей. Оказалось, что отделение обслуживает только привилегированных клиентов.",3,"Сожалеем, что возникла такая ситуация. Офис действительно обслуживает только держателей пакета «Привилегия». Информация об этом указана в разделах «Контакты» и «Особенности».

Формат работы отделения можно также уточнить перед посещением на нашем сайте: vtb.ru/about/offices или по звонку в контактный центр по номеру телефона 8 800 100-24-24 или 1000 с мобильного."
15,Anatoly Litvinenko,https://avatars.mds.yandex.net/get-yapic/48449/trWUAWXeYsTIs43EdQwKJtiwwg0-1/islands-68,2023-09-15 11:39:41,"4 года являюсь клиентом этого отделения банка. 
Красиво, просторно, нет очередей, обслуживание разумно- быстрое, к мнению клиентов прислушиваются.",5,"Спасибо, что доверяете нам! Постараемся и дальше соответствовать вашей пятёрке 💪"
16,Тамара Угляничная,,2023-10-16 10:49:05,"Офис чисто для клиентов Привилегия. Все соответствует. Замечаний нет. Было однажды, что с ОБЕДА ждала кассира долго, считаю, что в таком офисе нужно идти навстречу клиентам и прерывать обед…Хотя бывает большой поток клиентов конечно и тогда кому-то все равно придется ожидать, пока человек перекусит",5,Благодарим вас за отзыв. Обратная связь нам помогает понять наши проблемы и принять меры для улучшения сервиса и обслуживания.
17,golvik1,https://avatars.mds.yandex.net/get-yapic/68143/77VQiR4ljD60h3HRNCjUYMcFuSQ-1/islands-68,2023-11-02 11:46:21,"Отделение банка для ""белых"".
Прочитал официальный ответ ВТБ. 
Уважаемые авторы ответа! Я написал отзыв не о доставленных мне неудобствах, а о политике ВТБ фактического разделения общества на бедных и богатых.",1,"Не ставили себе такую задачу. Мы ценим всех наших клиентов 💛
С условиями обслуживания пакета «Привилегия» можно ознакомиться на нашем сайте: vtb.ru/privilegia/karty/"
18,Городская Сити,https://avatars.mds.yandex.net/get-yapic/58107/lo7Kd9U3PnJQIENb4TZcbo8MUo-1/islands-68,2022-12-18 09:46:51,"Что можно написать про отделение? Нормальное, я не отношусь к категории премиум клиентов, в связи с этим само обслуживание сотрудниками банка оценить не могу.Хотелось бы, чтобы начали обслуживать частных клиентов, не премиум сегмента, чтобы обычным людям обслуживаться. За обслуживанием для простых граждан, приходиться ехать на Юго западную или в Раменки, что не очень удобно. Тем более такой большой район, рядом ТЦ. Ну и наладить работу банкоматов, есть те, которые очень долго прогружаются именно на внесение наличных, зависают.",4,"Ольга, обратная связь помогает нам стать лучше. Примем к сведению ваши замечания."
19,Наталья М,https://avatars.mds.yandex.net/get-yapic/37154/BTC7FolAbmh4Vv6TYbkefIfl7s-1/islands-68,2024-01-09 12:29:21,Хорошее отделение в шаговой доступности от остановки общественного транспорта,5,Благодарим за положительный отзыв 👍
20,Анастасия А.,https://avatars.mds.yandex.net/get-yapic/20706/enc-a0cb65353109044c0b8d7866a84c9af298eee9008467e0d4eb455d6405be2647/islands-68,2023-11-10 10:13:51,"Нет возможности обслуживаться в отделении рядом с домом, т.к. оно только для Привилегированных клиентов",1,"Благодарим за обратную связь. Данное отделение действительно обслуживает только держателей пакета «Привилегия».
Отметим, что мы продолжаем развивать сеть наших офисов. Для вашего удобства мы реализовали возможность проведения большинства операций в личном кабинете ВТБ Онлайн."
21,денис чегодаев,,2023-11-07 10:37:52,"Ужасное отделение, нужно взять выписку и закрыть счет, а они этого сделать не могут, только кредит впарить. Не рекомендую!",1,"Благодарим за отзыв. Обратная связь помогает понять наши проблемы и принять меры для улучшения сервиса и качества обслуживания.

Важно отметить, что сотрудники всегда стараются предложить наилучшие решения, которые соответствуют требованиям клиента. При этом любые договоры с Банком могут быть заключены только с его добровольного согласия.

Расскажите, пожалуйста, подробнее, какие трудности возникли с закрытием счета и получением выписки? Позвольте также отметить, что большинство справок/выписок вы можете получить в личном кабинете ВТБ Онлайн."
22,Роман Романов,,2024-02-05 17:29:01,"Работают только с людьми у которых болшие вклады и я так понимаю с юрлицам. Банкоматы либо пустые, либо не работают.",2,"Нам очень жаль, что у вас сложилось негативное впечатление о Банке. ДО «Олимпийский» - отделение премиального обслуживания, здесь осуществляется обслуживание клиентов с пакетом «Привилегия».

Данная информация размещена в открытом доступе на нашем сайте online.vtb.ru/map/offices/."
23,Весельчак Меломан,https://avatars.mds.yandex.net/get-yapic/30431/JE9SfXrf5opUFe77CToknc5T8-1/islands-68,2024-02-12 19:26:25,"Отличное отделение, очередей нет. Особая благодарность менеджерам которые решили мой вопрос.",5,"Так приятно, что поставили нам высокую оценку 💙 Рады стараться для вас 👍"
24,Роман Дубовик,,2023-03-18 07:09:07,"Банк ВТБ сродни мошенникам. Достаточно активно пользовался их кредитной картой и в один день перед Новым Годом от банка пришло предложение в мобильное приложение о кредитных каникулах. Решил воспользоваться, предварительно побывав в отделении банка, у меня пакет ""Привилегия"", и уточнив у сотрудника банка все нюансы. В итоге банк всё-таки выставил проценты и никакие заявления (их было 2) не помогли. Налицо некомпетентность работников банка и по попросту обман. Был и второй случай, когда банк списал с меня комиссию за невыполнение требований бесплатного обслуживания пакета ""Привилегия"", хотя несколько лет я их выполнял. А тут банк их поменял, не уведомив меня как клиента. Просто отвратительное отношение к своим клиентам у банка, никому не рекомендую ВТБ.",1,"Поверьте, мы всегда стремимся быть лучше. Мы обязательно обсудим с руководителем офиса все детали, описанные в отзыве, и учтем ваши замечания. Примите, пожалуйста, наши извинения."
25,Ярослав,,2022-08-18 17:05:15,Отличное отделение. Первый опыт работы с ВТБ. Дружелюбный персонал. Очень квалифицированные персональные менеджеры. Имел дело с девушкой по имени Ольга. Полностью удовлетворен качеством обслуживания.,5,"Мы рады, что обслуживание в Банке оставило у вас приятные впечатления, и спасибо Вам за то, что уделили время и написали этот положительный отзыв о работе нашего сотрудника."
26,akhalkatsi@mail.ru,,2023-03-29 11:08:52,"Прошло примерно 2 года после закрытия счёта. Процесс выплаты процентов и закрытие счёта сам по себе был сопряжён с некомпетентностью и вызывал сильное раздражение и негативные эмоции.
Так вот, как оказалось , счёт не был закрыт, и туда случайно попали чужие деньги, которые надо было вернуть. У меня взяли заявку по телефону на закрытие счёта и возврат денег.
 В назначенное время заявка не была исполнена, мне сказали, что такие заявки не принимают оказывается по телефону, и ждать надо ещё месяц. А вообще надо ехать в отделение чтобы закрыть счёт.
 Третий (!) раз ехать в отделение чтобы сделать простую процедуру - закрыть и счёта Это кошмар какой-то!",1,"Поверьте, мы стремимся быть лучше. Обратная связь нам помогает понять наши проблемы и принять меры для улучшения сервиса и обслуживания. Благодарим вас за отзыв."
27,Ольга А.,,2023-11-23 11:24:56,Быстрое обслуживание и удобное расположение.,5,"Благодарим за положительный отзыв, нам очень приятно 👍"
28,Ирина Овдиенко,https://avatars.mds.yandex.net/get-yapic/51381/ZKZx4oeD8UFiNvcwveQx5w5riAY-1/islands-68,2023-06-02 09:47:29,"Приветливый и грамотный персонал, помог в решении вопроса. Несколько банкоматов, что очень радует, очередей там не видела",5,"Ирина, очень приятно получить такую высокую оценку, спасибо 😊"
29,Владимир Щелков,https://avatars.mds.yandex.net/get-yapic/63256/enc-cde7c6055a0f8f832947743bc2533e65ba08c98141b568115898ec6baa71854f/islands-68,2024-02-26 17:45:10,"Хорошее обслуживание, приветливый персонал!",5,"Довольные клиенты - наша лучшая награда. Благодарим за то, что так высоко оценили нашу работу 💙"
30,Ирина Ларина,,2023-06-30 13:28:06,"В целом, всё хорошо. Показалось только, что сотрудники несколько высокомерно относятся к посетителям, первый вопрос: ""Вы являетесь членом программы Привилегия?""",5,"Ирина, огромное спасибо за приятный отклик 💛
Ваше замечание мы обязательно направим руководителю офиса для дальнейшего анализа. Простите за возможные неудобства."
31,АлексейЛ.,https://avatars.mds.yandex.net/get-yapic/27274/cKCBlEss5UU3fUEJXDwYOkojA-1/islands-68,2022-05-22 17:15:43,Хорошее отделение. Просторный офис. Вежливые и компетентные сотрудники. Приятно обслуживаться. Благодарность главному администратору отделение и всем сотрудникам.,5,Спасибо за отзыв! Будем продолжать в том же духе 💪
