,name,icon_href,date,text,stars,answer
0,Александр Рыбаков,,2023-12-11 13:32:05,"Нет в компании архитектора дизайнера,который мог привести в порядок фасад, а внутри здания срочно заняться ремонтом потолка,вентиляции помещения , освещения,клинингу привести в порядок помещение по чистоте,персоналу в отделе привелегия убрать очереди,ссылаться на болезнь сотрудников,а на самом деле есть резервы но не рабочих местах
 очереди убрать.электротехническому персоналу проанализировать подсветку здания,она в настоящий момент убогая,применить эрджби светильники,подумать о рекламе на фасаде,банкоматы на входе прошлый век необходимо продумать расположения установкипоставить более современные.Пишу Вам с целью чтобы Вы были лучшими.",1,"Благодарим за обратную связь, которая помогает понять наши проблемы и принять соответствующие меры. Замечания приняли во внимание."
1,Надежда ж,,2023-10-31 19:15:36,"Мне в очередной раз приходится выразить глубокое недовольство качеством обслуживания в некогда любимом банке. На этот раз отличилось отделение банка ВТБ на Марксистской улице. Моя мама несколько раз обращалась в это отделение с целью получить накопительную часть пенсии, но спустя две недели, никто ей не может с этим помочь.. но обо всем по порядку. 



23.10 Мама обратилась в отделение, взяла талончик и попала к сотруднику Иваной Анастасии Олеговне. Сотрудница Анастасия, которая обслуживала мою маму, оказалась абсолютно не готовой и не заинтересованной в решении ее вопроса. Вместо того, чтобы оказать необходимую помощь, Анастасия отправила мою маму в НПФ ВТБ и посоветовала решать вопросы там. На следующий день, дозвонившись до НПФ ВТБ, мама узнала, что подать заявление может в любом отделении банка ВТБ, а также необходимый пакет документов для этого. Подойдя в этот же день в отделние, мама об этом рассказала Анастасии, которая заверила ее, что свяжется с фондом, узнает порядок действий, получит доступы и позвонит ей. Спустя 4 дня с мамой никто так и не связался. 30.10 мама вновь пришла в отделение и уже целенаправленно пошла к Анастасии, котрая порекомендовала ей подойти 31.10 и они оформят заявление, т.к получение доступов еще в процессе. Как и договорились, 31.10 мама пришла в офис ( мне кажется уже как на работу.... ), но сотрудник забыла упомянуть, что работает до 19, а так как мама пришла как раз в это время, то обслуживать она ее не будет, демонстративно встал и ушла, не передав никакому другому сотруднику и не сказав, а что же делать дальше.. 



И вот вопрос, зачем вы запустили баннеры в банкомате, пуши и рекламу, с призывом переводить пенсию в ВТБ, когда ваши сотрудники умеет только кредиты выдавать?! 

В конечном итоге, после нескольких посещений отделения, моя мама осталась без решения своего вопроса. Такое отношение к клиентам в целом абсолютно неприемлемо, а к пожилым и людям предпенсионного возраста и подавно. 

Во всем этот кошмаре, могу положительно отозваться только о (по всей видимости новом сотруднике) - Марии Александровне (фамилию мама не запомнила), которая, после того как Анастасия отказалась обслуживать маму и со спокойной душой ушла домой,пыталась хоть как-то помочь и проявить участие. 

Надеюсь, что банк примет меры для улучшения качества обслуживания и обучения своих сотрудников. А этот опыт несомненно заставит меня искать другой банк для получения пенсии моей мамой.",1,"Спасибо, что поделились с нами. Информацию в полном объеме мы передали ответственным руководителям для детального разбора и проведения необходимого цикла мероприятий.
Приносим извинения за доставленные неудобства. Надеемся, что в дальнейшем обслуживание будет соответствовать вашим ожиданиям."
2,Юлия Ц.,,2023-11-29 08:57:28,"Попала первый раз в ВТБ банк, очень понравилось! Сердечно благодарю Дупгарян Рипсимэ, очень грамотный и душевный специалист. Всех благ и процветания ей и банку",5,Благодарны вам за пятёрку и добрые слова о работе нашего сотрудника 💛
3,Ольга Макси,,2024-01-09 11:16:58,"Хорошее просторное отделение, светлый зал, есть вода в кулере, в последнее время толп народ не наблюдается, и обслуживание достаточно оперативное",5,"Спасибо, что поделились своими впечатлениями. Мы очень ценим обратную связь 💛"
4,Александр,,2023-08-14 16:49:43,"Данное отделение не в лучшей пешей доступности, от ближайшего метро 10 минут ходьбы. Что радует, это наличие круглосуточного доступа к банкоматам и хоть и платной парковки. Пару лет тому назад, было очень медленное обслуживание граждан по вопросам не имеющим прямого отношения к получению кредитов. Возможно сейчас что-то изменилось.",4,"Спасибо вам, очень приятно получать обратную связь 🙏👌 Приезжайте ещё 💛"
5,Екатерина Никифорова,,2023-12-07 18:03:48,"Молодая команда офиса. 
Очень услужливые, компитентные. 
Объяснили подробно, касательно моей проблемы. 
Молодцы. Ни одного нарекания.",4,"Благодарим за положительный отзыв, нам очень приятно 👍"
6,miko63,https://avatars.mds.yandex.net/get-yapic/54535/EqUDih4Fyg0riJ2y1boUKoP0CqM-1/islands-68,2023-11-21 00:31:52,Хорошее отделение для этого района. Наверное даже самое оптимальное. Особо очередей не наблюдал и вопросы быстро решили мои.,5,"Спасибо за положительный отзыв! Поверьте, мы это очень ценим 💛"
7,Инкогнито 2546,,2023-10-03 13:08:40,"Я Лещенко Анна Васильевна. Г. Москва. Выражаю сердечную благодарность руководству ВТБ Банка за добросовестное выполнение своих обещаний 06.09 *** сняли с пенсионной карты деньги. И так как моя карта была застрахована от мошенничества. Банк вернул мне денежные средства. Но все это произошло благодаря грамотному и внимательному высоко квалифицированному сотруднику банка Сучковой Марии Юрьевны. Которая помогла оформить обращение, успокоить в период моего стресса. Огромная ей благодарность. Вот таких сотрудников руководство должно беречь, они должны быть лицом банка и примером для молодых специалистов. Спасибо всем за вниманме к моей проблеме. Желаю всем успехов, удач и процветания. С Уважением Лещенко А. В.",5,"Мы с удовольствием передадим вашу обратную связь руководству офиса и лично Марии. Уровень её компетенций и проведённая работа будут хорошим примером для всех наших коллег.
Благодарим, что нашли время поделиться своим положительным опытом обслуживания в ВТБ!"
8,Nike,,2023-10-04 12:46:32,"Большой зал, быстрое обслуживание, чистая уборная, приветливый персонал. Оформлял карточку, получил ответы на все интересующие меня вопросы, остался доволен",5,"Благодарим за отзыв! Рады, что вы остались довольны 🙂 Мы всегда стараемся по максимуму удовлетворить потребности наших клиентов и создать для них комфортные условия обслуживания. Приходите ещё!"
9,Иван,,2023-11-15 22:32:18,"Не знаю, как в других отделениях, но здесь такое долгое обслуживание, и специалистов много, но чтобы попасть можно просидеть час и то не факт, что помогут. По моим вопросам обслуживание длилось очень долго",1,"Ваши замечания не останутся без внимания и будут незамедлительно переданы ответственным руководителям с целью реализации мер, которые обязательно будут направлены на повышение качества и скорости предоставляемых услуг. Простите за возможные неудобства."
10,Александр Зылев,https://avatars.mds.yandex.net/get-yapic/41409/X2fGI05HHjIHgxOVbXKIm9Kti0-1/islands-68,2024-02-22 09:47:57,Отвратительное обслуживание сотрудников банка. Сотрудники нерасторопны. Очереди как в девяностых годах. Если вы хотите получить максимальное приятное обслуживание то это не банк ВТБ. По банковским продуктам тоже большие сомнения.,1,"Нам жаль, если при обращении в офис Банка сотрудники не смогли предоставить вам качественное обслуживание. Обязательно проведем работу над повышением качества предоставления услуг!"
11,Семен Маркович,,2023-08-10 03:11:46,"Просторное помещение, электронная очередь, много обслуживающих специалистов готовых грамотно проконсультировать. Рядом остановка автобусов.",5,"Спасибо, нам очень приятно получать обратную связь 💛"
12,Красота Здоровье,https://avatars.mds.yandex.net/get-yapic/21493/enc-343d0247c50c902b798d97d4a733710b896892381dfce2e8a23db7d450bd5424/islands-68,2023-09-17 05:30:10,"К самому банку большие вопросы конечно! Лояльность к первичным клиентам больше чем к тем, кто с ним уже десятилетия. 
Но про этот филиал только самое хорошее. 
Сотрудники-Ваше всё. Отличные специалисты",5,"Благодарим за высокую оценку работы наших сотрудников 💛

Мы ценим и любим всех наших клиентов. Готовы предложить много интересного, поэтому рекомендуем следить за нашими новостями в официальных аккаунтах и на Банка."
13,Мария Самсонова,,2023-12-11 07:33:34,"Работает 8 окон, одно окно занято клиентов. Все остальные сотрудники сидят в телефонах или не замечают тебя. Даже в сбере уже нет такого обслуживания",1,"Сожалеем, что обслуживание в нашем офисе доставило вам неудобства. Мы обязательно организуем проверку на основании ваших замечаний вместе с его руководителем и примем необходимые меры.
Благодарим вас за обратную связь."
14,Ася Я,,2023-07-11 06:15:01,"Очень приятное отделение в сравнении с теми, где была ранее. Просторные залы, нет очередей. В зале привелегия переговорные комнаты, в тч отдельные (с дверьми, а не просто перегородки) куда сотрудники могут переходить с клиентами для совершения операций (с ноутами). в общем я довольна.",5,"Рады, что вам у нас понравилось. Приходите ещё 😃"
15,Сергей Гин,,2024-02-22 11:16:07,"Высокий уровень обслуживания, доброжелательный коллектив. Очередей не бывает",5,"Спасибо за положительный отзыв! Поверьте, мы это очень ценим 💙"
16,АНЕЧКА КРУТАЯ,https://avatars.mds.yandex.net/get-yapic/20706/enc-b79617928bf2cf3c61ebcff7e00ea8d8ab0efb114d01455b16146e2de4bc86f6/islands-68,2023-11-11 17:45:10,"Просторное отделение, быстрое обслуживание, грамотные специалисты.",5,Огромное спасибо за приятный отклик и доверие 💛
17,oxanas2,https://avatars.mds.yandex.net/get-yapic/15298/enc-7c018f6faf4b2f29087c81a6f862d8e1/islands-68,2023-01-04 11:12:52,"Скорость обслуживания низкая 
Компетентность во многих отделениях хромает
Одно подразделение не знает,что делает другое
За год уже неоднократно отправляли на рискую по ипотечным вопросам (в части урегулирования ситуации) а на римской поясняют,что кроме как открытие новых ипотечных кредитов они ничем не занимаются в вопросах ипотеки.
Стараются избавится от явки клиента скорее недели решить вопрос. Пришлось решать вопрос через досудебное урегулирования в форме претензии на имя председателя правления",3,"Благодарим вас за отзыв. Нам очень важно знать ваше мнение. Мы стремимся к тому, чтобы быть лучше. Проведем работу в целях улучшения качества обслуживания."
18,Игорь Лещинский,,2023-01-29 18:50:54,"Отличное обслуживание, грамотные сотрудники. Быстро и качественно решили все вопросы. Самое лучшее на мой взгляд отделение банка втб. Приятно был удивлён.",4,"Игорь, спасибо за отзыв! Будем продолжать в том же духе 💪"
19,Дмитрий Орлов,https://avatars.mds.yandex.net/get-yapic/54535/enc-9527488dc21a995656a38a77a561febef4cf749d9143255f9c9dd1bdc761de9c/islands-68,2024-03-02 05:32:44,"Заказал выдачу налички за 10 дней, прихожу забрать, а мне не отдают так как у них прога висит второй день, хоть бы предупредили, ушёл без своих денег",1,"Примите наши извинения за доставленные неудобства. Информацию прямо сейчас доведем до руководителя офиса, чтобы в дальнейшем такие ситуации не повторялись!"
20,Ольга Евлентьева,,2023-03-05 05:05:15,"Ужасное отделение.Нужна была выписка по детским соц.картам в определённом формате. Месяц назад я такую получала без проблем.В этот раз сотрудник сказала,что такую сделать не может.Сказала звонить на горячую линию и узнавать где её можно получить. На горячей линии я провисела 30 минут.Сотрудник ,то не видел этих карт,то переключался для консультаций.Потом он попросил к телефону сотрудника банка,но сотрудница,которая отправила меня на горячую линию отказалась подойти.Я попросила старшую по отделению. Мне сказали,что она занята и подойдёт через 15 минут,в итоге я с ней пообщалась,но спустя 50 минут!! В конце концов на горячей линии уже другой сотрудник сказала,что справку можно было заказать у оператора в банке.Я опять к оператору,а она-Мы ничего не заказываем! Берите справку какую я вам даю и все! Не знаешь кому верить! Старшая по отделению в итоге сказала,что справку можно было заказать,но готовится она 2 недели!!! Это ужас какая-то простая справка и 2 недели.У меня карты Сбер и Альфа и нигде нет такого бардака.У мужа была ВТБ и постоянно какие-то проблемы.В итоге мы её закрыли.Нет никакого желания связаться с этим банком.",1,"Ольга, поверьте, мы всегда стремимся быть лучше. Мы обязательно обсудим с руководителем офиса все детали, описанные в отзыве, и учтем ваши замечания. Примите, пожалуйста, наши извинения."
21,Флоп Флап,,2023-09-01 06:09:46,"Реально приятное о деление, обслуживание вежливо, быстро, по деловому. Был правда в субботу, но приятно, что очередей не было от слова совсем.",5,"Благодарим за положительный отзыв, нам очень приятно 👍"
22,Сергей Кочубей,https://avatars.mds.yandex.net/get-yapic/28439/lgAWt7KYok2u04OwL5D5A9kIYfY-1/islands-68,2022-10-22 12:10:40,"Хороший большой офис, много рабочих окон, вежливый персонал. Хотел перекредитоватся под более низкую процентную ставку но через онлайн получил отказ. Через некоторое время мне позвонила Виктория и предложила помочь в этом вопросе, пригласила в офис без очереди и вопрос был решён. Очень понравилось профессиональное отношение и обслуживание. Также Виктория продолжала консультировать меня после выдачи кредита. Больше спасибо!
Так же спасибо Дмитрию Губину за помощь в оформлении!",5,"Сергей, для нас очень важно, чтобы наша работа приносила вам только приятные впечатления. Постараемся и дальше вас радовать! Отдельное спасибо, что отметили работу конкретного сотрудника."
