,name,icon_href,date,text,stars,answer
100,Сергей С.,https://avatars.mds.yandex.net/get-yapic/59871/enc-e1448600bde39b65861108805897703f17fa0186642a583f70ca8d7df5919bf2/islands-68,2023-09-14 16:16:41,Неудобно добираться.,4,"Спасибо, что являетесь нашим клиентом! При выборе месторасположения офиса мы руководствуемся различными критериями, такими как инфраструктура и близость к общественному транспорту. Отметим, что мы продолжаем развиваться и расти. Приняли ваше замечание к сведению."
101,Фрося,https://avatars.mds.yandex.net/get-yapic/50595/BB6Pc3PpKX9HUjG7yc79xhNhI-1/islands-68,2022-04-24 16:38:25,Очень хороший персонал. Всегда объяснят конкретно всё.,5,
102,Елена Георгиади,,2021-12-09 11:40:32,"Уже 40 минут сижу в очереди что бы получить карту. Зачем этот терминал на входе не понятно, приходят люди и без всяких талонов обслуживаются.",1,
103,Ольга Ермакова,,2021-03-18 20:09:15,"Была пару раз и не приятный какой то персонал что ли. Ну правда, я не говорю мне песни петь при входе, но манерность нужно убавить. Мы вам деньги приносим, а не берём просто так. А так банкомат выручает порой))",3,
104,Светлана,https://avatars.mds.yandex.net/get-yapic/29310/1E5WWawjFizecaleDXRJjETWoT0-1/islands-68,2023-03-27 12:21:55,Все удобно для клиента,5,"Благодарим. Нам очень важно, чтобы каждый клиент оставался доволен 😃"
105,Miora,https://avatars.mds.yandex.net/get-yapic/25817/yIqrd1zWYuYiNrQ8CriEXacVmYo-1/islands-68,2021-06-22 14:24:09,Ультра медленное заведение. Втюхивают кредитки. При составлении договора на кредит попросила зафиксировать дату платежа - проигнорировали. Короче ещё тот адок.,2,"Примите наши извинения за возникшую ситуацию. Со своей стороны обязательно организуем встречу с руководителем офиса и разберем ситуацию в деталях, чтобы в будущем такого избежать."
106,Катерина Ш.,,2019-04-01 11:07:07,"Здравствуйте!!! Это отдаление банка мне нравится больше остальных отделений , по-крайней мере среди тех, где я была...рассказывают все очень доступно, документы всегда принимают быстро, всегда советуют и подсказывают, как и что лучше сделать. Вообще в этом отделении персонал весь очень грамотный. 
В данном отделении редко бывают большие очереди, несмотря на выгодное месторасположение. Клиентов здесь достаточно, я в этом уверена, сама видела, просто в отделении порядок и поэтому очередей не возникает. А еще всегда чисто, что тоже безусловно большой плюс.",5,
107,Марина Тимошенко,https://avatars.mds.yandex.net/get-yapic/62162/SvIYZbcNEhQUvMUrBVsxVwm9oqQ-1/islands-68,2023-08-24 06:24:46,Хорошее отношение,5,"Рады, что вам понравилось. Ждем вас снова 😃"
108,Marinka20062008,https://avatars.mds.yandex.net/get-yapic/29310/OgkNmKI1m8l58sbFdeXTNlB80BE-1/islands-68,2023-11-18 12:29:32,Комиссия если меняешь меньше 300$,3,"Действительно, при обмене наличной валюты на сумму менее 300 долларов США или евро взимается комиссия в сумме 300 руб. за операцию. Эта информация указана в наших тарифах, а также на официальном сайте:
www.vtb.ru/personal/platezhi-i-perevody/obmen-valjuty/"
109,владимир галущак,,2021-12-11 20:07:02,Не много народу удобно но находится не в лучшем месте,3,
110,Дмитрий Шмелёв,https://avatars.mds.yandex.net/get-yapic/50595/jbm1H6EpVns2SpFUNAgZRlnNy1U-1/islands-68,2020-07-29 13:51:58,"Отличный офис в руках замечательного управляющего. Отдельная благодарность Эдуарду за помощь в моём тяжёлом вопросе. Никто не взялся за данную проблему, кроме него. Большая просьба премировать данного сотрудника и выразить ему благодарность от моего лица.",5,
111,Станислав Кузнецов,https://avatars.mds.yandex.net/get-yapic/63256/WAeMDCBl2JlovhhGlV3yR0kIuo-1/islands-68,2020-09-03 13:39:41,"Хочу поблагодарить сотрудника Анастасию в помощи получения кредитной карты ""Карта возможностей"" По причине получения кредитной карты другого банка, ""карту возможностей"" получать не стал. Всё равно спасибо за уделённое мне время и искреннее желание помочь! С уважением ко всем сотрудникам ""ВТБ"", Станислав.",5,
112,Михаил Гриценко,https://avatars.mds.yandex.net/get-yapic/37154/AZJZcLjI23HkrtvI1o2RH8j3TQ-1/islands-68,2023-01-05 23:51:53,"Не дают пол ного информирования
 по вопросам.",3,"Благодарим вас за отзыв. Нам очень важно знать ваше мнение. Мы стремимся к тому, чтобы быть лучше. Проведем работу в целях улучшения качества обслуживания."
113,Антон Геннадьевич,https://avatars.mds.yandex.net/get-yapic/32838/enc-c34f41b6c0ab80353010bad4f2e618e2f56ba639544e07a320a6913d09c3d3d4/islands-68,2022-07-07 20:07:55,"Частенько очереди для физических лиц, тесновато.",5,
114,Иван,,2020-02-13 15:58:50,"Добрый день ! Нечего не могу сказать про филиал плохо , но конкретно хочу выразить свое недовольство про сутрудника Азарского Павла ! Ситуация такая ! Была просрочка по кредиту , прихожу в банк обращаюсь попадаю по талону к Павлу и говорю ! Павел есть просрочка готов оплатитть основной долг , могли бы отправить заявление на расмотрение что бы отменили штрафы ! Павел говорит я согласую и вам наберу ! Звонит в ближайшее время говорит приходите закрывайте основной долг со штрафами разберемся ! Пришел говорю куда оплатить карты на руках но пароль от них не помню ! ( был один потреб.кредит и один авто карта ) говорит вноси на потреб всю сумму и с нее спишут на авто карту ! Я так и сделал ! А по факту списали потреб со штрафами вместе и оставую сумму перекинули на авто карту ! И остался еще должен по авто карте ! В платежном поручении не сказал он что надо что бы вписали что сумма эта в счет погашение двух кредитов в счет основного долга ( я о таких нюансов узнал спустя время ) ! Вообще из за таких сутрудников упала в моих глазах репутация всего банка ! Обманул глядя в глаза !! Хотя когда приходил козался мне порядочным сотрудником !",1,
115,Рустам,https://avatars.mds.yandex.net/get-yapic/24700/enc-ffad3b60140e285d44aa754dad0f358cb0dbc8fc69fa2a8e10797344f2bf2ed5/islands-68,2023-06-03 17:15:15,Всегда без очереди,5,"Рустам, поверьте, мы принимаем меры для того, чтобы время ожидания было минимальным. Проведем проверку в отделении и обсудим с руководителем данную проблему. Надеемся, что в дальнейшем мы не заставим вас ждать."
116,Сергей Будкин,https://avatars.mds.yandex.net/get-yapic/40138/enc-96a2193f8f972f5fae308f5ef39db15798eee9008467e0d4eb455d6405be2647/islands-68,2021-07-21 15:27:59,Отвратительно как и все ВТБ. Ждал оч долго. При наличии персонала не все окна работали. После вызова начальника сразу все заработали. Дно банковского бизнеса. Позор.,1,
117,Виолетта Белицкая,,2021-12-10 12:47:34,"Отзывчивые консультанты, всё грамотно объясняют👍",5,
118,Denis Kamaletdinov,,2021-05-01 09:05:46,"В последние 2-3 года банк очень сильно сдает в плане сервиса, превращаясь по качеству в сбербанк. Очень много непонятный комиссий, в том числе при снятии наличных со счета.",4,
119,Никита C,,2022-12-04 06:34:39,Нельзя оплату пошлины произвести без Инн плательщика,3,"Поверьте, мы стремимся быть лучше. Обратная связь нам помогает понять наши проблемы и принять меры для улучшения сервиса и обслуживания. Благодарим вас за отзыв."
120,Наталья И,,2022-09-14 18:10:39,"Очень долго, сотрудники не квалифицированные",1,"Наталья, мы стараемся решать вопросы оперативно, чтобы клиентам не приходилось тратить время на длительное ожидание. Поэтому обязательно обсудим с руководителем причины образования очереди, а также проработаем вопрос с сотрудниками с целью повышения качества клиентского обслуживания. Примите извинения за неудобства."
121,Саныч,,2020-05-08 05:25:34,"Отвратительная работа банкоматов на приём денежных средств !!! Из двух банкоматов (находящихся во входной группе) один постоянно не работает на приём денежных средств (хотя данная функция в нём предусмотрена), второй - тоже довольно часто с периодичностью дней 15 в месяц не работает на приём. Советую пользоваться при возможности банковскими картами сторонних банков и обходить данное отделение стороной !!!",1,
122,Антонина,https://avatars.mds.yandex.net/get-yapic/49368/5CklfazfEKjKbV2wjKbzAkqJ4-1/islands-68,2019-11-27 07:36:36,"Изо всех отделений различных банков это отделение банка ВТБ на Октябрьском Проспекте 380 самое функциональное во всех отношениях.Персонал доброжелателен,учтив и профессионален.Клиенты это оценили .Одно замечание-помещение тесноватое для увеличивающегося потока клиентов",5,
123,SHAG,https://avatars.mds.yandex.net/get-yapic/48449/kTylRmHGPNyJlKy7MVDsIIWmg0-1/islands-68,2019-12-16 01:13:00,Я клиент разных банков как наверно и многие но честно хочу выразить большую благодарность именно этому отделению Банка так как такого внимательного приветливого и тп обслуживания я не встречал ни в одном другом банке ! Большое Вам Спасибо 🙏🙏🙏,5,
124,Евгений,https://avatars.mds.yandex.net/get-yapic/15430/Yr6sybjtWipHY8x2ojAcTfrlrU-1/islands-68,2020-12-22 12:02:57,"Хорошее отделение.
Быстрое обслуживание. 
Персонал грамотный и вежливый.",5,
125,Ксения Пилипенко,,2021-10-02 12:08:12,"40 минут в очереди, при том что не полный зал клиентов, ну это такое себе развлечение …. Очень все долго",1,
126,termo_yadro,https://avatars.mds.yandex.net/get-yapic/30061/fgBI1b5k65jXyMUxmFRZo7EjQe8-1/islands-68,2023-11-13 20:36:38,Вежливый персонал,3,Благодарим вас за отзыв.
127,Михаил Батов,https://avatars.mds.yandex.net/get-yapic/21493/enc-e0ba110203affd2f1ab2653769314f0b75e174156018245c4cfe7b34b4e2e489/islands-68,2021-11-29 09:49:21,Несколько раз не смог в банкоматы вечером положить деньги!Часто банковские аппараты не работают.,4,"Михаил, обязательно проверим работу банкоматов в данном офисе. Примите наши извинения за неудобства."
128,оксана исаева,https://avatars.mds.yandex.net/get-yapic/47747/RhT6ZrpDeWfI2VUJ0TtAcdMLDOg-1/islands-68,2021-11-01 04:03:24,Лучшее отделение ! Дисциплина сотрудников на высшем уровне,5,Довольные клиенты - наша лучшая награда. Благодарим за высокую оценку нашей работы.
129,Владислав Ц.,,2020-07-15 07:33:01,"Получил отказ на получение кредита. Даже не озвучивали этого, через 5 дней пригласили якобы на подачу документов, а по факту всучить хотят кредитку на маленькую сумму, типо попользуйтесь 2-3 месяца, а потом на кредит подадимся. Обман клиентов = ВТБ, лишь бы свою продукцию всучить 👍🏻",1,
130,юрий ворон,https://avatars.mds.yandex.net/get-yapic/54535/IVOSRccI6Zbb7KXSkGUpPPyC13I-1/islands-68,2021-03-31 05:21:09,"Нормальное отделение , только чуть расширить и добавить операторов было бы отлично.",5,
131,Серёжа Пичугин,https://avatars.mds.yandex.net/get-yapic/50071/5CdADFw8rcp37LNhDTm0XGQdc-1/islands-68,2021-07-19 11:37:12,"Близко, вежливый внимательный и грамотные работники.",5,
132,Сергей Чуков,,2021-04-28 15:21:59,"Мега долгая контора. Два часа ждал зарплатную карту. 5 окошек , по-полчаса. База висит. Жесть. Очень долго. Диз.",2,
133,FastDogs,https://avatars.mds.yandex.net/get-yapic/21377/enc-a7133f35a249b60678e658fb290a8556874d4fb0b869923f5ac9fd247e8a816c/islands-68,2021-07-24 09:10:46,"Бестолковое отделение для физ лиц. Разменять в кассе деньги нельзя, хотя я получил их в ихнем банкомате.",1,
134,Наталья Савченко,https://avatars.mds.yandex.net/get-yapic/65952/d1Dv3iaGZfSNFubFCwMx75cAHPM-1/islands-68,2020-02-18 14:02:57,"ВТБ банк хороший, но персонал работать не очень хочет, только паботает с тобой если кредит берешь, а если, что то другое, есть Онлайн, сами можете сделать, - их ответ. Ждали очереди в ВТБбанке 2.5 часа, а решился вопрос дома.",3,
135,Елена М.,https://avatars.mds.yandex.net/get-yapic/63032/y9dU2dXRSM9EsncYnsOV2sD2wEI-1/islands-68,2020-04-16 19:08:33,"Была сегодня в этом банке.учитывая обстановку в стране с эпидемией они создали очередь.закрыли вход в банк люди толпились на улице у входа. Естественно ни о какой дистанции речи и не шло.работают медленно.
Жаль,что тут фото очереди прикрепить нельзя.",1,
136,Ирина,https://avatars.mds.yandex.net/get-yapic/47747/uAzR6d4OqU9gZHI8ABqPxZd5ik-1/islands-68,2019-04-01 10:29:01,"Обслуживающий персонал этого отделения всегда очень вежлив и корректен. На любой вопрос получаешь исчерпывающий ответ! Спасибо всем сотрудникам данного отделения за внимательность, компетентность, профессионализм!",5,
137,Татьяна Тимакова,https://avatars.mds.yandex.net/get-yapic/56823/fMLEESTefA9AhGU1Dc3fVHn6A74-1/islands-68,2022-07-21 18:10:53,"Очень долгое обслуживание, ну очееень",3,
138,Тамара Ряховская,,2022-10-20 16:32:31,Отзывчивые сотрудники. Хорошее обслуживание,4,"Спасибо, рады стараться 😃"
139,Антон Гонин,https://avatars.mds.yandex.net/get-yapic/21493/enc-a60bc0ce63fa82a4ae67e10b053cedaf75e174156018245c4cfe7b34b4e2e489/islands-68,2021-04-08 10:00:38,"Хорошее обслуживание, приветливый персонал, очередей почти нет.",5,
140,Илья О.,,2020-09-06 04:33:17,"Уже много лет в этом отделении работает девушка, которую сложно не заметить. Анастасия, самая красивая и привлекательная!)",5,
141,Владимир Г.,,2022-09-20 03:17:02,Создают очередь сознательно.,2,"Владимир, благодарим за сигнал. Проведем проверку в офисе."
142,Надежда Адамова,,2022-11-01 04:52:28,Супер обслуживание,5,"Спасибо, рады стараться 😃"
143,Константин Макеев,https://avatars.mds.yandex.net/get-yapic/57243/yJIf0E7kkiYOcFT4zKx5qOqrAWQ-1/islands-68,2019-12-09 19:47:27,"Удобное месторасположение, всегда приветливый и грамотный персонал, много банкоматов.",5,
144,Александр Мужиков,,2023-07-08 17:20:30,Сойдёт,5,"Рады видеть, что вы оценили нас на 5 ⭐"
145,Саня,,2023-01-04 18:06:54,Быстро удобно если из центра .,4,"Рады, что Вам понравилось. Ждем Вас снова 😃"
146,иван пономаренко,https://avatars.mds.yandex.net/get-yapic/38436/VSgx7k84c7fWww8Pl8ZmC8EKFYc-1/islands-68,2022-10-29 17:49:25,Долгое обслуживание,3,"Иван, спасибо за отзыв. Обязательно проведем проверку в данном отделении на основание Ваших замечаний и примем меры, которые позволят оперативно решать вопросы клиентов."
147,Kirill Grechishkin,https://avatars.mds.yandex.net/get-yapic/29310/ugPNokGKjYbsUx1E6t22IMxvFF4-1/islands-68,2021-12-08 19:24:48,"Офис ВТБ банка ,внутри есть два банкомата на прием и на выдачу",5,
148,Сергей А,https://avatars.mds.yandex.net/get-yapic/62162/enc-b89f3a3eb7b051744bd1459d92d7643aba08c98141b568115898ec6baa71854f/islands-68,2021-01-14 12:22:37,"Хотел оформить зарплатную карту. 16.12.2020
В итоге прождал 50 минут.
За это время ни одно окно не освободилось.
Очередь только росла. 
Очень долго и не профессионально. Руководитель отделения совершенно не понимает как организовывается данная работа. 
Не дождался, ушёл.",1,
149,Sergey,https://avatars.mds.yandex.net/get-yapic/41409/6zDAAY1PKAv8aP9ks4R7dAPk3PA-1/islands-68,2021-08-29 18:20:49,"отличный банк, всегда помогут с какими либо вопросами",5,
150,Юрий Иванов,,2021-11-02 17:11:56,"Сам банк норм,,стоянка не удобная,часто занята да и пробки в этом месте ужас",5,"Рады видеть, что Вы оценили нас на 5 ⭐"
151,Дутчак Дутчак,,2019-08-02 14:51:40,"У меня очень хорошая банковская история, и в сбербанке России и в хоумкредите и в совкомбанке, а в втб кредит не дали, я не люблю и не беру кредитов не обдуманно, нужно было на ремонт. Больше в Втб не буду обращаться. Не объективное рассмотрение данных.",1,
152,Ольга Михайлова,https://avatars.mds.yandex.net/get-yapic/43473/RR3ZbSHApyaOlaVZtFt7xGRA14-1/islands-68,2019-08-03 13:40:27,"Проверенный годами,надежный.
Персонал очень доброжелательный,работа слажена.А от очередей никто не застрахован.Работники банка стараются максимально донести информацию каждому клиенту.
Спасибо за вашу работу!",5,
153,Макс К.,,2019-11-01 13:44:02,"Прежде всего понравилось наличие стоянки, есть где машину поставить. В зале была очередь, но работали все окна и очередь двигалась быстро.",1,
154,Евгений Тарасов,https://avatars.mds.yandex.net/get-yapic/51169/2kRKqwwQks4g71qWSv6ETFp7qY4-1/islands-68,2021-02-22 11:25:27,Близко удобное расположение но немного очереди,4,
155,Ирина Нестерова,https://avatars.mds.yandex.net/get-yapic/41409/WnD1UaYiIQqOrf3SvgpUkyIp32k-1/islands-68,2022-02-16 18:50:24,Сталкивалась один раз и не понравилось,1,"Хотели бы разобраться в ситуации, с которой Вы столкнулись в офисе. Расскажите, пожалуйста, подробнее. Обязательно изучим информацию и примем меры. Информацию просим направить на наш адрес SMedia@vtb.ru ваши ФИО, дату рождения. В теме письма необходимо указать «Яндекс, Люберцы, Октябрьский проспект, 380Д, 16.02.22»."
156,Shark,https://avatars.mds.yandex.net/get-yapic/61207/7TAZlvYDjk5rjLCeCVXc1fI8lw-1/islands-68,2022-05-24 17:49:37,"Очередь, офис маленький.",3,
157,liusinandrei,https://avatars.mds.yandex.net/get-yapic/31804/CLQeEQ9XHKC7OwGrU9Ns7Wwo-1/islands-68,2022-06-09 19:13:27,Всё на высшем уровне.,5,
158,Александр М.,,2021-10-01 13:50:19,Всё быстро и профессионально,5,
159,Иван И.,,2019-10-07 17:14:36,"Отвратительное отношение к клиенту, сотрудники не могут сделать ничего! Постоянно одни к другому бегают и что-то объясняют. Работает несколько окон, а очередь растягивается словно обслуживает одно окно с обедом в 3 часа!!!",1,
