,name,icon_href,date,text,stars,answer
0,Константин Соболев,,2024-02-17 03:17:03,"Добрый день! Был в этом славном заведении, оформляли дом на продажу в ипотеку. Молодцы! Сделано все для удобства работников банка, в туалет ходили в платный, через дорогу! Всем бы работодателям так заботиться о своих сотрудниках! Подготовка к сделке тоже была на высоте! Нас забыли предупредить, что кроме расписки за получение первоначального взноса, нужно иметь на счете у покупателя сумму в 3,5 миллиона. У всех же, приехавших из другого города и берущихся дом в ипотеку, такие суммы всегда на счету. Говорят, нужно хоть на минуту положить на карту нашего замечательного банка, а потом можете сразу снять! Бегали в чужом городе искали эту сумму на 5 минут. Спасибо банку за приключения! Было весело!🫶",3,Благодарим вас за обратную связь. Обратим внимание руководителя офиса на ваши замечания. Для нас важен ваш комфорт!
1,Марина 2986,https://avatars.mds.yandex.net/get-yapic/31804/4V8dNughqFYfr9VS25ZuW5CCFzY-1/islands-68,2023-11-23 06:48:22,"Хочу написать слова благодарности менеджеру Оганесян Давиду Сергеевичу ! Пришли в Офис и нас обслуживал Давид , как приятно видеть , слышать сотрудника грамотныого , образованного , внимателного, умеющего слышать , объяснить и сделать свою работу на все 100%.Зашли только получить информацию по банку ВТБ , а в итоге стали клиентом Банка ВТБ, перевела свою пенсию в банк и получила массу удовольствия , настроение , кару , счёт и добрые пожелния . Вот таким хочется видеть сотрудника банков! Прошу руководство премировать или благодарность объвить ! Огромное человеческое спасибо Давиду! С уважением Хлыстова Марина Николаевна!",5,"Мы с удовольствием передадим информацию руководителю сотрудника, который с вами взаимодействовал. Уровень его компетенции и проведенная работа будут хорошим примером для всех наших коллег."
2,София Гаврильцова,,2024-01-17 14:08:53,"Хочу выразить благодарность ВТБ банку Краснодара , обслуживает менеджер Смирнова Елена Васильевна, никаких вопросов, работает четко, легко на высоком профессинальном уровне, что по телефону, что при личном контакте, также меня обслуживали и другие менеджеры и тоже держали марку банка. Особо хочу отметить работу помошников онлайн банка. Терпеливо, грамотно обьясняют каждую ситуацию . Я работала и с другими банками, не скажу , что работа не устраивала, просто вышли еще на ваш банк и не пожалели. Желаю процветания банку и успехов всем сотрудникам банка.",5,"Спасибо, что поделились своими впечатлениями. Мы очень ценим обратную связь 💛"
3,Nataly Simonenko,https://avatars.mds.yandex.net/get-yapic/49368/E0aOzKvbVqIYKM8U9DhPZvEFHA0-1/islands-68,2024-01-31 08:10:46,"При пополнении карты через банкомат 26.01.2023г. произошел сбой операции, денежные средства в размере 50 000 руб. не были зачислены на карту, о чем мной был сделан звонок Банку, номер банкомата 397073, обращение CR-11833174 зарегистрировано. В срок до 29.01.2024г. Банк должен был уведомить о результатах. (интересно, каких)? Ок, ждем)... 29.01.2024г.: от Банка приходит сообщение: Для рассмотрения обращения потребовалось дополнительное время. Результат сообщим вам до 31.01.2024г. ??? Опять чего-то ждем... 31. 01.2024г. приходит очередное сообщение от Банка: Для рассмотрения обращения потребовалось дополнительное время. Результат сообщим вам до 02.02.2024г. Как вы понимаете, звонки на горячую линию с одним ответом - ожидайте..... Банкомат установлен на территории сети бизнес-центров класса А, подобные ситуации повторяются практически каждый день, Банку написано письмо от лица УК с просьбой заменить банкомат на более рабочий и современный. Мы работаем с данным Банком, в т.ч. и по зарплатному проекту. Ну что могу сказать: у банка не выстроен нормальный алгоритм работы, раз решение рядового вопроса затягивается на неопределенный и непонятный для клиента срок.",1,Приносим свои извинения за вынужденную задержку. Просим дождаться результатам рассмотрения обращения!
4,Саида Хатит,,2024-02-01 16:07:12,Хочу поблагодарить менеджера по работе с физлицами ВТБ Попова Алексея Владимировича за отличную профессиональную работу. Первый раз обратилась в этот банк и осталась очень довольна обслуживанием.,5,"Нам приятно, что вы поставили нам высокую оценку 👍 Постараемся и дальше ей соответствовать!"
5,Елена 🌷,https://avatars.mds.yandex.net/get-yapic/33202/kk7HHMzGlObYwniI26VeEji6g-1/islands-68,2024-02-09 07:45:00,"К сожалению остались очень плохие впечатления, ни от банка а от специалиста по работе с гражданами, 3 февраля мы с мамой пришли чтобы оформить вклад, летом мы были там-же у другого специалиста (очень приятная и вежливая, рассказала о всех акциях). Так вот в феврале ,нас принимала девушка, которая сквозь зубы с нами общалась, каждое слово почти вытаскивали из неё, я ей сделала замечание, в ответ получила язвительный ответ. У нас сложилось впечатление что мы были на приёме у директора , но не как у специалиста. Надеюсь банк обратит внимание на данного специалиста и примит меры. Специалиста зовут Лысакова Светлана.",2,"Нам жаль, если при обращении в офис Банка сотрудник не смог предоставить вам качественное обслуживание. Обязательно проведем работу над повышением качества предоставления услуг!"
6,Er,,2024-02-03 09:11:11,"Отзыв не конкретно об этом отделении, а вообще об банке ВТБ, если есть возможность обходите стороной этот банк, сервиса и лояльности к клиенту 0 Дозвонится и поговорить с оператором об интересующих вас вопросах, очень сложно, вы будете по 5-10 минут висеть, по несколько раз перезванивать и слушать одно и тоже от робота, раз дозвонился, алгоритма дозвона так и не понял, фразы «поговорить с оператором» и подобные, не работают! Мой кредит, после объединения банков, был перенесен с банка Открытие в банк ВТБ, так сложилось, что на работе, перенесли дату получения ЗП, обратился в банк, принес трудовой договор и приказ о переносе ЗП, с просьбой перенести списания ДС по кредиту с 8 числа на 11 число, банк подобных услуг не оказывает, в чем проблема для банка в такой услуге, разъяснить не смогли, смогли предложить только кредитные каникулы, которые ни как не решают моей проблемы, у других банков, с переносом сроков списания нет, это можно сделать хоть по звонку на горячую линию.",1,"Интересующая вас услуга появится у нас в 2024 году.

Приносим извинения за возможные неудобства!"
7,Сергей,https://avatars.mds.yandex.net/get-yapic/62162/NVpT7a6OZOc32C5DKzPHbPJIXkE-1/islands-68,2024-01-30 06:43:58,Давно работаю. Хороший банк. Был недочёт - расчетный счёт открывал ровно месяц. Так долго не открывал ни в одном банке. Но много плюсов. Ключ сохраняется на компьютере и легко переносится на другой по необходимости. Пароль для ключа + пароль для входа + смс пароль. Защита максимальна. При работе трудностей не возникает. Все интуитивно.,4,"Спасибо, что отметили наши плюсы и за обратную связь, которая помогает понять наши проблемы и принять меры для улучшения качества обслуживания. Простите за возможные неудобства 💛"
8,ольга пипник,,2024-03-30 11:50:58,"Очень приятно удивлена, очень удобно для клиента, больше похоже на кафе по интерьеру , чем на банк, индивидуальный подход к каждому клиенту",5,"Приятно видеть, что посещение нашего офиса вызвало у вас исключительно положительные эмоции 😉"
9,Вадим Огородников,https://avatars.mds.yandex.net/get-yapic/40138/kpt6rtzjlUbCr7zdMAuumlQlhvY-1/islands-68,2023-12-03 15:28:42,"Сотрудники вежливые и не ленивые. Но часто вынуждены советоваться с коллегами или руководством при любом не типичном вопросе. Загруженность офиса не линейная, от двух трёх человек, до большой толпы клиентов и соответственно приличной очереди. В описании продуктов много маркетинга и зачастую отсутствие практической информации. Офис многофункциональный. Есть несколько банкоматов и парковка напротив.",4,"Вадим, спасибо, что отметили наши плюсы и за обратную связь, которая помогает понять наши проблемы и принять меры для улучшения сервиса.
Мы обязательно учтем и проработаем ваши замечания, чтобы в дальнейшем у вас не возникало сомнений в правильности выбора нашего Банка.

Простите за возможные неудобства."
10,Владимир,,2023-10-31 18:25:59,С банком сталкиваюсь впервые. Нужно было открыть эскроу счет. Очереди не было. Все сделали за 15 минут. Объяснили на пальцах все. Сервисом доволен. Правда убедили сделать дебетовую карту. Но я не пожалел. Даже карту стикер подарили),5,"Благодарим за отзыв! Очень приятно, что обслуживание в нашем офисе оставило у вас положительное впечатление 😊"
11,андрей кудинов,https://avatars.mds.yandex.net/get-yapic/39460/PGpUIl1q7uBwnFMiUFrXfE4IAY-1/islands-68,2023-11-24 14:12:18,"Хороший и бошьшой офис-банк, преимущество, можно удобно парковаться перед банком, хоть и платная парковка 100р.час, но она есть!!!",5,"Спасибо, что поделились своими впечатлениями. Мы очень ценим обратную связь 💛"
12,Olli Zi,https://avatars.mds.yandex.net/get-yapic/64336/Z8CTxv5BdKgvutja5fzakZlBD8g-1/islands-68,2023-12-02 17:32:00,"Быстрое обслуживание, очередь практический отсутствует, из минусов нет парковки для клиентов и огромная проблема в рабочее время припарковаться рядом.",5,Благодарим за высокую оценку нашей работы! Замечание по парковке приняли во внимание.
13,Юрий,,2024-01-26 07:59:43,"Пойдёт. Понятно что офис центральный цивильный, очереди когда был не было, вызывали по талончику быстро. Плохо что для решения вопросов нужно сюда прямо ехать (например с ЮМР) и ближе ничего нет, а по телефону и в ЛК ""такое"" не решают они..",5,Спасибо за приятный отзыв. Довольные клиенты - наша лучшая награда 👍
14,Сергей Щукин,https://avatars.mds.yandex.net/get-yapic/62162/JH8mHbw93j31xxsrB093LMJ87Cc-1/islands-68,2024-01-24 13:43:59,"В целом обслуживание не плохое. Вопрос решили быстро. Ожидание в очереди слегка утомило, людей было много. Понравилось, что в нестандартной ситуации с другим человеком вмешался администратор и быстро решил вопрос.",4,Спасибо за приятный отклик 😉
15,ЛюбовьС.,,2024-02-13 18:20:52,"Очень хороший банк , всегда все вопросы решают быстро и профессионально. Я клиент этого банка и мне все нравится.",5,"Благодарим. Нам очень важно, чтобы каждый клиент оставался доволен 😃"
16,Галина С.,,2023-04-26 06:56:28,"Очень понравилось обслуживание, в офисе ВТБ на Гоголя,68.Особенно хочется отметить сотрудника Темченко Анастасию Игоревню.Очень компетентный сотрудник, грамотно все объяснила,доступно,терпеливо.Если ещё раз понадобится,то постараюсь попасть именно к ней",5,"Благодарим вас за отзыв! Очень приятно, что обслуживание в нашем офисе оставило у вас положительные впечатления. Ждем вас снова 😃"
17,Наталья Корниенко,https://avatars.mds.yandex.net/get-yapic/43978/enc-8c21e012804353916ba8e2ef9cca05c449c19e308a9862340c2fa206063d0602/islands-68,2023-12-12 17:49:00,"Невозможно дозвониться! Собираю документы для рефинансирования ипотеки. Казалось бы, что проще - дать сразу весь список необходимых документов, так нет же. Дали не все, теперь вынуждена гоняться за сотрудниками банка, чтобы переуточнить все. Дозвониться вообще проблема (((",2,"Сожалеем, что вам не удалось оперативно связаться с коллегами для уточнения информации.

Хотим помочь в решении вопроса. Для этого просим направить на наш адрес SMedia@vtb.ru ваши ФИО, дату рождения и контактный номер телефона. В теме письма необходимо указать «Яндекс, Краснодар, улица Гоголя, 68, 12.12.23»."
18,Станислав Дорохин,,2023-12-10 18:32:47,"К сожалению пришлось пообщаться с некомпетентными специалистами. За 1 окном парень не старался помочь мне, а 30 минут пытался навязать доп услуги и кредит. Приехал за 40 км чтобы помогли установить мобильное приложение. В итоге ничем не помогли. Посоветовали поменять телефон и обратиться в салон сотовой связи.",1,"Сожалеем, что обслуживание в нашем офисе доставило вам неудобства. Мы обязательно проведем проверку ситуации из вашего отзыва и передадим информацию руководству отделения для организации мероприятий по повышению качества обслуживания. Примите, пожалуйста, наши извинения, исправимся."
19,Алексей Скаредов,https://avatars.mds.yandex.net/get-yapic/37154/H8oXw1MJWNVS0W8H0VHGzyyFkPc-1/islands-68,2023-08-18 16:20:47,"Пожалуй в моей личном рейтинге банков ВТБ занимает предпоследнюю строчку снизу. Столь низкая оценка складывается из ряда факторов: начиная с качества обслуживания, и заканчивая откровенной ложью при продаже банковских услуг в частности кредита. Опишу последнюю ситуацию. Мне позвонили из этого банка и предложили рефинансировать кредит с услугой гарантированная ставка под очень ""привлекательную"" ставку в 9,6 процентов. На деле же из 517 тысяч рублей я получил бы только 446 тысяч рублей. Остальное это страховка, зашитая в тело кредита! 72 тысячи за 30 месяцев кредита! Ладно бы они сказали бы об этом, так нет до самого подписания договора они деликатно об этом умалчивали. В графике платежей, которы они дали по моему требованию страховка вообще не фигурировала. Когда же я прямо спросил, а где платежи по страховке, они сказали, что она включена в платеж, тогда я попросил их распечатать график платежей с платежами по страховке, специалист банка сказал, что сделать такой график они не могут. Тогда я напряму спросил сколько денег я в итоге получу и только тогда он мне сказал, что из 517 я получу только 446. Получается кредит я взял только 446 и страховку за 71 тысячу рублей тоже взял в кредит! Вообщем это рефинансирование под 9,6 процентов мне бы обошлось за 30 месяцев дороже более чем на 100 тысяч, чем кредит под 12,9 процентов годовых. Отлично ребята работают во главе с Костиным. Причем за все время существования этого банка он не разу не платил дивидендов своим акционерам, более того люди, которые вложили свои кровные в ходе народного IPO в 2008 году сейчас в убытке на 90 процентов! Во общем вы поняли очень ""хороший"" банк. Обходите его стороной! ЭТО МОЁ личное мнение!!!",3,
20,Зина Касем,https://avatars.mds.yandex.net/get-yapic/65952/VjgRwsxPyvoDdzzdFhGGiRheQ-1/islands-68,2023-03-12 17:33:34,Очень хорошее обслуживание! Персонал вежливый и компетентный. Все умеют улыбаться и желать работать. Особое спасибо сотруднику Виктория по оформлению ипотеке. Очень быстро профессионального работает. Не зря эта главный офис!,5,"Зина, для нас очень важно, чтобы наша работа приносила вам только приятные впечатления. Постараемся и дальше вас радовать! Отдельное спасибо, что отметили работу конкретного сотрудника."
21,Евгений Кудряшов,https://avatars.mds.yandex.net/get-yapic/42215/NcwqWHb57O5T6XOIamC6N13FY-1/islands-68,2023-10-06 11:37:17,"Добродушный вежливый персонал, быстро,качественно, вся информация без воды. Молодцы так держать. Чувствуется рука управляющего.",5,"Благодарим, что уделили время для оценки работы наших специалистов! Постараемся и дальше соответствовать вашей высокой оценке 😊"
22,Елена Семенова,https://avatars.mds.yandex.net/get-yapic/15298/enc-975049977b64f56aa383240f86f52c5398eee9008467e0d4eb455d6405be2647/islands-68,2024-03-24 14:57:00,"Вот буквально 22 марта 24 года открывали там ипотеку. Персонал вежливый, корректный, готовый помочь",5,"Благодарим за отзыв. Так приятно, что вы поставили нам высокую оценку 👍"
