,name,icon_href,date,text,stars,answer
277,Klein,,2022-05-11 17:15:48,"Ждите, ждите и ещё раз - ждите. Таково отношение к посетителям.",1,"Согласимся с Вами, что длительного ожидания не должно быть. Обратим внимание руководителя отделения на данную проблему и примем меры 👌 Надеемся, что в дальнейшем мы не заставим Вас ждать."
278,Ирина Шевелева,,2022-10-26 16:25:33,"Много народу, долгое ожидание",4,"Ирина, спасибо за отзыв. Обязательно проведем проверку в данном отделении на основание Ваших замечаний и примем меры, которые позволят оперативно решать вопросы клиентов."
279,Елена К.,,2018-12-15 07:37:06,"Отличное, современное, чистое отделение. Сотрудники квалифицированные, всегда готовы помочь, никогда не уходила с нерешенными вопросами. Всегда информируют о новых более выгодных продуктах, я полностью довольна обслуживанием.",5,
280,Валентин,https://avatars.mds.yandex.net/get-yapic/49368/lmX7ZcJep96eH6mqmRHFxCZY-1/islands-68,2021-09-13 21:50:07,Иногда очереди((( Не всегда могут ответить на все вопросы. Не знают или не хотят говорить,3,
281,Алексей Богомолов,https://avatars.mds.yandex.net/get-yapic/35885/15Rqr5XPkaNFcFPEUBt8KMP6I-1/islands-68,2021-10-13 10:03:32,Стандартное небольшое отделение ВТБ. Симпатичные девушки работают,4,"Благодарим за положительный отзыв, нам очень приятно 👍"
282,10.A.C.E.01,https://avatars.mds.yandex.net/get-yapic/27274/XVSvn6HTPS4WgD3DKZpMfBrWmfM-1/islands-68,2019-11-27 06:47:33,"При открытии счета мой родственник сделал на меня доверенность, которая оказалась не действительной! Я обнаружила это через полгода при обращении в банк. Мне сказали, что ничего нельзя сделать и нужно приходить с доверителем. Конечно автор этой доверенности уже не работал, а значит по мнению банка и спросить не с кого. У меня вся семья усомнилась в правильности выбора банка. Ощущается, что в банке сильная текучесть персонала и нет никакого контроля. Руководству стоит обратить внимание на все это, т.к. имидж ВТБ совсем пропадает.",1,
283,И л ь я с,,2023-05-11 16:20:19,Не одкватний,1,"Хотели бы разобраться в ситуации, с которой вы столкнулись в офисе. Расскажите, пожалуйста, подробнее. Обязательно изучим информацию 👌"
284,Dev,https://avatars.mds.yandex.net/get-yapic/68143/fa2ZvBFPHVxOVkzV6hn6lLN9R4-1/islands-68,2020-08-25 08:11:59,"Норм отделение, сотрудники. А мобильное приложение - отстой, и проблемы с ним уже давно. У меня на трех разных телефонах оно отваливается, достаточно почитать отзывы в маркете. Клиентоортентированность на нуле.",1,
285,Михаил Воронцов,https://avatars.mds.yandex.net/get-yapic/41409/enc-47e5c95d74764389ae2dc2f6e315a916ac578a40df30acb4696139b728d72875/islands-68,2023-10-07 07:32:03,Быстро,5,"Спасибо вам, очень приятно получать обратную связь 🙏👌 Приезжайте ещё 💛"
286,Анастасия В,https://avatars.mds.yandex.net/get-yapic/42215/HaLyAVtXzvZZA5Q2iBxtfgS4W4-1/islands-68,2021-06-07 10:24:35,"Банк хороший, а вот сотрудники не очень доброжелательны. Легкое раздражение не первый раз получаю",3,"Спасибо, что поделились с нами Вашим опытом обслуживания. Мы обязательно учтем Ваши замечания и проработаем их с сотрудниками офиса, чтобы в дальнейшем у Вас не возникало сомнений в правильности выбора нашего Банка."
287,Ольга С.,,2021-10-25 11:43:52,"Хороший, удобный банк. Удачно расположен.",5,"Рады, что Вам понравилось. Ждем Вас снова 😃"
288,денис каримов,https://avatars.mds.yandex.net/get-yapic/20749/ZWQOAE4YmeKMbhzCluJGmyvbg-1/islands-68,2022-12-07 17:32:21,Нормальное обслуживание,5,"Благодарим. Нам очень важно, чтобы каждый клиент оставался доволен 😃"
289,Ольга,,2021-10-03 15:07:32,"Постоянно не работают наружные банкоматы, то один, то другой. То не работают на приём денег.",2,Благодарим Вас за отзыв. Направим информацию специалистам для проверки работы банкоматов.
290,vladimir matveev,https://avatars.mds.yandex.net/get-yapic/27232/Fix951uT7bQU7Zz0BTecosVFp2c-1/islands-68,2021-12-17 11:32:30,"Внимательные сотрудники, быстрое обслуживание.",5,"Спасибо, рады стараться 😃"
291,Лена Лобачева,,2023-01-25 23:34:54,Постоянные очереди,3,"Поверьте, мы всегда стремимся быть лучше. Действительно, вопрос очереди требует незамедлительного решения. Нам важно, чтобы каждый клиент мог решать вопросы без длительного ожидания. Продолжим работу в данном направлении. Надеемся, что в дальнейшем мы не заставим Вас ждать."
292,Виталий Крючков,,2023-08-19 10:39:03,Зашибись,5,"Рады видеть, что вы оценили нас на 5 ⭐"
293,Максим П.,https://avatars.mds.yandex.net/get-yapic/36777/F3rYFqhqbIa35usx8iDYJRC3vQ-1/islands-68,2021-12-11 14:36:32,"Банк обыкновенный,но есть плюс,всегда можно снять деньги ,если надо...",5,
294,Павел Волхонский,,2021-04-15 12:49:07,"Забыли сообщить о карте priority pass, иногда в обычном офисе обслужат быстрее, чем в привелегии",3,
295,сергей беляков,https://avatars.mds.yandex.net/get-yapic/50595/iiH7ToQoaUL1om8FiXbKfnvkA8M-1572015671/islands-68,2023-08-20 16:43:26,Хорошо,5,"Спасибо вам, очень приятно получать обратную связь 🙏👌 Приезжайте ещё 💛"
296,Анастасия Ефимова,https://avatars.mds.yandex.net/get-yapic/51381/jfrr5GbQCsGpEE3tNLszatN37s-1/islands-68,2021-08-14 09:35:20,"Приятный персонал, удобное расположение",5,"Рады, что Вам понравилось. Ждем Вас снова 😃"
297,Ирина Кузькина,https://avatars.mds.yandex.net/get-yapic/43978/DIPNllW7I0Bsi1skkoUftWqSGs-1/islands-68,2021-07-14 07:37:12,"Хорошее отделение. Много банкоматов, и окошек со специалистами",5,"Благодарим. Нам очень важно, чтобы каждый клиент оставался доволен 😃"
298,Александр Грачев,https://avatars.mds.yandex.net/get-yapic/31078/s4YF1RqJEIIDATgeQfh4drEAq4-1/islands-68,2023-03-01 12:28:01,Дорого Богато,5,"Спасибо вам, очень приятно получать обратную связь 🙏👌 Приходите к нам почаще 💛"
299,said141073,https://avatars.mds.yandex.net/get-yapic/62162/nRK6vBnZuqExsyCPnMPWb8IFo-1/islands-68,2021-09-19 17:52:55,Недалеко от дома. Тихо. Есть парковка.,5,
300,Лариса,https://avatars.mds.yandex.net/get-yapic/27274/AoYIpEmuSpVGSqZKwVdonDIhGQ-1/islands-68,2021-03-15 14:41:06,"Отличное отделение, работают внимательные профессионалы!:))",5,
301,Алексей Т.,https://avatars.mds.yandex.net/get-yapic/40841/TPeiJfcUnqwJBJBrTCNjwRZ0-1/islands-68,2021-12-19 20:36:14,Пришёл положить денег в банкомате и оба банкомата не работают,1,"Проверили информацию. Действительно, два банкомата не работают. Специалисты работают над восстановлением устройств."
302,Вера Максимова,https://avatars.mds.yandex.net/get-yapic/59871/05MycZsbh4qNzxn2IaABl7OY-1/islands-68,2022-06-27 16:57:06,Внимательное отношение к клиентам!,5,
303,Инкогнито 9969,,2023-06-30 13:08:59,Good,5,
304,Александр Д,,2021-12-07 07:21:24,"Работают професионалы, все достаточно понятно.",5,
305,иван,,2021-12-07 13:52:57,"Банк как банк, все как везде. Обычно немного людей.",5,
306,Юлия Владимировна,https://avatars.mds.yandex.net/get-yapic/25358/hhbea9eA0Uoq9R9vHW3eXvjUdQ-1/islands-68,2021-05-01 10:40:49,"Хорошие сотрудники, всегда помогут во всех вопросах .",5,
307,Сергей Куликов,https://avatars.mds.yandex.net/get-yapic/29310/pdsSKNme3xwyTThaieZFrVQdFs-1/islands-68,2021-07-02 11:49:03,Очень корректное и доброжелательное отношение сотрудников.,5,"Спасибо, рады стараться 😃"
308,Цзиньхай Ван,https://avatars.mds.yandex.net/get-yapic/51381/MoxhxWqiqjnpE8vmYpwJ1I7RSqk-1/islands-68,2021-10-06 21:05:04,"Сотрудник заказал мне симкарту без моего согласия, еще списали 200 рублей.",1,"Хотим отметить, что без согласия клиента оформление продукта в Банке не производится. Только после получения письменного согласия сотрудник производит оформление продукта."
309,Андрей Васильев,https://avatars.mds.yandex.net/get-yapic/39803/DnCWzMLodkgf16N4rzTfEtGDdk-1/islands-68,2021-05-17 14:31:34,"Нормальный банк. Был несколько раз, народа мало. Были сложности с парковкой.",4,
310,Спец,,2023-05-20 19:57:59,Нормально,4,"Спасибо вам, очень приятно получать обратную связь 🙏👌 Приезжайте ещё 💛"
311,BlackBOLT,,2022-01-27 05:27:25,Иногда приходится ну очень долго сидеть в очереди.,4,
312,Оксана В.,,2019-08-22 16:50:16,"Приходится посещать, поскольку это самое ближайшее отделение. Если бы был выбор, не приходила бы сюда. Каждое посещение - ожидание в очереди 30-40 минут. И это не из-за того, что много клиентов, просто отсутствует персонал.",3,
313,warbe 8.,https://avatars.mds.yandex.net/get-yapic/41409/82RsRgYZLrR0GW8XfqSfHjhJkM-1569180216/islands-68,2021-08-06 13:34:26,Удобно расположен. Хорошие сотрудники,5,Ваш положительный отзыв для нас – лучшая награда 😊
314,Татьяна Ткаченко,,2020-08-06 11:15:29,Хорошее обслуживане. Все вежливо. Любой вопрос решается. Спасибо,5,
315,Виктор Сафонов,https://avatars.mds.yandex.net/get-yapic/41409/enc-c1656ea47a2539b580fb2fb9541e9ba25789f9044bd2158f7e6f0f854d344c22/islands-68,2021-11-27 14:58:28,"Сколько был в различных отделениях банка, но такого ужасного отношения нигде не видел. Работает одна девушка, трое мужчин сотрудников - бездельничают.",1,
316,Л.Р.,,2022-12-07 18:33:11,Больше часа в очереди! Кошмарно медленно работают. Худшее отделение!,1,"Любовь, поверьте, мы принимаем меры для того, чтобы время ожидания было минимальным. Проведем проверку в отделении и обсудим с руководителем данную проблему. Надеемся, что в дальнейшем мы не заставим вас ждать."
317,Евгения Пронина,,2023-04-04 18:24:09,Очень длительное время ожидания(,3,"Поверьте, мы всегда стремимся быть лучше. Действительно, вопрос очереди требует незамедлительного решения. Нам важно, чтобы каждый клиент мог решать вопросы без длительного ожидания. Продолжим работу в данном направлении. Надеемся, что в дальнейшем мы не заставим вас ждать."
318,Максим Чернышев,,2022-01-08 20:37:23,Более медленного обслуживания не видел нигде.,2,"Сожалеем, что вынуждены были потратить ваше личное время на ожидание в очереди. Обсудим с руководителем данную ситуацию и примем меры, которые позволят сократить длительное время ожидания."
319,галина егорова,,2021-03-26 11:55:16,Грамотные консультанты и быстрое обслуживание.,5,
320,роман волошин,https://avatars.mds.yandex.net/get-yapic/45848/Ch4YXOsF08oEEpvPgNk7dJYUko-1/islands-68,2021-08-27 16:37:55,Народу много . Парковки нет . А так банк есть банк,3,
321,Ирина,,2022-07-04 16:57:16,Лучший банк для меня,5,
322,Lucky,https://avatars.mds.yandex.net/get-yapic/36777/ALMhPYOWMP5IbLjIaz2pFzwf4Ds-1/islands-68,2019-10-30 04:33:36,"Медленно обслуживают. Сотрудники банка позволяют звонить на сотовые и стационарные телефоны после 21.30 времени. Никогда не спрашивают удобно ли общаться, не правильно произносят фамилию и имя. Совершенно невоспитанные и неграмотные люди в отделении этого банка.",2,
323,Вадим Шаповалов,https://avatars.mds.yandex.net/get-yapic/24700/enc-9894372f4bfb78fe1977afecf642ba21/islands-68,2020-07-25 20:46:11,"Мало клиентов, можно быстро оформить услугу. Только там и обслуживаемся и кредитуемся!",5,
324,Анонимный отзыв,,2021-09-13 15:33:19,Быстрое и вежливое обслуживание.,5,
325,Татьяна,,2020-05-05 22:51:40,"Посещала банк 5.05.20. Из двух банкоматов один не работает вообще, второй отказал в приеме налички. Банк в такой ситуации в стране создает очереди и наживается на просрочках по кредитам из-за отсутствия возможности внести деньги на карту! Был осуществлен звонок на горячую линию. От того, что банк принесет свои извинения, мне ни холодно, ни жарко.",1,
326,Олег,https://avatars.mds.yandex.net/get-yapic/56823/l8W2ef9VOJbVeK36X9J4PCROBKE-1/islands-68,2021-10-26 12:56:10,"Большой офис, но всего четыре банкомата.",4,"Олег, благодарим за отзыв. Нам важно знать Ваше мнение. Мы обязательно примем во внимание Ваши замечания."
327,marina gusena,https://avatars.mds.yandex.net/get-yapic/21377/enc-eab0634cc49d13501deeb5ceb714fb032bb02b7f1e30bb48680c92188f8a2fdd/islands-68,2021-08-12 10:31:30,"Новый интерфейс полный отстой, не могу сделать некоторые операции",1,"Хотели бы помочь в решении вопроса. Для этого просим направить на наш адрес SMedia@vtb.ru ваши ФИО, дату рождения и также пошаговые скриншоты Ваших действий и скриншот ошибки в ВТБ-Онлайн. В теме письма просим указать «Яндекс. Москва. Измайловский бул., 46, 12.08.21»"
328,AVA AVA,https://avatars.mds.yandex.net/get-yapic/15298/enc-dd26f8800d312fb235833fc284a05e75/islands-68,2020-08-03 13:25:24,"Иногда консультанты не могут ответить на простейшие вопросы. Например, как на пополняемый счет начисляются проценты :(",4,
329,Андрей Хартман,https://avatars.mds.yandex.net/get-yapic/57243/BG7mUpP70wztX3mO6uFclsmquE-1/islands-68,2021-04-12 14:41:00,"Отличное отделение , работают профессионалы!",5,
330,Алексей Горелов,https://avatars.mds.yandex.net/get-yapic/35885/L0t98RT7bH6c2aCmpgUOIvLiEhE-1/islands-68,2021-09-27 16:03:38,Удобно и ни разу там очереди не встречал.,5,
331,Шамиль Хайретдинов,,2022-11-07 04:57:00,Нет очередей,5,Спасибо за отзыв! Будем продолжать в том же духе 💪
332,мария соловьева,,2021-12-13 12:04:40,"Класс 
Все на высшем уровне",5,"Рады видеть, что Вы оценили нас на 5 ⭐"
333,Bazilito,https://avatars.mds.yandex.net/get-yapic/44850/ZbuZVa0V0LCHPHGp8myeXpxfo-1/islands-68,2022-02-19 06:30:42,"Банк как банк, ни чего особенного!",1,
334,Данила Прохоров,https://avatars.mds.yandex.net/get-yapic/39803/koq17gY12JPxUQ0HM992aCwNCGw-1/islands-68,2021-12-19 07:17:00,2 банкомата внутри не принимают деньги,3,"Данила, примите наши извинения за неудобства. Над восстановлением устройств работают специалисты."
335,JuJu,,2018-10-23 08:07:45,"Ужасное отделение! Чтобы попасть к операционисту нужно ждать час, даже если нет очереди. Так приезжала три раза,с четвёртого дождалась свою очередь. Сотрудники занимаются своими делами, во время приёма клиента пользуются своими телефонами ( для развлечений). Работа настроена плохо, либо пустые номера вызывают и долго ждут ( кажется утром себе набирают талоны,чтобы успеть проснуться), либо просто не принимают, очередь стоит! Потом разом всю очередь обслуживают и опять тишина",1,
336,Андрей Чернышев,,2022-04-20 16:49:21,Команда специалистов,5,
337,Галина Рыжова,,2019-10-24 13:54:02,Очень люблю этот банк! Персонал вежливый и грамотный! Все вссегда на высоте!,5,
338,makar_a m.,https://avatars.mds.yandex.net/get-yapic/38135/jCzvLTPDT4oYmdqACerOe4HXkY-1/islands-68,2021-09-28 07:15:09,За одной справкой сижу час хотя 2 человека всего,1,
339,София Карандашева,https://avatars.mds.yandex.net/get-yapic/28053/TJ5AjtzNh55jWXfc7CBqz8c3Q-1/islands-68,2022-09-25 08:42:13,банк как банк,5,"Рады видеть, что Вы оценили нас на 5 ⭐"
340,Катя Л,,2022-05-03 18:40:35,Пользуемся банкоматами,3,"Благодарим Вас за отзыв. Нам очень важно знать Ваше мнение. Мы стремимся к тому, чтобы быть лучше. Проведем работу в целях улучшения качества обслуживания."
341,Галина Гришнячива,https://avatars.mds.yandex.net/get-yapic/57243/Z61CQG6TuCc3OJcBiwuhuJ5nis-1/islands-68,2019-09-10 05:23:50,Два раза обращалась в это отделение. Первый раз: закрыть карту; второй: оплатить счет. Два раза сотрудница Евгения Русанова не смогла ничем помочь. Странно. Настораживает квалификация сотрудников.,1,
342,Егоров Андрей,https://avatars.mds.yandex.net/get-yapic/48449/enc-64a29c545412ff0afc7f690a42d64e27cf09ef18ebdbc821af1cb708442b8c8b/islands-68,2020-10-06 12:25:46,"Хорошие сотрудники, но все ужасно долго. Виснут программы ещё что то происходит, постоянно очередь",2,
343,ольга *,https://avatars.mds.yandex.net/get-yapic/20706/enc-72d750c1c1de8f3137ff4562f3569ac7f24874f4dc922b4eb50b455107676f1a/islands-68,2022-02-07 09:13:28,Слишком долгое обслуживание,4,
344,Алексей Б.,https://avatars.mds.yandex.net/get-yapic/41409/R5ZqBVMcR2ZOrYMyruIpBkbbKJo-1/islands-68,2020-03-04 04:01:23,Большой офис. Удобное расположение. Быстрое обслуживание.,5,
345,Рахматилла,https://avatars.mds.yandex.net/get-yapic/30431/np75leC8zVlEZDEHNGVx7fdMQ-1/islands-68,2022-10-24 17:34:38,Отлично👍,5,"Спасибо вам, очень приятно получать обратную связь 🙏👌 Приезжайте ещё 💛"
346,Антон Сумароков,https://avatars.mds.yandex.net/get-yapic/40841/AapFPM8KeT2g1J73HEFM0UPI-1/islands-68,2019-08-07 12:08:30,Конкретно к этому отделению данного банка претензий по работе и обслуживанию нет. Всё было сделано быстро и качественно. Моя проблема была решена,3,
347,z.mitki,,2022-01-18 18:14:41,Постоянно не работают банкоматы,2,
348,Кирилл Сухов,https://avatars.mds.yandex.net/get-yapic/38663/fafjDMvv1W1FxMZ7DZS6yVuVeF4-1/islands-68,2020-08-21 20:16:19,"Хорошее отделение, сотрудники клиентоориентированы и готовы помочь.",5,
349,Ivan Novoselov,https://avatars.mds.yandex.net/get-yapic/33202/mtx9KyHzgGh76dP5JbP4cTnB50-1/islands-68,2019-11-16 20:01:16,"Неплохое отделение, правда небольшое, есть привилегия, некоторые сотрудники не очень в теме",4,
350,Андрей Карпов,,2022-02-22 17:45:44,Отличное обслуживание,5,
351,Мария Галаева,,2021-11-24 22:26:01,Банк.... с очередями. Как обычно,5,
352,SunSunny,https://avatars.mds.yandex.net/get-yapic/27232/Oqxr2BKR8DqziuX0lN4FCyjXGM8-1/islands-68,2019-11-19 06:53:21,"Бестолковое отделение. Постоянно много народу. И несмотря на электронную очередь времени тратишь там очень много. 
Есть банкоматы.",2,
