,name,icon_href,date,text,stars,answer
48,Тимофей В.,https://avatars.mds.yandex.net/get-yapic/15298/enc-86ef858119aab1a40d1ca72aea534782/islands-68,2023-05-30 10:26:11,"Долго открывали счет и карту. В программе произошла какая-то ошибка и банк что-то мутил с повторной сменой номера мобильного. Спустя время кто-то мне звонил от имени банка по-поводу мобильного. Думаю, что ***, но звонки-то начались сразу после открытия счета. На текущий момент банк разорвал со мной отношения по своей инициативе ""без объяснения причин"". Не могу дождаться от них ответа на вопрос, как мне забрать деньги. В офисе в Некрасовке у них нет кассы, а банкоматы мою карту не обслуживают. Большой банк - свои законы и никто им не судья. Не рекомендую.",1,"Сообщаем, что требования законодательства о защите сведений, составляющих банковскую тайну (статья 857 Гражданского кодекса Российской Федерации, статья 26 Федерального закона от 02.12.1990 №395-1 «О банках и банковской деятельности»), строго соблюдаются Банком и его служащими.
Хотим помочь в решении вопроса. Для этого просим направить на наш адрес SMedia@vtb.ru ваши ФИО и дату рождения. В теме письма необходимо указать «Яндекс, Люберцы, Смирновская улица, 2, 30.05.23»."
49,Кристина,https://avatars.mds.yandex.net/get-yapic/51381/8JIQO3VWKYYF8Blz2IRFzokUAJA-1/islands-68,2024-01-12 13:48:47,"Персонал приветливый, общалась с руководителем ипотечного отдела, помог решить вопросы.",5,Спасибо за приятный отзыв. Всегда рады вам помочь 💪
50,olga lazareva,https://avatars.mds.yandex.net/get-yapic/15430/enc-54be54abc813af09cbb97d37f80e5e5f0f3eadec7d95c8c1a11c442706dfe7b9/islands-68,2023-02-15 16:57:21,"Отличное обслуживание, грамотный персонал, комфортная зона ожидания. Есть куллер с водой, рядом кофейня с очень вкусным кофе.",5,Довольные клиенты - наша лучшая награда. Благодарим за высокую оценку нашей работы.
51,Ирина Максимова,https://avatars.mds.yandex.net/get-yapic/53031/enc-a6c17aaacfc2cc2beee96c2eb75388168090f6147ed221af56a2d9c2deb45270/islands-68,2021-10-23 09:50:28,"Очень грамотные сотрудники... удивительно! Сделки с ипотекой просто супер! Внимательное и чуткое отношение к клиентам! Все четко, заранее продумано, документы подготовлены заранее...Быстрое и четкое проведение сделок! Экономия времени клиентов! Огромное спасибо Марии и Кириллу! За высокий профессионализм и четкость в работе...Все следующие сделки постараюсь проводить у вас! Браво!",5,"Благодарим за положительный отзыв работы сотрудников. Рады, что вы остались довольны 🙂"
52,Екатерина Ильина,https://avatars.mds.yandex.net/get-yapic/20706/enc-f8a469d6190c1d8373b7c822c91eb2dc/islands-68,2023-03-10 12:22:43,"Одна сотрудница ,меня гоняла толком ничего не знает на стойке, либо просто всё равно… вторая без терпения, перебивает ,сказать не даёт, пришла карту получить, но такая агрессия, со стороны сотрудницы, ничего не знает, говорить не хочет, я отказалась от карты ,сказала что бы утилизировали и счёт закрыли. Если бы мне сотрудница спокойно объяснила , ответила на вопросы и была бы прозрачность , я бы скорее всего с пониманием дела , ушла бы с картой и порадовала бы дочь. сделала в другом баке, с уважением и всё объяснили. Такое ощущение, что кроме кредитов им вообще предложить нечего и не хочется.",1,"Екатерина, благодарим вас за отзыв. Мы сожалеем, что обслуживание в нашем офисе доставило вам неудобства. Обязательно проведем проверку ситуации из вашего отзыва и организуем встречу с руководителем офиса и сотрудниками, на которой обсудим вопросы повышения качества обслуживания клиентов. Обратим внимание руководителя и на компетенцию сотрудников. Примите наши извинения, надеемся на дальнейшее сотрудничество."
53,Чехова Марина,https://avatars.mds.yandex.net/get-yapic/20749/enc-25d57e4792f3f311d0b2d59e0ba1b2c0b0dbc8fc69fa2a8e10797344f2bf2ed5/islands-68,2023-03-01 15:27:28,"Такого неклиентоориентироанного банка я еше не встречала , пришла оформить дебетовую карту , очередь была не большая ждала минут 15 потом меня пригласили в кабинет ,не обратила внимания на бейдж, после нескольких вопросов, «костюмчик» решил со мной не работать направил меня обратно в зал к 4 окошку , где я просидела больше сорока минут в надежде дождаться кого то из персонала, притом никто из персонала даже на спросил и не поинтересовался почему меня вернули , и почему я столько сижу без внимания,вообщем не приятно очень не выдержалаушла , притом посадили девушек пришедших значительно плзже меня . Больше я туда не пойду. Худший банк",1,"Марина, хотим извиниться перед вами за долгое ожидание. Более 40 минут - действительно недопустимо. Мы обязательно обсудим проработаем вопрос с сотрудниками с целью соблюдения стандартов клиентского обслуживания. Примите извинения за неудобства."
54,Любимка,,2023-07-22 09:44:09,"Хамское отношение администратора(
Отвечала на вопросы по примеру: «я не знаю что вам там в службе поддержке сказали»,сама толком не знала ответ на наш вопрос,далее к ней подошли два сотрудника отделения,она резко переключилась на общение с ними,ни сказав нам ни слова,на наш вопрос: «вы с нами закончили?»,был ответ: «ну да,а что еще то вы хотите»
К сожалению не посмотрели как зовут администратора (светленькая)",1,"Спасибо, что поделились с нами. Обязательно проведем проверку в данном отделении на основании ваших замечаний и примем необходимые меры. Приносим извинения за доставленные неудобства."
55,Ирина Максимова,,2023-02-07 20:27:11,"Зашли в банк , спросить как можно восстановить ипотечный кредит ( который был оформлен онлайн)менеджер не смогла ответить на наш вопрос и отправила нас с другое окно( 12 окно ) . Ждали мы минут 20 . После того как специалист освободилась , она подошла к своей коллеги и начали болтать на личные темы. Мы подошли и задали свой вопрос и она с таким гонором и высокомерием начала нам объяснять , что ничего восстановить нельзя , что все удалили , значит удалили У нас был ребёнок, поэтому не могли выяснять и настаивать на решение своего вопроса ( до этого не раз звонили на горячую линию , и знаем , что восстановить договор можно в любом банке втб по заявлению . Но она настаивала на своём и неизотропный вообще разговаривать . Таких специалистов втб я в своей жизни не видела …..",1,"Ирина, спасибо за отзыв. Обязательно проведем проверку в данном отделении на основание ваших замечаний и примем меры, которые позволят оперативно решать вопросы клиентов."
56,Цветок Вереска,https://avatars.mds.yandex.net/get-yapic/15298/enc-67037d427ecc68398aa2a41c49db1ce998eee9008467e0d4eb455d6405be2647/islands-68,2023-06-21 08:37:02,"Месяц назад начали поступать звонки от автоответчика о предложении услуг. Не будучи 20 лет уже как клиентом этого банка, я позвонила и попросила отключить все эти звонки на мой телефон. На что мне сказано, что я должна приехать к ним и написать отказ. То есть они имеют право названивать мне, а чтоб отказаться, я должна ехать к ним и просить их не делать этого. ВТБ, вы в себе?",1,"Для проверки и отключения ваших данных из списка возможных оповещений по информационным и рекламным материалам, а также специальных предложений Банка в рамках целевых и маркетинговых программ можно позвонить в наш контактный центр по номеру 8 800 100-24-24 или 1000 с мобильного.
Просим не исключать также возможность подмены телефонных номеров мошенниками. Сохраняйте, пожалуйста, бдительность.

Заявление на отзыв персональных данных необходимо подать в офисе Банка.

Благодарим вас за обратную связь."
57,Екатерина,,2023-05-10 19:23:42,"За перевод денежных средств из банка в другой банк взяли комиссию 1,25%, ранее переводы были бесплатными
Ссылаются на то, что с изменениями клиент должен ознакамливаться каждые 5 дней !! 
Подтверждающие документы предоставить не могут 
Буду обращаться в ФАС 
Зарплатный проект перевожу в другой банк 
В разговоре с оператором пытаются «впарить» кредит 
Никому не рекомендую данный банк",1,"Здравствуйте, Екатерина!
Сожалеем, что возникла такая неприятная ситуация. Вместе с тем обращаем внимание, что обязанность клиента самостоятельно знакомиться с информацией об изменении тарифов Банка закреплена в Правилах комплексного обслуживания физических лиц в Банке ВТБ (ПАО) (пункт 5.4). Мы же со совей стороны всегда заблаговременно (не менее чем за 5 календарных дней) размещаем информацию о предстоящих изменениях на нашем официальном сайте www.vtb.ru
В любом случае приносим извинения за возможные неудобства и надеемся, что в будущем ещё будет возможность изменить ваше мнение о нас в лучшую сторону."
58,Лиана,,2022-12-01 16:28:00,"Во первых огромные очереди, неважно какое время вы приедете, то обязательно простоите, а если повезет просидите в очереди, во вторых я с мужем обращалась по поводу открытия расчетного счета для ИП, что длилось по меньшей мере около часа. Далее что бы воспользоваться этим расчетным счетом через банк онлайн нужно очень много нервов и времени, так как ни приложение, ни сайт не работают, даже зайти не удалось, не то что бы начать им пользоваться. После ряда бесконечных звонков и обращений нам так и не наладили работу, у мужа терпение кончилось на 5 сутки этого мученья, я пыталась еще неделю, но поняла, что это бесполезно… Я сама обращалась по поводу рефинансирования ипотеки, так как мне предварительно одобрили, сказав, что необходимо просто привезти оригиналы документов, что я собственно и сделала, потратив в очереди а далее в заполнении документов целый день. Являясь зарплатным клиентом этого банка, а так же пользуясь не одним банковским продуктом полагала, что вопрос о рефинансировании будет быстрым, но вечером того же дня, мне после звонка отказали, не уточнив причины. Ранее рекомендовала данный банк своим знакомым и родственникам, о чем очень жалею, и намерена перейти в другой.",1,"Поверьте, мы всегда стремимся быть лучше. Мы обязательно обсудим с руководителем офиса все детали, описанные в отзыве, и учтем ваши замечания."
59,Маддалена Маддалена,https://avatars.mds.yandex.net/get-yapic/30955/EGDxIXa7lhLvbzLzdXdSDYzqVXY-1/islands-68,2024-01-05 18:28:07,!на столько медлительных работников я ещё не видела!!!сонное царство!!! одного человека принимают час!,1,"Ваше замечание не останется без внимания и будет незамедлительно передано ответственным руководителям с целью реализации мер, которые обязательно будут направлены на повышение скорости предоставляемых услуг. Простите за возможные неудобства."
60,Дмитрий,https://avatars.mds.yandex.net/get-yapic/6218514/OeBGaAxS4tVxSpX5TCSZ8ndgJU-1/islands-68,2023-10-23 11:50:39,"Приехал в 19-50. Девочки помогли с запросом, хотя рабочее время подходило к концу... Спасибо!",5,Довольные клиенты - наша лучшая награда 👍
61,Галина С.,,2023-09-04 07:57:55,"Были записаны на сделку, крайне долго. Электронные подписи выпускает только 1 сотрудник, в порядке общей очереди с остальными клиентами банка, ожидание более 1 часа! 
Сотрудники хамят и повышают голос!",1,"Сожалеем, что обслуживание в нашем офисе доставило вам неудобства. Мы обязательно проведем проверку на основании ваших замечаний вместе с руководителем и примем необходимые меры. Благодарим вас за отзыв."
62,Мари Мари,https://avatars.mds.yandex.net/get-yapic/27232/fyUBHT6CKlgNcyJc6LRiU6091M8-1/islands-68,2023-03-02 18:36:25,"Просторное помещение, ожидание минимальное по времени. Количество обслуживающих окошек и оперативность решения вопросов специалистами сокращает время ожидания. Замечательно. Но! Отсутствие защитных стёкол ( перегородок) между сотрудниками банка (а они сидят практически плотно друг к другу) не дают возможность с первого раза получить информацию. Или ждёшь когда рядом сидящие пообщаются или тебе неоднократно повторяют информацию. Не очень удобно.... А в остальном чистота, аккуратно, при входе помощь консультанта. Всё прекрасно. А этот момент нужно как то продумать. Просто при полном заполнении нужно сесть перед любым окном и почувствовать этот дискомфорт кому то из руководства.....",5,"Довольные клиенты - наша лучшая награда. Благодарим за высокую оценку нашей работы. Мы обязательно обсудим с руководителем офиса все детали, описанные в отзыве, и учтем ваши замечания."
63,Ева-Елизавета Д.,,2023-06-09 11:48:08,"Нужно было разрешение на регистрацию третьих лиц в ипотечной квартире, к сожалению только в Москве в центре города могут ее выдать, поставила 5* чтоб не портить репутацию именно этого филиала, но блин, сделайте поудобнее для людей, чтоб вообще в личный кабинет ответ приходил и все",5,"Здравствуйте!
Сожалеем, что действующие процедуры Банка доставили вам неудобства. Передадим ваш отзыв в профильный отдел. Благодарим за обратную связь!"
64,Кирилл Калмыков,https://avatars.mds.yandex.net/get-yapic/56823/cMUjtM4l7FjGz7Ko5Q9XLecQ0lY-1/islands-68,2023-06-22 09:00:01,"Бермутский треугольник, 15.06 приехали за выпиской по счету не можем получить по сей день 22.06. Операционист заставляет звонить в тех поддержку и просить решить инцидент операциониста. Быть прокладкой между сотрудником ВТБ и техподдержкой ВТБ это очень клиентоцентрично! Браво!",1,"Хотим разобраться в ситуации и помочь в решении вопроса. Для этого просим направить на наш адрес SMedia@vtb.ru ваши ФИО и дату рождения, а также наименование документа, который вам необходимо получить. В теме письма необходимо указать «Яндекс, Люберцы, Смирновская улица, 2, 22.06.23»."
65,eвгения семенова,,2022-10-31 18:04:12,"Крупный офис. Очередь около 30 мин, но атмосфера спокойная и приятная. Менеджер, к которому я попала, Анна очень профессионально все разъяснила и помогла.",5,"Огромное спасибо за приятный отклик 💛 Рады, что смогли помочь в решение вопроса 😉"
66,Лилия Шелявкина,https://avatars.mds.yandex.net/get-yapic/53031/c25buwOptpPBK3LKO52OQguzRoo-1/islands-68,2023-04-27 17:09:57,Отличный. анк. Приветливый и грамотный персонал. Быстрое оформление кредита. Рекоменлую.,5,Спасибо вам большое за доверие 🤗 Всегда рады приветствовать вас в нашем офисе!
67,Антон Гиренко,https://avatars.mds.yandex.net/get-yapic/27274/AFlk9V24fwVNPQN7ltQPDL4a7g-1/islands-68,2023-07-11 17:22:06,Хорошее отделени мне помогли проконсультировали. Но то что хотел я не получил ВТБ жмоты. Обидно людям без стажа и справок дают кредиты а мне со всеми бумагами и справками дали отворот поворот,5,"Спасибо вам, очень приятно получать обратную связь 🙏👌 Приезжайте ещё 💛"
68,Lunatik1620,https://avatars.mds.yandex.net/get-yapic/53031/EeIE0XaxiXFxwgWglIQK5dGoQ-1/islands-68,2023-01-23 21:49:43,"Обслуживание грамотное, о ношение к клиентам внимательное , с арабтся помочь с вашим вопросом , время ожидания минимальное. Являюсь постоянным клиентом банка уже много лет. Единственный минус , что это единственное отделение в Люберцах",5,Довольные клиенты - наша лучшая награда. Благодарим за высокую оценку нашей работы.
69,Любовь Водопьянова,,2023-01-19 15:25:07,"Доброжелательный персонал, вежливый, всё рассказали, что меня интересовало, рекомендую данный офис!!!!!! Спасибо!!!! 🤗🤗🤗🙌🙌👍",5,"Спасибо вам, очень приятно получать обратную связь 🙏👌 Приезжайте ещё 💛"
70,Кристина Войтюк,https://avatars.mds.yandex.net/get-yapic/62162/rEGN1bTY6HfD19V24IL2dEs5xYM-1/islands-68,2022-05-07 18:49:28,"Притензий нет. Обслуживание оперативное, профессиональное! Отличное расположение - на пересечении нескольких улиц и легко припарковаться. Красивый фасад! Внутри тоже чисто!",5,
