,name,icon_href,date,text,stars,answer
133,Элэн Д.,,2021-03-27 19:15:12,Нигде не указано что данный банк работает на премиум вкладчиков. Остальные езжайте в обычное отделение,3,
134,Олег Олег,,2022-02-18 18:42:50,Молодцы хорошее обслуживание.,5,
135,Мистер Пропер,,2021-03-10 10:59:31,"очень крутое отделение , работают профессионалы своего дела",5,
136,Galina G.L.,https://avatars.mds.yandex.net/get-yapic/38135/r3fAxmD9o2xP3gz7k8ynzkfiQXs-1571375001/islands-68,2022-06-22 06:21:29,Только для юридических лиц…,5,
137,Дмитрий Трифонов,https://avatars.mds.yandex.net/get-yapic/29310/l30s6TBMMU2ueq7whZt8UmFWb2Y-1/islands-68,2022-09-04 18:01:39,Обычное отделение.,5,Спасибо за пятерку! Всегда Вам рады.
138,Константин Дунаев,,2020-06-26 08:14:33,"Отделение банка ничем не отличается от других. Персонал вежливый, вполне профессиональный! Кофе не подают😁, но мне и не надо!!!",5,
139,Елена,,2021-12-10 17:51:56,Обслуживание только определенной категории лиц,5,
140,Татьяна Рыбалко,https://avatars.mds.yandex.net/get-yapic/26057/WqVxnjRPlAj9OU0ertjeL9brK8-1574586626/islands-68,2019-11-09 15:09:08,"Периодически пользуюсь услугами.
Обслуживанием довольна. Все быстро и доброжелательно.",4,
141,Кирилл Anabolic,,2021-10-01 12:10:14,"ну очень странный банк, не именно это отделение, а сам банк",1,
142,Sergey,,2022-02-11 19:47:41,Обслуживают только золотых клиентов,1,
143,Дилара Садриева,https://avatars.mds.yandex.net/get-yapic/24700/enc-46152457505d0fd3280cd86533e401c2e0ce88243222f0bac1426bbb9ad280da/islands-68,2019-01-23 12:05:23,"Единственное отделение ВТБ где сошлось все, грамотные специалисты, быстрое обслуживание, уютный офис, большое количество банкоматов.",5,
144,......,,2022-11-14 18:10:56,все отлично,5,Спасибо за отзыв! Будем продолжать в том же духе 💪
145,Илья Громов,https://avatars.mds.yandex.net/get-yapic/59871/yQ7m9zB7Xedp2Cr9yc27heXaI-1/islands-68,2021-12-14 08:07:28,Тут принимают только клиентов привелегии,1,
146,mom23kot,,2022-01-29 10:01:14,Обслуживание только вип лиц,1,
147,Артем Анненко,https://avatars.mds.yandex.net/get-yapic/20706/enc-22754e5d644975a5c30cf9257efe4cf198eee9008467e0d4eb455d6405be2647/islands-68,2021-09-23 13:34:06,Общение персонала оставляет желать лучшего,2,
148,Ирина ..,https://avatars.mds.yandex.net/get-yapic/63256/azddDkHhuzibUF2omOPZPiWwVQ-1/islands-68,2023-01-29 19:17:22,Всё ок.,5,"Спасибо вам, очень приятно получать обратную связь 🙏👌 Приезжайте ещё 💛"
149,Ganik,https://avatars.mds.yandex.net/get-yapic/32838/yRXPNoFiBLcxtIfvHOf2gdY23A-1/islands-68,2020-06-17 15:37:01,"Конкретно в этом банке не был но сколько раз имел чести общаться с банком ВТБ 
Не разу не остался довольным. 
Но общаться приходится так как к несчастью я их клиент. Если меня попросят сказать что то хорошее то мне не чего будет даже сказать. Как о самом банке так и о сотрудниках банка",1,
150,Евлампия Тараканова,,2021-04-16 13:22:23,ДО не понятно чем занимается. Простые операции выполнить не могут.,1,
151,Сергей,,2021-07-27 02:13:15,ВТБ привилегия. Простым людям там делать нечего.,1,
152,Денис Федоров,,2021-08-19 09:42:54,Очень не профессиональные сотрудники,1,
153,Дмитрий Силяев,,2022-05-13 16:23:01,Отличный банк,5,Спасибо за отзыв! Будем продолжать в том же духе 💪
154,Petr Venikov,https://avatars.mds.yandex.net/get-yapic/36689/enc-b85986b30b1dfc5210a64b20cecce74ca5cffb6fbf014b71798eab9d824894f6/islands-68,2021-09-09 11:44:04,Простых смертных не принимают,1,
155,Эдуард,https://avatars.mds.yandex.net/get-yapic/21493/enc-b33103c9783e10bae8d30a9e7810e8b1b63ccc489e8a6ba55257f36f231a37b5/islands-68,2019-08-30 11:30:02,"Обслуживают ТОЛЬКО клиентов с ""Привилегией"". Остальных клиентов ВТБ ""посылают"" искать другой офис, при этом ехидно улыбаются! Отзыв опубликован уже год, реакции ВТБ нет никакой! Что и требовалось доказать. На людей этому офису наплевать... P.S. Судя по двум недовольным - отзыв работники этого офиса наконец-то прочитали! Оценку подтверждаю!",1,
156,Мария Чиркина,https://avatars.mds.yandex.net/get-yapic/27503/eFuREKCOidbS3b0X24R4jAKw5fA-1/islands-68,2019-07-04 16:11:31,Все быстро и по делу. Очень приятные и вежливые сотрудники,5,
157,Эдвардс,https://avatars.mds.yandex.net/get-yapic/57243/hKfm9QJBAtLEVQtyAMeKxqUcXw-1/islands-68,2020-07-26 06:38:05,"Чисто, быстро, банкомат есть",5,
158,Ирина,https://avatars.mds.yandex.net/get-yapic/54535/enc-267fd475792b26e6d0672ff30c232cecd227ca162dadb905750f01b0cf9ff6db/islands-68,2021-07-11 09:22:44,До сих пор нареканий нет.,5,
159,Сергей Сорокин,,2019-11-20 14:46:58,"В округе отделения переполнены, а в этом ни одного клиента. За что они там зарплату получают.",1,
160,Klim S,https://avatars.mds.yandex.net/get-yapic/28053/gHZxyYVsk1Rghwbw8iQLx9Jum8-1/islands-68,2020-03-28 14:04:03,"Сотрудники не компетентные, на элементарные вопросы ответить не могут...",2,
161,Greenly,,2019-11-04 08:10:44,"Что значит - только для вип клиентов???? Заходила менять валюту, так дамы-работники смотрят так, будто они акционеры банка, а я милостыню пришла просить ! 👎",2,
162,Александр Аришин,https://avatars.mds.yandex.net/get-yapic/56823/kmc4u7GCUoELC5aZ1lYXreLrg-1/islands-68,2019-08-23 20:32:24,Как и всегда сервис на высоте. Сотрудники знают своё дело.,5,
163,Kay Ess,,2019-09-01 06:10:10,"Дальше порога зайти не решился, слишком привилегированно. В предбаннике с банкоматами тоже было хорошо, но мне они нужны и были.",5,
164,Елена Юшкова,https://avatars.mds.yandex.net/get-yapic/21377/enc-25ab38972c6b38048dd98d701081533dba08c98141b568115898ec6baa71854f/islands-68,2019-06-14 15:34:20,Приятная обстановка . Грамотный персонал,5,
165,wsdlegal,https://avatars.mds.yandex.net/get-yapic/30061/gHQ1fqNOxdqnaPYJPy4WEs6KeBc-1/islands-68,2019-10-06 17:06:57,Хорошее отделение и отличное обслужвнаие,5,
166,Татьяна М.,https://avatars.mds.yandex.net/get-yapic/31078/Lf8X0wNMJDZl6AnzaEe5m0Qb8-1/islands-68,2020-01-03 13:46:48,"Не смогли помочь мне,отправили в то отделение где брала кредит",1,
167,Дмитрий,https://avatars.mds.yandex.net/get-yapic/56823/Mg4xnePWjZngHDj1TQx0eQsRc4-1/islands-68,2019-08-25 13:08:05,"Здесь обслуживают только избранных! У меня зарплатная ""быдлокарта"".",1,
168,Олег,https://avatars.mds.yandex.net/get-yapic/20706/enc-01b723a15d4d9f5003d43fdea5d7c401/islands-68,2018-12-10 06:54:34,Отделение ТОЛЬКО для клиентов с пакетом Привилегия. Обычных посетителей не обслуживают.,2,
169,Евгений Сидоренко,https://avatars.mds.yandex.net/get-yapic/31804/enc-8ad176e2a371ceb2dceb4198a2cc525f8da5d01fc0d1fe8de3fc63f0b36bf9bf/islands-68,2019-03-31 18:35:21,"Все отлично, быстро, профессионально",5,
170,Vladimir Dorovsky,https://avatars.mds.yandex.net/get-yapic/38663/enc-db58803e5195521486ab096a14c00d7823fa55f04ec805d9e12d4f0f2310a832/islands-68,2019-10-20 11:59:26,"Доступное отделение, а в остальном стандарт",4,
171,Вера Сухих,https://avatars.mds.yandex.net/get-yapic/29310/woWe4Y5JQXIqfP0NxwQrWUIjkJI-1/islands-68,2019-09-06 06:58:13,"Отвратительно!
Не дали обычную справку!
Нет привилегий 
И никаких вывесок что обычным людям тут не место.",1,
172,Барабулька,,2019-07-28 18:34:55,"Парковки нет, могли бы позаботиться о вип клиентах",1,
173,алексей харитонов,,2018-02-17 07:41:01,"Мне попался абсолютно неквалифицированный работник Елдин И.А, который своей безграмотностью или ленью вводит клиентов в заблуждение",1,
174,Григорий,https://avatars.mds.yandex.net/get-yapic/28053/stDIlhYrPTFVZIrb9TMdtBtGHac-1/islands-68,2019-08-23 16:29:11,Да я заходил. Я не вип но всё было мило.,5,
175,korvet82,https://avatars.mds.yandex.net/get-yapic/39460/enc-dc038401e50a41a341c3e6eb98a6f7f7d4244a9ff2dd625fc99e2cbf3aa36589/islands-68,2019-03-13 15:28:17,"Обычных клиентов не обслуживают, только тех у кого есть корона",1,
176,Максим,https://avatars.mds.yandex.net/get-yapic/61207/smV3jaJYI85Ota3C7N0ffNqZWA-1/islands-68,2019-01-16 10:44:42,"Напишите, что в этом отделение только VIP. А то не хорошо получается. Хотел карточку открыть - выгнали ))",1,
177,Алексей Банников,https://avatars.mds.yandex.net/get-yapic/59871/W4rrCXuMyWp9QQJcORMp40pOPU-1/islands-68,2019-12-06 15:50:57,Не знаю там випов обслуживают,5,
178,Борис Александров,https://avatars.mds.yandex.net/get-yapic/36777/enc-f56fc0b95c0054d0dce18ea5802e382a76c632649bb865ff6839c56e8c8bd5d1/islands-68,2019-12-08 17:53:52,Заходил ноль людей и это радует,3,
179,Турист,,2020-03-13 03:52:06,Отличный персонал.,5,
180,Светлана Малащук,https://avatars.mds.yandex.net/get-yapic/32838/atfnHrEZ3qFzNmCbLlibjKXs4-1/islands-68,2019-10-20 07:44:01,"Клиентов нет, персонал спит! Ляпота!",5,
181,Максим Н.,https://avatars.mds.yandex.net/get-yapic/64336/lFudhIIK3fhlgkku6UCT75nxQY-1/islands-68,2019-12-24 20:54:42,Персонал хамит и охрана тоже,3,
182,Дмитрий Кузовлев,,2019-03-13 14:18:22,работают только с ВИП клиентами,1,
183,руслодиус д.,,2018-03-14 13:08:25,Очень мало парковочных мест и очередь в сам банкомат (,4,
184,Сергей С.,,2019-09-04 20:25:25,Отличный Банк.,5,
185,Artem,,2018-11-10 12:09:31,Не для простых смертных,1,
186,Olejjjka,https://avatars.mds.yandex.net/get-yapic/21493/enc-324f711443b017409ec376b97317624298eee9008467e0d4eb455d6405be2647/islands-68,2019-05-09 10:53:10,Только вип,1,
187,Artem N,,2019-07-22 11:24:21,Нет очередей,5,
