,name,icon_href,date,text,stars,answer
0,Влад Митрофанов,,2024-04-05 13:06:50,"Классный банк,Сотрудница по имени «Лейла» отлично знает свою работу,очень быстро и четка выполнила свою работу,за что я ей очень благодарна,советую всем обращаться к ней,очень быстро оформляет все,что нужно. отличии от «других,сотрудников!
Я Ставлю 5 звездочек,за ее работу)
По Набирайте по больше таких Красивых Сотрудниц 😎",5,"Для нас очень важно, чтобы наша работа приносила вам только приятные впечатления. Постараемся и дальше вас радовать! Отдельное спасибо, что отметили работу конкретного сотрудника 👍"
1,Ирина,https://avatars.mds.yandex.net/get-yapic/39803/enc-c5a86accbf75ee11b7b71e59042d505bb07a00b4c622db2534e858dfa9005da1/islands-68,2023-12-10 15:37:23,"Пользуюсь этим банком достаточно давно, никаких особых претензий к работе нет, за исключением, единственно, постоянного большого скопления посетителей и долгого ожидание в очереди.
Но наибольшое разочарование произошло, когда этот филиал переехал с такого удобного местоположения напротив метро Первомайская на Измайловский бульвар!
А их бывшее помещение заняли какие-то мелкие лавчонки типа цветочных или аптечных! Вот такая замена...",4,"Спасибо за обратную связь, которая помогает понять наши проблемы и принять меры для улучшения качества обслуживания!"
2,сергей жуков,https://avatars.mds.yandex.net/get-yapic/25817/S8tJVsOlsXNAEwY4VXMqGaGWThQ-1/islands-68,2023-09-28 06:12:24,"Банк очень большой , светлое , чистое помещение , всегда людно , работают быстро без проволочек , есть консультант ,он всегда поможет , удобно и приятно в общем",5,"Благодарим за отзыв! Рады, что вы остались довольны 🙂 Мы всегда стараемся по максимуму удовлетворить потребности наших клиентов и создать для них комфортные условия обслуживания. Приходите ещё!"
3,Наталья Сизова,https://avatars.mds.yandex.net/get-yapic/64336/S8axEzavtVzQxxlQqDmnk30O0-1/islands-68,2023-10-20 08:44:24,"Измайловский бул., 46 - пришла ровно без одной минуты 19:00 ( по другому не успеваю никак с работы). Сотрудник банка стоял копался изнутри с ключами - не мог найти ключ, что бы выпустить клиента. И с ехидной улыбкой - всё, мы закрыты. Для кого такой режим работы? У большинства работающих людей график работы до 18:00, но ещё и доехать надо. В районе нет других филиалов ВТБ. Куда идти то? По телефону/в чате вопрос не решают - говорят ""какая то дублирующая учетная запись появилась"" Какая дублирующая??? Откуда она взялась??? Почему я должна тратить на это время??? И кидают в чат мне рассылки на кредит...ссылку на подбор офиса банка. Издёвка какая то.",1,"Сожалеем, что вам пришлось столкнуться с трудностями в процессе обслуживания в нашем Банке. Возможность изменения графика работы обязательно обсудим с руководителем отделения."
4,Евгений Иванов,https://avatars.mds.yandex.net/get-yapic/27274/kGohL6ChfrRnJPj4ohIAKqkCME-1/islands-68,2024-02-15 20:17:07,Современный дизайн банка. Много банкоматов. Электронная очередь и редко бывает много людей. Вежливые сотрудники. Сервис в банке налажен на высоком уровне,5,"Мы стремимся предоставлять нашим клиентам качественное обслуживание и рады, что вы оценили это. Приходите к нам почаще 👍"
5,Катя Старикова,https://avatars.mds.yandex.net/get-yapic/27274/Wt8sFjUHJd5Lykk8ytAGHhLSBRU-1/islands-68,2024-01-21 11:24:01,"Отличное отделение, быстрое обслуживание. За день до посещение этого банка обращалась в банк у Щелковской. Не выслушали нормально проблему, соответственно и не решили, но сказали ожидать неделю и она решится. Зато пришла в этот банк, и мою проблему решили за несколько минут. Ушла довольная и счастливая. Советую.",5,Спасибо за обратную связь. Это помогает нам расти и развиваться 😊
6,Альбина Веденеева,https://avatars.mds.yandex.net/get-yapic/43978/qaQnnbcx0EfeJDhpX0fBurMmGQM-1/islands-68,2023-12-30 16:24:06,"Удобное расположение. Напротив есть парковочные места. В вестибюле два банкомата. Как и везде, обслуживание физлиц и юрлиц. Отношение сотрудников нормальное.",5,"Спасибо, нам очень приятно получать обратную связь 💛"
7,Валерий Швец,https://avatars.mds.yandex.net/get-yapic/48449/fzz0WB35iKdR0Z7LZRquUFP7MQ-1/islands-68,2022-12-28 16:21:57,"Несмотря на высокую нагрузку на сотрудников данного отделения по Измайловскому бульвару 46, банк вцелом справляется с работой,клиенты довольны работой персонала. Персонал молодой,вежливый и главное, - отзывчивый. Спасибо всем,особенно консультанту и менеджеру отделения привилегии по имени Антон. Всегла поможет и по любому вопросу.
Я обслуживаюсь в этом отделении банка Валерий Трофимович",5,"Хотим также взаимно вас поблагодарить за высокую оценку!
Уверены, что в будущем наше сотрудничество будет исключительно положительным. Спасибо вам за то, что являетесь клиентом нашего Банка, мы это действительно ценим."
8,@ngelinaleo,https://avatars.mds.yandex.net/get-yapic/27503/t42AwNPQMxzDTblnOIuEjLzoIiI-1/islands-68,2023-04-08 07:02:10,"Очень понравилась сотрудник отделения Евстифеева Валерия Евгеньевна. Внимательно выслушила наши пожелания, предложила все возможные варианты, помогла сделать выбор и надлежаще оформить продукты. Благодаря таким сотрудникам мы - клиенты ВТБ! Также отдельное спасибо Руководителю отделения Измайловский буль 46 за чёткое руководство и слаженность работы отделения.",5,"Спасибо, что уделили время и оставили отзыв. Конечно, нам приятно видеть, что помощь наших сотрудников вызвала у вас исключительно положительные эмоции 👍
Приходите к нам почаще!"
9,Илья Васин,https://avatars.mds.yandex.net/get-yapic/15430/9WM7tQ8uR2n9UgZRVDYUMgUYVY-1/islands-68,2023-11-07 01:50:47,"Пришёл закрыть карты и счета в данном банке, так как просто напросто не пользуюсь их услугами. Когда подошла моя очередь, я сел и озвучил цель своего визита сотруднице. Услышав, что я хочу закрыть все счета, сотрудница закатила глаза и сделала максимально недовольное лицо, словно её лишат премии или оштрафуют",2,"Илья, огорчены, что у вас возникла такая ситуация во время визита в наш офис. Обязательно проработаем с сотрудниками вопрос соблюдения стандартов клиентского обслуживания. Надеемся на сотрудничество в дальнейшем."
10,Георгий Иванов,https://avatars.mds.yandex.net/get-yapic/31078/wMkmwVwnDcF52l69ubTJqQAk-1/islands-68,2024-03-01 06:57:57,Большой зал. Тут много окошек с сотрудниками банка и это сопсобствует отсутствию очередей и быстрому обслуживанию клиентов. Много банкоматов и хорошее обслуживание. 👍,5,"Спасибо за положительный отзыв, нам очень приятно 👍"
11,Мари Лето,,2024-03-12 07:18:50,"Пришла в банк 12.03.24 в 9:58 открывается банк с 10:00. Стояла очередь, открыли дверь в 10:02 «специалист» на ресепшене посадила часть очереди за окна остальным сказала посидеть талоны она даст потом, в итоги я пришла раньше обслужили клиента который пришел после. Зачем задать людей если есть электронная очередь?! Испортили день",1,"Благодарим за отзыв. Обратная связь помогает понять наши проблемы и принять меры для улучшения сервиса и качества обслуживания.

Приносим извинения за возможные неудобства."
12,Екатерина Маслакова,https://avatars.mds.yandex.net/get-yapic/21377/enc-f3699129f1a2dff1df8c1236e5bc53401038f255316d4bcb4da897cc93fc35e1/islands-68,2024-04-09 06:37:18,"Хорошее отделение банка, просторный. По сравнению с другим отделением людей мало, работает достаточное количество сотрудников, чтобы не создавать огромную очередь.",5,"Спасибо, что поделились своими впечатлениями. Мы очень ценим обратную связь 💙"
13,Александр Макеев,https://avatars.mds.yandex.net/get-yapic/27503/PCgNwGR5VyVJATejpQbqaxxTylg-1/islands-68,2023-03-12 13:19:46,"Добрый день , обратились в банк ВТБ ,на Измайловском бульваре 46 , для совершении сделки . Сделку открывала Кристина , потом вёл ее Тываник Дмитрий Александрович . Очень грамотный специалист , старший менеджер в этом отделении . Была проблема , Сбербанк случайно закрыл ,счёт на который , должны были перевести деньги , из банка ВТБ. Открыв счёт в ВТБ и пройдя 9 кругов Ада , а это отдел который находится в Барнауле ( да Вы не ослышались !!! В Барнауле , мать его этот отдел ) с которым связь , только через почту . Дмитрий смог ,решить эту проблему ,отправить заявление , поменять реквизиты , попросил своего руководителя повлиять на эту ситуацию и у нас все получилось , за что Дмитрию , огромное , человеческое спасибо . Он смог , решить наши проблемы , грамотно среагировать . А ещё , он хороший человек , который даст таблетку от головной боли и когда ты в отчании , найдёт нужные слова , для успокоения , не самого спокойного клиента . 
Дмитрий , большое Вам человеческое Спасибо , надеюсь , вы станете Руководителем отделения ( может не этого ) и будете , также отлично решать проблемы и задачи , ваших , не самых умных и адекватных клиентов . ",5,"Огромное спасибо за приятный отклик 💛 Рады, что смогли помочь в решение вопроса 😉"
14,Полина Басова,,2023-09-06 09:01:13,"Хочу выразить огромную благодарность Поскребиной Алёне. Высококвалифицированный сотрудник, компетентная, быстро, четко без задержек организовала решение вопроса.",5,"Так приятно, что вы поставили нам высокую оценку и отметили работу сотрудника 👍"
15,Нина Курочкина,,2023-08-09 18:26:57,"Вопросы решаются быстро. Менеджер (Грудцева Надежда Николаевна) всегда любезна, внимательно, старается решить возникающие вопросы. Персонал всегда вежлив и доброжелателен.",5,"Спасибо за высокую оценку и за то, что отметили работу сотрудника 👍"
16,Анатолий Перепёлкин,https://avatars.mds.yandex.net/get-yapic/65952/tbuYDk0gQMzI6d1SlJLwZK7BH0-1/islands-68,2024-01-10 08:01:22,"Долго обслуживался в этом банке. Обещали, что не будут брать плату за счет, если не буду им пользоваться, но брали довольно приличную сумму. Не, сюда ни ногой.",2,"Огорчены, что у вас сложилось такое негативное мнение о нашем Банке.

Списание комиссии за годовое обслуживание осуществляется согласно действующим тарифам Банка. Никого не обманываем, все условия по продуктам и тарифам находятся в открытом доступе на нашем сайте: www.vtb.ru/malyj-biznes/otkryt-schet/otkryt-schet-ip/."
17,Александр Пантелеев,https://avatars.mds.yandex.net/get-yapic/62162/3et6XRLvUvz8vgpoimF3BAwpTg-1/islands-68,2023-11-09 16:24:50,"Хороший отдел, недалеко от дома. Спасибо менеджеру Бабайцева А. Оформили все быстро и понятно, вопросов нет",5,"Спасибо за высокую оценку и за то, что отметили работу сотрудника 👍"
18,АЛЕКСЕЙ А.,,2023-01-14 03:36:45,"Всегда вежливое общение с клиентами. Разъяснения сложных ситуаций. Оперативный доступ к ячейкам. Отдельная благодарность руководителю отделения. Поможет в трудную минуту, проверено. Всем рекомендую. Отличное обслуживание по системе Привелегия, сотрудники помогать в решении вопросов с позитивным настроением и профессионализмом. 
Удачи данной компании!",5,"Благодарим за положительный отзыв, нам очень приятно 👍"
19,Юрий Коваленко,,2023-11-11 17:05:45,"Отстояв , часовую очередь, с талоном для операций по вкладам , попал к менеджеру Динаре . Уважаемые клиенты ! Обходите этого менеджера стороной ! Низкая компетенция, не внимательная, плохо слышит клиента .",3,Спасибо за сигнал. Обязательно проведем проверку на основании ваших замечаний и примем меры. Простите за возможные неудобства.
20,Дмитрий,https://avatars.mds.yandex.net/get-yapic/40138/hkfIkMfqNJI8KZLzCqoKSbOWMCE-1/islands-68,2023-12-07 11:54:12,"Встретился с ситуацией, нужны выписки по счетам и вкладам за год. Оказалось, что у меня есть закрытые счета,но их не возможно взять за 2-4дня. Нужно оператору делать запрос у IP-отдела. Сроки по запросу неизвестны.",3,"Хотим разобраться в ситуации и помочь в решении вопроса. Для этого просим направить на наш адрес SMedia@vtb.ru ваши ФИО и дату рождения, а также подробное описание ситуации, с которой вы столкнулись. В теме письма необходимо указать «Яндекс, Москва, Измайловский бульвар, 46, 07.12.23»."
21,Костя.,https://avatars.mds.yandex.net/get-yapic/63032/enc-dc74454b084c24a3908bf3507137d428b191085db93c99772869662a19b68d9f/islands-68,2023-05-23 05:04:42,"В банке не умеют делать базовых операций. Для перевода со счета физлица на счет юрлица в том же ВТБ потребовалось два дня и часов 5 чистого времени. «Специалисты» не знают тарифов - то бесплатно, то не бесплатно и не умеют проводить базовую операцию в системе - потребовалась техподдержка для перевода со счета на счет. Как только столкнулись с проблемой своего незнания, тут же включили совковый подход, называя клиента «проблемным», «сложным» и стандартное «ну что вы хотите». Говорили, что решение проблемы с переводом в их же системе займет до 3 рабочих дней, отправили скриншот из своей же системы в техподдержку, не хотели решать свою же проблему с деньгами клиента, а хотели его отправить подальше.",1,"Костя, спасибо за отзыв. Обязательно проведем проверку в данном отделении на основание ваших замечаний и примем меры, которые позволят оперативно решать вопросы клиентов."
22,Оля Когай,https://avatars.mds.yandex.net/get-yapic/45566/XW3xZwtr7ZNGV5wRIktOSNeKSk-1/islands-68,2023-05-29 15:26:07,"Открывала тут карту! Всё объяснили, разъяснили спокойно, с пониманием. Обслуживанием осталась довольна. Компетенция сотрудников порадовала! Рекомендую, однозначно!",5,"Благодарим за такой приятный отклик. Нам очень важно, чтобы вы были довольны обслуживанием! Приезжайте ещё 💛"
23,Антон Карташов,https://avatars.mds.yandex.net/get-yapic/43978/6KRtdd5COJxT5xgqdrvIVKnAGs-1/islands-68,2023-12-01 17:54:15,"Одобряется кредит, Пишут-приходите в офис, предварительно одобрен. 
Приходишь в офис, никаких дополнительных документов не требуют и - отказ. Зачем гонять в офис, не понятно. 
Отзыв к банку вообще, не к конкретному отделению в частности. Но отказ был в этом отделении.",3,"Сожалеем, что если вы не смогли оформить интересующий вас кредитный продукт.
Позвольте пояснить, что каждую заявку на кредитный продукт Банк рассматривает индивидуально. Он имеет право запросить дополнительные документы, изменить условия или отказать в предоставлении кредита до момента подписания договора. Прокомментировать кредитную политику Банка, увы, не представляется возможным.

Приносим извинения за возможные неудобства."
24,ЛЕЙЛА Ц,https://avatars.mds.yandex.net/get-yapic/44850/cqPsdWibrUWAgYf7bmXKqiDNcxE-1/islands-68,2023-11-21 12:03:53,"Пришлось приходить несколько раз …никак не получалось добиться нужных документов от сотрудников !(для подачи заявления на детские пособия)Потратили время и нервы !В итоге в другом отделении получили то,что нужно .",4,"Сожалеем, что возникла подобная ситуация. Мы всегда стремимся быть лучше, поэтому надеемся, что в дальнейшем ваш опыт взаимодействия с ВТБ будет исключительно положительным."
25,Vladimir Shatsky,https://avatars.mds.yandex.net/get-yapic/40138/5fLYT89JL0yoWqQiOrgfCwdYpeo-1/islands-68,2024-03-10 13:18:35,"Получал карту. С точки зрения выдачи вежливости вопросов нет. Но даже на мой вопрос рассказать условия по карте менеджер проигнорировал, я же сам за ней пришёл, значит наверное должен знать.",3,"Нам жаль, если при обращении в офис Банка сотрудники не смогли предоставить вам качественное обслуживание. Обязательно проведем работу над повышением качества предоставления услуг!"
26,Сергей Д,,2024-03-31 10:50:40,Работает и в выходные дни. Все вопросы решили. О дополнительных возможностях рассказали. Спасибо Юлии Михайловне из Привилегии.,5,"Для нас очень важно, чтобы наша работа приносила вам только приятные впечатления. Постараемся и дальше вас радовать! Отдельное спасибо, что отметили работу конкретного сотрудника 👍"
