,name,icon_href,date,text,stars,answer
48,М Г,,2023-01-14 20:49:27,"Моего мужа мобилизовали, он подключил перед отъездом на мой телефон клон приложения и сделал дубликат карты. У нас кредит в этом банке. Спустя 2 месяца после его отъезда у меня слетело приложение, восстановить не получается, так как нужно подтверждение смс, у него там связи мобильной Российской нет, но есть ватцап, может набрать по видео связи, у меня есть Генеральная доверенность в которой прописано, что я могу пользоваться всем его имуществом, банковскими счетами и т.д. обратилась в банк за помощью, что бы восстановить приложение, оказалось это невозможно сделать, так как в доверенности не прописано, что я могу поменять номер телефона и отправили на горячую линию, один сказал, что можно изменить в банке(на что сотрудники банка сказали, что сотрудник горячей линии не компетентен), зачем интересно меня тогда отправили на горячую линию??? второй сотрудник горячей линии предложил мужу позвонить из-за границы, с другого номера так как его номер там не работает) и тогда мне помогут... Получается, если позвонит левый человек и представится мужем, то помогут, а если я прихожу с доверенностью, с паспортом и под камерой прошу помочь восстановить приложение, мне отказывают. Я пришла с картой, знаю пароль, могу снимать деньги и тратить деньги..., Так же на мой телефон приходят уведомления по операциям произведенным с данной картой, но не могу зайти в приложение, так как не прописано в доверенности, что можно изменить номер. Просила пригласить юриста, что бы он посмотрел доверенность, юриста нет, представителей службы безопасности нет... всех сократили... все в Москве...",3,"Если клиент не может к нам позвонить, изменить доверенный номер телефона вы можете в офисе банка по доверенности, в которой прописаны конкретные полномочия.
Дополнительно нужно предоставить подтверждающий документ – оригинал или нотариально удостоверенную копию договора об оказании услуг связи между клиентом и оператором сотовой связи, в котором указан новый доверенный номер телефона клиента."
49,Евгения Гордеева,https://avatars.mds.yandex.net/get-yapic/28439/LkggLRO3RDSjRCZCgZe3MqRBWg-1/islands-68,2023-03-12 12:48:20,"Я пользователь банкоматами этого офиса! Удобно, доступно в любое время! В банке ВТБ всегда хороший персонал и внимательное отношение к клиентам!",5,"Благодарим. Нам очень важно, чтобы каждый клиент оставался доволен 😃"
50,Яна Байкова,,2024-03-30 11:29:13,"Очередь большая и пришлось ждать более часа , в помещении жарко , сотрудник не компетентен.",2,"Благодарим вас за обратную связь.

Ваши замечания незамедлительно направим ответственным руководителям с целью улучшения клиентского сервиса и реализации мер, которые обязательно будут направлены на повышение качества предоставляемых услуг.

Приносим извинения за доставленные неудобства!"
51,Елена Кузнецова,https://avatars.mds.yandex.net/get-yapic/30431/ZTTwKrnd3iTZxytIIcaMkt96s-1/islands-68,2023-08-06 17:52:02,"Сотрудники не компетентные, пришла в отделение погасить ипотеку, сотрудник банка спросила есть ли у меня приложение ,я сказа , что есть,еследуюшее меня поразило,ну тогда подавайте заявление дала калькулятор и сказала посчитать остаток по ипотеки и потреб. кредиту сложить общую сумму. Для чего тогда нужны сотрудники?",1,"Елена, сожалеем, что обслуживание в нашем офисе доставило вам неудобства. Мы обязательно организуем встречу с руководителем и сотрудниками, на которой обсудим вопросы повышения качества обслуживания клиентов. Примите, пожалуйста, наши извинения, исправимся 👌
Позвольте отметить, что заявление на погашение действительно можно составить в личном кабинете ВТБ Онлайн. Реализовали такую опцию для экономии вашего времени.
Мы также всегда на связи и готовы помочь в любом из наших каналов обслуживания: vtb.ru/about/contacts/"
52,Алексей Братаныч,,2022-10-24 13:59:15,"Чисто, солидно, тишина и порядок, нарушаемый только вызовами электронной очереди. Несмотря на большое количество посетителей, менеджеры работают споро и очередь движется быстро. Мою проблему решили моментально, менеджер вежливо предложил доп услуги, от которых я вежливо отказался, никакой назойливости и мозгоклюйного навязывания, как у некоторых других. Всё чинно, спокойно, по деловому. 
Банк таким и должен быть.",5,Довольные клиенты - наша лучшая награда. Благодарим за высокую оценку нашей работы.
53,fat.hd@yandex.ru,,2023-11-11 06:43:12,"Хороший банк. Сотрудники внимательные, доброжелательные.",5,"Спасибо, мы стараемся! Приятно, что вы это оценили 😊"
54,наталья кошелева,,2023-08-28 16:37:06,"Очень понравился, грамотные сотрудники, помогли решить все вопросы которые в другом филиале этого же банка так и не решили. Большое спасибо!",5,Спасибо. Ваш положительный отзыв – наша лучшая награда 😊
55,Алексей ы,,2023-05-25 13:13:17,Отвратительная контора. 2 недели не могу получить деньги по наследству. На руках все документы (в том числе от нотариуса). В других банках делается долго - около часа. Но здесь целых две недели проверяют 2 бумажки! Крайне отвратительное обслуживание!,1,"Хотим разобраться в ситуации и помочь в решении вопроса. Для этого просим направить на наш адрес SMedia@vtb.ru ваши ФИО и дату рождения, а также подробное описание ситуации, с которой вы столкнулись. В теме письма необходимо указать «Яндекс, Краснодар, улица Гоголя, 68, 25.05.23»."
56,Марина Ц,,2023-09-15 07:11:59,Безответственные и брезгливые сотрудники и банк. Надо отзывать рецензию срочно и жаловаться в центра банк. Особенно Кузнецова Елена с Краснодара. Займетесь сотрудниками или потеряете клиентов,1,"Будем благодарны, если расскажете подробнее, с какой ситуацией пришлось столкнуться при обращении в офис. Не оставим без внимания и во всем разберёмся 👌"
57,Евгений Богданов,,2024-01-03 08:09:16,"Персонал приветливый, обслуживание хорошее.",4,"Рады, что вы остались довольны после посещения офиса 💛"
58,Mila Koval,https://avatars.mds.yandex.net/get-yapic/61207/eZ4qGTU0ZZx19t3wPni77QDeNlM-1/islands-68,2023-06-14 17:33:25,"Ужасный банк.Заказала для себя дебетовую карту.Пришло уведомление на получение.Я прождала почти 20 минут и столько же мне ее дооформлями.Потратила весь обед.Работники праздно шатаются, терминал не работает.Очень пожалела, что пошла туда.",3,"Поверьте, мы всегда стремимся быть лучше. Обязательно обсудим с руководителем офиса все детали, описанные в отзыве, и учтем ваши замечания. Примите, пожалуйста, наши извинения."
59,виктория Савица,,2024-03-15 12:01:31,"Приветливые сотрудники банка, всегда помогут в любом вопросе",5,"Спасибо за положительный отзыв, нам очень приятно 👍"
60,Алексей Соболев,https://avatars.mds.yandex.net/get-yapic/63032/9MEXkgQo7nafhuwZHgIBrmSjdY-1/islands-68,2023-05-04 05:58:19,"Был тут при передаче денег за недвижку. Попросили посчитать и проверить ещё сумму (которую имели с собой) на машинке в кассе. Всё за бабки!🤦🏽‍♂️ Да ещё и просят 1500₽ за это.🤪 Народу было полно, но наша операция быстро подошла. Парковка напротив платная. Мест почти нет.",3,Благодарим вас за отзыв. Обратная связь нам помогает понять наши проблемы и принять меры для улучшения сервиса и обслуживания.
61,Лариса Ресьян,https://avatars.mds.yandex.net/get-yapic/68143/zeBFn5uYRNpPIMg5yE7lPTHCTE8-1/islands-68,2022-12-08 16:11:52,"Очень хорошее отделение банка ВТБ. Конечно случаются и очереди. Но ожидание в пределах нормы, потому что работает много окон. Обслуживание очень хорошее. Отношение к клиентам доброжелательное. Вообщем рекомендую. К стати сказать не в каждом отделении этого банка так относятся к своим клиентам.",5,"Благодарим за положительный отзыв работы. Рады, что вы остались довольны 🙂"
62,Кирилл Касьянов,https://avatars.mds.yandex.net/get-yapic/51169/Yg5T1o7quSwcA4sVzZ8gzpYU21I-1/islands-68,2022-07-13 15:49:18,"Отличное расположение офиса Банка ВТБ, в пешей доступности от центральной улицы города, а также транспортных линий общественного транспорта. Удобная электронная очередь, если не в пиковые часы, то всегда можно быстро получить обслуживание.) Сам Банк по многим сервисам обходит ближайших конкурентов. Рекомендую.",5,
63,Башкиров Евгений,https://avatars.mds.yandex.net/get-yapic/15298/enc-9e4586f77401d1b8dbf2fef4f1ad17e25226a10ec27f07ed9545fd14a72a893f/islands-68,2024-01-28 12:13:40,Очень приятный и профессиональный персонал.,5,"Так приятно, что вы поставили нам высокую оценку и отметили работу сотрудника 👍"
64,Анна Л.,,2022-10-18 10:03:04,"Очень большая очередь, все очень долго и медленно. Не работает электронная очередь, нельзя взять талон. Из 15 окон работает 5, при этом полный зал людей. 
Так и не дождалась никого, ушла ни с чем, на выдаче талонов развели руками, очевидно что сотрудникам все равно как работает банк. Не хотелось бы пользоваться их услугами из-за такого отношения.",1,"Сожалеем, что вынуждены были потратить ваше личное время на ожидание в очереди. Обсудим с руководителем данную ситуацию и примем меры, которые позволят сократить длительное время ожидания. Примите наши извинения."
65,Starix,https://avatars.mds.yandex.net/get-yapic/29310/I1olXqGX5TKkvE3I4lXaIUcWA-1/islands-68,2023-09-11 12:15:00,"Хорошие специалисты которые решают вопрос не гоняя по окнам, а перенося сами документы, ожидание не долго по сравнению с отделение на Красной.",5,"Благодарим за положительный отзыв работы. Рады, что вы остались довольны 🙂"
66,Юлия,https://avatars.mds.yandex.net/get-yapic/24700/enc-cf84e2e7360c93d75369b79ef8937e43/islands-68,2022-09-05 07:29:32,"Судьба заставила стать клиентом банка, за месяц несколько посещений в разное время и дни, каждый раз не менее часа… и не сказать что очереди большие, нет, просто из 14 окон работает 2-3!!! Женщины с потухших взглядом (конкретно замученные) еле шевелятся. Сегодня, чтобы снять остаток денег со счете этого чудо банка провели в ожидании 55 минут! Галина Куколева (или как-то так) в 7 окне за это время приняла 2 человек, один из них я. Сказать, что сдают нервы, не сказать ничего! Кто тут пишет что всё прекрасно… не палитесь так явно с заказными отзывами. Банку - схлопнуться побыстрее и освободить крепостных, с таким подходом лучше с людьми не работать. Думал хуже Сбербанка нет, но всё позналось в сравнении.",1,"Благодарим, что нашли время поделиться вашим впечатлением об обслуживании в Банке. Мы не оставим этот отзыв без внимания и примем необходимые меры, которые позволят сократить время ожидания и обслуживания. Обсудим с руководителем возможность увеличения штата сотрудников. Приносим извинения за неудобства и надеемся на дальнейшее сотрудничество."
67,Алексей Белоусов,,2023-11-24 00:50:31,"Даже,если все окна с операторами,обслуживание клиентов происходит крайне медленно.",3,"Понимаем, что при обращении в Банк клиент ожидает получить оперативное и профессиональное решение имеющихся вопросов. Обратная связь помогает понять, над чем нам необходимо работать особенно усердно. Обязательно передадим руководству офиса этот отзыв для проверки и принятия необходимых мер.
Примите, пожалуйста, наши извинения за неудобства. Надеемся, что при следующих посещениях не заставим вас долго ждать."
68,Инкогнито 9883,,2023-09-26 13:53:49,"Всем добрый день! Хочу оставить отзыв о ""БЕССОНОВОЙ АЛИНЕ СЕРГЕЕВНЕ "". Крайне не компетентный, безответственный, халатный менеджер по ипотечному кредитованию и надменный!
02.09.2023 года, состоялась сделка по договору купле-продажи недвижимости ипотечного кредитования с заявлением в ПФР об использовании материнского капитала. Сделка состоялась, но есть одно НО! Спустя 12 раб. календарных дней, пытался узнать статус заявления о перечислении мат. капитала на гос. услугах, но никакой информации там не было. Решил позвонить менеджеру Алине, но как оказалось она ушла в отпуск и даже не соизволила об этом сообщить, а более того, не отвечала на звонки и смс . Находясь в подвешенном состоянии, решил поехать лично в банк ВТБ для выяснения своей ситуации. К моему удивлению, я встретил нашего менеджера Алину на своём рабочем месте . На мой вопрос, почему до сих пор нет никакого ответа от ПФР, а это уже было 19 сентября , по заявлению на использование мат. капитала, она ответила, что была в отпуске и вернулась только вчера. И в свое оправдание она пыталась донести, что в ее отсутствие никто не имел доступа к ее делам. Конечно же это полнейший бред, который она несла от безысходности, чтобы хоть как-то оправдать свою безответственность! 
Я не стал создавать конфликт, попросил вежливо позвать заведующего отделением по ипотечному кредитованию , на что она резко ответила , что все сделает и исправит ситуацию. Я дал ей время до 25 сентября ! Она убедительно сказала, что поняла меня, на этом встреча закончилась . 

25.09.2023 г. я звоню Алине и жду от неё положительной информации , но в ответ слышу , что заявление на рассмотрении и она ничего не может поделать . Снова вскормила обещанием позвонить в ПФР и перезвонить мне !

26.09.2023 г. не дождавшись ее звонка, я решительно еду снова в банк ВТБ, чтобы разрешить свою уже критичную ситуацию! Зайдя в офис , я сразу попросил встречу с руководителем отделения , к нам подошла Наталья Сонина, я ей объяснил, что из-за халатности ее сотрудницы мы находимся в очень неприятной ситуации : мы не уложились в сроки , нас выселяют, с 3-х летним ребёнком , через несколько дней со съемной квартиры , а продавец вовсе не собирается отдавать ключи от нашей купленной квартиры , даже намекает на отмену сделки , потому что часть денег ещё не поступила ему ! Наталья извинилась и сказала что посодействует нам в разрешении данной проблемы ! 
Руководитель извинился , а менеджер НЕТ )) Примите к сведению ! 

Что хочу сказать , из-за таких работников , серьезной организации , как Алина Бессонова , мы получаем кучу проблем и не получаем даже извинений ! Отдельная просьба руководителю , тщательно подбирать персонал ! Мы очень недовольны работой банка и если дело дойдёт, мы будем судиться!!!

PS: не вздумайте вести дела с данным сотрудником банка🙏",1,"Спасибо, что поделились с нами вашим опытом обслуживания. Мы обязательно учтем и проработаем ваши замечания, чтобы в дальнейшем у вас не возникало сомнений в правильности выбора нашего Банка.
Приносим извинения за доставленные неудобства."
69,A. A.,,2022-09-11 22:53:26,"С порога начинают отправлять домой, даже не вникнув в вопрос. Аж 3 сотрудника подряд не постеснялись сказать напрямую о том, что у них час времени до закрытия и мы не успеем. Ни о какой клиентоориентированности не может быть и речи. После долгих разбирательств всё-таки дали комментарии по вопросу. Информация у сотрудников банка отличается от информации на горячей линии. При указании на это одна из менеджеров в окне предложила передать ""привет"" горячей линии. На мой взгляд это худшее отделение ВТБ в Краснодаре. В других отделениях встречался более приветливый и компетентный персонал.",1,"Благодарим за сигнал. Согласимся, что такая ситуация недопустима. Организуем встречу с руководителем офиса и проведем проверку. Надеемся, что в дальнейшем обслуживание будет соответствовать вашим ожиданиям."
