,name,icon_href,date,text,stars,answer
0,Георг Г,,2023-12-21 23:34:35,"Немного не удобно в плане парковки, нужно оставлять машину у СК Олимп и пешочком прогутятся к офису. 
Сам офис просторный, главная по залу встретит, спросит, поможет с талончиком и направит в свободное кресло посидеть подождать...)) 
Работники приятные, доброжелательные, свое дело знают!)) 
Рекомендую!))",5,"Спасибо за отзыв. Мы любим и ценим наших клиентов, поэтому стремимся предоставлять им высококачественное обслуживание. Рады, что вы оценили это 😃"
1,Александр Козлов,https://avatars.mds.yandex.net/get-yapic/38663/kCjnBTZF5rjAVUqt5sUhC2yARzE-1/islands-68,2023-11-10 13:03:49,"Хорошее отделение, коллектив приветлив, понимаешь и готов помочь во многих вопросах. Всё вопросы и просьбы были легко решены. Молодцы ребята и девченки, так держать.",5,"Александр, благодарим за положительный отзыв о нашей работе 🙂"
2,Светлана Светлана,,2024-02-03 07:53:03,"НЕ СВЯЗЫВАЙТЕСЬ С ВТБ!!!! Проверяйте ежедневно! свои деньги на счету! 1.02.24 зачислили деньги на карту (есть чек),а утром на сл.день деньги исчезли! На гор.линии сами недоумевают как это могло случиться… и каждые 2 часа обещают, что они через 2 ч. поступят на счет. Сотрудник Пиндаленкова В.А. НЕКОМПЕТЕНТНА! По каждому вопросу почему-то звонила по внутренней связи. В итоге для составления платежного поручения, запросили кроме паспорта, еще какой-нибудь второй документ, хотя я являюсь клиентом этого банка и все данные у нее есть. На вопрос на каком основании отправили за вторым документом, не смогла толком ответить, ссылаясь, что это их внутренние «законы» и клиентам не имеют права предъявлять. Вышел ей в помощь Осипов С.Г. - директор по работе с клиентами, защищая своего сотрудника, также говорит, что нужно два документа, распоряжения не предоставил, лишь сказал, что вы можете его запросить и вам пришлют…На гор. линии никто не знает о таком внутреннем регламенте. Отвратительный банк! Работают, чтобы впарить кредит!!!Тогда они приветливы!!!",1,"Искренне огорчены, что вам пришлось столкнуться с трудностями при обслуживании.

Если ваш вопрос еще актуален, просим направить на наш адрес SMedia@vtb.ru ваши ФИО и дату рождения. В теме письма необходимо указать «Яндекс, Люберцы, Смирновская улица, 2, 03.02.24»."
3,Надежда Р.,https://avatars.mds.yandex.net/get-yapic/20706/enc-2238312d01c687ac050690b240dd58ff874d4fb0b869923f5ac9fd247e8a816c/islands-68,2023-12-16 18:25:02,"Уже больше месяца я не могу закрыть в ВТБ лицевой счёт. 13 ноября 2023 г я обратилась в отделение г. Дзержинский МО с просьбой закрыть карту и счёт, которыми я ни разу не пользовалась. Сначала приняли заявление на закрытие карты, не ранее чем через 2 недели можно прийти и закрыть счёт. Пришла через три недели, и дальше что то пошло не так. Я уже три раза приходила в отделение в г. Люберцы МО на ул Смирновской. Каждый раз оператор понимает, что счёт закрыть мне не может и надо писать в техподдержку, так как карта закрыта, но не закрыта и счёт закрыть не получается. Они честно пишут, обещают перезвонить и ничего, ни звонков ни результата. В этом банке хоть кто нибудь умеет работать? Я хочу закрыть счёт. И постараюсь больше никогда не иметь ничего общего с ВТБ, банком у которого нет грамотных программистов. В какое отделение надо обращаться? Кто то же должен уметь закрывать счета? С ужасом прочитала что кто то уже год на это потратил. Становится страшно.",1,"Хотим разобраться в ситуации и помочь в решении вопроса. Для этого просим направить на наш адрес SMedia@vtb.ru ваши ФИО и дату рождения. В теме письма необходимо указать «Яндекс, Люберцы, Смирновская улица, 2, 16.12.23»."
4,Маргарита Дудинова,https://avatars.mds.yandex.net/get-yapic/54535/szJq1um9M1j7M0NPlQcYIsrOS4M-1/islands-68,2024-03-11 13:44:50,"Быстрое обслуживание, приветливый персонал всегда может помочь стареньким людям с оплатой ЖКХ, для детей есть раскраски и карандаши, вода и стаканчики для посетителей всегда есть.",5,"Благодарим за отзыв! Рады, что вы остались довольны. Мы всегда стараемся по максимуму удовлетворить потребности наших клиентов и создать для них комфортные условия обслуживания. Приходите ещё!"
5,Наталья,https://avatars.mds.yandex.net/get-yapic/6218514/v1i1UqX7JxQ7ZWzu27RTokUBzA-1/islands-68,2024-03-09 18:32:54,"Хороший банк не большой ,находится относительно не далеко от станции Люберцы,примерно около 1 км .Быстрое и качественное обслуживание квалифицированных специалистов банка ВТБ.",5,"Спасибо за положительный отзыв, нам очень приятно 👍"
6,Екатерина Денисова,,2024-03-21 18:34:02,"Впервые в жизни пришла в отделение ВТБ 16.03.2024г., чтобы помочь маме 75 лет оформить пенсионные выплаты в банк ВТБ. Мы просидели в очереди больше часа, я решила снять на телефон многочисленное количество ожидающих клиентов и только 4 работающих сотрудника банка. 
На меня тут же ""налетела"" сотрудница банка, начала угрожать, что вызовет полицию и мне грозит 1,5 года лишения свободы за съемки в общественном месте. 
Вот такого хамства и угроз я не ожидала",1,"Благодарим вас за отзыв. Нам очень важно знать ваше мнение. Мы всегда стремимся к тому, чтобы быть лучше. Проведем работу в целях улучшения качества обслуживания."
7,Людмила,,2023-02-14 15:17:21,"Недавно посетила офис банка ВТБ и была приятно удивлена очень доброжелательным , внимательным обслуживанием. Работники банка очень профессионально помогают каждому клиенту. Ждать практически не пришлось. На все вопросы отвечают терпеливо-доходчиво, такое впечатление, что ты у неё первая и последняя. Спасибо большое Савельевой Ольге Сергеевне за её профессионализм. Не теряйте то, что уже наработали.",5,"Людмила, для нас очень важно, чтобы наша работа приносила вам только приятные впечатления. Постараемся и дальше вас радовать! Отдельное спасибо, что отметили работу конкретного сотрудника."
8,Татьяна Костенюк,,2024-03-12 08:32:05,"Удобно расположен,внутри чисто,сотрудники,с кем пришлось пообщаться,вежливы и смогли помочь по все вопросам.",5,"Спасибо за положительный отзыв, нам очень приятно 👍"
9,Стася Млечная,,2023-12-05 09:59:50,"02.12 была в отделении г Люберцы . Меняла номер телефона . Менеджер Киндаленкова Виктория Александровна , предложила оформить кредитную карту. Условия оказались и правда хорошие. Буду пользоваться.",5,Спасибо за приятный отзыв. Довольные клиенты - наша лучшая награда 👍
10,926107 Дюдюн,https://avatars.mds.yandex.net/get-yapic/40841/qyEv7KUrQ1ONajGoTuduvrttG4-1/islands-68,2024-04-07 07:05:18,"Чисто, удобно расположен. Пользуюсь не часто. Система по талонам отлажена и очередь мало вероятна. Рекомендую",4,"Спасибо за положительный отзыв! Поверьте, мы это очень ценим 💙. Надеемся, что в дальнейшем вы оцените нас на 5."
11,Irina Irina,,2023-12-25 13:28:38,"Сегодня была в отделение. 
Отличные сотрудники. Отдельно выделить менеджера Анастасию ( стажер) , фамилию к сожалению не спросила. И девушку администратора, которая встречает и распределяет. Спасибо за Вашу работу.",5,"Так приятно, что вы поставили нам высокую оценку и отметили работу сотрудника 👍"
12,Rina Kova,,2023-08-02 05:43:20,"Отделение в г. Люберцы на Смирновской оч удобное большим количеством сотрудников, но вот компетенция, профессионализм отсутствие этики одной сотрудницы Вероники оставляют желать лучшего.Вероники(к сожалению забыла фамилию открыто хамское поведение, на мое замечание, и просьбу извениться, ответила, что вообще не собирается со мной разговаривать. Напортачила с доверенностью, заведомо зная, что оформляет ее не по регламенту ,пользуясь плохим зрением моего мужа(я расцениваю это как издевку с ее сторонвы) тогда напрашивается вопрос!? Это было с ее стороны халатность, или престуаное вредительство и почему допускают к работе с людьми таких не компетентнвых сотрудников. 
Хочу выразить благодарность специалисту по работе с премиум клиентами, которая обещала провести 
корпаративную беседу о этике в работе с клиентами.",2,"Сожалеем, что обслуживание в нашем офисе доставило вам неудобства. Мы обязательно организуем встречу с руководителем и сотрудниками, на которой обсудим вопросы повышения качества, а также соблюдения стандартов клиентского обслуживания.

Примите наши искренние извинения. Сделаем все возможное, чтобы в дальнейшем опыт взаимодействия с ВТБ был только положительным!"
13,Виктор Стадников,https://avatars.mds.yandex.net/get-yapic/45848/enc-fd5a90bf39b1dcc705a4c47ebec925657c115b35200ac13c73771523e6073869/islands-68,2024-04-04 13:37:20,"Доступно, чисто, отзывчивый персонал. Решал вопрос с открытием счета - без проблем- быстро.",5,"Благодарим вас за отзыв. Так приятно, что вы поставили нам высокую оценку 👍"
14,ТЛ,https://avatars.mds.yandex.net/get-yapic/21377/enc-3bb782e4cc087d071bd4d8b4e9bf4f8b20d6fa4e581d699e083721a522e5e84f/islands-68,2023-12-29 18:22:58,"Очереди ужасные. При чем, если ест. Очередь, то держат в очередь за талонами. То есть их просто не выдают, говорят ждите и сколько ждать никто не знает, а люди толпятся, стоят и проклинают день, когда связались с банком😏",3,"Согласимся, вопрос очереди требует незамедлительного решения. Нам важно, чтобы каждый клиент мог решать вопросы без длительного ожидания. Дополнительно обратим внимание руководителя офиса на данную проблему и примем меры. Простите, пожалуйста, за неудобства."
15,Инкогнито 4751,,2023-09-12 09:44:15,"Отвратительный банк и ужасное обслуживание. Мама нарвалась на мошенников, и что вы думаете? *** направили ее в конкретный банк (по данному адресу). Оформили ей за 15 минут кредит 1.000.000руб + наличными, так ещё и карту. 

Сотрудник Соловьева Наталья признала, что видела потерянное состояние матери. Сказала один раз, а может это ***? (ОТКУДА МАТЕРИ ЗНАТЬ, *** ЭТО ИЛИ НЕТ). НО НИЧЕГО НЕ ПРЕДПРИНЯЛА совершенно!!! Не вызывала службу безопасности. 

Сегодня племянница пришла в банк и обещалась с данным сотрудником. Все документы по кредиту в личном кабинете, ЗАЙТИ В КОТОРЫЙ БЫЛО НЕВОЗМОЖНО из-за блокировки карты и счета… господи, что за сотрудники. 

У меня пару вопросов к вашему банку: 

- КАК ПРОШЛО БОЛЕЕ 13 транзакций?
- ПОЧЕМУ НЕ СРАБОТАЛА СЛУЖБА БЕЗОПАСНОСТИ И НЕ ЗАБЛОКИРОВАЛИ?
- ПОЧЕМУ СОТРУДНИК НЕ ПРЕКРАТИЛА ВЫДАЧУ КРЕДИТА? Если видела состояние матери? Позвала бы старших сотрудников.

Отказали естественно в пониженной ставке. Ужасный банк, ужасные сотрудники. Их не штрафовать надо, а увольнять!",1,"Сожалеем, если ваши близкие стали жертвой мошенников. Банк защищает данные и доступы к средствам клиентов, используя при этом самые современные инструменты для безопасности. Но если клиент передал денежные средства мошенниками самостоятельно, вопрос уже в компетенции правоохранительных органов, которым Банк оказывает максимальное содействие."
16,Анастасия Б.,https://avatars.mds.yandex.net/get-yapic/49368/FwnTSPHqLFRMfQZh0l3TGD924U-1/islands-68,2023-09-12 11:27:56,"2 недели назад моя родственница нарвалась на мошенников, на сумму более 1 млн. (Наличные + кредитная карта). 

*** направили её в этот банк, со словами «видите себя непринужденно». 

Кредит был оформлен в течение 15 минут. Работающему пенсионеру. 

Обслуживалась она у оператора Соловьевой Натальи Витальевне. Оператор «намекала», и спросила не *** ли это (при этом она подтвердила, что видела очень потерянное состояние моей родственницы). И не прекратила выдачу кредита. 

Далее, родственницу направили к конкретному банкомату этого же банка ВТБ. Было совершенно 15 переводов. И банк ни разу не остановил транзакцию как подозрительную. 

Пришли сегодня в банк, попали к этому же оператору, попросили пересчитать кредит, нам отправили в личный кабинет. С учетом того, что родственница пенсионер И НЕ РАЗБИРАЕТСЯ В ЛИЧНОМ КАБИНЕТЕ. И вообще в разных интернет ресурсах. 

Не дай бог вам попасть в эту ситуацию, это самый ужасный банк из всех. Сбербанк при попытке мошеннических действий - звонит! Тиньков блокирует переводы. А здесь что?! 

Все документы в электронном виде. Дали только эту несчастную бумажку. Обманутой пенсионерке.",1,"Благодарим за обратную связь. Обсудим с руководителем офиса ваши замечания и примем необходимые меры.
Сожалеем, что с вашими близкими произошла такая ситуация. Если они стали жертвой мошенников рекомендуем обратиться с соответствующим заявлением в правоохранительные органы. При поступлении документов от органов в Банк мы стараемся максимально ускорять принятие решения по подобным случаям."
17,Kris Pop,,2024-01-06 11:58:29,"Никаких очередей, приветливый персонал, помогли со всеми моими вопросами, до этого посетила около 5 банков, никакой конкретной информации не могла добиться",5,"Рады, что вы остались довольны после посещения офиса 💛"
18,Николай Райцев,https://avatars.mds.yandex.net/get-yapic/36777/wETNfeMbIfUQGOrbHuRzEFC3L4-1/islands-68,2024-01-22 13:30:31,"Удобное месторасположение . Профессиональный отзывчивый ,грамотный персонал",5,"Спасибо, что поделились своими впечатлениями. Мы очень ценим обратную связь 💛"
19,Alexey S.,https://avatars.mds.yandex.net/get-yapic/26057/w7c1rfpzioAbDOsPQV6p2RZ8oAQ-1/islands-68,2023-09-21 12:57:11,"Уже около года пытаюсь закрыть мастер счет в банке ВТБ в отделении Смирновская ул., 2, Люберцы. По всей видимости, там работают люди даже не с нулевой, а с отрицательной компетенцией, иначе это невозможно объяснить. Каждый раз у меня находят карту, которая не закрыта или закрыта не правильно, или не закрыт инвестиционный счет, который я тоже закрывал при снятии от туда всех средств. При этом в приложении на телефоне у меня все закрыто, а у банка в системе нет. Напрашивается два вывода, либо криворукие операционисты, либо программисты. В любом случае, сегодня, для меня этот квест с закрытием мастер счета продолжился.",1,"Хотим разобраться в ситуации и помочь в решении вопроса. Для этого просим направить на наш адрес SMedia@vtb.ru ваши ФИО и дату рождения, а также подробное описание ситуации, с которой вы столкнулись. В теме письма необходимо указать «Яндекс, Люберцы, Смирновская улица, 2, 21.09.23»."
20,Юлия Слащева,https://avatars.mds.yandex.net/get-yapic/49368/e4Lh6jjTfgkLX1NtQwP7XieJtc-1/islands-68,2024-01-25 14:53:56,"Не могут выдать выписку по счёту, привязанной к социальной карте москвича. Придумывают разные небылицы, отмазки, официальный отказ не дают. Из-за них не могу получить который месяц подряд пособия на детей. Буду писать в прокуратуру",2,"Хотим разобраться в ситуации. Для этого просим направить на наш адрес SMedia@vtb.ru ваши ФИО и дату рождения. В теме письма необходимо указать «Яндекс, Люберцы, Смирновская улица, 2, 25.01.24»."
21,Марина Кязимова,,2024-03-10 13:25:45,"Очень отзывчивые сотрудники, доброжелательные, всегда стараются решить вопрос, с которым обратились.",5,"Спасибо за положительный отзыв, нам очень приятно 👍"
22,Андрей Кондаков,,2023-10-20 20:54:02,"Грамотный персонал, с пониманием относятся к клиентам, особенно к возрастным. Молодёжь в онлайне, в банк идут пенсы, внимательно объясняют про личный кабинет, куда нажать и про остальные чудеса.",5,Довольные клиенты - наша лучшая награда 👍
23,Ирина,,2023-11-14 05:09:39,"В этом банке всегда всем помогут. Я часто обращаюсь то приложение обновить, то деньги снять, квартплату оплатить. Народу всегда много.Персонал отличный.Советую.",1,"Ирина, спасибо за отзыв. Будем надеяться, что в будущем сможем заслужить от вас более высокую оценку!"
