,name,icon_href,date,text,stars,answer
105,yuliyalihvan,,2022-02-21 08:24:37,"Ужасный банк,никому не советую брать ипотеку в нем,не дают полность досрочно погасить ипотеку,чё за бред???консультанты некомпитентны ,грубо разговаривают,зам.начальника отдела такая же,ничего не решает,заявления на погашение ипотеки не принимают,деньги на погашение не принимают,отказ письменный не дают,ссылаясь на то что у них нет отдела делопроизводства ,нервы потрепали хорошо мне,советую от чистого сердца обходить стороной этот ужасный банк.Причем когда я была у них на приеме,они даже не зашли в мои данные,(типо я к ним не приходила).это мне уже в другом отделении втб так сказали,потому что я к ним пришла а по базе как будто меня там не было,Тварят что хотят",1,"Хотим разобраться в Вашей ситуации. Для этого просим направить на наш адрес SMedia@vtb.ru ваши ФИО, дату рождения и подробности ситуации. В теме письма необходимо указать «Яндекс, Краснодар, Красноармейская улица, 43, 21.02.22»."
106,Алексей Игоревич,,2023-04-14 06:17:48,"Самый ужасный банк в России, долгий, постоянно ошибаются менеджеры. Сделка по ипотеки занимает 2-4 часа, ужас 😱😱",1,"Благодарим вас за отзыв. Поверьте, мы стремимся к тому, чтобы быть лучше. Обязательно проведем работу в целях улучшения качества и скорости обслуживания. Простите за неудобства."
107,Валерия Ж.,,2024-02-14 17:44:55,"Всё хорошо, вежливо",5,Спасибо большое за высокую оценку и вашу лояльность 😊
108,Сергей,,2021-12-01 06:21:34,"Решил взять здесь ипотеку и попал в ад.
По пунктам:
1) Некомпетентный менеджер Лиана, который в одном предложении говорит вещи друг друга взаимосключающие. После жалобы заменили на более вменяемого человека.
2) Анкета на кредит была взята от другого человека. Мои только ФИО в шапке, а вся остальная информация о месте работы, стаже, размере запрашиваемого кредита - не моя. На вопрос: как так вышло? Все просто пожимают плечами и говорят ""подписывайте"".
3) Оформлял страховку по ипотеке прям в здании банка за соседним столом от моего кредитного менеджера. Потом месяц ходил/звонил доказывал что не верблюд и что у меня есть страховка.
Банк настойчиво утверждал что я нигде не страховался.
4) Первый взнос по ипотеке взяли по ставке 10.2 как без страховки.
5) Все спорные вопросы решаются претензиями, претензии рассматриваются по 2 недели.
6) Просто так заблокировали мне личный кабинет как раз в момент когда мне надо было платить по ипотеке. На вопрос зачем???? Ответили: заблокировано по звонку третьих лиц. Кто эти третьи лица???
7) Просто так заблокировали мне две банковские карты, одну с причиной ""утеря"", другую с причиной ""съел банкомат"". Естественно с картами ничего не происходило, они были и есть у меня на руках.
8) Просил выпустить карту МИР. Выпустили карту с надписью МИР, но предупредили что ошиблись и на самом деле она не МИР, на ней только надпись по факту такая, социальные выплаты по ней получать нет возможности.
9) Теперь каждую неделю встречаюсь с сотрудниками банка, в отделении, чтобы вместе решать какие-то мои проблемы по блокировкам, страховкам и прочему. Проблемы, которые они сами же мне и создают.

А теперь подумайте, нужна ли вам ТАКАЯ ИПОТЕКА?

ВТБ, а вы сами как оцениваете качество вашего обслуживания?",1,
109,Николай Разумейченко,https://avatars.mds.yandex.net/get-yapic/69015/f8gNHv5qvAT6GiK3zYPI7LFpgc-1/islands-68,2023-03-19 17:49:07,"""Мне очень нравится"" график работы специалиста по исполнительным производствам. Этот банк вообще для людей?",1,Спасибо за отзыв! Приняли во внимание.
110,Александр Петрушин,https://avatars.mds.yandex.net/get-yapic/24700/enc-3fd31aeaebe0000e786412e54af5ea88d4782c86ba8d7be3dfc7af67d479cd1d/islands-68,2023-06-10 13:31:28,Худший банк из существующих. Не умеют в 21м веке закрывать счета без личного написания заявления в отделение.,1,"Здравствуйте, Александр!
Сожалеем, что действующие процедуры Банка доставили вам неудобства. Поверьте, мы всегда стремимся быть лучше, поэтому надеемся, что в будущем ещё будут возможности продемонстрировать наши положительные изменения."
111,Елена Z,,2022-01-03 12:20:24,"Большой офис. Много операторов,но время ожидания так же как и везде,много банкоматов. На входе можно уточнить у персонала куда обратиться и по какому вопросу. Удобное расположение офиса возле Кооперативного рынка. Вообще мне нравится этот банк.",5,
112,Юлия Е.,https://avatars.mds.yandex.net/get-yapic/37154/iE3Xk8lH8VtkaYgsLPS3lYVeAI8-1/islands-68,2023-06-01 17:13:43,"Сотрудник вроде бы Валерия все четко объяснила, помогла во всем",5,"Юлия, так приятно, что вы поставили нам высокую оценку и отметили работу сотрудника!"
113,Николай Куркин,,2022-07-06 19:50:51,"Увеличили проценты по кредитам после уменьшения ключ ставки клиенту с идеальной кредит историей до 25.9%. Снизили вклады до 7%. Отменили перевод мультибонусов себе на карту, у мультибонусов поменяли эквивалет, теперь он не равен рублю. А еще, чтобы получить сертификат за подорожавшие мультибонусы, надо заплатить за его доставку до города получателя!!!)))",1,
114,Елена Романова,,2021-10-24 08:35:59,"Не рекомендую, очень все вежливые, но с улыбкой на лице спокойно обманывают, договор обсуждался не один раз, по факту - приехали с другого города - договор совсем другой - читайте что Вам подсовывают на подпись, итог поездки неделя собрания документов, потеря времени и денег, (затрата на бензин, перекус, потеря рабочего дня - это тоже деньги фирмы и моя зарплата, обращались за рефинансированием",1,
115,corp-abraudiurso04581,,2022-03-09 14:55:37,Отвратительно работает банк и его сотрудники. Сотрудники не знают куда направить клиента!!! Банкомат не принимает деньги ни один из шести!!! В кассе не принимают деньги без карты!!! Сотрудников не хватает. 2 часа стоял в очереди что бы получить консультацию. Управляющая ничем не помогла!!! Отвратительный банк и филиал на Горького!!!,1,
116,Сергей Литвинов,https://avatars.mds.yandex.net/get-yapic/35885/s7cIPaDEB25PPn8D8YViTV7fnLU-1570539126/islands-68,2022-09-06 17:03:12,"Много народу, приходится ждать! Ждать очень долго! Установили 33 стола, а работают с людьми, реально ТРИ человека! А где остальные!!!!! Ждали полтора часа, а отфутболили за две минуты! Жесть!!!! Тружиники, мать вашу!",4,"Мы сожалеем, что обслуживание в нашем офисе доставило вам неудобства. Мы обязательно проведем проверку ситуации из вашего отзыва и организуем встречу с руководителем офиса и сотрудниками, на которой обсудим вопросы повышения качества обслуживания клиентов. Примите наши извинения за доставленные неудобства, исправимся 👌"
117,Константин М,https://avatars.mds.yandex.net/get-yapic/48449/pd11jyAlhI3dZnj6uaCO1hMecy0-1/islands-68,2022-02-23 06:31:17,"Быстрое и внимательное обслуживание. Электронная очередь, время ожидания среднее в зависимости от времени посещения. Персонал внимательный, не навязчивый.",5,"Благодарим за положительный отзыв, нам очень приятно 👍"
118,олег найденко,https://avatars.mds.yandex.net/get-yapic/36777/Pph4xctFqasW6oQWf5mohonM-1/islands-68,2021-12-09 12:42:20,"Недоволен работой отделения и банка в целом. Прождал более 40 минут в очереди, потом сотрудница выдала карту, которая оказалась неактивированной.В дальнейшем пришлось идти самому и активировать карту, но на этом проблемы не закончились. При регистрации в системе ВТБ Он-лайн, оказалось, что мой номер не внесен в систему безопасности, хотя на него исправно приходят сообщения. Позвонил на горячую линию, мне ничего не смогли решить и сказали снова обратиться в филиал Банка.",1,
119,Галина С.,https://avatars.mds.yandex.net/get-yapic/57243/NsYDvtUmxgc6aLgyuRUKVFHENI-1/islands-68,2022-05-20 07:20:02,"Быстрое качественное обслуживание, вежливый персонал, огромное количество банкоматов.",5,
120,Татьяна Д.,https://avatars.mds.yandex.net/get-yapic/56823/enc-f83f94e154f0715465c3ca658df5df392a1e9ab59b69d20a50852eff6d78190a/islands-68,2021-04-09 09:12:05,"Вежливый персонал, менеджер по ипотеке Коротков Владислав помогает во всех вопросах в любое время всегда перезванивает интересуется. Так же в банке предоставили оценку и оформление договора спасибо большое ! все делается в течении дня. Цены разумные. И ни каких сложностей в заказе. Мне очень понравилось справились без агенств . г.Краснодар, ул. Гоголя 68",5,
121,Алексей Канищев,https://avatars.mds.yandex.net/get-yapic/61207/nZGnRMCGp6Z08gcE7CflDtGIzag-1/islands-68,2023-11-25 16:39:51,Грамотные специалисты,5,"Благодарим вас за отзыв. Мы всегда стремимся предоставлять нашим клиентам качественное обслуживание и рады, что вы оценили это 😊"
122,ТУРИСТ004,https://avatars.mds.yandex.net/get-yapic/63032/InvCKAbOjDPagKAueSN99Ssvc-1/islands-68,2022-07-01 01:30:18,"Ведущий банк России, всё Ok. Приветливый и вежливый персонал рассказывают и объясняют.",5,
123,Екатерина,,2022-08-06 10:16:08,Все очень медленно. Нет уборной для клиентов в Головном офисе. Около 40 минут выдавали зарплатную карту. Вообщем....ходите в туалет дома)))),3,"Сожалеем, что вынуждены были потратить ваше личное время на ожидание в очереди. Обсудим с руководителем данную ситуацию и примем меры, которые позволят сократить длительное время ожидания и повысить комфортность в офисе."
124,Ivan ------,,2022-05-22 03:25:45,"Самый ужасный банк вводит в заблуждение клиентов, обманывает и не даёт ни какой информации и не оказывает помощь при обращении на горячую линию. Можно карту создать в личном кабинете, но отказаться от неё только в отделении банка. Обсурд.",1,
125,Николай М.,,2021-08-25 10:42:21,"Сегодня подписали кредитный договор по квартире. Сделку сопровождал менеджер Медведев Павел. Понравилась компетенция специалиста. Все прошло четко, все остались довольны!!! Спасибо, так держать. С уважением, Миронов Николай.",5,
126,Владимир Котов,https://avatars.mds.yandex.net/get-yapic/38663/ubw0HmcCLS97CY07h6TLSbvryE4-1/islands-68,2023-04-05 06:07:27,В удобном месте важно для клиентов образованный коллектив,5,"Владимир, спасибо, рады стараться 😃"
127,Роман Смит,,2022-03-21 12:30:09,"Втб-днище стал. Конкретно в этом отделении самые отстойные менеджеры. Час просидишь в очереди и тебя вежливо посылают»ничем не можем помочь». В других отделениях этого банка приятные,профессиональные. Тут вроде тоже стараются,но некоторые экземпляры просто продавщицы с рынка. Кокулевская галина сергеевна привет тебе..",1,"Спасибо, что поделились с нами вашим опытом обслуживания. Мы обязательно учтем ваши замечания и проработаем их с сотрудниками офиса, чтобы в дальнейшем у вас не возникало сомнений в правильности выбора нашего Банка."
128,Галина Сергеева,https://avatars.mds.yandex.net/get-yapic/50595/nKGrygQXV3pM6HhB7zhsfWG6HBw-1/islands-68,2021-06-08 19:29:04,"День обращения 24 мая. Тема - ЗАКРЫТИЕ ОБРЕМЕНЕНИЯ, Специалист ВОЛОШИНА ЕЛИЗАВЕТА, которую бы отправить ещё немного поучиться этому делу. ...Пришлось прибегнуть к помощи специалиста с соседнего окна, которая рассказала о дальнейшей фиксации документов и сроков их исполнения. Волошина сняла копии и сказала отправит. Всё бы ничего, если бы ВОЛОШИНА Е. грамотно ""провела"" мою заявку на услугу. Сегодня 8 мая, позвонив на горячую линия, выясняется, что заявка не сдвинулась с ""точка А"" и что якобы мне поступал звонок 27 мая (звонка однозначно не было) для выяснения каких-то обстоятельств и тем самым заявка ""зависла"". Сегодня заявку повторно отправили, и опять ответ ""ждите"". Прошу вмешательства УПРАВЛЕНЧЕСКИХ СТРУКТУР на срочное и положительное завершение СНЯТИЯ ОБРЕМЕНЕНИЯ.",2,
129,Владимир Травин,https://avatars.mds.yandex.net/get-yapic/62162/8meMfjThHHbk52FYocvzXoZyVI-1/islands-68,2022-11-03 07:04:52,Был в субботу. Работают только трое из 13. Очень медленно обслуживание. Пришлось стоять с 13 до 16 часов. Ради того чтобы услышать несколько слов.,1,"Благодарим за подробное описание ситуации, выясним причины такого построения графика работы сотрудников и проведем работу для ускорения обслуживания, а также для повышения комфортности."
130,Елена Валерьевна,https://avatars.mds.yandex.net/get-yapic/64336/ROih4LO1D3Sd0UaxkJCgYABpS4-1/islands-68,2022-04-28 03:12:17,"Чётко. Быстро и слаженно.
Несколько раз была в банке. Всегда помогут. Расскажут. Возможно мне так повезло. Но негативных впечатлений нет",5,
131,Иван Глинский,,2022-04-28 15:25:43,"Парковка бесплатно и по правилам практически не возмодна((( Как итог, посещение банка обходится в стоимость парковки... В остальном все стандартно для втб",4,
132,Анастасия Никулина,https://avatars.mds.yandex.net/get-yapic/63256/q3CSIbd4A3RVxLuy5VkeDPwsUc0-1/islands-68,2023-12-21 17:49:24,Все профессионалы,5,Спасибо за приятный отзыв. Довольные клиенты - наша лучшая награда 👍
133,Владислава Б.,,2024-04-11 16:10:29,Лучшее отделение 👍,5,
134,Герман Жестков,https://avatars.mds.yandex.net/get-yapic/58107/Z283ftMBySAS31iBoWGAU47kwpg-1/islands-68,2023-01-26 06:40:35,"Самый лучший офис, сотрудники всегда готовы решить любой вопрос.",5,Благодарны вам за пятерку и добрые слова о работе наших сотрудников))
135,Сергей Ясеновский,https://avatars.mds.yandex.net/get-yapic/65952/2FkVeiqlMS4KVlsZqll1rqkzt4-1/islands-68,2022-02-15 21:14:44,Головной офис банка ВТБ в городе Краснодар. По всем вопросам обращаюсь сюда. Очень качественно и быстро решаются все вопросы 👍🏻,5,
136,Владимир,https://avatars.mds.yandex.net/get-yapic/38436/iUakuR2UDuOwXHBZZJRUEIXEIOk-1570861295/islands-68,2021-08-29 13:28:57,"Отлчиный филиал, доброжелательные консультанты и специалисты! Все вопросы решили быстро! Молодцы! Рекомендую данный филиал!",5,"Спасибо, рады стараться 😃"
137,Тимофей Тургунов,https://avatars.mds.yandex.net/get-yapic/40841/U0nb6mbITplODAw0vIFCrdoTu7Q-1/islands-68,2022-10-19 13:36:18,"Очень долгое обслуживание, не работает электронная очередь и постоянно большие очереди, сегодня просидел 1,5 часа",1,"Поверьте, мы всегда стремимся быть лучше. Действительно, вопрос очереди требует незамедлительного решения. Нам важно, чтобы каждый клиент мог решать вопросы без длительного ожидания. Продолжим работу в данном направлении. Надеемся, что в дальнейшем мы не заставим Вас ждать."
138,Дмитрий Маслов,https://avatars.mds.yandex.net/get-yapic/39803/HlA5aTZO2lylbQcnb0qKon1jYac-1/islands-68,2023-01-04 08:14:42,"Работают 2 сотрудника вместо 4, табличка с номерами для очереди сломана. У банка кончились деньги????",1,"Согласны с вами, проблема с долгим ожиданием стоит в этом офисе остро. Мы работаем над увеличением скорости обслуживания. Надеемся, что при следующем визите вы уже сможете оценить, как изменилась ситуация."
139,Mariya Gyseva,https://avatars.mds.yandex.net/get-yapic/59871/wFWFyd7GnxfCVMPZq03s1qLLnuw-1/islands-68,2023-07-07 13:07:47,"Хамские сотрудники и огромные очереди, больше нечего добавить",1,"Спасибо, что поделились с нами. Обязательно проведем проверку в данном отделении. Приносим извинения за возможные неудобства."
140,А.Л.И.,,2021-03-22 13:39:40,"22.03.201г. ВТБ на ул. Красноармейской,43 по ул.Гоголя, ""порадовал"" своей беспомощностью. Бывших клиентов ""Банка Москвы"" (которые уже года три как клиенты банка ВТБ) в данном отделении не обслуживают!!!!!! 50 минут ожидания в очереди и такое откровение. ""Не получили пенсию в марте? Вам в феврале 2021г. изменили номер счёта?.... Все вопросы в ""Банк Москвы""..."" (т.е. Октябрьская,28, 40 лет Победы и т.д.) - СЕРЬЁЗНО?! ""Банк Москвы""? ТАК ЭТО ЖЕ ВЫ СДЕЛАЛИ И КАРТА ПЕНСИОННАЯ С ЛОГОТИПОМ ВТБ!!! Короче, спасибо,переходим в другой банк где не нужно иметь навязанных, дополнительных счетов!",1,
141,Олег Геннадьевич,https://avatars.mds.yandex.net/get-yapic/15298/enc-e2eaa9315c1805d59c56e443cee572e998eee9008467e0d4eb455d6405be2647/islands-68,2022-07-16 09:03:31,"В целом ВТБ банк делает всё, чтобы по максимуму поиметь своего клиента... Став в 2017 году их клиентом и взяв там кредиты много раз жалел об том.",1,
142,Алла Ж.,https://avatars.mds.yandex.net/get-yapic/45566/BTNBA6lDliRuJQ2j6EDKyNmrY-1/islands-68,2022-07-03 17:22:20,"Быстрое обслуживание, внимательнее отношение, приветливый персонал",5,
