,name,icon_href,date,text,stars,answer
133,Елена М.,,2021-05-25 17:00:19,"Уже не первый раз сталкиваюсь, что операционисты не могут толком ничего решить. Все спихивают на работу программы. Подала заявление на кредитные каникулы, выдали новый график платежей. Но в дату платежа вечером остаток с карты списали, а там сумма лежала меньше, т.к. я даже пополнять не стала, потому что взяла каникулы (отсрочку на месяц)! Оказывается программа почему-то отказала заявление и не подключила каникулы, и мне об этом операционист не сообщила! И ничего изменить, переподключить они не в состоянии и деньги вернуть, которые я не собиралась переводить в оплату кредита в этом месяце. Офигеть, я считаю, что банк ввёл меня в заблуждение и испортил кредитную историю (ранее у меня никогда не было просрочек). Вот куда можно на них написать?",1,
134,Dana Petrova,https://avatars.mds.yandex.net/get-yapic/20749/enc-db9a74ba441b0a56e8ec21f0e96157652a583a267ed7112ea3822be6d043c09b/islands-68,2021-04-14 16:42:10,"Хороший офис, внимательные сотрудники. Мне нужно было быстро снять валюту с карты. В привилегию была большая очередь. Быстро помогли в обычном зале. Спасибо за внимательное отношение к клиентам.",5,
135,Алла С.,,2022-11-05 13:33:34,В банке электронная очередь . Очень удобно. Ждать приходится не очень долго. Персо6ал вежливый.,5,"Алла, благодарим за положительный отзыв работы. Рады, что вы остались довольны 🙂"
136,Adelya Rafikova,,2023-01-15 19:16:57,Проводили сделку. Переговорные отстой. Даже вешалок нет для верхней одежды. Менеджеры вообще отстойные.,1,Спасибо за отзыв. Обязательно проведем проверку в данном отделении на основании ваших замечаний и примем меры.
137,Алексей С.,https://avatars.mds.yandex.net/get-yapic/28053/qiXXy8iYVgLVxusNyPqLjjVZY4-1/islands-68,2021-10-26 08:51:13,"Дикая некомпетентность сотрудников отдела Привилегия. Все сделали плохо, не так как должно было быть. А потом заявили, что ничего сегодня уже исправить не могут, предложили обратиться в другой день в любой другой офис, хотя изначально по телефону убежали, что моя проблема может быть решена только в их офисе и только при личном моем присутствии.",1,
138,Pavel Gorin,https://avatars.mds.yandex.net/get-yapic/25358/QePOw4bMbn0WpeobONCdJhrhSw-1/islands-68,2021-09-24 09:44:33,"Очень приятные сотрудники , всегда помогут и все объяснят. Обстановка очень комфортная и уютная.",5,
139,Татьяна Соцкова,https://avatars.mds.yandex.net/get-yapic/23186/enc-578ce405c2a9d1ce220c630f586ed697c0e49ac532fc17e8bae636bfb6a6cc12/islands-68,2023-11-05 10:57:44,Удобное отделение банка.Но не все сотрудники компетентны,4,"Благодарим за отзыв. Мы обязательно организуем встречу с руководителем и сотрудниками, на которой обсудим вопросы повышения качества обслуживания клиентов."
140,BESTESTATE.GURU,https://avatars.mds.yandex.net/get-yapic/39249/EUyaPzK2OgSigdoVBGvc7KCjk-1/islands-68,2022-01-31 05:43:39,"Огрехи есть, но в моем непростом случае решение нашли и воплотили. Мелочи можно простить. Но шаблонность мышления сотрудников зашкаливает. Ставлю 5 за то, что решили вопрос все-таки",5,"Рады видеть, что Вы оценили нас на 5 ⭐"
141,Алла Е.,,2022-07-08 15:11:15,"Ужасно некомпетентные сотрудники. Ощущение, что в этот банк специальный отбор.
Что можно сказать про банк в которым никто из сотрудников не смог активировать, выданную ими же, карточку?!",2,
142,Марина ИВАНОВА,https://avatars.mds.yandex.net/get-yapic/28053/wR8TvDSL8YOA79GWuGOxi4qX0-1/islands-68,2021-12-20 17:53:53,"Проводили сделку в этом отделении банка, очень плохое обслуживание, менеджер банка Александра не профессиональный сотрудник, такое ощущение что у неё лишь бы день до вечера, работать то ли не хочет, то ли не умеет!",2,"Мы сожалеем, что обслуживание в нашем офисе доставило вам неудобства. Мы обязательно проведем проверку ситуации из вашего отзыва и организуем встречу с руководителем офиса и сотрудниками, на которой обсудим вопросы повышения качества обслуживания клиентов. Примите наши извинения за доставленные неудобства, исправимся 👌"
143,Алена Репина,https://avatars.mds.yandex.net/get-yapic/29310/pYzbSkx4567Y6NM1w1nJqZTuwxw-1/islands-68,2023-08-22 17:03:24,Долго оформляли карту в итоге так и не оформили.,3,"Алена, спасибо за отзыв. Обязательно проведем проверку в данном отделении на основание ваших замечаний и примем меры, которые позволят оперативно решать вопросы клиентов."
144,Елена У.,,2021-04-28 09:48:16,"Отзыв от 10 апреля 2021г. - читала и обалдевала, прям моя сделка почти один в один. Только я думала, что это мне так не повезло, что сделка 6 часов, косяк на косяке, договор переделывали три раза, при том, что каждый пункт согласовывался с банком заранее, на электронную регистрацию нас не записали, хотя она была заявлена заранее, при подаче документов накосячили, регистрация приостановлена Росреестром, я в таком ужасе от этого отделения, словами не передать!!!!! Те же самые сотрудники, то же самое наплевательское отношение! Планирую писать официальную жалобу на все это раздолбайство.",1,
145,Игорь О.,,2021-05-08 07:51:20,"Одно из немногих отделений ВТБ с компетентными специалистами. По своему вопросу были проконсультированы. Сотрудница Данилюк Ирина Юрьевна компетентна, заинтересована в результате. Побольше таких сотрудников!",5,
146,SONIA,https://avatars.mds.yandex.net/get-yapic/43978/axgEqGKx0aKEr1y92r9UHYHAbqA-1/islands-68,2023-01-26 20:11:52,Хороший банк. Вежливый персонал.Удобная зона ожидания.,5,"Благодарим за положительный отзыв работы. Рады, что вы остались довольны 🙂"
147,Almaz Shanazarov,https://avatars.mds.yandex.net/get-yapic/53031/zmLYPQ9DM5QA2qkRxMceZpaqo-1/islands-68,2022-02-06 14:15:46,"Обслуживание хорошее, персонал на высоте. Запасаться терпением на целый день. Занимает много времени.",4,Благодарим за оценку наших сотрудников. Над вопросом длительного обслуживания мы работаем.
148,Инкогнито 3377,,2023-05-30 21:50:18,Крутой банк! Все быстро и без очередей.,5,Спасибо за отзыв! Будем продолжать в том же духе 💪
149,Елена Неверова,https://avatars.mds.yandex.net/get-yapic/28053/2Qqj6Sen1nTrAniNQoi5TQlwmJo-1/islands-68,2022-02-15 12:12:01,"Сегодня посетила этот ужасный офис. Ужасный в плане обслуживания юридических лиц. Отказались провести стандартную операцию. Я это не умею, ответ специалиста банка. Желание сотрудников работать отсутствует .",1,
150,Люсова Елена,https://avatars.mds.yandex.net/get-yapic/57243/SuBJNo03O2bSVMWlaHNj4lYvkw-1/islands-68,2022-04-27 16:49:47,"Самый ужасный банк. Обслуживание просто на нуле, просидела два часа в пустом зале, пока не попросила книгу жалоб не пригласили к менеджеру. Сотрудников много, но все делают вид, что тебе нет.",1,"Благодарим за сигнал. Согласимся, что такая ситуация недопустима. Организуем встречу с руководителем офиса и проведем проверку. Надеемся, что в дальнейшем обслуживание будет соответствовать вашим ожиданиям."
151,Лилия,,2022-03-09 12:07:54,"Обслуживание на 0 уровне. 
Месяц назад пришла заблокировать карту и счёт, т.к. это был зарплатный проект. 
С начала сказали, что подали заявку на закрытие и приходите через 10 дней 
Пришла через 10 дней, сказали всё, заблокировали всё, что было возможно. 
Итог: рассылки продолжают приходить, через СБП карта видна.
Оказалось, что сотрудник не правильно меня понял и заблокировал только карту. 
Пришла в третий раз, очередь сумасшедшая, принимают долго, 1 и 2 окно не вызывают клиентов, хотя сотрудники сидят на местах. 
3 раза, карл, 3 раза я пришла в банк чтобы мне просто заблокировали карту!",1,"Мы сожалеем, что у вас возникла такая ситуация во время визита в наш офис. Со своей стороны обязуемся провести комплексную проверку вместе с руководителем офиса и примем соответствующие меры. Примите наши извинения."
152,Ольга Василёк,https://avatars.mds.yandex.net/get-yapic/26311/QiTblFSnpyhtkKLUEjbsj2Xf61A-1/islands-68,2023-02-05 16:42:55,"Ужасный банк! Заказала деньги три дня, назад, приехала, а передо мной один перец, зашёл к начальнице и договорился о наличие без предварительного заказа. В итоге, когда я пришла денег в кассе не было, и мне пришлось воспользоваться перечислением",1,"Примите наши извинения. Информацию прямо сейчас доведем до руководителя офиса, чтобы в дальнейшем такие ситуации не повторялись. Надеемся на дальнейшее сотрудничество."
153,Наталия,,2021-09-22 10:01:07,"Большое, современное здание, много сотрудников, много клиентов, консультант на входе торопится, не умеет слушать и слышать клиентов. В кассе обслужили быстро и профессионально.",4,
154,Dmitry Kuznetsov,https://avatars.mds.yandex.net/get-yapic/28439/9uJaetITrXckOfhnFlJt7xDwZ0-1/islands-68,2021-12-09 17:48:18,Последнее посещение порадовало… нужно было продлить сертификат на эл. Банк-клиент. Сразу нашли место для парковки и вся процедура (с ожиданием) заняла минут пятнадцать.,5,
155,Гоар Абраамян,,2021-05-25 09:41:46,"Почта России быстрее обслуживает. Берите пример!) 
Огромный офис, 3,5 клиетна в банке. Я 3ья в очереди. За 20 мин ситуация не изменилась. Решила не ждать, молодой человек на выходе, предложил прийти в следующий раз и взять талон без очереди. А сейчас нельзя 🤣 🤷‍♀️
Дала 2 звезды за тишину и прохладу в офисе.",2,
156,Денис А,https://avatars.mds.yandex.net/get-yapic/50595/JiAgRlwu5mFT8SljkOE79pbs3o-1/islands-68,2022-05-13 16:10:05,Просторно. Удобная парковка. Вежливый персонал. Очередей нет,5,"Очень приятно получить такую высокую оценку, спасибо 😊"
157,Дмитрий,https://avatars.mds.yandex.net/get-yapic/43978/qwtYU4b6SeUX6bN77lsOWgiFzs-1/islands-68,2023-06-03 17:57:24,"Быстрое, качественное обслуживание",5,"Рады, что вам понравилось. Ждем вас снова 😃"
158,Валерия М.,,2021-03-02 11:43:22,"Улучшить надо качество обслуживания! Я ждала больше часа, несколько раз подходила к сотрудникам , чтобы решить вопрос, очередь ушла вперёд , меня уверили, что не нужно брать новый талон, так как скоро меня примут, и пока моя жалоба не переросла в коллективную, вопрос не начали решать. Меня приняли , но выяснилось , что мне услугу не могут оказать, точнее могут, но вместо 10 дней по регламенту , мне придётся ждать 2 месяца. Лучше обратитесь в другое отделение , чтобы не потерять уйму времени!",1,
159,Наталия К,,2023-03-19 19:36:34,Взяли за выдачу справки для заполнения декларации госслужащим 200 рублей. Позор!,3,Комиссия взимается в соответствии с тарифами банка. Получить такую справку бесплатно можно в личном кабинете ВТБ Онлайн.
160,Fandorin_E,https://avatars.mds.yandex.net/get-yapic/45848/OIGeomJw7ihC0NsSAkiAEzKfQU-1/islands-68,2023-01-01 15:36:23,На самом деле очень хорошее отделение. По вечерам мало народу и нет очередей.,5,"Благодарим за положительный отзыв работы. Рады, что вы довольны 🙂"
161,Марк Иванов,https://avatars.mds.yandex.net/get-yapic/62162/vW7XGjbLkqQ4R1VCqDhefGnQ-1/islands-68,2020-11-18 09:04:29,"Ужасное отделение. Людей не так много (18.11.202 11:10) большая часть рабочих мест пустые. Электронная очередь идёт не по порядку. Любая операция занимает минимум 40 минут. У них так медленно работает программа или у них регламентированное время обслуживания минимум 40 минут. Не рекомендую к посещению. 
p.s. наблюдаю картину как заместитель руководителя филиала (так она представилась) операционист разводят бабулю лет 70-ти на покупку облигаций, установку мобильного приложения 🤦🏼‍♂️",1,
162,Алла Владимировна,https://avatars.mds.yandex.net/get-yapic/51381/C3Exg9ui1gefoghyWw50p74bA-1/islands-68,2022-12-19 19:58:40,Была сделка с недвижимостью... понравилось обслуживание..,5,"Алла, спасибо, рады стараться 😃"
163,Timur Alsultanov,https://avatars.mds.yandex.net/get-yapic/26057/enc-1cf68ade253cb63590b49bb248ae1f9d94d971d93985e5568b746155503f2b5f/islands-68,2021-03-25 11:05:26,"Подал заявку на сайте втб. поздравляем! Банк готов выдать вам кредит. Ждем вас с необходимыми документами в офисе банка по адресу: 111024, г. Москва, ул. Авиамоторная, д. 10, кор. 1. Предложение действует до 24.05.2021.
Пришёл я в банк со всеми документами который банк запросил, объяснил сотруднику банка что подавал заявку на кредит и что мне одобрили, из всех документов взяли только паспорт, и сразу мне дают ответ, что у банка для вас нет предложений. Документы все в порядке, я абсолютно адекватном состоянии. Я не могу понять что за хамское отношение, зачем заманивать людей. Ради чего? Чтобы потом предложить открыть счёт? Потратил своё время и деньги! Остался негативный осадок!",1,
164,Валентина Гаврилова,,2020-11-11 06:21:59,"Это сасое худшее отделение москвы и вообще в банковском сегменте. Сервис заоблочный. Я обратиоась в пндельник. Мне скащали ожидание булет 1,5. Я не распологала этим времением. Пришла во вторник. Ожидание опять более часа. Я взяла талон пошла по своим делам. Вернулась. А очерель еще не подошла. Прождав еще мин 30. Вуаля, вот оно заветное окошко. Сотрудник девушка узбекской наружности и узбекского поведения. Зовут кажется Диана. Окно 8. Операция у меня проще простого. Просто выдать карту с привязкой к имеющемуся счету. Она делает мне заявку на именную карту. Которая булет готова через неделю. При этом не уточняет у меня ничего. Выдает щаявление. На что я ей скащала, что вы слелали, почему не уточнили, я не распологаю временем еще раз умереть в очереди. Она еачала на меня орать..... что это я должна была ей скащать что карту надо не именнную. Это как вообще сотрулник ьанка ореееет на клиента. Я ей скащала левушка вы как сеья позволяете вести с клиентом!!!! Далее интереснее. Соседка этой девушки, в соседнем окне обслуживала женщину. И эта диана влезоа к ней в окно, при этом отвернулась от меня и начала там что то говорить, помогать или еще что. Хотелось скащать куда ты лещегь, ты у себя не разобралась. Я встала и ушла. .. до сих пор не могу в сеья придти. Это как. Я такого не вилела ниииигде. И это солидный ьанк . Центр Москвы. Почта в разы оучше рабоиает. Там ожилание не более 10 мие. Тут же просто дуть. И это панлемия. Где маски, перчатки, дистанция... прлный щал народу. Жуть",1,
165,Александра Шувалова,https://avatars.mds.yandex.net/get-yapic/59871/enc-cd33efb941283204b21a5acad8d249b0950f8e579fd19cf0de9335246cc3ef0f/islands-68,2021-12-09 07:21:31,"Электронная запись не работает. Занимаешь живую очередь, сидишь , получить зарплату карту надо в окошках под названием ""кредиты наличными"", естественно всё это долго. 12 рабочих мест, работают всего 3. Ужасно просто.",1,
166,Наталья Чеснокова,,2021-04-12 12:33:20,"Отвратительное отделение. Из 21 окна, работает, в лучшем случае, три. Разблокировать учетную запись заняло: 3 часа в очереди и дополнительно у сотрудника ещё час. На вопрос:как отказаться от навязанных услуг, сотрудник посоветовала обратиться к банкомату. Сотрудник у банкомата отправил обратно к операционист. Итого: дикие очереди, медленные и некомпетентные сотрудники.",1,
167,Ольга,https://avatars.mds.yandex.net/get-yapic/53031/ZchZVkTnR90MwBo2UnOLnvNffA-1/islands-68,2021-10-15 09:07:24,"Второй раз за неделю здесь, в будни , и не в не час пик. Чтобы попасть к специалисту ожидание по 40-50-60 минут, при этом 7 окон из 21 не принимают. Не рекомендую обращаться сюда",2,
168,Двенадцать Месяцев,https://avatars.mds.yandex.net/get-yapic/69015/xHhR0a3Ut2OUcmL83EqtgcQ1ao-1/islands-68,2021-01-29 06:22:59,"«Банк ленивцев и черепах.»
Кажется что сотрудники тут, просто существуют. Они не понимают что им нужно сделать, их как будто не обучают этому. Был в этом отделении пару раз, по вопросу ипотеки и получению карточки. 
Во-первых – ну ооооооочень долго. 
Во-вторых – за карточкой приехал к ним специально по раньше к 9-ти, запланировал день, а у них, не работает база. И все. Мне сказали, что ничего не поделаешь, надо ждать час пока починят. Ни «извините», ни «до свиданья»
21-й век до ВТБ ещё не добрался.",1,
