,name,icon_href,date,text,stars,answer
124,Сергей Завьялов,https://avatars.mds.yandex.net/get-yapic/20706/enc-f3dba7f5ba3719e17925f6b13314a86ef69e0d9e9d0ff638611d6654c740cbcb/islands-68,2022-11-30 13:06:57,"Мы для них лишь номер в базе данных, передо мной сотрудник 40 минут уговаривает пенсионерку перевести пенсию в этот «ЧУДО» банк. Возможно он работал в связном или Евросети🤦‍♂️🤦‍♂️🤦‍♂️ в очереди больше часа…",1,"Сергей, спасибо за отзыв. Обязательно проведем проверку в данном отделении на основание ваших замечаний и примем меры, которые позволят оперативно решать вопросы клиентов."
125,Мисс В.,,2021-07-02 19:49:41,"Как ни приду, всегда долго сижу в очереди. Брокерское обслуживание в порядке живой очереди, эти же менеджеры (и их там мягко говоря немало) и для клиентов привилегия, получается что иной раз (не всегда) обычные операторы по простым вопросам в соседнем зале обслужат быстрее. Не все менеджеры компетентны оказать консультацию по брокерскому обслуживаю,легче было дома спокойно прочитать на сайте, потому что они даже не знали с чего начать.
Операторы в основном зале работают немного быстрее, но !!! как можно двоим операторам обслуживать одного клиента, это было несколько дней назад, прождала в очереди полчаса пока на моих глазах троих клиентов обслуживали пять операторов, причем в одной паре второй оператор просто расплылась на стуле и разговаривала с той что работала рядом (может у нее рабочий день закончился в пол 5 так пусть не злит клиентов), в другой паре оператор за компом сидела просто как мебель и ничего не делала (может не умеет, может стажёр) в то время как над ней постоянно стояла над ее же компьютером другая оператор. Я уже привыкла что идя сюда надо закладывать час времени, пока обслуживание на таком неорганизованном уровне точно не перейду на привилегию, мне хоть локация и удобна, и продукты они предоставляют по сути те же, но мотаясь в другой район меня обслуживают быстрее и компетентнее. 
Ещё тут нет систем переводов типа короны, вестерн и тд, наверное тогда бы тут вообще по полдня клиенты сидели в очереди.",3,"Благодарим, что нашли время поделиться вашим впечатлением об обслуживании в Банке. Мы обязательно учтем ваши замечания и проработаем их с сотрудниками офиса, чтобы в дальнейшем у вас не возникало сомнений в правильности выбора нашего Банка."
126,Анастасия Сергеевна Чигвинцева,https://avatars.mds.yandex.net/get-yapic/57243/Zs83KciTn3NAdcNYcNJle4nbJk-1/islands-68,2022-03-23 13:35:15,"Когда пришла в отделение, взяла талон, передо мной было 12 человек. Работало 4 окна. Потом одно окно закрылось, далее другое. Начальница, на мои вопросы о скорости работы специалистов, говорит-ждите, все по очереди. В итоге я просидела 1,40ч. 

Специалисты бегают к друг другу за консультациями, из-за этого, на одном окно по 2-3 специалиста. А другие окна закрывают. Бардак! 1,40!!!!",1,"Согласимся с Вами, что длительного ожидания не должно быть. Обратим внимание руководителя отделения на данную проблему и примем меры 👌 Надеемся, что в дальнейшем мы не заставим Вас ждать."
127,Людмила Лобузова,,2022-05-03 14:53:07,"Обслуживание очень хорошие,быстрое, обслужающий персонал культурные , знающие своё дело,всем советую.",5,"Спасибо вам, очень приятно получать обратную связь 🙏👌 Приезжайте ещё 💛"
128,kim6908,https://avatars.mds.yandex.net/get-yapic/24700/enc-9f65b6ffd462531d50306f330a24ec15ba08c98141b568115898ec6baa71854f/islands-68,2022-09-22 17:15:58,"Очень много времяни приходится ждать, хотя представители банка работают но их не хватает, плюс по решению вопроса тебе начинают втюхивать ненужные услуги, а это увеличивает время посищения.",3,"Спасибо за отзыв. Обязательно проведем проверку в данном отделении на основание Ваших замечаний и примем меры, которые позволят оперативно решать вопросы клиентов."
129,Николай Жижкин,,2023-12-12 16:47:26,"Очереди, ждал целый час, кошмар",3,"Извините, что заставили вас ждать. Мы с вами полностью согласны, такого долгого ожидания быть не должно! Информацию довели до сведения руководителя офиса, обязательно примем меры 👌"
130,Макс М,,2023-03-04 13:05:30,"Обслуживание очень отвратное. Самый ужасный банк. Сотрудники не приветливые и злые как будто я им что-то должен,",1,"Поверьте, мы стремимся быть лучше. Обратная связь нам помогает понять наши проблемы и принять меры для улучшения сервиса и обслуживания. Благодарим вас за отзыв."
131,наташа розонова,,2023-03-28 13:23:08,"Быстро и вежливо обслужили,всё объяснили,помогли активировать карту",5,Спасибо за такие приятные слова. Всегда вам рады помочь 💪
132,Юлия Майорова,https://avatars.mds.yandex.net/get-yapic/31804/XfjSj5dFnyu2J84cVpy9DLSuVM-1/islands-68,2022-11-06 13:32:19,"Пришла в банк,чтобы оформить рескрутизацию кредита.Сидела в очереди почти 2 часа... Девушка блондинка,имя не помню,ее место около окна,сказала,мне что в банке они этим не Занимаются,позвоните на гарячую линию,при чем я несколько раз спрочила так ли это,меня уверила,что да,так. Пришла домой,звоню,а мне говорят,что это делают в банке,а не по телефону ......мне нужно справка о доходе и трудовая заверенная. В итоге все сделали в филиале на белорусской без проблем!!!!!! А сотрудница просто меня отшила мягко говоря. Потратила зря время и испортила настроение!",2,"Благодарим Вас за отзыв. Нам очень важно знать Ваше мнение. Мы стремимся к тому, чтобы быть лучше. Проведем работу в целях улучшения качества обслуживания."
133,dancer729,,2023-01-19 08:06:33,В самом отделении все быстро и по делу. Персонал отоичный. Но банкоматы часто сбоят.,4,"Благодарим за положительный отзыв, нам очень приятно 👍 Проверим работу банкоматов в данном офисе."
134,Антон Дубровский,https://avatars.mds.yandex.net/get-yapic/58107/u02tXoeA8FZWgikn5364zVVyIo-1/islands-68,2021-11-20 10:59:20,"Небольшое отделение для юридических лиц. Не так далеко от метро Первомайское, рядом остановка. С парковкой сложновато. Персонал адекватный.",5,"Благодарим за положительный отзыв, нам очень приятно 👍"
135,Ляля Н,,2022-11-11 11:55:26,"Хорошее отделение. Просторно. Но, некоторые сотрудники медлительные. А в целом всё не плохо.",5,"Благодарим за положительный отзыв работы. Рады, что вы остались довольны 🙂"
136,Dmitry Sautenkov,,2022-12-27 09:44:54,"Вечные очереди! Зачем-то у них есть еще Привилегия, которая подразумевает ВИП сервис. Там очередь еще больше. И она живая. В чем смысл?",1,"Сожалеем, что вынуждены были потратить ваше личное время на ожидание в очереди. Поверьте, мы принимаем меры для того, чтобы сделать время ожидания минимальным. Продолжим работу в данном направлении."
137,Максим М,,2024-01-04 16:17:45,2 декабря пытался снять деньги в банкомате. Из-за ошибки банкомата уже месяц не могу получить 60000 на счёт.,1,"Искренне огорчены, что вам пришлось столкнуться с трудностями при обслуживании.

Если ваш вопрос еще актуален, просим направить на наш адрес SMedia@vtb.ru ваши ФИО и дату рождения. В теме письма необходимо указать «Яндекс, Москва, Измайловский бульвар, 46, 04.01.24»."
138,tranzitochka,https://avatars.mds.yandex.net/get-yapic/59871/E8eGabQqpi9BhzErcDO5GzYQKrk-1/islands-68,2023-05-10 13:16:03,"Удобное расположение, вежливый персонал 👌🏼",5,"Рады, что вам понравилось. Ждем вас снова 😃"
139,Влад Бак,,2022-10-10 10:58:18,"Ваш бот! 15 минут не пускает к оператору, все команды перепробовал. Удалите его нафиг! «Я кажется не понял вопрос» «оператор занят какой у вас вопрос?» и одно и тоже на все сообщения",1,Благодарим за сигнал. Примем к сведению ваши замечания!
140,татьяна шапкина,,2023-04-21 12:29:09,Долго ждать мне лично пришлось в очереди. 3 терминала из4 не работали. Но персонал вежливый.,4,"Сожалеем, что для решения вопроса вам пришлось потратить свое личное время на длительное ожидание в очереди. Мы обязательно примем меры для сокращения времени ожидания. Приносим наши извинения."
141,Ирина Сергеева,https://avatars.mds.yandex.net/get-yapic/20706/enc-6fce88df005c68d09277969c25b7f44d/islands-68,2024-01-02 09:53:05,Комфортное отделение,5,Спасибо за отзыв. Ваш комфорт - наша основная задача 👌
142,Ираида Егоровна С,https://avatars.mds.yandex.net/get-yapic/65952/SqWJeabNHtTgflcKLTioM3ZAKpg-1/islands-68,2022-11-24 13:38:35,"Клиенты банка замучили нас. Все паркуются на придомовой парковке. 
Деньги экономят- а что людям мешают- это ничего!
Вот и мнение! Надоел нам.",2,Спасибо за отзыв! Приняли во внимание.
143,Тип Топшоп,,2022-06-29 07:02:20,"На входе на табличке написано что банк работает с 9, внутри на принтерном листочке что с 10. Серьёзный уровень отношения к клиентам. 
Апд: 10:02 - отделение ещё закрыто",1,
144,елена,https://avatars.mds.yandex.net/get-yapic/41409/s8qyLPUxHRjCpquvS2I33PI2kro-1/islands-68,2022-02-22 16:17:38,Удобно расположено. Быстрое обслуживание. Паркинг есть. Немного посетителей. Короткое время ожидания,5,
145,Ю А,,2021-11-26 09:26:53,"При выдаче дебетовой мультикарты ВТБ сотрудник мне неправильно объяснил условия программы ""Мультибонус"". Сказал, что за покупку ценных бумаг на бирже даётся кэшбэк 1.5%. Но позже выяснилось, что кэшбэк даётся только за покупки в магазине. А за покупки ценных бумаг никакого кэшбэка нет. В итоге я подключил ненужную мне платную опцию за 249 рублей и потерял деньги из-за того, что был введён в заблуждение. И избежать платы за обслуживание не помогла даже блокировка карты.

Абрамкин Юрий Сергеевич",1,
146,Наталия Ильина,,2022-12-18 13:14:23,"Огромные очереди , по часу можно ждать оператора . На просьбы клиентов ускорить процесс не реагируют . Банкоматы часто не исправны .",1,"Мы прекрасно вас понимаем. Данный офис очень востребован для клиентов, поэтому часто возникают очереди. Поверьте, мы работаем над сокращением очередей. Надеемся, что при следующем визите вы сможете оперативно решить вопрос. Проверим работу банкоматов."
147,Инкогнито 3903,,2023-10-09 14:32:25,"Неудобное отделение, неторопливые работники.",1,Благодарим вас за отзыв. Обратная связь нам помогает понять наши проблемы и принять меры для улучшения сервиса и обслуживания.
148,a155155,https://avatars.mds.yandex.net/get-yapic/24700/enc-353c04ec03eb1a791829de0fd7b3839b98eee9008467e0d4eb455d6405be2647/islands-68,2022-05-24 06:14:18,"отл. народу не так много как у м. щелковская.
удобная очередь с талонами. у меня с получением карты не было проблем. бытро.
нпроду мало если будни днем.",5,"Благодарим за положительный отзыв, нам очень приятно 👍"
149,Юрий К.,,2022-11-24 14:18:46,"Отделение банка явно бедствует, не хватает работников банка-очереди на час-полтора, чтобы взять выписки и справки",1,"Юрий, спасибо за отзыв. Обязательно проведем проверку в данном отделении на основание ваших замечаний и примем меры, которые позволят оперативно решать вопросы клиентов."
150,Андрей Буров,https://avatars.mds.yandex.net/get-yapic/44850/7FjhOwgrJwLu78kVvk8KnW1xeC0-1/islands-68,2022-12-03 16:11:13,Не очень дружелюбный персонал. На входе ученики банка. Машину припарковать только платно или далеко идти.,3,"Благодарим вас за отзыв. Нам очень важно знать ваше мнение. Мы стремимся к тому, чтобы быть лучше. Проведем работу в целях улучшения качества обслуживания."
151,Катерина,https://avatars.mds.yandex.net/get-yapic/21377/enc-531db610eb5741d4307e1a0bcce745f59b3698e0e1ceeb12ac7b0858b885f617/islands-68,2022-12-15 14:48:50,Так медленно работать нельзя!!! Больше часа ждать в очереди это отвратительно! Неужели трудно увеличить количество персонала ?,2,"Катерина, поверьте, мы принимаем меры для того, чтобы время ожидания было минимальным. Проведем проверку в отделении и обсудим с руководителем данную проблему. Надеемся, что в дальнейшем мы не заставим вас ждать."
152,Андрей,https://avatars.mds.yandex.net/get-yapic/36689/7VK5PPkbOWDlW2OdqGW0v7HENs4-1/islands-68,2024-01-27 21:20:28,Отличный банк 👍👍,5,"Рады видеть, что вы оценили нас на 5 ⭐"
153,Юлия У.,https://avatars.mds.yandex.net/get-yapic/45131/GBx8D3BiTtu5zh7PKqxGlLP23A-1/islands-68,2022-10-20 14:52:42,"""Время - деньги"", совсем не девиз этого офиса((( Сотрудники еле шевелятся... Больше часа в очереди... Не серьёзно...",1,"Юлия, спасибо за отзыв. Обязательно проведем проверку в данном отделении на основание Ваших замечаний и примем меры, которые позволят оперативно решать вопросы клиентов."
154,Сергей С,https://avatars.mds.yandex.net/get-yapic/21493/enc-f21cf17c770e615533d62c42ee0d9ea4/islands-68,2021-11-15 07:43:11,"11.11 оплатил часть кредита. у меня деньги списали, а на мой счёт, типо не легли. операторы мне рассказывают, что деньги на моём счету, только их не видно и ими нельзя воспользоваться. решение по этому вопросу сформируют к 20.11. вот такой замечательный банк...",2,"Хотим разобраться в вашем вопросе. Для этого просим направить на наш адрес SMedia@vtb.ru ваши ФИО и дату рождения и подробное описание ситуации. В теме письма необходимо указать «Яндекс, Измайловский бул., 46, Москва, 15.11.21»."
155,Floki,,2023-09-08 13:05:21,"Крутой банк , чистоти опрятно",5,Спасибо за отзыв! Будем продолжать в том же духе 💪
156,Майкса,,2024-03-18 12:58:46,Хорошие сотрудники,5,Спасибо за высокую оценку нашей работы!
157,Евгений,,2020-09-28 12:13:21,"Расшифровывается «Вот Такой Банк!!!». 
Плюсы: персонал везде вежливый и обходительный.
Минусы: всё остальное!!! Начиная от программного обеспечения и заканчивая режимом работы.
Поменять пин-код на карточке - это для них ОГРОМНЕЙШАЯ проблема!!! Два с половиной часа меняли. До конца так и не смогли поменять! Теперь у меня НА ОДНОЙ И ТОЙ ЖЕ КАРТЕ пин-код для оплаты в магазине один, а для снятия денег в банкомате другой!!!!!!!! Какому-либо другому банку слабо так сделать, а? А ВТБ может!

Офис на Марксистской - в одну из суббот собирались туда поехать. Мы накануне вечером позвонили на горячую линию, спросили у оператора, работает ли этот офис в субботу? Сказали, да работает.
Приезжаем. Угадайте.... Правильно! Офис закрыт!!!!!!

У них всё так. Через голову. Нижнюю!!!",1,
158,Peter Subrt,https://avatars.mds.yandex.net/get-yapic/54535/eijVjy4Tp1MBF6xR3PolEtjizPw-1/islands-68,2021-09-09 05:51:16,"Представительство банка в спальном районе, удобно что здесь можно припарковаться и что здесь круглосуточно доступен банкомат для снятия или вклада денег.",4,
159,Kate L.,https://avatars.mds.yandex.net/get-yapic/53031/f1MjR1SIsWZR1WSDBbTuc9VzHK8-1/islands-68,2021-04-12 19:21:21,"Выражаю благодарность специалисту Андрею (фамилию не запомнила, к сожалению) отделения ВТБ на Измайловском бульваре. Очень грамотный специалист, очень человеческий подход и профессильная помощь.",5,
160,Владимир Орлов,https://avatars.mds.yandex.net/get-yapic/59871/UCGdnsQfpHOpZETdVV9dpNI4ka4-1/islands-68,2022-04-25 17:37:42,"Обслуживание на высоте, однако с парковкой очень сложно, только платная, все места во дворах забиты полностью, а дела в банке не на 5 минут",4,
161,strela7,https://avatars.mds.yandex.net/get-yapic/27232/Y6ji7Zc2wjqjjd9XZIAvhAR6xa0-1/islands-68,2023-04-22 11:56:33,Все хорошо а главное недалеко от дома,5,"Рады, что вам понравилось. Ждем вас снова 😃"
162,Анастасия Третьякова,,2022-10-13 13:14:58,Ужасно огромная очередь в середине дня. Духотища. Через приложение элементарно не работает замена паспорта и нужно идти в эту парилку и ждать миллион лет!,1,"Примите наши извинения за длительное ожидание. Нас такое ожидание не красит. Мы организуем встречу с руководителем и вместе разработаем комплекс мер, которые позволят сократить время ожидания. Проверим систему вентиляции в офисе."
163,Теа Абакелия,,2020-09-25 19:32:18,"Очень довольно обслуживанием банка. Особенно выражаю благодарность Гаджиеву Тагиру Мирзаевичу. Воспитаний, внимательны, эрудированны, знающий своё дело и имеющий подход к каждому клиенту. Желаю вам успехов Тагир, карьерного роста и здоровья.",5,
