,name,date,text,stars,answer
0,Макс Весна,2023-11-23 13:00:15,"Очень хорошее, и удобное обслуживание. Персонал грамотный, компетентный и приветливый. Есть возможность снятия и внесения наличных. Имеется парковка для автомобилей.",5,
1,Анастасия Хорева,2023-08-01 06:17:04,"Хотели узнать информацию по ипотеке, зашли в отделение банка взяли талон, тут же подбежала администратор со словами: «что вы делаете?». На наш ответ, что хотели получить консультацию по ипотеке, сказала все можно в приложение узнать, и не надо для этого брать талоны. В итоге так и ушли без консультации, т.к. с ее слов подробную информацию можно только через приложение узнать, а в банке можно только подать заявку.",1,
2,Светлана Дзубан,2023-06-12 02:11:38,"Сотрудники очень внимательные . Всегда приятно заходить в банк, чисто и комфортно Для меня это надежный банк, перешла из другого банка из-за машейников",5,
3,С. Моисеенко,2024-01-16 14:03:44,Отличный офис. Профессиональные сотрудники. Парковка груглогодично,5,
4,Dmitriy L.,2023-03-29 16:10:23,"Отделение Сбербанка в целом не плохое,правда банкоматы не всегда работают,могут заглотить карту и приходиться заказывать новую...помещение простороное,чистое ,работники всегда подскажут и помогут взять талон к специалисту!",4,
5,Елена Л,2023-09-02 13:27:45,"Прекрасные сотрудники. Все объяснили, помогли решить нашу проблему. Все быстро, в очереди ожидать не пришлось.",5,
6,Никита Тресков,2023-09-27 14:51:18,Хороший сбербанк всегда снимаю деньги именно там ну и ложу тоже там в принципе сбербанк как сбербанк. Советую всем удачи и здоровья!,5,
7,Дамир Муллаяров,2023-06-16 13:44:10,"Уютно, очереди практически нету, отзывчивые сотрудники, легко разобраться. - Навязывают услуги",4,
8,Айрат Ф.,2022-04-28 05:45:01,"Хорошее отделение,просторное,недавно появился минус-убрали в фойе банкоматы в которые можно было зайти круглосуточно и снять-положить наличные, и вообще к сберу лично,пугает исчезновение банкоматов по городу,иной раз накатаешся пока найдешь где снять наличку,не всё ещё работают по безналу.",5,
9,Дмитрий Федотов,2023-04-07 12:55:23,Персонал очень вежливый сам не однократно туда обращался отношения к клиентам отличное время ожидания не более пяти минут вообщем рекомендую,5,
10,Сергей Кононенко,2023-05-09 13:20:20,"Доступный банк ! И как пожелание для вас , а именно кому отзыв ! Пожалуйста рядом с вами есть рынок Русь ! Люди сейчас все ходят с картами а не с наличными ! Сделайте пожалуйста дело 
Поставьте банкомат в крытый рвнок Русь ! 
И торговле легче и вам оборот увеличит ! 
Спасибо",5,
11,Кира Т.,2023-03-03 06:22:17,Все хорошо. Отдельная благодарность : менеджеру Трополиновой Анне Андреевне. Очень помогла,5,
12,Инкогнито 7196,2024-01-15 12:52:14,Все хорошо. Персонал вежливый.,5,
13,дмитрий лукачев,2023-12-16 11:55:27,Сбербанк как Сбербанк. Один из трёх в нашем городе.,5,
14,эркинжан эргашев,2023-02-07 12:22:45,Взял в сбар баке кредит 300000т без просрочек почти выплатил и сбр банк не одобряет мне поновому кредит не могу понять почему наверно что я не воспользовался бонкротством,1,
15,Эдуард Шевцов,2022-07-30 17:05:36,"Пандус сделали, молодцы. Вы бы ещё сделали как к нему подъехать, кругом высокие бордюры. Ладно коляску с ребёнком помогут перетащить а инвалид колясочник? Да он даже до кнопки вызова персонала не доберётся, если она ещё вообще работает.",2,
16,Татьяна,2021-10-20 23:12:15,"Как и должно быть в банке!Уютно,удобно быстрое обслуживание,внимательные сотрудники: объясняют доходчиво,решают на месте возникшие вопросы Много банкоматов самообслуживания",5,
17,Александр,2023-08-16 15:52:39,"Отличное отделение, всегда быстрое обслуживание",5,
18,Тимур Каразбаев,2023-12-18 13:34:35,"Стоишь по 20-30 минут, ждешь очередь",2,
19,Евгений Дорохов,2022-09-16 13:38:32,"За последнее время напрягли, банкоматы, ошибаются, мои же деньги вернуть пока не желают от вложенных наличкой на карту. За каждую услугу дерут нет таких как этот банк.",1,
20,Ирина Е.,2023-10-01 14:17:42,"Грамотные, вежливые сотрудники.",4,
21,Евгений Дорохов,2023-04-25 13:27:07,От сбер банку почти отказался дерут за всё а процент и разговоров нет,4,
22,Елена Шевсенко,2022-07-17 17:11:31,"Не плохо, хорошо, приветливы, готовы прийти на помощь, подскажут, обращалась и на раз, проблема была решена",5,
23,илья худяков,2022-08-17 15:00:16,"Хороший персонал, выслушаю проблему, решат её и подскажут как можно лучше сделать",5,
24,Pasifist42,2023-02-28 13:24:09,"Всё стандартно,как и во всех отделениях сбера🤷‍♂️🤗",5,
25,738391 Хазов,2023-06-25 12:45:29,В здании проблемы со связью ждал код так и не пришел,4,
26,Андрей К.,2021-09-12 15:05:14,"Зашёл заказать карту мир. Встретили как родного😊😊😊 , проводили к менеджеру. 
Через 10мин я освободился.
Всё прошло без суеты.
Получал карту в том же духе. )))",5,
27,Анатолий Соловьёв,2020-11-20 10:07:12,"Пользуюсь услугами банка и крайне недоволен работой персонала! Являюсь инвалидом и на банковский счёт перечисляют страховые выплаты из фонда социального страхования за профзаболевание. Обычно перечисление производится 20 числа месяца. Банк задерживает выплаты, оправдывая тем что ещё нет перевода, хотя мне известно что не так! Об этом мне сообщили в КРОФСС. И мне приходиться на костылях, в 70 лет, с большим трудом добираться домой, чтобы потом придти ещё раз или потратиться на такси! Потом в сберкнижке будет стоять дата моего первого посещения! По опыту знаю, что процедура перевода не занимает много времени и в вечернее время должно быть наверняка закончено! Кто объяснит причину этого издевательства над клиентами?",4,
28,MrIce 8856,2022-12-21 13:19:47,"Я там греюсь, классно что круглосуточно открыт",5,
29,Дарина,2019-11-24 16:31:23,"Сбербанк лидер в бизнесе многофункциональное отделение с банкоматами и терминалами. Всегда стоят помощники-консультанты однажды мне бесплатно подключили они услугу. 
Сегодняшняя цена на золото, серебро, платину на обозрении всем посетителям.
Считаю окон для приемов и вывода платежей хватает. 
Очереди проходят около 15 мин. 
Кто не понял кому проходить далее так и для слабослышащих доступен экран с №талончика и № окна.
Отдельный зал для бизнесменов.
Руководители подумали про инвалидов колясочников обеспечили самостоятельный вход. 
Парковка автомобильная маленькая.",5,
30,Антон Сергеев,2022-08-17 06:36:23,"Быстрое, внимательное и вежливое обслуживание",5,
31,Светлана Колегова,2021-08-03 09:18:47,"Сотрудники грамотные, квалифицированные, отзывчивые. Решение вопросов 5-10 минут. Рекомендую!!!",5,
32,Светлана Т,2023-09-09 13:43:29,Вежливые сотрудники,5,
33,Галина Шокурова,2020-06-18 03:05:52,"Ужасный банк. При оплате за сад, сотрудник спросил 3 раза фамилию, потом переспросил, и все равно не правильно ввёл данные. Паспорт сказали не нужен! И как итог, деньги улетели в неизвестном направлении. Конечно можно поехать, написать заявление на отказ. Только вот людям нужны лишние хлопоты? По вашему им больше некуда деть свое время? Будьте любезны, если у вас проблемы со слухом, переспрасите 10 раз, возьмите и откройте паспорт, покажите в конце концов экран монитора! Я понимаю что деньги не ваши и вам как бы плевать, но так безолаберно относится к своей работе...",1,
34,СЕРГЕЙ Сарычев,2021-09-19 16:02:21,"Отличное место. При каждом посещении, кого-то да встретишь. Лично мне доставляет удовольствие то,что я захожу снять свои денежки,а не оставить.",5,
35,Ольга Танцерева,2022-08-24 12:26:11,"Чистое, светлое и «быстрое» отделение.",5,
36,Алеся Соколенко,2022-10-08 04:53:42,"Обслуживание на уровне ноль. Всегда очень, когда бы не зашёл.",1,
37,иван загорнов,2021-07-18 01:52:33,"Вежливые консультанты ,быстрые разьяснения, максимальное внимание к клиентам. Лучший банк.",5,
38,максим ч.,2019-08-18 03:45:19,"хороший вежливый оперативный персонал банка всегда подскажут покажут и обьяснят, всем доволен, ещё бы процент кридитования был пониже, всё гуд, так держать молодцы！ С уважением Максим Ч.",5,
39,Инна Тихонова,2022-05-17 02:45:54,"Удобно, быстро, часто заезжаю в банкомат.",4,
40,Андрей Усов,2021-06-09 11:50:08,"Выгодные ставки быстрое, обслуживание















Выгодные предложения быстрое, обслуживание",5,
41,Мария Сычева,2021-04-17 12:21:15,Всегда помогут консультанты в офисе. Круглосуточная работа банкоматов действительно круглосуточная.,5,
42,Октавия,2023-03-08 16:37:24,"Из огромного банка остался закуток, как в деревне. Персонал профессиональный.",5,
43,Дарья К.,2021-12-25 11:08:34,"Хорошее обслуживание,квалифицированный персонал",5,
44,Татьяна К.,2021-10-09 00:42:01,"Пришла заказала деньги наличными на покупку квартиры 
Сказали приходить 7/10/21
Пришла денег не дали 
Устроили проверки 
Сделка на срыве
 Мне и мои деньги не отдали
Больше с этим банком я работать не буду.",1,
45,светлана топорова,2023-02-06 01:28:28,Отлично работаю!,5,
46,Таня Скачкова,2022-12-22 13:40:50,Банкомат круглосуточно,5,
47,Павел М.,2021-12-11 10:04:18,Совершенно не возможно припарковаться в зимнее время. Не чистят снег.,2,
48,ТАТЬЯНА К,2023-09-03 13:03:37,Все супер,5,
49,Юрий Русаков,2021-09-16 06:17:48,"Пытаются быть похожими на хороший уровень обслуживания,но не особо получается.",3,
50,Vlad X,2021-09-06 15:44:28,"Типичный Сбербанк, качество обслуживания меняется в худшую сторону",4,
51,Елена Завацкая,2022-12-20 07:08:33,Всё нормально.,5,
52,Анютка Д.,2021-08-21 02:33:16,Быстро и качественно работает персонал,5,
53,константин,2019-12-20 10:06:38,отличный сбербанк нормальный шас немного стал удобней чем был но шас просторней стало,5,
54,Вероника Кузьмина,2022-06-09 13:09:07,Приветливые сотрудники,5,
55,Юлия Шумилина,2019-09-18 01:33:50,"Банк, что ещё можно сказать, после ремонта, красиво конечно но не удобно расположены банкоматы для выдачи денег, места мало, не пройти",5,
56,Николай Ф.,2021-06-10 11:21:23,Карту поменял за 10 минут. Для Сбербанка уровень хороший.,5,
57,Ольга,2021-05-12 07:58:07,"Приятная обстановка, хорошие сотрудники, всегда помогут, чем могут.",5,
58,Красный Дракон,2021-11-10 03:45:04,Очень тупой робот отвечает на телефонные звонки.,1,
59,Иван Давыденко,2022-05-15 14:10:37,Грамотные сотрудники.,5,
60,Анастасия Таюрская,2021-06-12 14:30:07,"Консультанты вызывают на консультацию, когда услуга недоступна",4,
61,Елена Сандакова,2022-11-24 09:34:27,Все отлично,5,
62,Халикова Иннара,2020-04-28 13:09:58,Всё отлично!быстро с пониманием и прекрасное отношение,5,
63,sdlisin,2022-01-13 08:01:55,Удобно расположен.,5,
64,Лилия Степанижова,2021-02-16 14:00:08,Молодцы! Все уютно и внимательно!,5,
65,Светлана Кулакова,2022-12-12 12:40:49,Всё норм.,5,
66,maruf muminovich,2022-05-31 12:53:47,Хороший персонал,5,
67,Олга Кузина,2021-10-12 10:55:01,"Обычное отделение банка, как и везде.",5,
68,Андрей,2020-07-24 08:53:53,"Работают профессионалы своего дела, самый любимый банк.",5,
69,Сергей Юрьевич Чувашов,2021-07-06 14:25:37,Нормальный. Пенсию там получаю.,5,
70,Елизавета Мишукова,2020-03-04 15:49:37,"Всё хорошо, удобно ждать своей очереди.",5,
71,Лидия,2020-08-12 18:29:30,Грамотное и быстрое обслуживание.,5,
72,ssvetlakowa,2021-10-04 15:24:43,Всегда всë-ОК!!!,5,
73,Агафья,2019-08-21 13:12:12,"Быстрое обслуживание,грамотные консультанты)",5,
74,T P,2018-12-19 22:47:40,"Банк с самыми квалифицированными сотрудниками. Его посещение, это всегда праздник!",5,
75,Tatiana B.,2020-01-12 03:37:19,Быстро качественно обслужили,5,
76,валентина целищева,2019-08-09 04:21:19,"Близко к дому, часто большие очереди, мало места.",5,
77,Пилот,2019-08-09 13:48:00,"Отказался от него кругом одни страховки,а за что то что они крутят вашими деньгами",1,
78,любовь мищенко,2020-08-14 07:28:47,Грамотные консультации,4,
79,Ирина Васильева,2020-02-01 02:07:31,"Офис большой, культурный персонал",5,
80,Евгения Белькова,2019-08-08 11:42:40,"Вежливый персонал,а это самое главное!!",5,
81,Мария Чеснокова,2020-04-06 12:42:54,Не очень вежливый персонал,3,
82,Денис В.,2020-01-07 12:49:49,Очередей нет грамотный персонал,5,
83,Татьяна,2020-02-08 13:08:59,единственный банк которому я доверяю,5,
84,Оксана Б.,2020-03-22 14:09:37,"Приходится долго сидеть в очереди, раньше такого не было.",4,
85,юрий дуванов,2020-01-22 12:01:43,Грамотные консультанты,5,
86,Светлана Яковлева,2020-04-04 13:16:14,Хорошие сотрудники,5,
87,Вячеслав Мухаметсафин,2019-12-25 13:49:34,"сбер, он и Африке сбер",5,
88,Алексей Ш.,2019-08-19 08:44:58,Не понятно когда работают,2,
89,Евгений Шиянов,2019-09-26 18:48:33,Всё как обычно...,5,
90,Дмитрий-Олегович Смокотин,2020-03-19 17:33:04,Всё нравится,5,
91,Александр Б.,2019-12-19 08:34:13,надежный банк,5,
92,Олег Б.,2020-03-15 13:17:41,Просто клас,5,
93,Любовь Попова,2020-01-04 13:27:09,Все хорошо,1,
94,сергей б.,2019-11-14 23:00:48,Все хорошо,5,
