,name,date,text,stars,answer
0,Ольга Иванова,2023-10-20 06:54:12,"В самом помещении банка всё отлично. Можно быстро с помощью персонала выполнить все необходимые операции. Отношение работников банка к клиентам на высшем уровне. Чисто, уютно, никакой путаницы и длительных ожиданий. Минус вижу только в вестибюле, где стоят банкоматы. Они постоянно ломаются или тормозят. Иногда работает один-два или вообще ни один. И это длится уже несколько месяцев. Неужели такая небедная организация не может решить этот вопрос?",4,
1,Анна Гизатова,2023-10-31 19:04:27,"Хорошее большое отделение, чисто , есть где ожидать своей очереди , имеются автоматы с напитками и едой, есть туалет ( что не мало важно ) . Машину можно поставить за территорией :(",5,
2,светлана з.,2023-12-07 10:36:56,"Сегодня посетила отделение этого банка. Очень разочаровалась в обслуживании . Я ИП , мне 46 лет и мне тяжело с установкой приложений. Взяла талон ,попросила соорудника помочь мне скачать приложение и установить программу криптопро. Так как меня уверили в др. Отделении, что именно тут мне помогут, но сотрудник отказался, сказал , что звоните по номеру в поддержку и устанавливайте самостоятельно. Очень жаль, что такое отношение к клиентам ... Изначально уговаривали открыть счет именно в сбере, говорили , что всегда будет помощь и поддержка с их стороны.... Хотя были банки , где работают с ИП за меньший процент с счетами., но я, изначально хотела работать со сбером, так как была уверена , что тут всегда помогут и подскажут. НЕ РЕКОМЕНДУЮ НИКОМУ!!! Теперь найду для работы с ИП более удобный банк для себя и с низкой процентной ставкой, а в Сбере буду закрывать счет.Так же выбрала установку эквайринга, но нет, с таким отношением не хочу и не буду .
Моя оценка 1.",1,
3,Семён К.,2023-11-18 11:05:30,"Если вы хотите просто забрать готовую карту и работаете в будни, то вы еë не получите никогда ( или надо будет уходить с работы днëм и терять свою зарплаиу), так как вечерами тут народу много на получение, а в субботу вообще невозможно. Я вот взял талон и по итогу за час очередь продвинулась ну максимум на 10 человек и до моего номера ещё 30-40, а до закрытия остался час! Лучше уж если хотите без очередей, то есть Тинькофф, который доставит вам карту прямо к дому и не надо париться в очередях бесконечных. Сбер разочаровал!",1,
4,София М.,2024-04-19 17:11:38,"Один из лучших банков для проведения сделок с недвижимостью. Ипотечный отдел на 5 баллов из 5. Общий зал 5 из 5. Всегда во всем помогут, подскажут, что нужно распечатают без вопросов. Просто зайки ❤️",5,
5,Н П,2024-02-29 11:13:54,"Посещение в выходной день. Поситителей много, но очередь движется очень быстро. Персонал вежливый и компетентный. Предоставленной услугой полностью удовлетворён",5,
6,Надежда Б.,2024-01-19 15:02:13,"Сегодня была на консультации в центральном отделении сбербанка г. Королев, и хочу сказать СПАСИБО работнику КОКАТКИНУ АЛЕКСЕЮ!! Редко встречаешь таких грамотных, вежливых и главное желающих помочь! Объяснил все подробно, подсказал на что обратить внимание и даже помог сэкономить))",5,
7,Михаил Иваничкин,2023-11-12 19:09:42,"В данном офисе проводили сделку по недвижимости. В отделении чистота, порядок, персонал на высоком уровне. Быстрота обслуживания, всё отлично!",5,
8,Екатерина Максимова,2024-04-22 16:28:10,"Была тут в первый раз. Очень красивое, просторное здание, много воздуха. Консультанты очень приветливы, корректны,вежливы",5,
9,Тина Е,2023-11-10 17:01:13,"Хороший, современный офис. С большой нагрузкой, всегда много народа. Была в день, когда по техническим причинам невозможно было получить талончик, Сотрудники организовали живую очередь, все быстро, четко, мне помогли решить мой вопрос, сотрудница была внимательна и спокойна, профессиональна и дружелюбна. Спасибо.",5,
10,Анна Воробьёва,2024-04-07 19:24:52,"Очень нравится этот сбер. Отличный персонал! Вежливые, улыбчивые. Очень устают, но это не мешает им быть улыбчивыми и добрыми! Молодцы!",5,
11,Попович Ива,2024-03-22 14:36:06,"Сегодня посетил Сбербанк как клиент сбербизнес, взял талон и ждал вызова, через 5 минут на экране вызвали меня по номеру на талоне, а когда подошёл к столу, оказалось что сотрудник ни имеет никакого отношения к сбербизнес. На словах меня перенаправили к другому столу, но там сидели клиенты и никто не собирался уходить. Прождав 15 мин, я так и не попал к сотруднику сбербизнес и на экране номер моего талона больше не появлялся.",1,
12,Олег Владимирович,2023-11-07 18:34:06,"За последние годы банк изменился в лучшую сторону. С кошмаром вспоминаю очереди в кассу, что бы оплатить ЖКХ или другую какую квитанцию! Вечная ругань - я тут стояла!!!! Бабки поназанимают во все кассы очередь и бегают туда-сюда!! А сейчас благодать - взял талончик и сиди спокойно без всяких нервов и жди, когда на экране появится твой номер. Кругом бы так сделали!!! И внутри приятно, ремонт хороший сделали.",5,
13,Екатерина К.,2024-01-22 19:02:02,"Сбербанк есть сбербанк, мало пользуюсь отделением, стараюсь решать через приложение. В отделении чисто, стоит автомат, берешь номерок и ждешь своей очереди. Персонал разный, надо быть в теме вопроса",4,
14,Игорь Утвенко,2024-04-10 13:01:22,"СберБанк тоже чудит, обычно я квартплату оплачиваю у них, в тут получилось оплатил через Онлайн банк, мне 25 приходит СМС, что найден счет не оплаченный, в счёт оплачен ещё 07. Прихожу беру распечатку об оплате в потом показываю СМС от них , ответ ввёл в ступор, вас же никто не заставляет платить внимания не обращайте. Посмотрел на неё слов нет, да , специалисты работают..",1,
15,Андрей Филясов,2024-02-06 19:16:56,"Доброго времени суток! 
Часто бываю в этом банке, сотрудники по обслуживанию юр.лиц работают на твердую 5. Иногда прихожу за 20-30 минут, до закрытия, сотрудники всегда стараются уложится и решить поставленную задачу",5,
16,Оксана,2024-03-18 06:12:45,"Отвратительное отношение к клиентам! Муж с ребёнком пошёл поменять деньги, которые копила дочь (мелочь), сумма около 3 тысяч. Сотрудница из 4 окна грубо обращалась, не отвечала на вопросы, и в целом, была очень недовольна тем фактом, что принесли менять деньги! Звонил после этого муж и сказал, что больше в этот банк ни ногой. Прошу разобраться с данной ситуацией и объяснить сотруднице, как нужно общаться с клиентами!!! Приходили 16.03.2024г.",1,
17,Юлия Харыкина,2023-11-25 12:29:32,"Добрый день! Почему такое отношение к клиентам? При наличии 24 окон,обслуживает меньше половины. Где ориентированность на клиента? Зная,что суббота является наиболее удобным для посещения Банка,руководство не организует правильную расстановку кадров?!!!",1,
18,Владислава Столповских,2023-11-03 09:33:55,"Здесь бесконечно долго, вся жизнь пролетает, пока ждешь своей очереди. 1,2ч и чуть в обморрок не упала. Сидят в окошке по 45 минут, карты предлагают кредитные и истории рассказывают. Мне карту получить лишь, а мне байки рассказывают. Сидят с планшетами, компьютерами Такие умные, а люди в очередях умирают",2,
19,Redflower_z,2023-04-11 12:18:12,"Очень хорошее отделение банка! Сотрудники очень вежливые и доброжелательные. Часто обращаемся по бизнес-вопросам, девочки всегда выручают! Всегда находим решение, что очень приятно! Время ожидания не большое, ни разу долго не ждали. Рекомендую к посещению! 👍",5,
20,Ольга,2023-01-27 12:29:23,"Во первых удобное расположение ! Обслуживание проходит спокойно, без суеты . Персонал очень вежлив, всегда подскажут. Сколько посещаю , банкоматы всегда работают. Хочу пожелать дальнейшего процветания и большое спасибо за все!",5,
21,Ольга К,2023-12-17 04:38:38,"Чисто, комфортно, приветливый персонал, но всегда много народу, за это и сняла один балл",4,
22,Владимир Садчиков,2023-01-10 20:20:36,"Банк удобно расположен. Много банкоматов. Грамотный, отзывчивый персонал всегда готов помочь, если у Вас возникли затруднения. Хорошо организована очередь для клиентов, можно удобно расположиться при необходимости ожидания",5,
23,Лена л,2024-03-15 08:06:08,"Долгое ожидания время приёма. Иногда стоишь больше часа. Часто работает одна касса, а желающих много. Банкоматы вообще беда. Наведите порядок, время ожидание не более 15 минут должно быть.",3,
24,Ольга Терентьева,2023-11-06 11:32:13,отличное обслуживание. вежливый персонал. Всегда четко проводят сделки с недвидимостью.,5,
25,Полина Михайлова,2023-01-31 18:02:16,"Первоначально хочется отметить именно сотрудников - профессионалы и отзывчивые люди, всегда приятно обращаться в любые отделы) Работают быстро и слаженно 
Отделение не слишком далеко от ж/д, опрятное и чистое. Огромный плюс: работа в субботу, а также широкий спектр услуг в самом отделении т.к площадь позволяет",5,
26,Aleksandr,2023-05-22 05:21:53,"Главный центральный Сбербанк города, очень хорошее обслуживание, сотрудники добросовестные и отзывчивые что очень хорошо, быстро выполняют свою работу и не задерживают людей долго в списке ожидания, много банкоматов поэтому очереди редко бывают👍",5,
27,Владимир Ермолин,2024-02-08 10:36:12,"остались ужасные впечатления от посещения этого филиала. Хотел открыть расчётный счёт для бизнеса, получить КЭП и токен. В итоге ушёл ни с чем, к сожалению попалась неадекватная женщина оператор, которая совершенно не помогла.",1,
28,Олька Фиголька,2023-05-17 12:57:14,"Как же всё долго. Просидели 6 часов, чтобы провести сделку по продаже квартиры с помощью ипотеки. У наших партнёров были проблемы со страховкой, кто-то из сотрудников сбербанка накосячил с суммой. Не хватало 135р, долго с этим вопросом разбирались. 
Если даже все документы подгрузите на Дом Клик, то всё равно вылезет какая нибудь хрень, которой будет не хватать или где-то найдется косяк. 

👍Есть туалет, автоматы с кофе(какое качество не знаю, не брали). 

Рядом с банком есть магазины, можно побродить по ним, пока ожидаете.",3,
29,Abu,2024-02-24 12:25:17,Благодарю у специалиста она очень хорошая девушка всё что сделала быстро и удобно.,5,
30,Зинаида Наталич,2024-04-11 07:52:59,"Всегда очередь,с коляской,тяжело ,потому что ,мебели много,проходы узкие!Редко,но такое бывает,что сотрудник банка,просит помочь ,свою коллегу ,по вопросу,касаемо вашей ситуации!",4,
31,Михаил Курзенко,2024-03-17 10:59:55,"Огромные очереди, начиная с получения талона на обслуживание. Аппарат выключают, тобы люди стояли в очереди до входа в зал, а не сидели в зале. Лишний раз идти в сбер не хочется.",1,
32,Олег Лунин,2023-12-22 18:53:50,"На весь Королёв, кажется осталось только одно отделение, не уверен. Но работают, и справляются. Кажется что много народу, но очередь идёт быстро.",5,
33,Евгений,2023-12-20 11:32:21,"Всё хорошо, но в выходные ходить не рекомендую - народу тьма. Если идете - ориентируйтесь на минут 40 ожидания плюс/минус",4,
34,Анна Г.,2023-05-06 13:29:35,"Большой филиал, с очень большой проходимостью, и отсюда некоторые проблемы.
В целом хорошо, но! Дважды я оказывалась в ситуации, когда в общем зале стоял ужасный запах, терпеть который было невозможно. Плюсом к запаху долгое ожидание, более 20 минут, поэтому пришлось уйти, перенести визит.
Второе неприятное, с чем столкнулась, сотрудники основного зала не в курсе, что ип и юрлица обслуживаются в отдельном помещении. Кто в первый раз (как я тогда), может прождать зря.",4,
35,Геннадий Сабинин,2023-09-10 10:58:40,"Сбер всегда в своем амплуа. Все делают быстро, аккуратно, крайне удобно для посетителей. Любой сотрудник всегда может, и готов, прийти на помощь.",5,
36,Инкогнито 7668,2023-02-14 13:18:15,"Не могу охарактеризовать весь Сбербанк. Я обслуживаюсь в Сбербанк Премьер в этом здании. Хочу отметить персонального менеджера Ниязову Сабину. Могу сказать что она всегда приветлива, доброжелательна, квалифицировано консультирует по всем вопросам, которые возникают у меня. Помогает в работе с телефоном. Всегда предварительно договариваемся о времени встречи и переносов или отклонений от запланированных даты и времени обслуживания никогда не было.",4,
37,Виктория Белозерова,2024-02-05 17:41:27,"5 января отправила через это отделение 3 посылки, в итоге спустя месяц посылки утеряны, деньги не возвращают, а сбер якобы «принимает все возможные способы отыскать», звонить на 900 бесполезно",1,
38,Инкогнито 6599,2024-02-20 20:32:30,Профессиональная некомпетентность и человеческая лень отдельных сотрудников отделения просто удивляют. Кадровая работа на низком уровне.,1,
39,Ольга С.,2023-09-21 09:17:14,"Посещение банка 19.09.23. Взяла талончик , передомной 20 человек. За 10 минут ожидания ни разу не вызвали букву Б. С трудом нашла сотрудницу банка, которая общалась с пенсионерами и с посетителями с маленькими детьми. Задала ей вопрос об электронной очереди … сотрудница сообщила, что она работает с температурой и работать некому и слышала ли я об новом вирусе? Вопрос: сотрудник банка специально распространяет инфекцию? И специально создается очередь на получение « пенсии и наличных».",1,
40,Татьяна,2023-07-15 12:12:51,"Отвратительное отделение банка. Всегда всё долго. Работники не знают что делать. Бегают друг за другом. 
Раскрытие счёта заняло полтора часа. 0отя работы там минут на 10. Перекидывать с одного окна в другое. Старший по залу или как там её ещё называют вообще не могла ответить на вопросы. Она ни-че-го не знает и точка. Спустя пол часа вызвала другого сотрудника, начали что-то делать , потом сел планшет. Начали ждать когда он зарядить и это в 10 часов утра. Потом оказалось что та у которой доступ с паролем и т.д. выходная и больше никто не может войти. Этого нет, тот в отпуске, кто-то курит кого-то пьёт кофе и т.д. Вобщем еле добились результата. Ужасное обслуживание! Будь то сделка или просто обслуживание. Повысить бы вам свой уровень УВАЖАЕМЫЕ сотрудники Сбербанка на проспекте Космонавтов.",1,
41,Марина Иванова,2023-11-11 07:35:56,"Много народу. Ждали очередь очень долго для обмена валюты. В кабинки заходили люди по другим вопросам, а нас не вызывали. Ушли, не дождавшись.",3,
42,Bellerofont,2023-10-06 05:33:42,"конвейер по приему населения в Сбере, огромное количество людей и персонала, но все равно обратиться при входе не к кому, сам тыкаешься в их эл очереди. Ощущение как говорится ""женщину убрали, машину поставили"", нет уюта и желания посещать",3,
43,Markus YAKUN,2023-08-01 23:20:12,"Огромное новое (?) помещение, с большим количеством работников вечером заполнилось клиентами. И такое количество клиентов (и очереди, и ожидание) вызваны, как мне показалось, не страстью народа к СБ, а слабой подготовкой и невысоким профессионализмом сотрудников. Элементарная операция открытия р/с для юрлица заняла 3 часа, а некоторые операции сотрудники сделать не смогли, соврав, что их сделать нельзя...",3,
44,Савелий Пилсудский,2023-11-04 12:24:03,"Отделение так себе! Большое, масса народа, в очереди минимум полчаса! Чтобы попасть в ячейку надо приходить к открытию, а то добро пожаловать в зал ожидания один раз ждал 55 мин",3,
45,Сергей Коннов,2024-02-14 13:10:20,"Хороший банк,но дорогой.Много навязывают доп.услуг.А как кредит. То у вас отвратительная история.Но ведь В.В.Путин говорил не надо переписывать историю.",5,
