,name,date,text,stars,answer
0,Жизнь,2024-04-11 19:10:57,"В данном отделении была первый раз. Забежал с мамой под закрытие. Меня обслудивал кассир в окне 6, очень душевная женщина. Спасибо ей за её доброжелательность. Мама меняла карту, сотрудница банка сюк сожалению не запомнили как зовут. Так всё подробно рассказала, показала как в приложении, что и как... мама выходя из отделения скащала: Какая же девочка хорошая, сразу видно любит свою работу. 
Спасибо.",5,
1,Нина Борисова,2024-01-17 20:25:44,"Отличный банк,ответственные и компетентные сотрудники,рекомендую;решают все вопросы быстро и доступным для клиентов способом;помогают проводить операции в терминалах и банкоматах!",5,
2,ирина федорова,2024-02-16 17:12:54,"Хорошее отделение Сбербанка, все услуги предоставляются быстро и профессионально. Жаль , что это единственное отделение в мкр. Юбилейном, ещё одно отделение , которое находилось на ул. Пионерская д1/4 так и не работает)))",5,
3,Константин 04031970,2024-02-04 14:59:33,"Скучно стало. Нет очередей. В очереди то все новости узнаешь. Посабачишься, типа: ""вас здесь не стояло!"" Барышня подойдёт к тебе и спросит: ""зачем пожаловали? Ткните пальчиком сюда, сюда и сюда!""До свидания!"" Всё ваша операция завершена. 
Выглядишь и думаешь: что это было!? 
А поговорить!? Наверное, за этим в кредитный отдел))))
В общем всё хорошо.",5,
4,Дмитрий Гаврилов,2024-03-06 12:03:58,"Спасибо большое прекрасному сотруднику Айнур, максимально компетентна во всех вопросах, очень вежливая и внимательная👍",5,
5,Елена Рунева,2024-01-18 08:23:58,"Из всех работает только одно окно, приходу не первый раз и почти всегда так. По юр лицам помощи нет. Если не знаешь какой талон взять тоже не кому подсказать, на вопрос кто может направить для того чтоб взять нужный талон , в ответ получила : у нас нет такого сотрудника. Плохое обслуживание.",1,
6,Сергей Свешников,2023-10-18 17:31:08,"Самый близкий Банк от ул. Героев Курсантов. Помещение/площадь ОГРОМНАЯ. Оповещения о твоей очереди - кругом, видно да-же где бы ты не находился. Помощники есть/бывают, но не всегда. Облуживание вежливое, всегда и всё растолкуют. Хотел-бы посоветовать Администрации соорудить/огородить местечко звуконепроницаемое для разъяснений, разборок проблем и советов для клиентов Сбера и пенсионеров.",5,
7,Дмитрий Шевцов,2023-05-27 12:48:39,"Немноголюдно, электронная очередь, чисто и уютно. Персонал вежливый, приветливый. За спасибо можно многое купить, в остальном - коммерческий банк.",5,
8,Мария Иванова,2023-11-19 17:35:41,"Здесь всегда толпы посетителей … не надейтесь получить услугу за 10-15 мин, должен быть в запасе хотя бы час. Это не касается банкоматов, там быстрее.",4,
9,Надежда Т,2024-01-23 14:46:50,"Звезду сняла за то, что в зале очереди не было, но я ждала пока меня примут минут 10-15. А так, персонал приветливый. Приходила установить приложение, всё сделали быстро",4,
10,Andrey Skobelkin,2023-02-05 11:56:15,"Посетителей немного (суббота, 12-13ч). Очередь двигается быстро. Обслужили быстро, вежливо, с улыбкой. Талон был в кассу. Чисто, тепло, много мягких диванчиков для ожидания очереди. Мне всё понравилось.",5,
11,ЕКАтерина Дорошенко,2024-03-15 15:45:13,"Хороший руководитель , хорошие сотрудники. Без вопросов задержались ,чтобы решить мою проблему. Отличное отделение !!!",5,
12,ирина v,2024-01-16 17:36:17,Всегда много посетителей. Сотрудники внимательно относятся к каждому. Стараются помочь.,5,
13,Максим Пузанов,2023-09-09 08:00:43,"Удобный филиал банка, есть стол и стульчик для детишек (машинки, доска с мелками, карандаши). Офис просторный, специалисты местные, но добрые.",5,
14,Татьяна Чичконакова,2022-10-14 14:52:01,"Все очень понравилось: быстрое, вежливое обслуживание, удобная организация процесса, чистое, аккуратное, красивое помещение, доступная среда для людей с ОВЗ и предусмотрен досуг детей.",5,
15,Александр Романовский,2023-07-07 08:41:51,"Редактирую отзыв потому что его отклонили. Это обычный сбербанк. Не смогли закрыть карту и сразу выдать деньги потому что она была открыта в другом отделении. Отказываются выдавать бесплатные карты моментум, вечно выдумывают будто их нет. Впаривают пожилым людям ненужные допуслуги. Я приходил с мамой чтобы ее не развели так мне говорят вы илите погуляйтк нам надо с клиентом без вас поговорить. Это все в принципе что нужно знать.",1,
16,Павел Комиссаров,2023-12-23 10:12:37,"Отвратительное место прождал 1:20 что бы открыть вклад и положить деньги , окон много а специалиста два , не тратьте свое время тут все плохо",1,
17,Галина Поляков,2024-01-31 06:42:06,"Большой офис,есть все сервисы.Хороший персонал.Быстро решают интересующие вопросы.",5,
18,Andrey Kobernik,2022-12-30 14:24:26,Единственный офис Сбера в мкр. Юбилейный. Достаточно просторно. На входе очень вежливые и грамотные сотрудники помогают сориентироваться и отвечают на вопросы.,5,
19,Виталий М.,2024-03-24 06:25:41,"Молодцы, стараются помочь от души, а не работы!!! Негатива не было ни разу. Удачи, так держать!",5,
20,Елена М.,2024-04-01 18:21:52,"Медленно работают, плюс постоянно навязывают дополнительные платные услуги. Довольно агрессивно",4,
21,Виталий Лёвин,2023-01-01 13:14:52,"Отдел Сбера. В целом, никаких вопросов и претензий нет.
Персонал спокойный, вежливый и общение на высшем уровне. 
Спокойно закрыли карты все необходимые, сверили паспортные данные.
Бывают правда огромные очереди на банкоматах, но это уже человеческий фактор.",5,
22,Дмитрий Анатольевич,2023-07-02 14:39:14,Хорошее отделение сбербанка. Вежливый персонал. Очередь небольшая. Долго ждать не приходится. Много банкоматов. три на улице и внутри есть еще.,5,
23,Александр Гаврилин,2023-10-07 06:51:22,Отличный филиал. Прекрасные сотрудницы. Длительное время пользуюсь банковскими услугами. Недостатков не выявлено.,5,
24,Евгений Андреев,2023-06-09 18:40:09,"Понравилось...
Был, крайне, удивлен, когда работники данного филиала, не нарушая принятых правил, помогли снять с карты значительно больше стандартно разрешенной суммы. И все - в рамках закона...
Как-то так...",5,
25,Екатерина,2023-03-02 18:45:36,"Отделение хорошее. Персонал отзывчивый, помогает, доходчиво разъясняет. Очереди небольшие, ожидание не длительное.",5,
26,Татьяна Гроссман,2023-07-12 17:41:01,"Хороший филиал , достойное и грамотное обслуживание . Быстро и по делу . Спасибо !",5,
27,Наталья Пилецкая,2022-05-07 12:24:54,"Остался единственный Банк в городе , хотя бы изменили график на шестидневный, компетентный и вежливый персонал но бесит назойливое втюхивание доп услуг... В банке чисто , уютно, было бы здорово лавки добавить, замечала как старики в ожидании мучаются.",4,
28,Андрей М,2022-06-19 19:10:12,"Отделение вроде ничего, раньше было быстрое обслуживание. В очередной раз заехал, нужно было оплатить налоги, так как почему-то УСН в онлайн оплате не находилось. Взял талон на оплату картой, народу то было 6 человек. , сижу, уже и эти прошли и новые люди проходят, а я сижу, опаздываю на работу,, да ещё то кассир за водичкой сходил,, то у другого лента закончилась, вставить не могла, другую отвлекла, из трех кассиров работает одна, просидел 25 минут, по табло вижу мой талон где-то вдали,, плюнул, и убежал. Конечно больше не приду в это отделение. Все таки мы уже привыкли к быстрому обслуживанию, раньше так и было. Но не сейчас.",3,
29,Bounty Bounty,2024-03-09 18:37:07,"Пользуюсь банкоматами на улице всё устраивает, а как внутри не знаю)",5,
30,Марина Ерхова,2023-01-09 17:32:36,"Обслуживание на уровне, принятом Сбербанком. По вопросам не сложным - быстро и без проблем, по нестандартным вопросам лучше обращаться в Центральный офис (просто не помогут из-за отсутствия компетентности)",3,
31,татьяна Сысина,2024-02-01 19:12:19,Далеко от моего дома единственный минус! В остальном - на твёрдое 4!,4,
32,Дарья Леонтьева,2023-07-11 19:15:24,"Отличный, вежливый персонал! Всё быстро и максимально комфортно",5,
33,Надежда Шаламова,2022-08-03 11:32:52,"Удобное расположение ОТДЕЛЕНИЯ , банкоматы работают круглосуточно. В этом отделении работает СБЕРЛОГИСТИКа, все оформили за 10мин, отличный сервис!",5,
34,Сергей Орехов,2022-12-05 17:19:05,"Очень вежливый персонал!По всем вопросам дали ответы, подсказали, порекомендовали как и что сделать, спасибо большое сотрудникам Сбербанка, РЕКОМЕНДУЮ!!!",5,
35,Виктор Бородулин,2024-02-04 18:14:57,Хорошее отделение сотрудники приветливые,5,
36,Наталья Мхитарян,2023-09-10 12:39:41,Доброжелательный коллектив отделения банка. Работают быстро и чётко.,5,
37,Владимир Михеев,2023-07-05 16:40:07,"Отличное отделение Сбербанка. При возникновении вопросов персонал объяснит всё, и Вы примете правильное решение !!!",5,
38,Марина Вайло,2022-12-08 12:50:05,"Обслуживание специалистами отделения на хорошем уровне.
Внимательные и на высоком профессиональном уровне были даны консультации.",5,
39,ЕЛЕНА Гоменюк,2023-08-29 08:49:03,"Удобно, знающий, ответственный и дружелюбный персонал.",5,
40,Вероника Волкова,2022-10-22 17:46:19,"Обслуживание на пять с плюсом. Удобное расположение. Не курят. Очереди маленькие, если есть. Юбилейный в этом плане город хороший. Услуги не навязывают. Пришел, решил, все по человечески.",5,
41,Богдан Буторин,2022-01-28 16:15:08,"Всем позитива! Зашёл в отделение поменять карту, сразу встретила приветливая девушка, выдала талон и проводила к столу, оперативно перевыпустили карту, проконсультировали по новым функциям Сбербанк Онлайн, и уже через несколько минут я уехал. Для парковки всегда есть места, очереди нет, всё здорово и оперативно!",5,
42,Наталья Иванова,2022-12-01 13:02:27,"В этом отделении мне помогли с возвратом средств. Надежды было мало, так как виновата была сама. Положила 40000₽ в открытый купюроприемник и он благополучно закрылся, а карточку я даже не проложила. ((( Операционистка заполнила заявление. Через 4 недели деньги зачислили мне на карту!!! Счастье ))))",5,
43,Оксана Горшкова,2023-03-16 06:13:22,Очень понравился филиал. Сотрудники серьёзно подошли к моему вопросу. Получила полную консультацию и 100% решение моего вопроса . Чистое помещение.,5,
44,Виктория Сиднева,2023-05-06 18:08:25,"Получить наличные , целая эпопея, нужно заранее заказывать, так как суммы которые им привозят не хватает для выдачи. Персонал дружелюбный.",3,
45,Александр Алхимов,2022-07-25 18:56:50,"Работник банка настойчиво названивала чтоб приехал на получение кредитной карты . Потратил время зря , когда спросил почему при звонке не уточнила информацию , сказала поставите мне оценку . Естественно после посещения этого отдела , запрос на оценку не пошёл и понятно почему )) то есть эту функцию они регулируют сами . Такая оценка из-за отдельного работника . Само отделение приличное , есть уголок для детей",2,
46,Алекс,2022-06-04 11:05:35,"Отличное, душевное обслуживание. Персонал грамотный и радушный к клиентам. Банкоматы постоянно работают как на выдачу, так и на вложение. График удобный.",5,
47,Владимир,2024-02-26 16:52:06,"Спасибо, все сделали быстро, качественно и профессионально.",5,
48,Всеволод Долгополов,2023-07-04 22:14:05,"Очень понравилось корректное обслуживание персонала. Особенно кассир-администратор Марина( извините , фамилию не запомнил). Грамотно подсказали как избежать лишних трат и правильно совершить платежи. Спасибо за помощь.",5,
49,eurodir,2023-12-09 18:30:52,Высокое положительное отношение к клиентам.,5,
50,Анастасия Тельных,2023-08-19 13:33:30,"Наверное самый долгий по очередям сбер. Это просто пытка 
Предпочитаю другие, хоть и более дальние отделения",2,
51,Юля Брт,2023-07-10 12:46:21,"Отзывчивый персонал, всегда рады помочь и дать совет!",5,
52,Альбина Газалиева,2022-05-09 06:55:31,"Я здесь пользуюсь только уличными банкоматами, работают бесперебойно. Однажды заходила внутрь, нужна была помощь консультанта, подошли и оперативно все объяснили.",5,
53,Razgon911,2023-11-08 17:45:58,"Все обычно, на твердую четверку.",5,
54,Андрей Нечаев,2023-03-02 18:15:30,"Забирал готовую карту. Электронная очередь, ждал мин 10. Обслуживание приятное, лишних услуг не навязывали, осторожно напомнили про них и все))",5,
55,Ольга Лебедева,2023-08-22 00:39:51,"Мне видимо не повезло, не очень любезный специалист попался!!! Как-то было удивительно",3,
56,Дмитрий,2023-01-21 18:25:23,Отличное отделение удобно расположено. Обслуживание хорошее,5,
57,Александр,2022-05-15 09:33:26,"-добавить рабочую субботу!
можно даже за счет понедельника.
-изменить рабочее время!
работать начинать позже, заканчивать рабочий день в 20:00 или 20:30.
-установить банкомат в 1 городке.
можно в круглосуточном дикси на остановке ""лесная школа """,3,
58,игорь зиненко,2022-07-02 18:11:38,"Получал 02 июля 2022 г посылку от Сберлогистик. Вошёл в отделение, взял талон, пригласили к 8 окошку, сверили исходные данные, оплатил. На все манипуляции ушло менее 10мин, товар доставлен вовремя, как и было указано в СМС, удобна форма постоплаты. Сотрудник вежлив, приветлив и компетентен. Оценка 5",5,
59,Dmitry,2022-09-09 21:39:18,"Хороший офис с удобными банкоматами, которые вроде как перестали постоянно ломаться. И теперь можно воспользоваться услугами АТМ в любое время✅",5,
60,Алена Федотова,2022-07-29 18:10:34,"Удобно, рядом, всегда есть место для парковки, есть Сберлогистика. Три банкомата на улице.",5,
61,Вадим Б.,2022-08-25 17:20:22,"Хороший банк, грамотные и корректные сотрудники. Обращался по поводу вступления в наследство, не дай бог кому-нибудь такое. Спасибо, всё очень правильно!",5,
62,Ольга,2023-05-21 07:43:40,"В отделении получала банковскую карту. Будний день, в самый час пик. Ждала не долго, сотрудница была очень любезна. Также установила СБОЛ на ios, услышав что мое приложение больше не работает. Все понравилось!",5,
63,Елена Рогова,2024-02-05 16:18:37,Долгое ожидание специалистов,3,
64,Николай Валентинович,2023-07-04 12:50:00,Все ок. Добродушный компетентный персонал...,5,
65,Ирина Сергеева,2022-11-24 18:14:48,Персонал всегда дружелюбный и отзывчивый. Обслуживание отличное.,5,
66,Ольга Титова,2022-12-03 18:40:23,"Замечательный персонал,обслуживание и отношения к клиентам внимательны и вежливы.",5,
67,Алла К.,2022-12-31 19:34:41,Теперь тут пункт сберлогистики. Менеджер вручила не тот подарок….. испортили все настроение. Мало того она кого-то оставила без его подарка,1,
68,Лена Самарская,2023-07-25 01:38:03,"Решили вопрос за 2 мин до закрытия, очень приятно. Спасибо",5,
69,Vandena Jee,2022-12-21 21:37:58,Вежливые и компетентные сотрудники! Очень приятно! Спасибо!,5,
70,авдотья крылова,2021-09-07 19:20:37,"Лицо организации, прежде всего, — сотрудники, их поведение, их отношение к клиенту. Увы, рутинную процедуру — оформление доверенности, периодически продлеваемой, — можно превратить из привычного доброжелательного собеседования в допрос с пристрастием. Есть инструкции, а есть личная ретивость, неучтивость, желание уличать в грязных помыслах. Старший менеджер по обслуживанию Бандо Татьяна Николаевна и представившаяся руководителем на 06.09.2021 года преуспели в лихом ведении дела. Не сочли нужным проявить воспитание перед пожилыми клиентками, матерью и дочерью. Жаль. Участник события Ильченко Ирина Борисовна.",2,
71,Тамара Григорьева,2023-11-16 13:51:11,Банкомат работают через раз,2,
72,Сергей,2022-02-21 17:53:43,"Были небольшие проблемы. Встретили, помогли их решить. Ребята молодые, приятные и главное - грамотно решали, спасибо!",5,
