,name,date,text,stars,answer
0,daz73,2024-02-20 17:24:20,"Удобно расположен. Рядом мфц. В минуте ходьбы от магазинов магнит 🧲,фикс-прайс,да,и торгового центра. Банкомат работает круглосуточно. В сам сбербанк хожу редко, оплачиваю практически все онлайн. Персонал приветливый, чем смогут помогут 👍",5,
1,Олег Б.,2024-02-22 14:28:02,"Плюсы: удобное месторасположение, Банкоматы работают исправно
Чисто и опрятно 
Минусы: слабые консультанты, чтобы оплатить страховку сотруднику потребовался старший, а ему ещё и главный. В итоге даже в 3 неправильно рассчитали сумму и дату",3,
2,VladisL@v,2024-02-14 09:36:49,"В данном районе единственное отделение. Поэтому, не смотря на электронную очередь, и когда бы ты сюда не пришел, очередь будет всегда! В любое время днЯ и ночи. Сам офис выдержан в современном стиле. Ремонт, 3 банкомата, есть парковка. Правда с местами могут быть проблемы. Персонал вежливый и учтивый. Правда много молодых. Решение вопросов может затянуться.",4,
3,Наталья Артемьева,2023-09-09 20:38:55,"Хорошее отделение Сбербанка,поставили третий банкомат,доступ круглосуточно,сотрудники вежливые,часы работы удобные,выходные воскресенье и понедельник.Помещение небольшое,но очень комфортное,подождать свою очередь можно на мягком диванчике,бывает,что очереди вообще нет,но это как повезет.",5,
4,Наталья Радченко,2024-03-22 15:36:53,Раньше любила этот Сбербанк!!! Вежливость и высокий профессиализм сотрудников. На улице со мной часто здоровуются бывшие сотрудники. А теперь этого нет. Вижу многие некомпетентны и раздраженный почему-то!!???,3,
5,Татьяна Беспалова,2022-09-21 02:47:45,"Всем привет!Очень много времени не пользовалась услугами Сбера.Вчера получала карту и осталась очень довольна обслуживанием . Чётко,быстро,лояльно!
Понравилось доброжелательное и приятное 
 отношение и общение.Минимальное время ожидания,корректное и профессиональное оказание услуг.Спасибо за работу!",5,
6,Наталья Артемьева,2023-08-24 12:53:15,"Банкоматы работают круглосуточно,именно работают,бывают сломаны очень редко.
В самом банке персонал вежливый,помогают чаще всего,но я сама там бываю нечасто.",5,
7,Ольга Николаевна,2024-04-06 15:48:48,"Прекрасный банк и отличное обслуживание! Очень внимательны к пенсионерам, людям пожилого возраста!",5,
8,Incognito 2558,2024-03-16 11:24:29,"Я 4 раз приеду сбербанка консультанты говори мне невозможно получить моментально карты, сейчас я жду консультанты должен звонит мне. 😠",1,
9,Казбек Кубатов,2023-01-03 17:44:50,"Банкоматы работают круглосуточно. Всегда чисто и светло. Приветливые оперецеонисты и руководители. Однажды на оформление страховки потратили один час, но нечего не вышло. Зайду в следующий раз.",5,
10,*R*U*S*L*@*N *,2023-05-26 17:03:34,"Супер обслуживание. Чётко, быстро, качественно. Единственное - большая очередь в банкомат.",5,
11,Лариса Зацепина,2023-11-25 11:07:25,Спасибо за работу. Консультируют по всём интересующим вопросам,5,
12,richdad18,2023-01-05 08:55:15,"За последние пару тройку лет уровень подрос в обслуживании клиентов. Я сам к сберу не очень положительно отношусь, но когда необходимо обратиться, свою работу выполняют добротно. В отделении так-же есть 2 банкомата и постамат СберЛог.",5,
13,Елена Моисева,2021-11-29 10:10:21,"Прекрасный офис, грамотный и ОЧЕНЬ вежливый персонал. Обслуживают внимательно, что не всегда просто, потому что в этом районе живёт много пожилых людей, которым приходится иногда очень подробно объяснять, повторяя несколько раз одно и то же. Поэтому сотрудникам необходимо иметь запас терпения. Ни разу не видела, чтобы у кого-то этого терпения не хватило. Спасибо!!!",5,
14,Лариса Зацепина,2023-11-19 11:07:47,"Очередей нет, консультируют по интересующим вопросам. Спасибо за работу",5,
15,Сидоренко Дмитрий,2023-09-30 08:16:44,"Общая очередь для всех, кто сидит по часу прохлаждается и тем кому просто купить валюту.
Обслуживание крайне медленное, сидят только улыбаются",1,
16,Елена Д.,2023-04-16 12:50:38,"Отличное обслуживание.Нигде так комфортно ,только в этом Сбербанке.Профессионалы.Молодцы.",5,
17,Елена Светлова,2022-02-18 18:27:47,"Хорошее отделение. Небольшое. Функции свои выполняет. Приветливые сотрудники. 

Сделали СберЛогистику и важное - поставили два терминала для выдачи наличных. 

Что не понравилось. 
Обращения несколько было:
1. Касса, отлично. 
2. По кредиту переносу, ничего не могли рассказать, Сбер сам не в курсе своих правил. 
3. По кредитке разбирались, запутался консультант и я. Но сгладило впечатление позитивное общение.",4,
18,Дмитрий Ворошилов,2023-04-09 08:41:15,"Быстро помогут и подскажут. Не мог скачать приложение - подсказали быстро, и много других вопросов было.",5,
19,Андраник Балозян,2023-06-30 09:43:03,Очень приятно иметь дело 🤝такими специалистам 📝⭐️как Плотникова Александра Владимировна👍,5,
20,Елена,2022-12-06 15:03:42,"Ощущение неопрятности помещения. Словно плохо проветривают. Работники хорошие. Внимательные, грамотные, терпеливые. Но сам банк, конечно, явно не ощущает конкуренции. Неклиентоориентирован.",4,
21,Александр Григорьев,2023-06-14 18:11:56,Без вопросов работают профессионалы своего дела. Терпеливые и внимательные,5,
22,Денис,2023-07-01 18:10:52,Всё быстро четко!!! Задача выдать вам кредит))) что бы вам понравилось,5,
23,Анастасия Т.,2022-05-13 14:56:15,"Сотрудники не квалифицированные. Не дают консультацию по профилю деятельности а оценивают мои ресурсы. Не профессионально 
Жаль не посмотрела не бейджик, запомнила что была высокая девушка консультант блондинка",1,
24,Надежда Арефьева,2022-08-13 12:36:16,"Уже писала про сбербанк. Рядом, все доступно. Милые работники. Всегда помогут и подскажут.",5,
25,Якубов Элдор,2023-05-13 12:19:58,Небольшой офис с нужными услугами и хорошим отношением персонала,5,
26,Алексей Зайцев,2022-05-14 17:25:07,"Банк не плохой как и остальные. Чисто. Сотрудники прветлевы помог во всем разобраться, предложения хорошие, но не все. Мало людей, и из за этого проходимость высокая!",4,
27,Анна Барышева,2023-01-29 17:23:08,"Отличное отделение ,быстрое и качественное обслуживание.",5,
28,Сергей,2022-04-19 15:42:42,"Время работы этого филиала как то странно заниженно, все отделения минимум работают до 19:30, но нет, это до 18:30, и главное что попасть надо именно в это отделение, но после работы успеть не возможно!!!!!",1,
29,Uni Pool,2021-11-02 09:15:02,"Здравствуйте, добрые друзья! И снова - Сбер... Ну куда же без него? И хотя к любимому банку очень много вопросов, и к заявлениям его руководства - ещё больше, тем не менее!!! это, пожалуй, одна из немногих систем государства, пока ещё работающих нормально. Хоть и дорого обходится для нашего кармана 🙂",5,
30,Михаил,2023-10-28 20:46:08,Иногда мало налички,4,
31,Георгий,2023-01-27 15:31:29,Колектив професиональный. Быстро уверенно и понятливо. Одним словом ЛЮДИ.,5,
32,Елена Лепанова,2024-02-01 19:41:22,Работают хорошо,5,
33,Дмитрий Пилипенко,2023-05-29 22:50:38,Очень приветливый и вежливый персонал,5,
34,Petrmgnp,2022-05-17 16:45:37,Стал большим и хорошим магазином для жителей посёлка Пироговский ранее в это помещении чего только не было; столовая маникюрный салон.,5,
35,Ирина Минина,2021-08-27 15:44:45,Чисто по территориальному расположению самое близкое к месту проживания.По сравнению с прежним Сбером на Прудной - небо и земля!,5,
36,михаил мироненко,2023-03-28 13:03:03,Рядом с домом. Квалифицированный персонал.,5,
37,Дмитрий Аббасов,2023-06-16 10:32:03,Не авторизовались деньги...придумать ничего умнее видимо не смогли,1,
38,Наталья Долгушева,2022-11-03 17:41:43,"Доброжелательный коллектив всегда, улыбчивые.",5,
39,Андрей Александров,2023-06-10 17:13:11,"Корректны к клиентам, обслуживание ближе к 4+",5,
40,вера гордеева,2023-06-27 17:26:09,"Приятный, квалификацированный персонал",5,
41,Борис Тепляков,2023-05-18 18:30:49,Хороший банк. Больше не чего не скажу. Люди разные.,5,
42,Владимир Ефисько,2021-11-23 18:18:04,Отделение очень нравится потому что находятся близко к дому и редко бывают большие очереди,5,
43,Валерий В.,2022-12-04 17:25:18,"Обычный Сбербанк. Нормальное, хамское обслуживание. Норма для Сбербанка.",1,
44,набижон мурадов,2023-05-16 17:56:33,Спасибо обслуживающему персоналу.,5,
45,Аветисян Алиса,2021-06-14 05:57:52,"Сотрудники хамоваты. Занимаются своими делами в рабочее время. Получить оперативную помощь крайне затруднительно. Была в данном банке в первый раз и надеюсь в последний.
Если у кого-то из сотрудников плохое настроение, то пусть по крайней мере держат это при себе. Спасибо.",2,
46,Анастасия Склейнова,2021-12-16 12:19:26,Банк мне нравится. Персонал всегда помогает. Все работают слажено и аккуратно.,5,
47,Светлана Королева,2024-03-13 14:09:44,Супер!!!!!,5,
48,Николай К.,2022-10-15 21:37:28,"Хороший Сбер, мало народу, большая парковка.",5,
49,Александр Башинин,2023-11-22 12:00:56,Все норм,5,
50,Игорь Збиглый,2023-03-02 17:14:07,Пандус есть отзывчивость сотрудников на 5,5,
51,владимир решетняк,2024-01-07 06:51:48,Все супер,4,
52,Григорий Слав,2022-05-09 18:16:26,"Лично мне понравился, офис, персонал, удобное расположение.",5,
53,Денис Журов,2023-01-17 17:40:33,"Банк как банк, бабки в банкомате есть, людей у банкомата нет.",4,
54,Королев Алексей,2023-02-04 06:11:47,Удобное расположение и нет очереди,5,
55,Ольга С.,2021-07-20 16:06:59,"Отделение после ремонта, очередей нет, персонал вежлив. Навязывание услуг и продуктов, но это претензия к руководству и общей политике - раздражает.",4,
56,Сабира Ормонова,2023-09-07 10:55:34,Чистота и порядок,5,
57,Андрей Саркисян,2021-04-07 10:15:04,"Очень понравилось что делают ремонт ночной зоны, уже есть логистика и скоро поставят банкоматы новые. На данный момент в ночной зоне банкоматов нет... (06.04.2021)",5,
58,Павел Мурашов,2023-09-24 06:33:43,Очень удобно,5,
59,Secret Of,2023-03-28 16:36:05,"Обслуживание на пять,после ремонта все отлично",5,
60,ремонт строй Клим,2021-09-07 09:10:31,Отличный вариант для посещений все удобно и быстро работает,5,
61,Танзиля Наильевна,2023-02-12 12:31:55,Добрые отзывчивые сотрудники банка,5,
62,mr.Seller,2023-01-11 03:51:36,В нём есть 2 круглосуточных банкомата. Вот в принципе и всё что надо о нём знать 🤷🏻‍♂️,5,
63,Федор,2021-10-26 12:10:54,Сотрудники очень быстро обслуживают. В очереди проводишь совсем минимальное время!,5,
64,Юлия Изотова,2021-10-06 09:33:06,"Отзывчивые и вежливые работники , а филиал самый обычный, в нашем районе он один",5,
65,Инкогнито 5147,2023-01-25 11:58:03,Всё на 100% из 100 . 5 ⭐⭐⭐⭐⭐,5,
66,Андрей Г.,2023-03-03 20:10:58,Всё на хорошем уровне.,5,
67,Вероника Михайловна,2023-01-07 13:28:03,Прекрасное обслуживание !,5,
68,Алена Корж,2021-07-14 11:32:11,"Хорошее отделение, ответственные оператора. Отличная парковка.",5,
69,Моника Колосс,2021-08-25 09:54:24,Хороший персонал.Сняла одну звезду из за того что слишком навязывают дополнительный сервис к картам,4,
70,Олег Пушкаш,2022-04-27 19:48:45,Отличный персонал все хорошо.,5,
71,Иваныч,2022-04-20 17:28:07,"Стандартное, ничем не выделяющееся от других, отделение.",5,
72,Владислав Р.,2023-08-08 17:53:27,Удобно,5,
73,St.Win,2021-04-08 23:35:24,"Маленкое отделение. В банкомате всегда очереди, могли бы еще парочку поставить. Не самая бедная организация страны, а очереди как в ссср.",1,
74,Андрей Белинин,2021-07-17 17:10:17,"Недавно ремонт сделали, удобно, рядом с домом)",5,
75,Abdurahim Mominov,2021-11-07 08:16:55,Обслуживание очень хорошо мне нравится,5,
76,Андрей,2022-01-20 07:15:34,"Хороший ремонт, приветливый персонал",5,
77,Вадим Викторович,2021-03-23 18:29:15,"Нет отдельной парковки, помещение небольшое. Персонал старается.",3,
78,Мария Ж.,2022-11-30 17:16:45,Замечателтный банк)),5,
79,хусниддин ибрагимович ярматов,2021-09-22 14:32:47,Оформил карту всё чётко объяснили как пользоваться.,5,
80,Хильда,2021-09-13 10:22:42,"После ремонта стало здорово, и очень удобно, и несколько банкоматов.",5,
81,Геннадий Кладов,2021-08-04 20:00:24,Рядом с домом. После ремонта изменился к лучшему.,4,
82,Николай Лазарев,2023-01-12 14:24:32,Понравилось.,5,
83,Оксана,2021-05-23 12:56:36,"С ремонтом стало намного лучше, надеюсь больше банкомат кушать деньги не будет.",5,
84,Александр А,2021-03-16 10:26:28,Всё хорошо. Единственный минус не работают в выходной.,4,
85,FUTURE BILLIONAIRE,2023-04-14 22:01:07,Отзывчивые сотрудницы!!!,5,
86,Оксана Колокольчикова,2020-02-27 06:53:51,"Очень вежливый персонал, помогают пенсионерам с новыми гаджетами. Всегда чисто",4,
87,Тимур,2020-11-04 20:51:00,"Сбер как Сбер. Есть банкомат. Есть обслуживание как физиков, так и юриков.",4,
88,дамир антипин,2021-08-11 10:37:03,Не понятен график работы также всё сложно с графиком,4,
89,Николай Васильевич Маслов,2020-10-10 07:54:34,"Очень отзывчивый персонал, бываю там часто.",5,
90,Игорь Збиглый,2022-06-14 16:13:10,Обычное отделение,4,
91,15 12,2022-01-21 17:41:35,"Хороший банк, научились.",5,
92,ксюша весна,2022-02-13 20:59:54,Долго ждать. Медленно работают,3,
93,Ирина,2023-02-23 18:05:26,Отличное обслуживание.,5,
94,Ася Рейн,2021-02-24 10:24:51,Быстрое и качественное обслуживание.,5,
95,Генадич,2021-09-15 17:05:52,Нет очередей. Понравилось,5,
96,Di,2020-04-05 15:19:01,"Очень вежливый персонал, помогают во всех вопросах..",5,
97,Сергей Сурков,2022-05-08 21:06:32,Бысто обслужили,5,
98,Юлия К.,2020-02-13 11:08:09,"Вежливый персонал. Маленький минус, что не всегда банкоматы исправны..",5,
99,алексей хашин,2021-10-07 15:56:57,За отсутствие банкомат на улице,3,
100,Тамара Николаевна,2020-08-24 13:51:35,"Очень мало операторов и всегда приходится ждать, так как народу много",3,
101,Татьяна Лебедева,2021-05-08 09:13:01,"Хожу в этот сбербанк,потому что он рядом .",5,
102,Л.З.А,2021-09-02 18:39:19,Все что нужно исполняется,4,
103,Оксана А.,2021-07-07 18:44:27,"В очереди в субботу провела 45 минут,",3,
104,наталия,2021-10-01 15:09:08,Все отлично !!!,5,
105,Лариса Вер,2021-01-24 13:31:51,Все здороао. Только всегда душно внутри.,5,
106,Владимир Ткалич,2021-08-14 16:08:09,"сделали ремонт, просто сбер",4,
107,Ирина Нурметова,2019-10-20 09:27:32,Нравится быстрое обслуживания. Внимания и вежливость сотрудников.,5,
108,Анна К,2020-11-10 05:26:15,Нормальное отделение. Только маски носят носом наружу,4,
109,Алексей М,2018-12-08 11:17:04,"На снятие работает один банкомат, очередь как в девяностые за колбасой,народ ругаетсяся а сотрудники вообще не реагируют на такую ненормальную ситуацию,похоже для Сбера это норма.",1,
110,Андрей,2021-06-02 02:16:50,"всегда готовы помочь!от сотрудника до директора ,на5+",5,
111,Жанна Орлеанская,2021-03-05 14:08:48,Банкоматы не всегда работают,2,
112,Татьяна Ц.,2019-05-20 16:53:14,Не работают банкоматы по понедельникам. Хамское отношение сотрудников. Иногда пытаются слишком навязать кредитные карты,1,
113,натали беловп,2019-10-17 17:32:03,Банкоматы день работают и три не работают... График работы у отделения неудобный...,3,
114,ОЛЕГ ПРИГОРНИЦКИЙ,2021-04-21 17:42:03,Отличный филиал!!,5,
115,Коля Павлов,2019-11-03 07:30:50,"Хороший персонал, отличное обслуживание",5,
116,Иван Пупков,2020-06-16 08:56:28,"Удобно,большое помещение...",5,
117,татьяна Дровских,2021-08-29 11:54:37,Хороший банк,5,
118,Дмитрий Ж.,2020-01-19 11:54:43,"Удобно,девушка всё подскажет.",5,
119,Алёна Суслова,2021-04-05 05:31:55,добрый персонал,5,
120,Артур Пирожков,2020-08-10 09:21:13,Постоянно не работают банкоматы на приём,1,
121,Сильвия Коваленко,2020-04-27 23:35:43,Банкоматы очень часто не работают!!!!!👎,1,
122,Ирина Котельникова,2019-12-01 10:07:32,"Чистое отделение, быстро обслуживают.",5,
123,Лариса С.,2019-12-13 08:19:55,Вежливый грамотный персонал,5,
124,Просто К.,2019-12-15 18:10:28,"Хороший банк,отзывчивые работники",5,
125,Oleg Novikov,2021-08-30 10:55:48,Ок. 👌👌👌,5,
126,Ираида О.,2019-07-21 18:25:27,"Внимательный, отзывчивый персонал!",5,
127,* Милана,2019-11-22 20:19:19,в отделении постоянно не работает банкомат(,3,
128,Борис Кузнецов,2020-09-30 10:35:14,Толковые ребята,5,
129,Сергей З.,2021-08-24 11:10:26,Хорошо.,5,
130,Оленька Горозия,2020-09-18 13:58:09,Хорошее отделение,5,
131,Надежда Ш.,2019-12-02 16:26:36,Очень вежливый и внимательный персонал,5,
