,name,date,text,stars,answer
0,Светлана Аленчикова,2024-03-03 16:08:18,"Отделение расположено рядом с местом проживания. Удобная обстановка. Очень хорошие специалисты, всё знатоки своего дела. Грамотно и конкретно могут решить любую проблему. Спасибо большое за обслуживание. Всегда внимательные. Очень приятно.",5,
1,Микуси,2024-01-07 12:24:16,"Очень маленькое отделение, бывают большие очереди, но достаточно быстро двигаются. Достаточно молодой коллектив, быстро, четко работают, начальница всегда в деле. Быстро откликается и помогает своим сотрудникам. Больше притензии не к работникам, а к мелкому отделу, им пора расширяться!",3,
2,Надежда,2024-04-11 11:17:05,"Обычное отделение банка со всеми функциями услуг. Не далеко от дома, удобно пользоваться банкоматами. Персонал вежливый, приветливый, с пониманием относятся к проблемам клиента, грамотно решают его проблемы.",5,
3,Екатерина,2024-02-14 18:35:15,"Не помню такого, чтобы здесь не пришлось долго стоять в очереди.
Не все сотрудники компетентны. С одной и той же проблемой (списали деньги за оформление заказа на Яндекс Маркете, но деньги по назначению не попали) пришлось обращаться несколько раз. Потом поняла, что тот, к кому сначала по очереди попала , не совсем ""в теме"". При повторном обращении другой сотрудник сразу оформил заявление.",3,
4,Инкогнито 6321,2023-09-20 18:30:51,"Приветливые и вежливые сотрудники,всегда готовы помочь в решении любых вопросов, оперативно и слаженно,люблю сюда ходить,удобно что много банкоматов и рядом Макдак:)",5,
5,Marishka Tsikunova,2023-07-20 12:24:56,"Очень удобно расположенный офис. Небольшой, но обычно ажиотажа не бывает. Персонал неизменно вежливый и внимательный. 
Из удобств-банкоматы работают круглосуточно. 
Рядом остановка.",5,
6,ян бездушный,2024-02-10 12:17:05,"Очень долго обслуживают ждал час свою очередь если не больше, никому не советую сюда приходить, чтобы отдать карту занимает 10 минуты а не 2 часа, другие обслужили человек 10-15 а они 1-го клиента не могут обслужить",1,
7,Александр Блохин,2024-03-20 17:08:05,"Сотрудники заботливо распределяют очередь, помогают сориентироваться тем, кто в этом нуждается. Профессионально консультируют",5,
8,Аминат Магомедова,2024-03-16 13:55:16,"Хороший сбер)) могут дать в долг, если даже не просишь))
Запихнуть кредитку даже толком не объяснив ничего. Не ходите с детьми чтоб здраво мыслить) *** из них получились бы шикарные. 4 за то что чисто, убрано, сотрудники приветливые, стараются помочь. В очередях стоишь не долго)",4,
9,матильда с.,2023-03-20 18:00:00,"Одно из лучших отделений в городе, в центре.
Быстро, удобно, профессионально.
И офис и банкоматы в одном месте.
Обслуживание клиентов вежливое и внимательное.",5,
10,юлия янковская,2024-04-22 17:36:00,Лучшее отделение банка в Королеве.Весь коллектив приветливый и готов помочь с любым вопросом .,5,
11,Анна Полякова,2023-06-11 04:58:47,"Моё любимое отделение «Сбербанк».
Очень быстрое обслуживание.
Второй раз оформляю кредитную карту за 5 мин. Очень хорошее отношение к клиентам. Всегда помогут и подскажут.",5,
12,Улугбек Икромов,2023-03-10 16:13:18,"Удобно расположенный офис. Вежливые сотрудники, быстрое обслуживание. Банкомат есть, всегда все работает на100% отлично.",5,
13,Александр Афанасьев,2023-10-24 04:05:08,Мгого народу. Но персонал общительный и приветливый. На все обращения реагируют адекватно. Время ожидания от 20 иин.,4,
14,Светлана,2023-11-27 14:12:01,"В банкомат часто бывают большие очереди, в отделении тоже приходится ждать. Отделение маленькое.",3,
15,лазиз акрамов,2024-03-27 20:34:46,Красивые места для отдыха и чистий место приходите по гуляйте,5,
16,Инкогнито 3245,2023-09-30 07:28:30,Спасибо специалисту Гульнаре в подборе выгодного вклада и за быструю качественную работу 🤝,5,
17,Екатерина Кузнецова,2023-01-22 12:06:38,"Обслуживание было нормальным, ждать не очень долго если не много народу. Но сотрудники стараются быстро справиться с очередью. Максимально решить вопрос или подсказать/помочь на уровне своей компетенции и возможности.",5,
18,золотарева вера,2024-03-19 13:37:12,Профессиональный подход к клиентам банка. Всегда оказана помощь в решении любого вопроса.,5,
19,Ольга Ковешникова,2024-01-22 18:48:50,"Давно пользуюсь услугами этого Сбербанка, всё быстро и организованно.",5,
20,Анна Кирилова,2023-04-01 18:43:34,"Пришла оформить детскую карту. 1.04.2023г. Электронная очередь не выдавала чеков. Человек который стоял там, грубо, и на повышенных тонах выражался ""чека нет, запоминайте свой номер"", на вопрос по детской карте ответил: ""карта здесь не оформляется, заходите в сбербанк онлайн"". Когда я спросила как это делается, он ответил:как не понять, там куда не куда всё понятно расписано. Прошу принять меры к этому хаму. Мне было не приятно, из-за хамского поведения я заказала карту в другом банке.",1,
21,Заблокирован,2023-03-20 15:19:11,"Всегда много народу. Не понятно как движется электронная очередь. В ней можно стоять час, причем люди, которые приходят позже, проходят раньше. Не компетентные сотрудники. можно проконсультироваться с двумя и получить разную информацию . В данном отделении не был решен ни один вопрос. Лучше поехать в центральный банк на Космонавтов. Там точно помогу.",2,
22,жидкова мария,2023-12-31 20:57:38,"Быстро обслуживают , хороший коллектив , спасибо",5,
23,Константин Кононенко,2023-07-01 13:50:49,"Очень оперативно и вежливо. Забирал заказ из СберМаркета, ждать вообще не пришлось.
Большой зал с местами для ожидания, на входе бвнкоматы",5,
24,Матильда,2022-02-10 12:58:17,"Все очень удобно, достойно, чисто, народ долго не толпится. Достаточно персонала и банкоматов. Все вежливые и компетентные. Внимательны ко всем клиентам. Очень часто пользуюсь. Оформляла у них кредит, довольна.",5,
25,Марина Есина,2023-04-26 10:47:43,"Отличный персонал, все знают всегда помогут, иногда бывают очереди, но минут на 20, девочки работают хорошо 👍",5,
26,Ольга М.,2023-09-21 12:21:34,"Вежливые сотрудники, всегда терпеливо и с вниманием помогут решить вопросы! Спасибо им большое!",5,
27,Людмила Старостина,2024-01-15 23:48:43,Отличный филиал. Вежливый и компетентный персонал.,5,
28,надежда Теплых,2023-11-08 11:49:57,"Хорошее отделение Сбербанка, квалифицированные сотрудники.",5,
29,Brovzlu,2023-02-17 09:59:33,"Знаете Я всегда любил это место 
Я так привык к Сберанку в Статусе
Когда он был на проф ремонте 
Я уже было начал переживать 
Что он никогда не заработает 
Но мои переживания развеялись 
Когда он снова открылся 
Высокий уровень обслуживания 
Грамотный персонал 
Хорошое качество услуг 
Мне очень нравится",5,
30,Kati Gm,2023-08-14 19:26:35,"Чисто, оперативно обслуживают. Банкоматы чинят быстро, проходимость высокая",5,
31,Королев Алексей,2024-04-18 12:50:23,"Удобное расположение, есть парковка",5,
32,Лариса Сошникова,2022-12-08 06:55:14,"Просторное отделение, много окон. Обслуживают вежливо. Мы открывали аккредитив. Оператор сказала, что с такими вопросами к ним приходят редко, но все оформили, помогли, подсказали. Большое спасибо, все оперативно.",5,
33,Светлана К.,2023-04-08 11:29:18,"Не знаю, кто пишет эти прекрасные отзывы ниже, наверное друзья персонала, но отделение просто ужасное. Электронная очередь вообще непонятная, народу куча, можно потерять 2 часа из жизни, как минимум.",1,
34,Алексей мя,2024-03-25 15:32:30,"Всё новое,удобное Хорошый персонал.",5,
35,вероника прочук,2024-04-01 12:46:56,"Вежливо, всегда готовы помочь!",5,
36,Анатолий Голиков,2024-02-12 16:45:13,"Удобное расположение, порядок",5,
37,Марина **********,2022-10-09 21:25:13,"Вчера, 09 октября 2022 года, около 12:00, после внесения денежных средств через банкомат они не были зачислены на мой счёт. Банкомат с трудом выдал карту, но чек о внесении не появился. Аппарат сломался. Сообщила о проблеме роботу по указанному телефону. Как же хочется общаться с сотрудниками, а не с роботами.",1,
38,Саша Фикс,2023-09-29 15:33:54,"не выдают посылку, если много клиентов по вопросам банка, зачем вы тогда взялись за посылки!?",1,
39,Владимир Волков,2023-02-07 07:12:39,"Удобно, быстрое обслуживание, вежливый персонал. Мне нравится.",5,
40,Татьяна,2023-04-05 14:10:30,Удобное место расположения. Часто бывает очередь в банкомат.,5,
41,nekcyc,2023-09-29 15:30:09,Не могу получить карту просто физически. Количество людей после 16.00 превышает все разумные пределы. Зачем Центральный офис направляют в такое маленькое отделение?!,3,
42,boris nikak,2023-10-17 13:53:20,"Замечательный Кайзер банк, почта банк отдыхает!",5,
43,Ариадна С.,2022-12-21 14:40:45,"Душно, тесно, всегда много народа. Сотрудники работают не все и из- за этого ждать долго… не лучшее представительство Сбербанка в городе",3,
44,Полина Пулукчу,2022-08-31 11:32:07,Очень хорошие специалисты ходила туда делать карту и ничего не понимала но мне спокойно всё объяснили что да как и я осталась очень довольна,5,
45,Светик З.,2022-08-20 13:30:52,"Хорошее отделение, всегда работают четко и быстро. При входе всегда подсказывают в какое окно лучше обратиться. Меньше терминалов стало, но по сути и народу не так много. Многие банкоматы сейчас убрали в городе, странное решение. Но хорошо что, в центре города, есть данное отделение.",5,
46,Евгений Беляев,2023-09-28 12:13:39,"В Сбербанке почти нет, очереди)) по талонам все быстро проходят",5,
47,Анна С.,2023-03-26 12:57:33,Один из самых лучших отделений банка. Персонал работает быстро и не разу не сидела долго в очередях.,5,
48,алексей шустров,2023-11-30 09:44:31,График работы неудобный.,4,
49,Михаил Б.,2021-10-20 03:21:37,"Сотрудница банка Варвара ввела в заблуждение и откровенно обманула. При получении мной карты Мир, был навязан сервис Сберпрайм. При вопросе о кэшбеке в 10% при оплате топлива на АЗС, она сказала, что конечно это так, но при оформлении подписки на Сберпрайм. И обслуживание карты будет бесплатным. После оформления подписки на год за 1990₽, уже будучи дома, я обнаружил, что обслуживание карты бесплатно и при тратах в месяц свыше 5000₽, и никаких 10% кэшбэка на заправках нет, а только при тратах с карты в месяц 75000₽ и выше. 
Будьте осторожны!",2,
50,hranina921,2021-11-05 13:31:59,"Проводили сделку в этом отделении. Неудобно, переговорных нет, все заполняли в коридоре на коленке, по итогу пришлось переделывать. Почему не сделать удобно для клиентов? Такие суммы ипотечные большие, а места для клиентов жалко банку.",4,
51,Екатерина Иванова,2024-03-15 09:25:44,удобное отделение,5,
52,Антон Ульчугачев,2021-09-13 09:29:26,"Вполне адекватное отделение сбера много банкоматов, много окон. Это же и недостаток - здесь большой поток людей. Однажды здесь немного нахомили моей жене, она подала жалобу, и вскоре внутреннее расследование сбера удовлетворил жалобу. Реагирую - это хорошо.",4,
53,Война и Мир,2023-01-18 16:40:07,"Сотрудники работают хорошо, но иногда бывает маленькое хамство я заметил с пожилыми людьми",4,
54,Mia16,2021-10-04 17:04:38,"Приятные сотрудники, но всегда большие очереди, как в Банкоматы,так и в окна. Хорошее расположение отделения, но внутри часто бывает тесно.",4,
55,Kostas,2022-09-03 21:00:00,"Спасибо , девушка блондинка!Вы мне сегодня очень сильно помогли на кассе с обналичиванием денег , а я даже спасибо не успел сказать 😔",5,
56,Алексей Соколов,2021-09-17 19:09:28,"Рядом. Удобно. Быстро. Если бы не постоянные очереди у банкоматов, вообще было бы супер. Но в Сбере очереди у всех банаоматов",5,
57,Людмила Решетник (Кирилина),2023-02-06 09:17:44,Недоброжелательное отношение к пожилым клиентам отделения (конкретно работник банка Ворошилова),1,
58,Пользователь З.,2021-09-02 11:50:14,"Вежливый персонал , который всегда предлагают и оказывают помощь в необходимой операции с платежами. Быстро принимают клиентов , не приходится долго дожидаться своей очереди. Банкоматы работают хорошо .",5,
59,Анастасия Горлова,2022-06-15 12:07:57,"Стоять в общей очереди, чтобы отправить посылку? Вы серьезно? Зачем открывать «СберЛогистик», если вы не можете обеспечить отделение персоналом.",1,
60,Нина Ш.,2023-06-04 18:11:41,"Отделение хорошее, сотрудники грамотные.",5,
61,Есть контакт,2021-04-20 16:26:57,"Сервис обслуживания клиентов - самый ужасный, который доводилось видеть за свою жизнь. Работают совершенно не квалифицированные сотрудники, негатив от них чувствуется за версту. Суть обращению была: расторжение договора. Подписал бумагу спустя пол часа просиживания штанов в отделение. Никакого подтверждения не выдается, со слов старшего консультанта: подтверждением является удаление из приложения счета. Подобного ничего не произошло. Обращался повторно в чате поддержки, по четыре дня отвечали, а последнее обращение от 19 апреля 2021 г. - окончательно ""убило"". Прикреплю фото, наглядно посмотрите.",1,
62,Ирина Бородкина,2021-08-31 21:20:10,"Нечасто бываю в этом отделении, но всегда там очень многолюдно, в очереди приходится долго ждать.
Персонал вежливый, компетентный.",4,
63,Дарья Ершова,2022-10-26 21:36:53,"Маленькое не очень удобное отделение,убого зделано! Зал процитировал явно человек не бывающий в банках",4,
64,Светлана З.,2021-09-06 14:27:09,"Стандаотный офис, достаточно вышколенный персонал, очереди периодически бывают, но это связано с тем, что бываю там в основном вечером после работы, т.е. в самый час пик.",5,
65,zmeelov06,2023-05-24 07:58:54,"Решаются все вопросы, удобно, много сотрудников , пользуюсь",5,
66,Katrin Sher,2023-12-06 11:29:44,Маленькое неудобное помещение с большими очередями!,2,
67,temurmalik,2023-09-16 07:33:00,Селый час сижу обслуженный 0 бала,2,
68,Дмитрий,2021-10-13 12:31:08,"У жены был одобрен кредит онлайн по хорошей ставке, пришли сюда спросить как лучше поступить, посоветовали что лучше через них оформить, а не онлайн, и ОП оформили, ставка выросла пока менеджер общалась.",1,
69,ЕЛЕНА ГАЙДЕС,2023-11-15 17:18:56,Все вполне,5,
70,Павел Рассказов,2022-06-01 18:03:01,"Вежливый персонал, всегда ответит на интересующие вопросы. Очереди небольшие.",5,
71,Дмитрий Дмитриев,2022-05-05 07:15:22,"Норм место! Часто денежку в банкомёте снимаю, скора иду новую карту Мир получать! Вот тока народу всегда Многовато!!!",4,
72,Светлана аленчева,2022-06-09 06:26:17,Удобный зал ожидания. Сотрудники не всегда компетентны в отдельных вопросах.,4,
73,Анна Бузулуцкая,2023-05-17 19:53:45,Отличные сотрудники там работают,5,
74,Андрей Козлов,2023-03-18 18:18:55,Помойте банкоматы в холле! Ощущение что бомжи обрыгали,3,
75,Мария Е.,2022-05-17 07:19:51,Откровенно хамское отношение сотрудников! Не хотят выполнять свою работу по какими-то нелепыми выдуманными отговорками,1,
76,Елена Иванова,2022-09-21 13:20:50,"Обычное отделение Сбера, все хорошо, нормальное обслуживание, комфотный зал.",5,
77,Наталья Великоредчанина,2021-05-05 14:12:52,"Очень тесно, всегда столпотворение. Была несколько раз и осталась не очень давольна. Все толпятся, толкаются, сразу хочется уйти оттуда. Возле банкоматов тоже всегда толпа людей. Простите, но вот как-то так...",3,
78,Лана Калинина,2020-12-18 20:25:22,"Зашли поменять валюту, взяли талон. Зашла женщина - вышла. Далее зашёл мужчина у которого не было талона. Мелочь принёс. Ждали с ребёнком когда он все сделает минут 10, терпение мое лопнуло, спросила девочек администраторов что за безобразие, стали говорить какую то ахинею. Мало того, человек был без средств защиты на лице. И никого это не волновало. Вопрос куда смотрит руководство и сами сотрудники. Вам хочется болеть????",1,
