,name,date,text,stars,answer
335,Евгений Паель,2023-02-21 18:15:51,Для открытия счета для бизнеса лучшее отделение в Королеве и Мытищи,5,
336,Дмитрий Федорович,2023-02-23 18:26:34,Любимый банк!!!! Много проводим всеем сделок!!!!,5,
337,Саня Мощный,2023-06-17 17:58:02,Несправедливое распределение электронной очереди.,3,
338,Я,2022-11-07 14:28:26,Да всё хорошо и удобно!! И обслужат и подскажут и банкоматы тутже!! Всё удобно!!,5,
339,Саня,2023-07-10 17:50:25,"хороший банк, всё удобно",5,
340,Мирослава Р.,2021-08-29 07:08:50,"Недавно (вероятно, после ребрендинга, сожравшего кучу денег) сократили персонал, большие очереди. После того как позакрывали несколько других отделений, очереди, вероятно, станут еще больше.",3,
341,Ирина Лисовенко,2021-06-16 12:53:38,"Ужаснулась халатностью. В очереди стоял бродяга-бомж от которого очень сильно пахло. Он дождался своей очереди , зашёл в окно закрытого типа и после его ухода никто даже не стал ни ручку двери протирать ни кресло , где он сидел. Ни закрыли в принципе это окно для дезинфекции. Бомж без маски, без перчаток. И это в разгар новой волны короновируса...",2,
342,Наталья,2022-06-11 11:44:22,Очень быстро проводят сделки связанные с ипотекой. Приветливые сотрудники,5,
343,Русин Василий,2021-09-05 09:54:57,"Вообще я не предпочитаю этот банк всем остальным.... уровень обслуживания и продуктов очень не дотягивает до желаемого....
Всегда складывается впечатление, что где-то тебя накалывают.... мягко говоря....",3,
344,Владимир Алексеевич,2023-01-13 17:33:11,"Ужасное заведение как и весь сбер.
Нет ни одного квалифицированного специалиста",2,
345,Виталий Меренков,2021-11-13 09:57:46,"Работает до 19.30 поэтому лучше не тянуть до вечера, все в порядке, только с номером повнимательнее, нужно преждевременно сообразить куда к какому столику нужно будет идти",5,
346,Надежда Соболева,2023-03-25 12:54:28,Всегда на все подробно ответят и помогут,5,
347,рисалат зайнутдинова,2022-12-30 15:55:01,Несерьезная контора. 2 раза прилетела на сделку по ипотеке и оба раза улетела ни с чем,1,
348,Никита Гуцу,2022-05-19 08:00:20,"Все сделки по ипотеке только тут проводим, менеджеры профессионалы с большой буквы!",5,
349,Елена Матушкина,2022-06-03 14:31:26,"Удобное расположение, много банкоматов, грамотные клетки.",5,
350,Иван Новичков,2022-07-19 19:13:03,"Вежливый персонал,быстрое обслуживание-всё удобно.",5,
351,Алексей Батунов,2023-08-30 21:44:04,Все время очереди везде причем,3,
352,Papa,2022-10-27 04:35:12,"Очень часто вечером работает сигнализация, что стоять невозможно…снятие денег превращается в пытку",3,
353,Сергей Лушников,2023-03-20 16:02:47,Он такой один в городе. Бывает что много народу.,4,
354,Алексей Брокер ЗА,2023-05-20 18:03:10,"Ипотечный отдел хромает, а так обычное отделение",3,
355,сергей тепцов,2021-10-07 11:51:25,"Карта перестала работать, мне это принесло неприятные моменты, так моло того что при получении новой меня проверять начили как будто я чемодан с кнопкой у ввп украл, так ище сняли за смс обслуживание, от которого я отказался довно.",1,
356,f f,2021-09-27 10:46:45,"Флагман в Королёве. Ещё 20 лет назад организация посетителей была на уровне. Сейчас разница с другими отделениями сократилась за счёт того, что остальные потянулись.",5,
357,Оксана Г.,2021-05-06 12:37:47,"Оформляли ипотеку... И сбербанк забыл перечислить ипотечные деньги застройщику, пришлось ругаться, чтобы дело сдвинулось с мертвой точки. Но самое веселое было с мат капиталом, который сбербанк запросил у пфр и неизвестно куда перечислил. Разбирались полтора месяца, потому что менеджер, Юлия, отморозилась, на тел и письма не отвечала, а в службе поддержки Сбера только один ответ: обратитесь к менеджеру, как будто мы лично у нее леньги одолжили, а не у организации",1,
358,Борис,2022-12-07 16:26:23,Обычный банк. Вроде 8 банкоматов. В плане очереди как обычно много людей.,4,
359,Светлана Хренова,2022-01-28 12:43:27,Очень большой банк !!!Все очень отлично !!Персонал отзывчивый !!,5,
360,Сергей Магаль,2021-11-20 14:57:28,"Оценку 5 я поставил, вежливый персонал, вежливое, качественное обслуживание, спасибо за труд.",5,
361,Доцент,2020-12-29 20:57:42,"Был здесь только один раз при подписании кредитного договора господдержки в мае месяце. Уровень обслуживания оставляет желать лучшего, целый час ждал специалиста только для того, чтобы поставить свою подпись под договором за 2 минуты. Если вы можете потратить столько денег на ребрендинг, стоит подумать и об обучении персонала.",4,
362,Наталья К.,2021-05-13 10:31:10,"Оформляли здесь сделку. Очень большой. Народу очень много, но при этом все очень хорошо налажено. Все прошло быстро и понятно.",5,
363,Юлия Суркова,2022-04-29 18:47:34,Все четко. Всегда готовы помочь. Обслуживание быстрое.,5,
364,Puh Puh,2022-07-22 18:54:14,"Не все так замечательно, как выглядит с наружи...вроде офис головной, а банковских ячеек нет...",3,
365,Татьяна Радионова,2022-11-09 16:44:32,Лучшие специалисты обслуживают в этом сервисе! Рекомендую!,5,
366,", Наталья Бачелис",2021-11-05 08:20:28,Я Риэлтор очень люблю проводить сделки в сбербанк. Работают сотрудники быстро и грамотно. Т,5,
367,Ирина,2021-09-12 16:35:37,"Удобное и большое отделение сбербанка, очередей нет , посетителей обслуживают быстро, много банкоматов",5,
368,Александр,2022-07-19 17:44:57,"Хорошее отделение, много банкоматов ,операторы работают быстро !",5,
369,Денис Гурбангельдиевич,2022-10-21 16:14:26,Молодцы! Руководитель Станислав молодец знает всё!!,5,
370,александр ретюнский,2023-04-07 17:56:16,Достойный и вежливый персонал,5,
371,ольга т.,2021-04-06 13:44:09,"Хочется оставить самый хороший отзыв,спасибо за понимание! быстрота исполнения операции. Получала в этом отделении карту, девушке операционистке в окне 6 огромное спасибо!!!",5,
372,Инкогнито 6655,2022-11-08 04:28:41,"Хорошее обслуживание ,приятный персонал .",4,
373,Евгений Ветров,2024-04-21 11:05:06,Профи,5,
374,Евгения Хамнагдаева,2021-12-27 13:30:50,Сберлогистика ужасна! Чтобы получить посылку нужно очень долго ждать. Может вы поставите сюда пункт с ячейками и не будете тратить время сотрудников и клиентов????,2,
375,Игорь Леонидович,2022-07-13 21:34:22,"Находится в удобном месте, есть места для парковки",5,
376,nutrilon_dietolog,2022-12-13 12:44:18,"Приветоивый персанал, можно быстро получить услугу",5,
377,Объективная,2022-04-19 17:18:24,"Всегда очень долго ждать приходится, миниму 40мин уходит на минутный вопрос. Мало толковых специалистов",2,
378,Фарход Д.,2021-12-25 14:23:11,Большой очень удобно быстро приходит очередь.и персонал хороший,5,
379,Николай Коновалов,2022-11-22 19:39:49,"И за того что нету Парковки , остановитесь на дороге придёт крутой штраф",1,
380,галина косицына,2021-12-12 14:15:17,"Многие вылетают из-за неустойки невовремя оформленный страховки на жильё при ипотеке, многие не просматриваю это в договоре, а банк молчит, как партизан, лишь бы больше начислилось",1,
381,Борис Медведев,2022-07-01 20:59:04,"Быстро решили мои вопросы,тактичный дружелюбный персонал",5,
382,Иван Ианович,2023-06-02 16:43:46,"Облуживание высокого качества,",5,
383,Алексей Шумилин,2021-12-06 15:04:36,"Делал детям карты сберкидс. Очень долго. Оператор - прекрасная девушка, очень хорошо общалась.",5,
384,Тимур,2023-09-25 18:09:21,Восхитительно!,5,
385,Махмаднаби Умронов,2022-08-08 16:19:31,"Обслуживает хорошо красивой девушки, мне нравится.",4,
386,Андрей Володин,2023-10-02 10:55:16,Отличный офис банка.,5,
387,Кирилл Еремичев,2021-09-06 06:37:36,"Бывал с момента основания. Видел все стадии развития, не нравится навязчивость персонала с кредитами. Но оценку не снижаю, понимаю это их хлеб",5,
388,Шахром Ибодуллоев,2022-08-08 17:50:44,"Больше года назад отказался от аппарата эквайринга, должны были приехать забрать, до сих пор жду.",1,
389,Katrin Sher,2023-12-06 11:25:43,Это лучшее отделение в городе Королев!,4,
390,Igor Belodedov,2020-10-28 14:34:25,"Просто уморительно. Сотрудник сопровождающий ипотечные документы как привидение. Было обещано, что сотрудник появится в данном филиале с 27 октября, а по итогу, приехав 28 числа, узнаём, что она на больничном до 2 числа «И в помощь вам филиал Мытищ!». Операторы Сбербанка не знают ничего, для чего они сидят в своих креслах так и не понятно. Они не компетентны. Ещё ни разу не было момента, когда хоть кто-то хоть как-то мог решить мой вопрос без посещения филиала. А ведь я звонил и хотел себя подстраховать, дабы узнать, РАБОТАЕТ ЛИ ДАННАЯ МАДАМ СЕГОДНЯ. Но суждено было скататься через всю Москву в Королёв, чтобы посетить Мытищи.",1,
391,Аннна,2021-07-20 14:02:56,"Лучшее отделение из всех. Быстро, чётко, без очередей и волокиты. Порадовали очень.",5,
392,Игорь,2022-04-23 16:18:49,"Самое большое отделение Сбера в городе Королёв.
Обслуживают физлица и юрлица.
Имеется отделение ячеек.
Много банкоматов.",5,
393,Батон,2023-09-01 15:37:12,Удобно хорошо,5,
394,Мария,2022-11-29 15:47:18,"попался ужасный сотрудник, который не смог решить мою проблему..",1,
395,Мукаддам Сатторова,2024-04-12 18:36:25,Хороший,5,
396,Дмитрий Зайцев,2021-12-04 08:39:45,Радует что очень много банкоматов и операторов непосредственно в самом банке. Как и должно быть в центральном отделении.,5,
397,Юлия Середа,2021-12-12 13:40:18,Хорошее отделение. Удобное расположение. Вежливый персонал.,5,
398,Марина Котова,2022-10-15 18:16:49,"Операторы не ориентируются в вопросах, хорошо обслуживают, но тупят.",5,
399,Владимир Зворыгин,2022-07-11 18:10:41,"Очень хорошо! Много окошек, очередь идет быстро.",5,
400,М М,2021-07-30 15:31:44,"Быстрое обслуживание, грамотные девочки, подсказали, как и что лучше сделать",5,
401,Александр Федченко,2020-08-23 07:18:16,Очень классный эмпатичный персонал. Могут дать хороший совет. Всегда помогут. И качественно обслужат. Благодарю!,5,
402,золотарева вера,2022-06-10 11:28:35,"Быстрое обслуживание, решение проблем! Спасибо за работу 🤗",5,
403,Геннадий,2023-02-15 16:23:00,Скажем с виду более пафосно. Внутри ничего особенного,3,
404,Анонимный отзыв,2021-03-13 14:48:00,"Вот очень клиентоориентированно - изменить график работы в субботу и не следить, что написано об их организации в интернете. Вот зачем потом звонить и спрашивать о качестве обслуживания - обслуживание и его качество начинается с мелочей. Суббота до 16 или 16.30 теперь :) а не как указано.",1,
405,Олег Каплин,2021-10-20 08:10:07,"Самое унылое и бесполезное собрание людей по объявлению. Пришли с вопросом по ипотеке, а в итоге, 20 минут простояв под дверью ""Сопровождение ипотеки"", ушли ни с чем.",1,
406,Светлана Василевская,2020-12-07 15:36:02,"Сбербанк сама по себе специфичная структура, но конкретно этот офис оставил положительные эмоции. Много сотрудников, очередей не замечено (были 3-4 раза там). Сотрудники, с которыми пришлось взаимодействовать, проявили профессионализм и участие. В целом все хорошо.",5,
407,Тигран Матинян,2020-10-06 12:54:01,"Были на сделке по купле-продаже недвижимости. Очень долго. Несмотря на то, что всё по записи, уже в 11:00 задержка составляла уже 40 минут. Кабинеты для сделки очень тесные, духота. А еще кругом стоит старая оргтехника и пачки бумаги.",2,
408,илзе сафарова,2023-09-17 16:48:15,Хорошое обслуживание.,5,
409,Юля Немцова,2022-10-30 16:13:52,"Очень удобно, пользуюсь банкоматом.",5,
410,Виктория Бакланова,2021-12-10 14:32:30,"Слишком долгое обслуживание, точнее ожидание. Были не в час пик, ждали почти час. Половина окон пустых, сотрудников нет.",2,
411,Сергей Прокофьев,2021-04-27 13:04:09,"К этому месту претензий нет.Я просто не знаю где похвалить вашего робота когда звонишь в Сбер.Он делает мозг беременным все время общения.Просьба установить его в тел.вашего шефа на все звонки ,чтобы он был с ним до конца его дней.даже на 112.",3,
412,Yulia Makhamasheva,2020-07-09 11:55:38,"К сожалению, в нестандартных ситуациях вопросы решаются крайне медленно. У меня это касалось снятия денег с Московского счета по доверенности (ходила в итоге три раза, тк сотрудники не могли понять каков верный алгоритм действий). А также закрытия карты, которую навязали моей престарелой матери. Сотрудникам явно не хватает компетенций. Писала жалобы. Рекомендую делать также при необходимости, иначе , считаю, ничего не изменится. Надеюсь, это поможет потом другим людям.",3,
413,Анонимный отзыв,2023-05-21 17:34:26,Очень грязно всегда у банкоматов.,3,
414,Алексей Софронов,2021-04-01 19:09:18,"Да, стало лучше. Теперь не 2 часа ждать в электронной очереди, а «всего» 30 минут (при наличии 15 касс...............). Предпочитаю посещать отделение в конце проспекта Космонавтов.",2,
415,Natalya S,2021-05-11 17:50:12,"Большое отделение. Всегда можно снять большую сумму денег в кассе, без заказа. Хорошие специалисты на консультации и в ипотечных отделах. Проблем не было.",5,
416,Ольга Самсонова,2021-10-10 16:54:04,Очень хорошее обслуживание ! Все подробно объясняют по всем операциям!,5,
417,максим нечитайлов,2023-07-20 17:16:28,Сделка прошла за 30 минут,5,
418,Юлия Хохлова,2023-03-11 16:18:02,Самое лучшее отделение в городе.,5,
419,Андрей Д.,2022-04-19 08:14:28,Удобное расположение. Вежливое обслуживание.,5,
420,Игорь Р.,2022-09-12 13:14:03,Оперативная работа сотрудников. Отправили посылку менее чем за 5 минут,5,
421,Сергей Чайка,2020-08-31 21:25:16,Здесь вполне комфортно можно получить разнообразные банковские. услуги. Персонал дружелюбный и ответственный.,5,
422,Наталия,2021-06-02 07:40:03,"Удобные места для ожидания, много окон приёма, очередь продвигается достаточно быстро.",5,
423,Ирина Пушкина,2020-04-03 09:31:34,"Удобное расположение офиса. Большой зал, чисто в помещении.
Быстрое профессиональное обслуживание. Операционисты предлагают услуги банка, но не навязчиво.
 В общем, все на ""5"".",5,
424,Сергей Кондин,2021-12-09 17:30:21,Народу много .суеты но помощь адекватная .достойное место.,5,
425,Марина Ермакова,2023-03-24 12:02:09,"Пользуюсь часто, нареканий нет.",5,
426,Вячеслав К9,2020-11-08 05:56:46,"Лучший Сбербанк в Королеве. Четверка потому что Сбер всегда остается Сбером - громоздкая система, не всегда способная быстро и эффективно работать",4,
427,Александр Дементьев,2023-09-02 16:38:03,Лучшее отделение,5,
428,rumisky_sharif,2023-02-28 17:36:25,Нравится смотреть на него из окна по ночам,5,
429,Ivan Migurin,2021-11-19 03:11:01,"Хороший, современный Сбербанк, все в одном месте. Рекомендую.",5,
430,куркин алексей,2022-11-11 16:56:27,Хороший офис.все грамотно сделано,5,
431,Иван Андреев,2023-04-02 20:35:35,Много банкоматов. Без очередей,5,
432,Евгения К.,2022-06-21 16:51:32,"Быстро, вежливо, а главное ненавязчиво 👍🏼",5,
433,Анна,2022-10-26 19:14:19,Вечные очереди. После 6 помощников персонала в зале не найти,1,
434,Ингеборга Сатернус,2022-12-06 11:17:45,Все хорошо. Ещё бы парковка была бы,5,
435,Илья,2023-06-30 23:20:00,"Сбербанк все как всегда, толпа народу но сотрудники расторопные, не спят",5,
436,Дмитрий,2021-07-13 12:30:20,"Много банкоматов, очереди не большие, все удобно, отзывчивые сотрудники",5,
437,Макс Лобов,2022-05-27 12:18:30,"Много окон,поэтому обслуживание всегда быстрое.",5,
438,Сергей Бугаков,2022-01-30 20:33:55,"Чисто, уютно, очередей нет, общительный персонал",5,
439,Римма Задорова,2022-05-09 10:12:39,Все устраивает.отношение отличное.персонал хороший .вежливый.,5,
440,Александр Казаков,2022-01-01 19:57:08,Работа банкоматов 24ч. Всегда свободно. Днем бывают проблемы с парковкой.,5,
441,Милана И.,2020-07-26 07:21:21,Только там мне помогли и смогли нормально и правильно принять документы по ипотечным каникулами. На горького 27 сбербанк не совсем компетентные работники. Которые вообще ничего не знали о каникулах и как брать доки из-за этого у меня справка в итоге рросрочилась и пришлось из-за них её заново ехать делать.,5,
