,name,date,text,stars,answer
0,Сергей Глухов,2024-02-14 17:45:42,"Нормальное отделение банка с профессиональными, дружелюбными сотрудниками
Часто заказываю сюда доставку посылку из интернет магазина. Все нравится. Рекомендую",5,
1,Валентина Кириллова,2023-10-19 13:55:07,"Вежливые, приветливые объясняют все доходчиво приятно когда общаешься с хорошими специалистами",5,
2,Олег Ш.,2023-12-10 15:51:59,Удобное расположение. Вежливые сотрудники. Вкусный кофе.,5,
3,Полина Павлова,2024-03-14 16:03:49,"Бродяги постоянно пасутся внутри рядом с банкоматами, банкоматы старые уставшие..",4,
4,Инкогнито 8006,2023-03-26 16:43:11,"Мне нравится. Квалифицированный персонал. Помещение не слишком большое, но,вероятно, этого достаточно)) При любом затруднении менеджеры оказывают посильную помощь.",5,
5,Никита Ме,2023-09-02 17:30:27,Ужасно иногда какие то бомжи сидят и греются даже страшно при них снимать деньги. Рядом столько разливаек что кажется что снимешь сразу же потеряешь(,1,
6,Владимир Брагин,2023-11-22 08:54:04,"Хорошие операционисты, всегда здороваются. Постоянно дают деньги",5,
7,Львович,2024-01-19 16:21:32,Хорошее обслуживание девочки просто класс,5,
8,Руслан Мурашов,2024-04-09 11:26:40,"Решают вопросы быстро, вежливые сотрудники",5,
9,Эльмира С.,2023-04-03 05:25:23,"Специалисты грубияны, не помогают разобраться в вопросах. Отправляют или в сбер онлайн или в банкоматы. Объяснять что-либо отказываются. Навязывают не нужные продукты банка.",2,
10,Danskiy,2024-01-22 18:30:46,Палочка-выручалочка. Ближайший Сбер на районе,5,
11,326115 рычкова,2023-07-19 18:56:34,Персонал к клиентам относится с уважением время ожидания небольшое банкомат всегда работает,5,
12,Вячеслав Федоров,2024-04-11 14:25:41,"Отличный банк, хотя некоторые его не любят.",5,
13,Аксинья,2022-08-16 12:28:37,Если честно я заходила только деньги ложить на карту. Но я заметила что персонал добродушный и сразу готовы помочь если что-то вам не понятно. Я видела как заходили люди и они сразу же подходили и спрашивали нужна ли помощь,5,
14,Юля Санникова,2024-01-24 14:21:25,Не правильно поставила. Всё понравилось.,5,
15,Наиль Тасимов,2022-11-17 16:50:25,Удобное расположение. Внимательный персонал. Быстрое обслуживание. Рекомендую.,5,
16,Владимир Максимов,2022-07-24 16:35:40,"Вежливый персонал, помогут, объяснят, что, куда и зачем, так же есть банкомат, которые работают круглосуточно, нет проблем со снятием денег, если они есть))) рекомендую",5,
17,Виталий Л.,2023-07-05 10:40:58,"Удачное местоположения, большой спальный район.",5,
18,Swag Soldier,2024-02-16 16:37:44,Бабки закинул и норм,5,
19,Сергей Зайцев,2022-06-07 14:38:28,"Удобное место где можно снять деньги и положить,есть консультанты,много банкоматов.
Всё устраивает.",5,
20,Марианна С.,2022-04-02 05:15:20,"Очень понравился персонал. Внимательные, вежливые, доброжелательные.",5,
21,сергей матвеев,2022-11-18 16:31:57,"Рекомендую, все грамотно, быстро и вежливо",5,
22,Alexander Dragomirov,2022-11-01 14:48:19,"Вежливый персонал, помогли быстро решить проблему",4,
23,Надежда,2022-11-26 01:47:02,"Хорошее обслуживание, грамотный персонал",5,
24,виталий гумиров,2023-10-15 08:24:37,Грамотно и чутко,5,
25,Олег Самоволькин,2021-03-28 10:20:32,"Хорошая культура обслуживания. Вежливые и внимательные консультанты. Чистота, порядок. Близко от дома.",5,
26,лилия горбунова,2021-08-30 09:46:23,"Хорошие специалисты, всегда помогут , расскажут, очень приятные люди. Спасибо",5,
27,422948 Ахметгарееа,2023-07-09 16:14:12,Ответственный коллектив,5,
28,Оксана Ткаченко,2023-07-02 16:54:26,Банкоматы съедают карты,2,
29,Ирина-Глафира Валентиновна,2021-11-17 20:31:53,"Да всё прекрасно. Просто мне далеко ходить до него. Прям бесит. Банкомат сбера то на каждом шагу, то 1 через улицу",3,
30,Ильдар Багаутдинов,2023-01-17 11:44:01,Круглосуточно работают банкоматы,5,
31,Инга Кашина,2019-12-13 15:15:23,"Сотрудники банка очень вежливы,всегда всё терпеливо объяснят,выслушат,помогут. Консультанты у терминалов вообще молодцы! Внимание каждой бабушке, любому человеку помогут произвести оплату, разьяснят,что не понятно! Молодцы!",5,
32,iury-kirill,2021-10-01 16:47:58,"Там очень уютно ,всегда подойдут спросят мне нравится",5,
33,Вячеслав Лазарев,2022-05-29 15:01:53,"Обслуживание, расположение и отношение к клиентам",5,
34,Данил Ка,2022-08-12 06:19:27,"Банк у дома , очень удобно",5,
35,Лариса,2022-01-12 17:22:06,"Понравилось обслуживание. Помогли, ответили на все вопросы.",5,
36,Alesik Pav,2020-07-24 04:49:04,Удобное расположение. Много места для посетителей и достаточное количество сотрудников.,5,
37,Вера Л.,2019-11-25 15:29:01,"Недавно через терминал делала платежи и в банкомате оставила в нем нечаянно свою карту,вспомнила только черёз 40 мин.в Сбербанк, буквально минут 15 потребовалось на заявление и возврат мне карты,сотрудники сбербанка извинились передо мной за доставленные неудобства и подарили вполне приличную шариковую ручку.Я осталась очень довольна!!!",5,
38,Марат Хайруллин,2021-07-26 11:55:52,"Удобное месторасположение, много банкоматов и терминалов оплаты. Консультанты в самом отделении излишне навязчивы.",4,
39,Fire,2021-09-25 13:38:14,"Не любовь... И эти акции...
Здесь надувательство. И эти назойливые менеджеры...",2,
40,Надежда Минеева,2020-08-11 06:56:49,Родное отделение Все отлично Есть стулья для клиентов Все внимательны другие отделения хуже,5,
41,Виктор Аношин,2021-08-01 09:32:12,Персонал. Грамотный. Специалисты. знают своё дело.,4,
42,YaNeUmniy,2019-08-20 21:15:27,"Довольно приветливые, компетентные сотрудники, но иногда крайне навязчивые. В часы ""пик"" очереди скапливаются довольно большие, но это не ""Пятерочка"" с вечной одной кассой. Стараются, все же, разрулить",4,
43,наталья,2021-05-05 07:34:17,"Душно как в душегубке- круглый год, висит сплит система , зачем непонятно- ни разу не видела работающей.",3,
44,ok udm,2021-07-19 18:12:27,"Ужасная доставка , не могут определиться с адресом гоняют по городу доставить не могут.",1,
45,Ксения,2019-09-21 08:32:14,"В час пик душегубка, и казалось бы много банкоматов, от куда такие очереди, а всё потому что из нормальных функциональных их всего 2 или 3 максимум, остальные бестолковые и не понятно зачем их вообще поставили",3,
46,Fara 757575,2021-11-29 21:12:59,"Хорошо,но два киоска самообслуживания это мало.",4,
47,Надежда Б.,2020-04-05 06:39:12,"Приходится ждать, иногда по 40 минут, не всегда на вопросы могут ответить при входе стажеры, стараюсь по минимуму пользоваться этим филиалом.",3,
48,Дмитрий Русских,2019-08-17 08:33:47,"В операционном зале у банкоматов бывает тесно и грязно. Заходят посидеть бомжи. Консультанты часто отсутствуют на месте в рабочие часы, банкоматы часто не работают. Специалисты-операционисты не всегда бывают вежливыми",3,
49,Ирина Мингалёва,2022-10-21 16:24:28,Все нравится,5,
50,Алексей Стерхов,2022-08-22 17:47:31,Работает норм,5,
51,Альбина Тима,2022-12-03 17:20:44,Компетентно,5,
52,$_RichBitch_$,2019-12-09 06:01:19,"Жмут и жмут обычного человека, навязывают кучу не нужных услуг. Если есть какая то скидка по ипотеке или кредиту, специально скрывают эту информацию.",2,
53,Алексей,2019-09-11 16:09:37,"Худший офис по всем критериям. Сотрудники не грамотные, внутренних правил не знают. Обломали мне сделку своим советами. Потом сказали, что так бывает)))",1,
54,Анжелика Сабурова,2021-09-05 11:02:12,Все быстро и удобно,5,
55,baj-stas,2019-11-12 02:04:40,"Все как в сбербанке, но парковка маловата, а с большой не выехать-постоянный затор на выезде.",3,
56,Anna K,2021-08-09 20:22:29,Высокий уровень оказания услуг,5,
57,аватар а.,2019-09-23 10:02:37,Специалисты вежливые. Всё расскажут и приятно обслужат.,5,
58,Яна,2019-12-28 15:51:54,Отличное расположение для активного микрорайона.,5,
59,Татьяна,2020-03-22 15:44:58,"Очень много народа , долго ждала . Сотрудники приветливые .",3,
60,Иван Алексеев,2020-11-14 20:52:36,"Хорошие сотрудники, дружный персонал",5,
61,Дмитрий С.,2019-09-10 09:10:33,"Удобное расположение, достаточно быстро обслуживают.",5,
62,Анастасия Мокрушина,2021-06-08 11:12:31,Удобное расположение.,5,
63,Григорий,2019-11-23 11:34:05,"Удобное расположение,отзывчивый персонал",5,
64,Ирина Т.,2021-03-15 16:05:56,Не всегда хватает консультантов.,4,
65,Л.Д.,2021-07-14 13:12:48,Быстрое обслуживание.,4,
66,Ириша,2022-07-17 19:46:14,Лучший,5,
67,Сергей морозов,2020-03-08 07:14:14,"удобный подъезд, работает круглосуточно!",5,
68,Елена,2019-12-05 04:19:18,"Молодцы! Хорошо и быстро работают, не сидишь и не ждешь.",5,
69,Наталья Ф.,2019-09-14 09:34:31,Быстрое обслуживание и грамотные консультанты,5,
70,Александра Паршикова,2019-09-16 15:21:58,"Удобное местоположение, много специалистов.",4,
71,Анатолий Советский,2019-09-15 08:11:27,"Сберкассой были так и остались, часто очереди пенсионеров, спертый воздух...",2,
72,Алексей К.,2020-03-15 07:21:44,Персонал есть грубияны. При входе огромная лужа!,3,
73,Олег Дмитриев,2021-08-22 03:04:01,Банкомат 24,5,
74,Анастасия Б.,2018-07-31 03:51:18,Обслуживают быстро. Все сотрудники чётко выполняют свои обязанности.,5,
75,Антон,2020-02-11 14:01:33,Банк как банк не чего примечательного...,1,
76,Эдуард Неклюдов,2019-07-29 11:32:56,Т.к. рядом нет других отделений это очень загружено,3,
77,руслан,2017-12-28 14:07:41,"Очень долго идёт обслуживание по номеркам,а если возьмешь номерок ""решить проблему"" можешь стоять час",3,
78,сергей киселев,2020-01-06 12:24:57,Кормилец. Нет задержек с пенсиями,5,
79,Денис Солнечный,2020-02-18 09:41:02,"Очень много народа 
Не люблю Сбербанк",2,
80,Александр А.,2019-09-25 06:04:12,В целом хорошие сотрудники,4,
81,Турал Бабаев,2020-04-22 14:35:03,Все нормально,5,
82,Наталья И.,2019-12-15 14:15:06,Хорошее обслуживание,5,
83,Алексей Ч.,2019-08-01 09:34:28,Быстрое обслуживание,5,
84,Алексей Абрамов,2020-03-04 17:58:47,Очень тесно.,2,
85,Алексей Сутыгин,2019-09-09 06:09:13,Большие очереди!,3,
86,Михаил Г,2020-03-15 21:40:24,Очень много народа!,4,
87,Евгений Р.,2018-03-31 05:49:36,Удобное расположение и график работы,5,
88,Александр Н.,2019-07-31 07:48:04,Обычный сбербанк,4,
89,Саша С.,2020-04-19 08:15:35,Обычный сбербанк,1,
90,Андрей,2019-09-13 05:06:24,Всегда много народу,3,
91,Nik M.,2019-09-18 18:09:57,пойдет,4,
