,name,date,text,stars,answer
0,Анастасия Филимонова,2023-12-12 06:30:51,"хорошие сбербанк, качественное обслуживание, квалифицированные сотрудники, помогут при любой проблеме. Объяснят все подробно и доступно для каждого будь то подросток или пожилой человек.",5,
1,Любовь А.,2024-01-31 13:56:09,"В помещении удобно, много сидячих мест. Персонал отличный, всегда внимательные и терпеливые.",5,
2,Анонимный отзыв,2023-07-03 12:42:54,"Отделение Сбербанка в принципе очень даже неплохое 
Рабатуют профессионалы в своей сфере 
Добрый отзывчивый персонал 
Но небольшим минусом было то что зимой тут всегда на входе огромные лужи и слякоть от снега 
А так всё понравилось",5,
3,Нежная,2024-02-16 17:51:00,"Отлично. Персонал знает свою работу на 5+ Всегда вежливые, подскажут советом, если потребуется.",5,
4,Дмитрий Задорин,2023-11-03 13:37:45,"Ужасное обслуживание работает только 1 женщина в платежах и то , которая помогает всем с регистрацией в онлайн банке ,очередь, скопилась из 5 людей и все равно . Наймите нормальное количество персонала или пусть из подсобки выходят .",1,
5,😇,2023-11-12 13:52:38,"Очень приятные сотрудницы 
Обслуживание быстрое
Очереди везде есть",5,
6,Евгений Максимов,2023-09-23 12:11:23,"Стандартное отделение банка данной сети. В не рабочее время отделения банка банкоматы работают. В случае сбоя терминалов, есть терминалы рядом в Пятерке",5,
7,Александр,2023-04-26 11:47:45,Хорошей персонал. В помещении всегда прибрано. Из минусов иногда бывают большие очереди когда приходит зарплаты там всегда большие очереди и много людей,4,
8,Олег Лебедев,2023-10-18 08:01:06,"Хорошее отделение, грамотный, дисциплинированный, доброжелательный персонал.",5,
9,Леонид Зыкин,2023-04-02 05:21:42,"Никаких проблем, никаких очередей (в разумных пределах). Сотрудники все расскажут и объяснят. Хожу в это отделение с мамой 89 лет. Какое же терпение нужно иметь при общение! Спасибо, все хорошо",5,
10,Александра Богданова,2021-12-29 07:02:39,"Отделение не большое, но места всем хватае😊. Всегда чисто. Есть места стулья и места диваны, чтоб ждать в очереди было комфортно. Персонал вежливый, 3 сотрудника, но все успевают и обслужить и ответить на вопросы, банкоматы находятся в коридоре, отделенным дверью, их 3 штуки.",5,
11,Павел Смирнов,2022-09-09 18:18:19,"Не большое отбеление , но есть всё что необходимо, парковка большая, режим работы адекватный, специалисты тоже адекватные , в целом очень доволен, спасибо",5,
12,Александр Л,2023-12-06 11:16:09,Вежливый персонал и оперативная помощь,5,
13,Александра Зуборева,2023-06-29 18:42:39,"Очень маленькое отделение, видимо, для села рассчитано, но никак не на пгт. Очень медленно, иногда огромные очереди, нет кредитного отдела и сберлогистики.",2,
14,Наталья Александрова,2023-12-23 12:40:00,"Очень хорошо, девушки всегда помогают",5,
15,Марина Алиханова(Лиса),2023-12-31 08:05:12,"Работают не плохо, даже, если набирается очередь.чисто и аккуратно.",3,
16,Алина М.,2024-03-27 16:24:10,"Потребовали документы, которые в другом отделении не спрашивали.",2,
17,Алёна,2023-10-26 19:24:50,Банком это сложно назвать. Проще съездить в город) хожу сюда исключительно из-за банкомата.,5,
18,Игорь Теряев,2024-04-11 16:58:22,"Маленький, но без проблем",5,
19,Наталья,2022-11-07 13:13:52,"график работы... работают с 9 до 14 и с 15 до 18 суббота и воскресенье выходной.
само отделение очень маленькое, тесное.",4,
20,Михаил Карпов,2021-07-20 11:17:36,"Самый колхозный Сбербанк из всех в которых я был.
Минусы:
- работают только 3 окна
- нет терминала, который сортирует клиентов по видам их обращений
- все стоят в одну очередь, если нужно забрать карту это только в 1 или 2 окне ( об этом надо самим догадаться)
- очень медленное обслуживание
Забрать карту из этого отделения не мог 3 дня, приезжал а у них не работал интернет, на четвертый день наконец-то мне это удалось.
Если у вас есть возможность обращайтесь лучше в другие отделения.",1,
21,денис зиновьев,2022-08-28 18:05:02,Банкоматы есть. Маленькое отделение. Когда пик посетителей в очереди можно прождать долго. Вежливый персонал.,3,
22,Инкогнито 3003,2023-06-15 19:58:14,Работник Римма фамилию не помню очень милая девушка,5,
23,Наталья Зайцева,2021-10-15 14:01:14,"Сбер как Сбер, операторы всегда помогут, если приходят кто не знает как пользоваться банкоматом, вежливые, обходительный операторы, так же стоят банкомат когда Сбер закрыт!",5,
24,дмитрий Амосенок,2024-02-22 14:10:15,"Мало места,",4,
25,valechk4.sergeevna,2022-05-17 23:26:36,"Не ловит интернет,это затрудняет работу менеджеров и клиенты теряют много времени.Слелали бы вайфай в таком случае....",3,
26,Вагиф,2022-05-08 17:59:19,"Постоянно очереди, банкоматы часто не работают, вообще для посёлка очень маленькое отделение!!!",3,
27,Андрей Семернин,2023-08-09 17:11:10,Одно из худших отделений,1,
28,Юрий Рябов,2022-09-02 17:48:23,Быстрое обслуживание . Бывают очереди . Банкоматы рабочие,5,
29,Елена Грудинина,2020-02-16 08:56:43,"Неплохой офис. Обслуживание тоже хорошее, по крайней мере вежливое. Сталкивалась с хамством сотрудников Сбербанка, поэтому рада, что в нашем поселковом офисе такого нет. Женщина-кассир тоже очень приятная. Честно говоря, в этот офис хочется приходить. Даже несмотря на то, что часто бывают очереди. Спасибо!",4,
30,Наталья,2021-08-09 11:49:19,"Грамотные консультанты, почти нет очередей, всё всегда быстро и удобно",5,
31,Максим Трушин,2023-10-14 08:04:39,Живая очередь,2,
32,Правильная,2022-01-11 11:28:15,"Хорошее отделение, вежливое отношение к клиентам! Всё объяснят, помогут, если какой то сложный вопрос",5,
33,Анатолий Степанов,2023-02-27 13:19:28,Удобно и не далеко от дома!,5,
34,Александр Бежинец,2022-06-09 05:27:04,Все сотрудники порядочные и доброжелательные,5,
35,Владимир Трофимов,2022-02-01 19:06:32,"Приходишь такой платить комуналку, не маленькую вовсе. А тут на тебе 2% комиссии. Вот радость то!",5,
36,Ирина Большакова,2021-10-27 11:50:15,"Отличный филиал, работой персонала очень довольна!",5,
37,Максим Смирнов,2021-04-21 11:47:00,"Отделение нравится, очередей нету, хорошее расположение, плохо что банкомат работает не круглосуточно",5,
38,Евгений Никаноров,2021-10-29 13:40:30,Приветливый и квалифицированный персонал.,5,
39,ComatozZzZzZz,2021-07-29 14:44:02,"Маленькое помещение с минимумом функционала. Для местных - самое то, ибо других вариантов нет))",3,
40,Алексей Кадышев,2021-08-14 14:41:49,Сбербанк отличное заведение. Лучшее в своей деятельности,5,
41,Андрей,2021-09-13 18:47:02,Работае круглосуточно отличный персонал,5,
42,Алексей Шиянов,2022-09-21 05:25:34,Отсутствует кредитный отдел,5,
43,ТаКа,2020-11-17 18:51:57,"Вежливые и терпеливые сотрудники, помогают в решении всех проблем.",4,
44,Александр Сухов,2021-08-07 12:56:08,Маленькое отделение. Работает всего одно окно. Народу не развернуться.,3,
45,Кирилова Маргарита,2021-12-04 14:31:45,Хорошее качественное обслуживание,5,
46,игорь новицкий,2022-05-04 18:49:04,Один банк на всю меснасть.,5,
47,Анна Тыжненко,2021-12-28 17:16:39,Один единственный на весь микрорайон,4,
48,Viktor02,2021-10-22 09:17:14,Ну очень долго обслуживают!!! Нет талончиков!,1,
49,Андрей,2021-09-05 15:25:00,"Бывает много людей, помещение маленькое.",4,
50,Umeda,2021-12-12 13:55:08,"Тесновато, где аппараты стоят.",4,
51,Денис,2022-01-11 17:47:24,"мало места,но душевно",5,
52,Мария Кудрявцева,2022-01-26 13:30:45,Безумные очереди в дни оплаты квартплаты,1,
53,равиль салихов,2020-02-02 11:00:19,"Слишком большая очередь ,постоянно.Жителей много и всего 1 сберкасса на весь растущий микро район.",3,
54,Дмитрий Ф,2019-10-14 08:03:39,"В основном всегда много народа, поэтому посидеть придется. Маловато одного такого филиала на такой поселок!!!",3,
55,Серж Я,2021-09-13 17:08:24,Отвратные банкоматы денег не снять почти ни когда!!,1,
56,Lora Belayeva,2021-12-30 12:28:15,"Колхоз,а не сбербанк,ужас......",4,
57,Илья,2021-05-04 08:25:41,"Можно вспомнить времена перестройки по тому, какие очереди.",2,
58,Сергей,2021-11-02 10:07:38,Очень нравится персонал.,5,
59,Сурен,2021-08-16 17:06:01,"Профессионально, быстро.",5,
60,Олег Киселев,2020-06-05 01:34:29,"Часто не работает один из автоматов выдачи денег,в поселке где практически негде снять наличные деньги",2,
61,Алексей Булдаков,2021-08-12 17:16:53,"Всегда очередь, персонал не успевает.",3,
62,Hulkplay H.,2020-10-27 05:56:43,Сбербанк все удобно но касс очень мало,5,
63,Елена Ефимова,2021-09-04 14:50:10,Обычное отделение Сбербанка,5,
64,Пользовалель,2021-11-21 19:55:06,"Близко,удобно.",5,
65,Никита Рыбаков,2021-11-19 12:01:17,Вежливый персонал,5,
66,Татьяна Сергеевна,2021-08-14 16:48:22,Профессионально,5,
67,Денис Садиков,2021-09-29 18:34:26,Работают на износ(,5,
68,ВАДИМ ДРОЗДОВ,2021-12-10 13:44:08,Хорошие люди,5,
69,Владимир Самсонов,2021-09-08 05:26:09,Постоянно очереди,3,
70,nphne-f6ckshl6,2022-02-19 15:52:06,. Хорошо,5,
71,Мариша,2020-10-15 12:31:31,Операторы медленно работают.,3,
72,Ира И.,2019-06-05 05:29:07,Ужасное обслуживанием. Некомпетентные работники.Ходить туда совершенно не хочется.,1,
73,Д. Б.,2019-12-25 05:20:36,"Банкоматы не работают.
Само отделение не работает по воскресеньям. 
Вечные очереди.",1,
74,Kosyta Trade,2021-08-20 18:42:48,лучший,5,
75,Сергей Р,2020-10-29 15:24:14,Очень часто не работают банкоматы.,2,
76,Анонимный отзыв,2020-10-03 13:03:17,Обычный сбер,5,
77,Ольга,2019-12-05 10:52:10,Меня полностью устраивает,5,
78,Дмитрий Фалькин.,2019-03-12 14:44:57,Тянут кота за хвост на человека по 30 мин,4,
79,Александр,2019-07-29 08:55:24,Всегда очередь,3,
80,S.T.A.L.K.E.R.,2019-12-02 17:26:07,Не плохое отделение.,4,
