,name,date,text,stars,answer
0,Людмила Маликова,2024-04-16 16:14:25,"Прекрасное отделение. Атмосфера добрая и хорошая. Работает профессиональный коллектив. Особая сердечная благодарность Анастасии Вербицкой. Чуткий и душевный человек, очень помогла в моём сложном вопросе.",5,
1,Игорь Ш.,2023-11-03 12:35:56,"Лучшее отделение из когда-либо посещаемых мной! Все девушки отзывчивые, улыбаются и искренне стараются помочь разрешить ситуацию, даже несмотря на обстоятельства от них совершенно независящие! Отдельное спасибо хотелось бы сказать Начальнику отделения, ее заместителю Наталье Владимировне, а также девушке которая начала битву с Тех. Поддержкой (IT отделом) Сбера, когда система глючила и не проходил ДБО, а мы сидели и слушали музыкальную паузу от их Тех. Поддержки и всё прошло максимально позитивно! Да-да, милая девушка со светленькими волосами и всегда в белой рубашке, огромная вам благодарность!

P.s. Касаемо технической поддержки сбера, ребятам которые пытаются помочь своим сотрудникам разрешить проблемы и системные баги в недоПО огромный привет. Надеюсь вы станете лучше и будете стараться работать как это отделение!

Фото не делал, поэтому не приложу, к сожалению.",5,
2,Максим Малошик,2023-12-09 09:14:24,"Самые лучшие сотрудники банка! Уважительное и терпеливое отношение к любым проблемам клиентов. Опыт и квалификация позволяют решить любую проблему. В отделении чисто и приятно. Вот поэтому здесь всегда очень много людей, приятно вернуться именно в это отделение.",5,
3,Екатерина Никишина,2024-03-21 19:15:31,"Пандус, конечно, слишком крутой, но в остальном хорошее отделение. Работает эл.очередь, специалисты вежливые, консультируют подробно.

21.03.24 Ни одного банкомата в отделении нет, на выдаче наличных и пенсий сегодня с 14:00 до 15:00 работал один сотрудник. Ближайший банкомат от этой точки — пустой. Работа отделения при отсутствии банкоматов буквально парализована.",1,
4,Надежда С.,2024-03-11 12:33:42,"В само отделение редко обращаюсь но вот убрали банкоматы, которыми часто пользовалась положить или снять деньги с карты. Оплатить коммуналку. И всегда было много народа. Банкоматы убрали все до одного и в округе в Старых Химках больше нет Сбербанка и банкоматов,я имею ввиду за железной дорогой. Теперь целая проблема оплатить, положить.... Банкомат есть в ТЦ Цитрус но он один там. Да ещё Сбербанк присылает смс чтобы переводила пенсию в Сбербанк. А смысл? Чтобы потом бегать искать банкоматы? Не все оплачивается картой,наличные тоже нужны. Зачем это сделали непонятно. Огромный минус Сбербанку.",3,
5,Анастасия Ф,2024-03-25 14:23:13,"Просто удивительно, что в таком классно отделении НЕТ БАНКОМАТОВ !! СБЕРБАНК, вы серьёзно?! В отделении без банкомата ??? 

Единственное нормальное отделение с качественным обслуживанием , сотрудники девочки очень отзывчины , всегда помогают! 
А банкоматов нет ......",1,
6,Наталья Соболева,2024-02-08 18:51:26,"Отличный центр! К сожалению сотрудники меняются часто. Но общение с любым из них оставляет очень приятное впечатление. Граммотность, вежливость и внимание сотрудников располагает к доверию.",5,
7,Максимум Покушения,2024-01-26 13:26:01,"Хорошее отделение, рекомендую. Очень доволен результатом и очень хороший персонал. Все сделали очень быстро. Хороше отношения к клиентам. На высшем уровне 👍",5,
8,258318 Катаева,2024-01-24 16:28:20,"Не очень большой офис. Всегда есть рядом парковочные места. Все сотрудники, которые мне попадались, очень приятные в общении и граммотные. Подолгу в очереди никогда не стояла.",5,
9,Александр Кулибаба,2024-03-16 13:53:27,"Хорошее отделение, много банкоматов. Если собираетесь в это отделение на автомобиле, то за углом этого здания на ленинском есть парковка, если она занята, то чуть дальше въезд во двор, сразу после ароматного мира, там всегда можно найти местечко",5,
10,Инкогнито 1024,2023-12-11 21:11:35,"Пришла оформить сумму на депозит суда, два сотрудника по очереди пытались выяснить под какой процент мне нужно открыть вклад, со второй попытки удалось сделать то, зачем пришла)). Правда так и не поняла почему, если положить нал себе на карту и с нее перевести на депозит, то деньги поступят не сразу? Пришлось класть наличные, не стала тратить время и пытаться выяснять. Делаю вывод, что молоды и не компетентны.",4,
11,Ирина alim-pika,2024-04-16 09:33:34,"Удобное расположение, много работающих банкоматов, очереди в целом небольшие, с обслуживанием проблем не было
Upd: уже 2 месяца как убрали банкоматы и неизвестно, когда появятся. Весьма печально",5,
12,Игорь Колесников,2023-12-26 13:05:24,"Нормальное отделение банка. Девочки вежливые. Если бы все окна работали когда очередь, было бы совсем хорошо. Когда нет очереди ради бога пусть хоть половина окон не работает. Но когда очередь хотелось чтобы все окна работали.",4,
13,Юрий Бурцев,2023-12-19 18:09:04,"Хорошее здание, персонал- когда как. Жаль что автомат по выдаче талонов- оставили, а девушку- помошницу- убрали. Попал- месяц назад- не тот талон взял- 40 минут ждал, потом ещё 10, а надо то было всего выписку со счета-фактуры это я потом узнал, а так взял талон про счёт и карту.. .",5,
14,Ира Уткина,2024-03-03 13:13:22,"Отличный банк , но сняли банкоматы временно, приходится ходить на станцию к банкомату. Так отдел хороший много специалистов, отличное обслуживание.",5,
15,Сергей Романов,2024-02-11 21:00:47,"Я в целом не хочу обсуждать сбербанк, но в этом офисе работают особо одаренные работники! Чего стоит ситуация с выдачей кредитки - пришло смс о том, что она в данном офисе - прихожу, а карточки нет, КУРЬЕР ПО ДОРОГЕ ПОТЕРЯЛСЯ и так два дня - супер так держать. Поэтому за проблемами в данный офис и в Сбербанк в целом",1,
16,Марина Савальскова,2023-11-10 12:50:41,"Сотрудники грамотные, все разъяснят и подскажут. Очередь продвигается быстро, банкоматов достаточно .",5,
17,Елена Туникова,2024-03-25 10:15:23,"Работы нет, отделение с банкоматами не работает больше месяца, работает два окна, включая кассу, в фойе более 20 человек. Понедельник 13-12. Просим принять меры, так работать нельзя, закрывайтесь, не портите картину в общем по СБ. хотя одно слово, Химки, по всем вопросам отрицательно, кроме строительства жилья.",1,
18,Vladimir L,2024-02-25 17:26:44,"Работа с премиум клиентами организована плохо несмотря на большое количество персонала.
Дополню 05.02.22 с супругой зашли сделать биометрию и у них ""не получилось"", типа ""госуслуги не работают"". В ВТБ сделали за 5 мин.",1,
19,Олег Е.,2024-04-12 18:37:07,"Персонал на высоте, но уже достаточно долго не могут поставить банкоматы, чем создают большое неудобство горожанам. Организация богатая, а своим клиентам создают неудобства.",4,
20,Мастер вброса,2023-08-08 14:30:25,"Обычное отделение сбербанка. В предбаннике банкоматы. на выдачу, часто не работают. На прием, оплату работают всегда. Внутри все стандартно. Сотрудники вежливые. Есть столик с раскрасками для детей.",5,
21,Вера Матвеева,2023-11-16 19:01:00,"Без вашего согласия при выдаче карты заходят в ваш аккаунт через планшет, чего-то там щёлкают сами, подписываются на все подряд, отношение к людям пренебрежительное, очереди долгие.",1,
22,Николай С.,2024-01-03 10:49:25,Приветливый персонал и хороший руководитель. Обращался по разным вопросам и всегда шли на встречу.,5,
23,Леонид Иванов,2023-11-30 09:24:20,"Отвратительный офис, был 30.11. В офисе жара, специалисты работают медленно, компьютеры не работают, специалист только улыбаться но вопрос не решает. Не рекомендую.",1,
24,Наталья,2023-04-18 04:53:52,"Новое чистое просторно отделение банка в спальном районе Химок. На входе 4 банкомата, которые доступны для клиентов круглосуточно. Удобно.",5,
25,Инкогнито 3324,2024-01-12 14:10:00,Работают хорошо сотрудникам спасибо очень вежливо отвечают на все вопросы,5,
26,Ольга Ясюк,2023-11-06 06:28:00,"Отличное отделение Сбера. Сотрудники внимательные, решают все вопросы. Молодцы.",5,
27,Андрей Пак,2024-04-04 10:42:26,Банкоматов нет. Огромные очереди на пополнение и выдачу . Из плюсов - вежливые и добрые сотрудники.,3,
28,Сергей Горбачев,2023-05-05 11:19:13,"Хорошее отделение 
Есть обслуживание премиальных клиентов 
Электронная очередь 
Работают сотрудники быстро
Консультируют по продуктам очень подробно",5,
29,ИХТИЁР ХУЖАМОВ,2023-06-23 13:42:54,"Обслуживание отлично по очереди принимают.
Чистый зал тишина. Дружный коллектив понравилось меня. Спасибо Огромное",5,
30,Елена Шульгина,2024-03-17 00:17:07,"Очень удобное расположение офиса, внимательный персонал.",5,
31,879500 Mitkaleva,2023-06-03 16:16:53,Отличное отделение. Персонал вежливый. Чисто. Быстро обслуживают. Очень довольна работой этого отделения.,5,
32,Leonid M.,2024-02-28 15:19:12,"Сотрудников не хватает, в очередях люди от 30минут и больше сидят. Персонал хороший а вот управляющим видимо плевать",4,
33,Инкогнито 0406,2023-11-06 11:12:10,"Большое отделение с пунктом выдачи.
Из минусов - работал бы постомат чуть дольше, было бы совсем хорошо",4,
34,721923 манонзада,2023-06-04 12:20:51,"К сожалению не знаю имя специалиста за 6 окошком, но если все такие будут внимательные, отзывчивые наши структуры будут работать прекрасно. Обращалась 03.06.2023 года Прошу руководство заслуженно наградить сотрудника за работу. 6 окошко . Огромное спасибо.",5,
35,No One,2023-09-06 11:15:07,"Жесть! Пришел днем в час дня, очередь такая что люди на улице стоят! Чтоб получить талончик нужно просить людей подвинуться, очень много людей и огромная очередь. Чтоб вы понимали я стоял в очереди два часа..два часа вдумайтесь ! Консультанта рядом с аппаратом по выдаче талонов не было.",1,
36,Инга Сазонова,2023-05-11 06:12:28,"Очень хорошее отделение Сбербанка, особенно персонал! Спасибо большое,что вы работаете качественно и для людей! Отношение к клиентам на уровне!",5,
37,Маргарита,2024-03-12 13:08:19,Постоянно большие очереди.В данный момент ждем когда вернут банкоматы в отделение банка. Очень не удобно.,3,
38,Ильяс Сабиров,2023-08-01 12:14:54,"Персонал, способный найти оптимальное решение вашего вопроса. Внутри системы Сбера есть технические нестыковки. Люди на месте научились их решать. Работают быстро. Очередь не накапливается.",5,
39,александр к.,2023-10-31 10:47:50,"Большая нагрузка на отделение сбербанка, поэтому возникает ожидание.
К сожалению не все клиенты понимают и начинают срываться на сотрудников!!!
Персонал терпеливый, внимательный, помогает, разъясняет
Спасибо!!!!",5,
40,Андрей Андреев,2024-03-21 09:39:02,"Очень долго, очереди, вопрос решается за две минуты, а очередь на 40 минут. Не советую сюда обращаться.",1,
41,Елена Борисова,2022-04-30 13:36:33,"Внимательное вежливое профессиональное отношение специалистов. Помогают во многих вопросах. Помещение банка приятное, удобно ждать очередь, есть банкетки, вентиляция. Расположен банк близко от автобусных и троллейбусных остановок, от паспортного отдела г.о.Химки.",5,
42,Юрий Рыжаков,2024-01-27 14:10:46,Персонал понравился решают затруднительные вопросы очень вежливые.,5,
43,..,2023-01-22 23:11:38,"Просто не люблю Сбербанк. Почему-то всегда ассоциациируется с почтой. Всё также долго, нудно, безграмотно. На каждый вопрос одна реакция-""подождите, я спрошу у главного"". Персонал аморфный и не заинтересованный в клиенте. Да и к самому банку больше вопросов, чем ответов и объяснения. Ни с одним другим банком у меня столько проблем никогда нет возникало. Вплоть до того, что имея карты четырёх банков самой незащищённой оказалась карта именно этого банка. Взломали через месяц после получения. Теперь просто исключили его из своей жизни и прекрасно живём дальше, без всяких Сбербанк онлайнов, карт и прочей никчёмной ерунды от этой экосистемы.",1,
44,Андрей Россохин,2023-07-21 17:17:09,"Очень хорошее обслуживание, грамотный и профессиональный персонал. Большое спасибо.",5,
45,Никита Дымчин,2024-01-25 15:18:59,"Сотрудники грубые 
Не знают своего дело
Вместо того чтоб помочь грубят типо они заняты сами идут и сидят в зале",1,
46,Кудинова Марина,2022-10-28 17:28:30,"Шикарный сбербанк, рядом с домом, очень вежливый и знающий сотрудник Бируля Олеся, всегда поможет в трудной ситуации, никогда не оставит без не решенного вопроса. Спасибо, что есть такие сотрудники сбербанка",5,
47,Леонид,2024-03-22 06:03:05,Оцениваю на данный момент. Неудобно стало. Сняли банкоматы. Уже месяц нету их. Очереди огромные на снятие наличных в кассе.,3,
48,Юлия В,2022-05-17 16:48:40,"Мне нравится этот офис- всегда чисто, вежливый персонал, помогут разобраться в вопросах, работают быстро. Электронная очередь к специалистам работает всегда, это тоже радует.
Банкоматов такое огромное количество, что очереди не бывает.",5,
49,Денис Ка,2023-08-06 17:19:39,"Ждал карту 50 минут. Есть банки, которые привезут на дом карты. Мне Сбербанк не привозит. Мне надо стоять в очереди. На ходите туда. Там очередь, которая перетекает изо одного дня в другой",1,
50,yana_berrouz,2022-11-04 16:45:43,"Сразу скажу. Отделению ставлю 5, они мне старались помочь максимально. а вот сотрудникам по номеру 900- жесткая 1. Набрали мальчиков и девочек 20 лет, без опыта, без умения общаться. Свои деньги снять невозможно. 2 дня потратила по 3 часа, плюс поездки в отделение. Ответила на 50+ вопросов сотрудникам технической поддержки. О безопасности они беспокоятся, как же. Если что- то происходит, то они сразу в закат уходят. Вообщем, полное дно. Еще раз прошу прощения перед отделением, что пришлось поставить низкую оценку, конкретно сервис отделения отличный",1,
51,Вячеслав Казанов,2024-01-19 12:45:22,"Как не зайдёшь, всегда на час!!!???? ((((((
Толи операторов мало, Толи чего-то не хватает...???",2,
52,Кирилл Чугаев,2024-03-27 17:17:56,"Как отделение претензий нет, но сделайте парковку! Постоянно посетители перекрывают проезд!",1,
53,Сергей С.,2023-12-10 09:37:54,"Хватит блокировать переводы моим клиентам . Сбербанк , самый удачный банк для бизнеса",1,
54,Никита Г.,2022-05-30 11:06:25,"Большие очереди - это конечно же большой минус , но он перекрывается хорошими и отзывчивыми сотрудниками. Всегда есть дежурный консультант ,который не откажет в помощи . Есть шесть банкоматов ,что в свою очередь большой плюс ( нет очереди ) . В заведении всегда чисто и опрятно . Расположение отделения очень удобное - находится на углу здания и не требуется больших усилий ,чтобы найти вход !",4,
55,Валерия Л.,2024-04-08 09:19:25,Очень долгое обслуживание. Огромные очереди. Работаем мало сотрудников.,1,
